Id,DateAware,DateSubmitted,DataBreachCause,DateStart,DateEnd,Name,CyberattackType,WashingtoniansAffected,IndustryType,BusinessType,InformationType,Year,WashingtoniansAffectedRange,BreachLifecycleRange,EntityState
9707,02/06/2017 12:00:00 AM,05/24/2017 12:00:00 AM,Cyberattack,2016-02-26T00:00:00,2016-12-05T00:00:00,"Incipio, LLC",Unclear/unknown,1650.0,Business,Accessories,Other,2017,"1,000-9,999",300-399,
9708,05/26/2017 12:00:00 AM,05/26/2017 12:00:00 AM,Unauthorized Access,2013-10-23T00:00:00,2017-03-31T00:00:00,"Kennewick Public Hospital District, dba Trios Health",,942.0,Health,,Name,2017,500-999,500+,
9708,05/26/2017 12:00:00 AM,05/26/2017 12:00:00 AM,Unauthorized Access,2013-10-23T00:00:00,2017-03-31T00:00:00,"Kennewick Public Hospital District, dba Trios Health",,942.0,Health,,Medical Information,2017,500-999,500+,
9710,04/18/2017 12:00:00 AM,06/05/2017 12:00:00 AM,Unauthorized Access,2016-08-10T00:00:00,2017-02-09T00:00:00,"GameStop, Inc.",,27956.0,Business,Retail,Name,2017,"10,000-49,999",200-299,
9710,04/18/2017 12:00:00 AM,06/05/2017 12:00:00 AM,Unauthorized Access,2016-08-10T00:00:00,2017-02-09T00:00:00,"GameStop, Inc.",,27956.0,Business,Retail,Financial & Banking Information,2017,"10,000-49,999",200-299,
9710,04/18/2017 12:00:00 AM,06/05/2017 12:00:00 AM,Unauthorized Access,2016-08-10T00:00:00,2017-02-09T00:00:00,"GameStop, Inc.",,27956.0,Business,Retail,Other,2017,"10,000-49,999",200-299,
9712,04/26/2017 12:00:00 AM,06/08/2017 12:00:00 AM,Theft or Mistake,,,Washington State University,,769088.0,Education,,Name,2017,"50,000-999,999",Unknown,
9712,04/26/2017 12:00:00 AM,06/08/2017 12:00:00 AM,Theft or Mistake,,,Washington State University,,769088.0,Education,,Social Security Number,2017,"50,000-999,999",Unknown,
9712,04/26/2017 12:00:00 AM,06/08/2017 12:00:00 AM,Theft or Mistake,,,Washington State University,,769088.0,Education,,Medical Information,2017,"50,000-999,999",Unknown,
9712,04/26/2017 12:00:00 AM,06/08/2017 12:00:00 AM,Theft or Mistake,,,Washington State University,,769088.0,Education,,Other,2017,"50,000-999,999",Unknown,
9714,05/17/2017 12:00:00 AM,06/20/2017 12:00:00 AM,Cyberattack,2016-11-01T00:00:00,2017-03-30T00:00:00,Home Point Financial Corporation,Phishing,815.0,Finance,,Name,2017,500-999,100-199,
9714,05/17/2017 12:00:00 AM,06/20/2017 12:00:00 AM,Cyberattack,2016-11-01T00:00:00,2017-03-30T00:00:00,Home Point Financial Corporation,Phishing,815.0,Finance,,Social Security Number,2017,500-999,100-199,
9714,05/17/2017 12:00:00 AM,06/20/2017 12:00:00 AM,Cyberattack,2016-11-01T00:00:00,2017-03-30T00:00:00,Home Point Financial Corporation,Phishing,815.0,Finance,,Driver's License or Washington ID Card Number,2017,500-999,100-199,
9714,05/17/2017 12:00:00 AM,06/20/2017 12:00:00 AM,Cyberattack,2016-11-01T00:00:00,2017-03-30T00:00:00,Home Point Financial Corporation,Phishing,815.0,Finance,,Financial & Banking Information,2017,500-999,100-199,
9714,05/17/2017 12:00:00 AM,06/20/2017 12:00:00 AM,Cyberattack,2016-11-01T00:00:00,2017-03-30T00:00:00,Home Point Financial Corporation,Phishing,815.0,Finance,,Full Date of Birth,2017,500-999,100-199,
9714,05/17/2017 12:00:00 AM,06/20/2017 12:00:00 AM,Cyberattack,2016-11-01T00:00:00,2017-03-30T00:00:00,Home Point Financial Corporation,Phishing,815.0,Finance,,Other,2017,500-999,100-199,
9716,03/14/2017 12:00:00 AM,06/22/2017 12:00:00 AM,Unauthorized Access,,,Caliber Home Loans,,20437.0,Finance,,Name,2017,"10,000-49,999",Unknown,
9716,03/14/2017 12:00:00 AM,06/22/2017 12:00:00 AM,Unauthorized Access,,,Caliber Home Loans,,20437.0,Finance,,Social Security Number,2017,"10,000-49,999",Unknown,
9716,03/14/2017 12:00:00 AM,06/22/2017 12:00:00 AM,Unauthorized Access,,,Caliber Home Loans,,20437.0,Finance,,Driver's License or Washington ID Card Number,2017,"10,000-49,999",Unknown,
9716,03/14/2017 12:00:00 AM,06/22/2017 12:00:00 AM,Unauthorized Access,,,Caliber Home Loans,,20437.0,Finance,,Financial & Banking Information,2017,"10,000-49,999",Unknown,
9716,03/14/2017 12:00:00 AM,06/22/2017 12:00:00 AM,Unauthorized Access,,,Caliber Home Loans,,20437.0,Finance,,Full Date of Birth,2017,"10,000-49,999",Unknown,
9716,03/14/2017 12:00:00 AM,06/22/2017 12:00:00 AM,Unauthorized Access,,,Caliber Home Loans,,20437.0,Finance,,Unique Private Key (e.g. used to authenticate or sign an electronic record),2017,"10,000-49,999",Unknown,
9716,03/14/2017 12:00:00 AM,06/22/2017 12:00:00 AM,Unauthorized Access,,,Caliber Home Loans,,20437.0,Finance,,Military ID Number,2017,"10,000-49,999",Unknown,
9717,06/06/2017 12:00:00 AM,06/30/2017 12:00:00 AM,Unauthorized Access,2016-08-10T00:00:00,2017-03-09T00:00:00,Preferred Hotel Group,,2370.0,Business,Hospitality,Name,2017,"1,000-9,999",300-399,
9717,06/06/2017 12:00:00 AM,06/30/2017 12:00:00 AM,Unauthorized Access,2016-08-10T00:00:00,2017-03-09T00:00:00,Preferred Hotel Group,,2370.0,Business,Hospitality,Financial & Banking Information,2017,"1,000-9,999",300-399,
9718,06/06/2017 12:00:00 AM,07/05/2017 12:00:00 AM,Cyberattack,2016-08-29T00:00:00,2017-03-09T00:00:00,Loews Hotels & Co. ,Malware,912.0,Business,Hospitality,Name,2017,500-999,200-299,
9718,06/06/2017 12:00:00 AM,07/05/2017 12:00:00 AM,Cyberattack,2016-08-29T00:00:00,2017-03-09T00:00:00,Loews Hotels & Co. ,Malware,912.0,Business,Hospitality,Financial & Banking Information,2017,500-999,200-299,
9718,06/06/2017 12:00:00 AM,07/05/2017 12:00:00 AM,Cyberattack,2016-08-29T00:00:00,2017-03-09T00:00:00,Loews Hotels & Co. ,Malware,912.0,Business,Hospitality,Other,2017,500-999,200-299,
9719,06/06/2017 12:00:00 AM,07/06/2017 12:00:00 AM,Cyberattack,2016-08-10T00:00:00,2017-03-09T00:00:00,Four Seasons Hotels Limited,Unclear/unknown,636.0,Business,Hospitality,Name,2017,500-999,300-399,
9719,06/06/2017 12:00:00 AM,07/06/2017 12:00:00 AM,Cyberattack,2016-08-10T00:00:00,2017-03-09T00:00:00,Four Seasons Hotels Limited,Unclear/unknown,636.0,Business,Hospitality,Financial & Banking Information,2017,500-999,300-399,
9719,06/06/2017 12:00:00 AM,07/06/2017 12:00:00 AM,Cyberattack,2016-08-10T00:00:00,2017-03-09T00:00:00,Four Seasons Hotels Limited,Unclear/unknown,636.0,Business,Hospitality,Other,2017,500-999,300-399,
9720,06/13/2017 12:00:00 AM,07/10/2017 12:00:00 AM,Cyberattack,2017-06-13T00:00:00,2017-06-21T00:00:00,Pacific Science Center,Phishing,605.0,Business,Entertainment,Name,2017,500-999,1-99,
9720,06/13/2017 12:00:00 AM,07/10/2017 12:00:00 AM,Cyberattack,2017-06-13T00:00:00,2017-06-21T00:00:00,Pacific Science Center,Phishing,605.0,Business,Entertainment,Social Security Number,2017,500-999,1-99,
9707,02/06/2017 12:00:00 AM,05/24/2017 12:00:00 AM,Cyberattack,2016-02-26T00:00:00,2016-12-05T00:00:00,"Incipio, LLC",Unclear/unknown,1650.0,Business,Accessories,Financial & Banking Information,2017,"1,000-9,999",300-399,
9707,02/06/2017 12:00:00 AM,05/24/2017 12:00:00 AM,Cyberattack,2016-02-26T00:00:00,2016-12-05T00:00:00,"Incipio, LLC",Unclear/unknown,1650.0,Business,Accessories,Name,2017,"1,000-9,999",300-399,
9706,05/09/2017 12:00:00 AM,05/19/2017 12:00:00 AM,Theft or Mistake,2017-05-09T00:00:00,2017-05-09T00:00:00,Zillow,,1086.0,Business,Real Estate,Other,2017,"1,000-9,999",0,
9706,05/09/2017 12:00:00 AM,05/19/2017 12:00:00 AM,Theft or Mistake,2017-05-09T00:00:00,2017-05-09T00:00:00,Zillow,,1086.0,Business,Real Estate,Social Security Number,2017,"1,000-9,999",0,
9706,05/09/2017 12:00:00 AM,05/19/2017 12:00:00 AM,Theft or Mistake,2017-05-09T00:00:00,2017-05-09T00:00:00,Zillow,,1086.0,Business,Real Estate,Name,2017,"1,000-9,999",0,
9705,,05/17/2017 12:00:00 AM,Cyberattack,2017-01-30T00:00:00,2017-04-11T00:00:00,"Rite Aid Online Store, Inc.",Malware,657.0,Business,Retail,Other,2017,500-999,Unknown,
9705,,05/17/2017 12:00:00 AM,Cyberattack,2017-01-30T00:00:00,2017-04-11T00:00:00,"Rite Aid Online Store, Inc.",Malware,657.0,Business,Retail,Financial & Banking Information,2017,500-999,Unknown,
9705,,05/17/2017 12:00:00 AM,Cyberattack,2017-01-30T00:00:00,2017-04-11T00:00:00,"Rite Aid Online Store, Inc.",Malware,657.0,Business,Retail,Name,2017,500-999,Unknown,
9704,04/03/2017 12:00:00 AM,05/16/2017 12:00:00 AM,Cyberattack,,,"Nicopure Labs, LLC",Malware,541.0,Business,Consumable,Other,2017,500-999,Unknown,
9704,04/03/2017 12:00:00 AM,05/16/2017 12:00:00 AM,Cyberattack,,,"Nicopure Labs, LLC",Malware,541.0,Business,Consumable,Financial & Banking Information,2017,500-999,Unknown,
9704,04/03/2017 12:00:00 AM,05/16/2017 12:00:00 AM,Cyberattack,,,"Nicopure Labs, LLC",Malware,541.0,Business,Consumable,Name,2017,500-999,Unknown,
9703,04/24/2017 12:00:00 AM,05/15/2017 12:00:00 AM,Cyberattack,2016-01-04T00:00:00,2017-03-29T00:00:00,TALX Corporation,Other,1467.0,Finance,,Other,2017,"1,000-9,999",400-499,
9703,04/24/2017 12:00:00 AM,05/15/2017 12:00:00 AM,Cyberattack,2016-01-04T00:00:00,2017-03-29T00:00:00,TALX Corporation,Other,1467.0,Finance,,Full Date of Birth,2017,"1,000-9,999",400-499,
9703,04/24/2017 12:00:00 AM,05/15/2017 12:00:00 AM,Cyberattack,2016-01-04T00:00:00,2017-03-29T00:00:00,TALX Corporation,Other,1467.0,Finance,,Financial & Banking Information,2017,"1,000-9,999",400-499,
9703,04/24/2017 12:00:00 AM,05/15/2017 12:00:00 AM,Cyberattack,2016-01-04T00:00:00,2017-03-29T00:00:00,TALX Corporation,Other,1467.0,Finance,,Social Security Number,2017,"1,000-9,999",400-499,
9703,04/24/2017 12:00:00 AM,05/15/2017 12:00:00 AM,Cyberattack,2016-01-04T00:00:00,2017-03-29T00:00:00,TALX Corporation,Other,1467.0,Finance,,Name,2017,"1,000-9,999",400-499,
9702,02/23/2017 12:00:00 AM,05/15/2017 12:00:00 AM,Cyberattack,2016-12-20T00:00:00,2017-03-03T00:00:00,Kuru Footwear,Malware,513.0,Business,Clothing,Other,2017,500-999,1-99,
9702,02/23/2017 12:00:00 AM,05/15/2017 12:00:00 AM,Cyberattack,2016-12-20T00:00:00,2017-03-03T00:00:00,Kuru Footwear,Malware,513.0,Business,Clothing,Financial & Banking Information,2017,500-999,1-99,
9702,02/23/2017 12:00:00 AM,05/15/2017 12:00:00 AM,Cyberattack,2016-12-20T00:00:00,2017-03-03T00:00:00,Kuru Footwear,Malware,513.0,Business,Clothing,Name,2017,500-999,1-99,
9701,04/17/2017 12:00:00 AM,05/12/2017 12:00:00 AM,Cyberattack,2016-11-14T00:00:00,2017-04-17T00:00:00,Indigo Wild,Malware,501.0,Business,Retail,Other,2017,500-999,100-199,
9701,04/17/2017 12:00:00 AM,05/12/2017 12:00:00 AM,Cyberattack,2016-11-14T00:00:00,2017-04-17T00:00:00,Indigo Wild,Malware,501.0,Business,Retail,Financial & Banking Information,2017,500-999,100-199,
9701,04/17/2017 12:00:00 AM,05/12/2017 12:00:00 AM,Cyberattack,2016-11-14T00:00:00,2017-04-17T00:00:00,Indigo Wild,Malware,501.0,Business,Retail,Name,2017,500-999,100-199,
9700,04/24/2017 12:00:00 AM,05/12/2017 12:00:00 AM,Cyberattack,2016-04-04T00:00:00,2017-03-01T00:00:00,Brooks Brothers,Skimmers,,Business,Clothing,Financial & Banking Information,2017,Unknown,300-399,
9700,04/24/2017 12:00:00 AM,05/12/2017 12:00:00 AM,Cyberattack,2016-04-04T00:00:00,2017-03-01T00:00:00,Brooks Brothers,Skimmers,,Business,Clothing,Name,2017,Unknown,300-399,
9694,01/26/2017 12:00:00 AM,04/18/2017 12:00:00 AM,Cyberattack,2017-01-23T00:00:00,2017-02-22T00:00:00,Pacific Lutheran University,Phishing,813.0,Education,,Other,2017,500-999,1-99,
9694,01/26/2017 12:00:00 AM,04/18/2017 12:00:00 AM,Cyberattack,2017-01-23T00:00:00,2017-02-22T00:00:00,Pacific Lutheran University,Phishing,813.0,Education,,Full Date of Birth,2017,500-999,1-99,
9694,01/26/2017 12:00:00 AM,04/18/2017 12:00:00 AM,Cyberattack,2017-01-23T00:00:00,2017-02-22T00:00:00,Pacific Lutheran University,Phishing,813.0,Education,,Financial & Banking Information,2017,500-999,1-99,
9694,01/26/2017 12:00:00 AM,04/18/2017 12:00:00 AM,Cyberattack,2017-01-23T00:00:00,2017-02-22T00:00:00,Pacific Lutheran University,Phishing,813.0,Education,,Driver's License or Washington ID Card Number,2017,500-999,1-99,
9694,01/26/2017 12:00:00 AM,04/18/2017 12:00:00 AM,Cyberattack,2017-01-23T00:00:00,2017-02-22T00:00:00,Pacific Lutheran University,Phishing,813.0,Education,,Social Security Number,2017,500-999,1-99,
9694,01/26/2017 12:00:00 AM,04/18/2017 12:00:00 AM,Cyberattack,2017-01-23T00:00:00,2017-02-22T00:00:00,Pacific Lutheran University,Phishing,813.0,Education,,Name,2017,500-999,1-99,
9693,,04/14/2017 12:00:00 AM,Cyberattack,2016-09-29T00:00:00,2016-12-29T00:00:00,Six Continents Hotels,Malware,13825.0,Business,Hospitality,Financial & Banking Information,2017,"10,000-49,999",Unknown,
9693,,04/14/2017 12:00:00 AM,Cyberattack,2016-09-29T00:00:00,2016-12-29T00:00:00,Six Continents Hotels,Malware,13825.0,Business,Hospitality,Name,2017,"10,000-49,999",Unknown,
9692,03/24/2017 12:00:00 AM,04/12/2017 12:00:00 AM,Cyberattack,2016-10-01T00:00:00,2017-01-01T00:00:00,"ILKB, LLC",Other,1140.0,Business,Fitness,Other,2017,"1,000-9,999",100-199,
9692,03/24/2017 12:00:00 AM,04/12/2017 12:00:00 AM,Cyberattack,2016-10-01T00:00:00,2017-01-01T00:00:00,"ILKB, LLC",Other,1140.0,Business,Fitness,Financial & Banking Information,2017,"1,000-9,999",100-199,
9692,03/24/2017 12:00:00 AM,04/12/2017 12:00:00 AM,Cyberattack,2016-10-01T00:00:00,2017-01-01T00:00:00,"ILKB, LLC",Other,1140.0,Business,Fitness,Name,2017,"1,000-9,999",100-199,
9691,02/11/2017 12:00:00 AM,04/09/2017 12:00:00 AM,Cyberattack,2017-01-30T00:00:00,2017-01-30T00:00:00,Lake Kennedy McCulluch CPAs PS,Other,1688.0,Finance,,Other,2017,"1,000-9,999",1-99,
9691,02/11/2017 12:00:00 AM,04/09/2017 12:00:00 AM,Cyberattack,2017-01-30T00:00:00,2017-01-30T00:00:00,Lake Kennedy McCulluch CPAs PS,Other,1688.0,Finance,,Full Date of Birth,2017,"1,000-9,999",1-99,
9691,02/11/2017 12:00:00 AM,04/09/2017 12:00:00 AM,Cyberattack,2017-01-30T00:00:00,2017-01-30T00:00:00,Lake Kennedy McCulluch CPAs PS,Other,1688.0,Finance,,Financial & Banking Information,2017,"1,000-9,999",1-99,
9691,02/11/2017 12:00:00 AM,04/09/2017 12:00:00 AM,Cyberattack,2017-01-30T00:00:00,2017-01-30T00:00:00,Lake Kennedy McCulluch CPAs PS,Other,1688.0,Finance,,Social Security Number,2017,"1,000-9,999",1-99,
9691,02/11/2017 12:00:00 AM,04/09/2017 12:00:00 AM,Cyberattack,2017-01-30T00:00:00,2017-01-30T00:00:00,Lake Kennedy McCulluch CPAs PS,Other,1688.0,Finance,,Name,2017,"1,000-9,999",1-99,
9690,02/06/2017 12:00:00 AM,04/04/2017 12:00:00 AM,Cyberattack,2016-02-26T00:00:00,2016-12-05T00:00:00,Tempur-Pedic,Malware,7366.0,Business,Manufacturing,Other,2017,"1,000-9,999",300-399,
9690,02/06/2017 12:00:00 AM,04/04/2017 12:00:00 AM,Cyberattack,2016-02-26T00:00:00,2016-12-05T00:00:00,Tempur-Pedic,Malware,7366.0,Business,Manufacturing,Financial & Banking Information,2017,"1,000-9,999",300-399,
9690,02/06/2017 12:00:00 AM,04/04/2017 12:00:00 AM,Cyberattack,2016-02-26T00:00:00,2016-12-05T00:00:00,Tempur-Pedic,Malware,7366.0,Business,Manufacturing,Name,2017,"1,000-9,999",300-399,
9689,02/10/2017 12:00:00 AM,03/27/2017 12:00:00 AM,Cyberattack,,,"Easy Breathe, Inc.",Unclear/unknown,2034.0,Business,Other,Other,2017,"1,000-9,999",Unknown,
9689,02/10/2017 12:00:00 AM,03/27/2017 12:00:00 AM,Cyberattack,,,"Easy Breathe, Inc.",Unclear/unknown,2034.0,Business,Other,Financial & Banking Information,2017,"1,000-9,999",Unknown,
9689,02/10/2017 12:00:00 AM,03/27/2017 12:00:00 AM,Cyberattack,,,"Easy Breathe, Inc.",Unclear/unknown,2034.0,Business,Other,Name,2017,"1,000-9,999",Unknown,
9687,02/13/2017 12:00:00 AM,03/16/2017 12:00:00 AM,Unauthorized Access,2017-02-11T00:00:00,2017-02-13T00:00:00,"Northwest Christian Schools, Inc.",,526.0,Education,,Other,2017,500-999,1-99,
9687,02/13/2017 12:00:00 AM,03/16/2017 12:00:00 AM,Unauthorized Access,2017-02-11T00:00:00,2017-02-13T00:00:00,"Northwest Christian Schools, Inc.",,526.0,Education,,Full Date of Birth,2017,500-999,1-99,
9687,02/13/2017 12:00:00 AM,03/16/2017 12:00:00 AM,Unauthorized Access,2017-02-11T00:00:00,2017-02-13T00:00:00,"Northwest Christian Schools, Inc.",,526.0,Education,,Financial & Banking Information,2017,500-999,1-99,
9687,02/13/2017 12:00:00 AM,03/16/2017 12:00:00 AM,Unauthorized Access,2017-02-11T00:00:00,2017-02-13T00:00:00,"Northwest Christian Schools, Inc.",,526.0,Education,,Social Security Number,2017,500-999,1-99,
9687,02/13/2017 12:00:00 AM,03/16/2017 12:00:00 AM,Unauthorized Access,2017-02-11T00:00:00,2017-02-13T00:00:00,"Northwest Christian Schools, Inc.",,526.0,Education,,Name,2017,500-999,1-99,
9686,02/06/2017 12:00:00 AM,03/10/2017 12:00:00 AM,Unauthorized Access,2016-02-26T00:00:00,2016-12-05T00:00:00,Bambeco Inc.,,2176.0,Business,Home,Other,2017,"1,000-9,999",300-399,
9686,02/06/2017 12:00:00 AM,03/10/2017 12:00:00 AM,Unauthorized Access,2016-02-26T00:00:00,2016-12-05T00:00:00,Bambeco Inc.,,2176.0,Business,Home,Financial & Banking Information,2017,"1,000-9,999",300-399,
9686,02/06/2017 12:00:00 AM,03/10/2017 12:00:00 AM,Unauthorized Access,2016-02-26T00:00:00,2016-12-05T00:00:00,Bambeco Inc.,,2176.0,Business,Home,Name,2017,"1,000-9,999",300-399,
9685,02/06/2017 12:00:00 AM,03/08/2017 12:00:00 AM,Cyberattack,2016-02-26T00:00:00,2016-12-05T00:00:00,Atlantic Cigar,Malware,803.0,Business,Retail,Other,2017,500-999,300-399,
9685,02/06/2017 12:00:00 AM,03/08/2017 12:00:00 AM,Cyberattack,2016-02-26T00:00:00,2016-12-05T00:00:00,Atlantic Cigar,Malware,803.0,Business,Retail,Financial & Banking Information,2017,500-999,300-399,
9685,02/06/2017 12:00:00 AM,03/08/2017 12:00:00 AM,Cyberattack,2016-02-26T00:00:00,2016-12-05T00:00:00,Atlantic Cigar,Malware,803.0,Business,Retail,Name,2017,500-999,300-399,
9684,02/06/2017 12:00:00 AM,03/08/2017 12:00:00 AM,Cyberattack,2016-12-14T00:00:00,2017-02-06T00:00:00,prAna,Malware,18172.0,Business,Clothing,Other,2017,"10,000-49,999",1-99,
9684,02/06/2017 12:00:00 AM,03/08/2017 12:00:00 AM,Cyberattack,2016-12-14T00:00:00,2017-02-06T00:00:00,prAna,Malware,18172.0,Business,Clothing,Username and Password/Security Question Answers,2017,"10,000-49,999",1-99,
9684,02/06/2017 12:00:00 AM,03/08/2017 12:00:00 AM,Cyberattack,2016-12-14T00:00:00,2017-02-06T00:00:00,prAna,Malware,18172.0,Business,Clothing,Financial & Banking Information,2017,"10,000-49,999",1-99,
9684,02/06/2017 12:00:00 AM,03/08/2017 12:00:00 AM,Cyberattack,2016-12-14T00:00:00,2017-02-06T00:00:00,prAna,Malware,18172.0,Business,Clothing,Name,2017,"10,000-49,999",1-99,
9683,02/22/2017 12:00:00 AM,03/07/2017 12:00:00 AM,Unauthorized Access,2017-02-22T00:00:00,2017-02-22T00:00:00,Russell Investments,,1291.0,Finance,,Other,2017,"1,000-9,999",0,
9683,02/22/2017 12:00:00 AM,03/07/2017 12:00:00 AM,Unauthorized Access,2017-02-22T00:00:00,2017-02-22T00:00:00,Russell Investments,,1291.0,Finance,,Health Insurance Policy or ID Number,2017,"1,000-9,999",0,
9683,02/22/2017 12:00:00 AM,03/07/2017 12:00:00 AM,Unauthorized Access,2017-02-22T00:00:00,2017-02-22T00:00:00,Russell Investments,,1291.0,Finance,,Full Date of Birth,2017,"1,000-9,999",0,
9683,02/22/2017 12:00:00 AM,03/07/2017 12:00:00 AM,Unauthorized Access,2017-02-22T00:00:00,2017-02-22T00:00:00,Russell Investments,,1291.0,Finance,,Social Security Number,2017,"1,000-9,999",0,
9683,02/22/2017 12:00:00 AM,03/07/2017 12:00:00 AM,Unauthorized Access,2017-02-22T00:00:00,2017-02-22T00:00:00,Russell Investments,,1291.0,Finance,,Name,2017,"1,000-9,999",0,
9682,02/06/2017 12:00:00 AM,03/06/2017 12:00:00 AM,Cyberattack,2016-02-26T00:00:00,2016-12-05T00:00:00,West Music Company,Malware,1495.0,Business,Retail,Other,2017,"1,000-9,999",300-399,
9682,02/06/2017 12:00:00 AM,03/06/2017 12:00:00 AM,Cyberattack,2016-02-26T00:00:00,2016-12-05T00:00:00,West Music Company,Malware,1495.0,Business,Retail,Financial & Banking Information,2017,"1,000-9,999",300-399,
9682,02/06/2017 12:00:00 AM,03/06/2017 12:00:00 AM,Cyberattack,2016-02-26T00:00:00,2016-12-05T00:00:00,West Music Company,Malware,1495.0,Business,Retail,Name,2017,"1,000-9,999",300-399,
9681,02/06/2017 12:00:00 AM,02/25/2017 12:00:00 AM,Cyberattack,2016-02-26T00:00:00,2016-12-05T00:00:00,"Movie Mars, Inc.",Malware,524.0,Business,Retail,Other,2017,500-999,300-399,
9681,02/06/2017 12:00:00 AM,02/25/2017 12:00:00 AM,Cyberattack,2016-02-26T00:00:00,2016-12-05T00:00:00,"Movie Mars, Inc.",Malware,524.0,Business,Retail,Financial & Banking Information,2017,500-999,300-399,
9681,02/06/2017 12:00:00 AM,02/25/2017 12:00:00 AM,Cyberattack,2016-02-26T00:00:00,2016-12-05T00:00:00,"Movie Mars, Inc.",Malware,524.0,Business,Retail,Name,2017,500-999,300-399,
9680,02/06/2017 12:00:00 AM,02/25/2017 12:00:00 AM,Cyberattack,2016-02-26T00:00:00,2016-12-05T00:00:00,"Century, LCC",Malware,639.0,Business,Retail,Other,2017,500-999,300-399,
9680,02/06/2017 12:00:00 AM,02/25/2017 12:00:00 AM,Cyberattack,2016-02-26T00:00:00,2016-12-05T00:00:00,"Century, LCC",Malware,639.0,Business,Retail,Financial & Banking Information,2017,500-999,300-399,
9680,02/06/2017 12:00:00 AM,02/25/2017 12:00:00 AM,Cyberattack,2016-02-26T00:00:00,2016-12-05T00:00:00,"Century, LCC",Malware,639.0,Business,Retail,Name,2017,500-999,300-399,
9679,02/06/2017 12:00:00 AM,02/25/2017 12:00:00 AM,Cyberattack,2016-02-26T00:00:00,2016-12-05T00:00:00,"Plow and Hearth, LLC",Malware,1274.0,Business,Home,Other,2017,"1,000-9,999",300-399,
9679,02/06/2017 12:00:00 AM,02/25/2017 12:00:00 AM,Cyberattack,2016-02-26T00:00:00,2016-12-05T00:00:00,"Plow and Hearth, LLC",Malware,1274.0,Business,Home,Financial & Banking Information,2017,"1,000-9,999",300-399,
9679,02/06/2017 12:00:00 AM,02/25/2017 12:00:00 AM,Cyberattack,2016-02-26T00:00:00,2016-12-05T00:00:00,"Plow and Hearth, LLC",Malware,1274.0,Business,Home,Name,2017,"1,000-9,999",300-399,
9678,02/06/2017 12:00:00 AM,02/25/2017 12:00:00 AM,Cyberattack,2016-02-26T00:00:00,2016-12-05T00:00:00,"Vapour Organic Beauty, LLC",Malware,847.0,Business,Cosmetic,Other,2017,500-999,300-399,
9678,02/06/2017 12:00:00 AM,02/25/2017 12:00:00 AM,Cyberattack,2016-02-26T00:00:00,2016-12-05T00:00:00,"Vapour Organic Beauty, LLC",Malware,847.0,Business,Cosmetic,Financial & Banking Information,2017,500-999,300-399,
9678,02/06/2017 12:00:00 AM,02/25/2017 12:00:00 AM,Cyberattack,2016-02-26T00:00:00,2016-12-05T00:00:00,"Vapour Organic Beauty, LLC",Malware,847.0,Business,Cosmetic,Name,2017,500-999,300-399,
9677,02/06/2017 12:00:00 AM,02/25/2017 12:00:00 AM,Cyberattack,2016-02-26T00:00:00,2016-12-05T00:00:00,"Blue Mercury, Inc.",Malware,778.0,Business,Cosmetic,Other,2017,500-999,300-399,
9677,02/06/2017 12:00:00 AM,02/25/2017 12:00:00 AM,Cyberattack,2016-02-26T00:00:00,2016-12-05T00:00:00,"Blue Mercury, Inc.",Malware,778.0,Business,Cosmetic,Financial & Banking Information,2017,500-999,300-399,
9677,02/06/2017 12:00:00 AM,02/25/2017 12:00:00 AM,Cyberattack,2016-02-26T00:00:00,2016-12-05T00:00:00,"Blue Mercury, Inc.",Malware,778.0,Business,Cosmetic,Name,2017,500-999,300-399,
9676,02/06/2017 12:00:00 AM,02/25/2017 12:00:00 AM,Cyberattack,2016-02-26T00:00:00,2016-12-05T00:00:00,"Nutrex Hawaii, Inc.",Malware,725.0,Business,Consumable,Other,2017,500-999,300-399,
9676,02/06/2017 12:00:00 AM,02/25/2017 12:00:00 AM,Cyberattack,2016-02-26T00:00:00,2016-12-05T00:00:00,"Nutrex Hawaii, Inc.",Malware,725.0,Business,Consumable,Financial & Banking Information,2017,500-999,300-399,
9676,02/06/2017 12:00:00 AM,02/25/2017 12:00:00 AM,Cyberattack,2016-02-26T00:00:00,2016-12-05T00:00:00,"Nutrex Hawaii, Inc.",Malware,725.0,Business,Consumable,Name,2017,500-999,300-399,
9675,02/06/2017 12:00:00 AM,02/25/2017 12:00:00 AM,Cyberattack,2016-02-26T00:00:00,2016-12-05T00:00:00,Alpha Industries,Malware,1013.0,Business,Clothing,Other,2017,"1,000-9,999",300-399,
9675,02/06/2017 12:00:00 AM,02/25/2017 12:00:00 AM,Cyberattack,2016-02-26T00:00:00,2016-12-05T00:00:00,Alpha Industries,Malware,1013.0,Business,Clothing,Financial & Banking Information,2017,"1,000-9,999",300-399,
9675,02/06/2017 12:00:00 AM,02/25/2017 12:00:00 AM,Cyberattack,2016-02-26T00:00:00,2016-12-05T00:00:00,Alpha Industries,Malware,1013.0,Business,Clothing,Name,2017,"1,000-9,999",300-399,
9674,02/06/2017 12:00:00 AM,02/25/2017 12:00:00 AM,Cyberattack,2016-02-26T00:00:00,2016-12-05T00:00:00,"New England Biolabs, Inc.",Malware,746.0,Business,Biotech,Other,2017,500-999,300-399,
9674,02/06/2017 12:00:00 AM,02/25/2017 12:00:00 AM,Cyberattack,2016-02-26T00:00:00,2016-12-05T00:00:00,"New England Biolabs, Inc.",Malware,746.0,Business,Biotech,Financial & Banking Information,2017,500-999,300-399,
9674,02/06/2017 12:00:00 AM,02/25/2017 12:00:00 AM,Cyberattack,2016-02-26T00:00:00,2016-12-05T00:00:00,"New England Biolabs, Inc.",Malware,746.0,Business,Biotech,Name,2017,500-999,300-399,
9672,01/12/2017 12:00:00 AM,02/24/2017 12:00:00 AM,Theft or Mistake,2017-01-12T00:00:00,,"Pasco Rentals, Inc.",,6300.0,Business,Other,Other,2017,"1,000-9,999",Unknown,
9672,01/12/2017 12:00:00 AM,02/24/2017 12:00:00 AM,Theft or Mistake,2017-01-12T00:00:00,,"Pasco Rentals, Inc.",,6300.0,Business,Other,Driver's License or Washington ID Card Number,2017,"1,000-9,999",Unknown,
9672,01/12/2017 12:00:00 AM,02/24/2017 12:00:00 AM,Theft or Mistake,2017-01-12T00:00:00,,"Pasco Rentals, Inc.",,6300.0,Business,Other,Name,2017,"1,000-9,999",Unknown,
9671,01/05/2017 12:00:00 AM,02/24/2017 12:00:00 AM,Cyberattack,2015-07-30T00:00:00,2016-12-14T00:00:00,Roberts Hawaii,Malware,1178.0,Business,Transportation,Other,2017,"1,000-9,999",500+,
9671,01/05/2017 12:00:00 AM,02/24/2017 12:00:00 AM,Cyberattack,2015-07-30T00:00:00,2016-12-14T00:00:00,Roberts Hawaii,Malware,1178.0,Business,Transportation,Financial & Banking Information,2017,"1,000-9,999",500+,
9671,01/05/2017 12:00:00 AM,02/24/2017 12:00:00 AM,Cyberattack,2015-07-30T00:00:00,2016-12-14T00:00:00,Roberts Hawaii,Malware,1178.0,Business,Transportation,Name,2017,"1,000-9,999",500+,
9669,02/06/2017 12:00:00 AM,02/24/2017 12:00:00 AM,Cyberattack,2016-02-26T00:00:00,2016-12-05T00:00:00,Mrs Prindables,Malware,784.0,Business,Consumable,Other,2017,500-999,300-399,
9669,02/06/2017 12:00:00 AM,02/24/2017 12:00:00 AM,Cyberattack,2016-02-26T00:00:00,2016-12-05T00:00:00,Mrs Prindables,Malware,784.0,Business,Consumable,Financial & Banking Information,2017,500-999,300-399,
9669,02/06/2017 12:00:00 AM,02/24/2017 12:00:00 AM,Cyberattack,2016-02-26T00:00:00,2016-12-05T00:00:00,Mrs Prindables,Malware,784.0,Business,Consumable,Name,2017,500-999,300-399,
9668,02/06/2017 12:00:00 AM,02/23/2017 12:00:00 AM,Cyberattack,2013-06-01T00:00:00,2016-12-31T00:00:00,Abbott Nutrition,Malware,1819.0,Business,Consumable,Other,2017,"1,000-9,999",500+,
9668,02/06/2017 12:00:00 AM,02/23/2017 12:00:00 AM,Cyberattack,2013-06-01T00:00:00,2016-12-31T00:00:00,Abbott Nutrition,Malware,1819.0,Business,Consumable,Financial & Banking Information,2017,"1,000-9,999",500+,
9668,02/06/2017 12:00:00 AM,02/23/2017 12:00:00 AM,Cyberattack,2013-06-01T00:00:00,2016-12-31T00:00:00,Abbott Nutrition,Malware,1819.0,Business,Consumable,Name,2017,"1,000-9,999",500+,
9667,11/16/2016 12:00:00 AM,02/22/2017 12:00:00 AM,Cyberattack,2016-04-24T00:00:00,2016-12-14T00:00:00,Intex Recreation Corp.,Malware,1547.0,Business,Manufacturing,Other,2017,"1,000-9,999",200-299,
9667,11/16/2016 12:00:00 AM,02/22/2017 12:00:00 AM,Cyberattack,2016-04-24T00:00:00,2016-12-14T00:00:00,Intex Recreation Corp.,Malware,1547.0,Business,Manufacturing,Financial & Banking Information,2017,"1,000-9,999",200-299,
9667,11/16/2016 12:00:00 AM,02/22/2017 12:00:00 AM,Cyberattack,2016-04-24T00:00:00,2016-12-14T00:00:00,Intex Recreation Corp.,Malware,1547.0,Business,Manufacturing,Name,2017,"1,000-9,999",200-299,
9666,02/06/2017 12:00:00 AM,02/22/2017 12:00:00 AM,Unauthorized Access,2017-02-03T00:00:00,2017-02-06T00:00:00,"InterMountain Management, LLC",,558.0,Business,Hospitality,Other,2017,500-999,1-99,
9666,02/06/2017 12:00:00 AM,02/22/2017 12:00:00 AM,Unauthorized Access,2017-02-03T00:00:00,2017-02-06T00:00:00,"InterMountain Management, LLC",,558.0,Business,Hospitality,Social Security Number,2017,500-999,1-99,
9666,02/06/2017 12:00:00 AM,02/22/2017 12:00:00 AM,Unauthorized Access,2017-02-03T00:00:00,2017-02-06T00:00:00,"InterMountain Management, LLC",,558.0,Business,Hospitality,Name,2017,500-999,1-99,
9665,01/09/2017 12:00:00 AM,02/08/2017 12:00:00 AM,Unauthorized Access,2016-11-21T00:00:00,2016-11-21T00:00:00,The Boeing Company,,7288.0,Business,Manufacturing,Other,2017,"1,000-9,999",1-99,
9665,01/09/2017 12:00:00 AM,02/08/2017 12:00:00 AM,Unauthorized Access,2016-11-21T00:00:00,2016-11-21T00:00:00,The Boeing Company,,7288.0,Business,Manufacturing,Full Date of Birth,2017,"1,000-9,999",1-99,
9665,01/09/2017 12:00:00 AM,02/08/2017 12:00:00 AM,Unauthorized Access,2016-11-21T00:00:00,2016-11-21T00:00:00,The Boeing Company,,7288.0,Business,Manufacturing,Social Security Number,2017,"1,000-9,999",1-99,
9665,01/09/2017 12:00:00 AM,02/08/2017 12:00:00 AM,Unauthorized Access,2016-11-21T00:00:00,2016-11-21T00:00:00,The Boeing Company,,7288.0,Business,Manufacturing,Name,2017,"1,000-9,999",1-99,
9664,12/23/2016 12:00:00 AM,02/03/2017 12:00:00 AM,Unauthorized Access,2016-11-16T00:00:00,2016-11-16T00:00:00,"Conover Capital Management, LLC and Conover Securities Corporation",,1197.0,Finance,,Other,2017,"1,000-9,999",1-99,
9664,12/23/2016 12:00:00 AM,02/03/2017 12:00:00 AM,Unauthorized Access,2016-11-16T00:00:00,2016-11-16T00:00:00,"Conover Capital Management, LLC and Conover Securities Corporation",,1197.0,Finance,,Driver's License or Washington ID Card Number,2017,"1,000-9,999",1-99,
9664,12/23/2016 12:00:00 AM,02/03/2017 12:00:00 AM,Unauthorized Access,2016-11-16T00:00:00,2016-11-16T00:00:00,"Conover Capital Management, LLC and Conover Securities Corporation",,1197.0,Finance,,Social Security Number,2017,"1,000-9,999",1-99,
9664,12/23/2016 12:00:00 AM,02/03/2017 12:00:00 AM,Unauthorized Access,2016-11-16T00:00:00,2016-11-16T00:00:00,"Conover Capital Management, LLC and Conover Securities Corporation",,1197.0,Finance,,Name,2017,"1,000-9,999",1-99,
9662,12/23/2015 12:00:00 AM,01/18/2017 12:00:00 AM,Cyberattack,,,"CoPilot Provider Support Services, Inc.",Other,1522.0,Health,,Other,2017,"1,000-9,999",Unknown,
9662,12/23/2015 12:00:00 AM,01/18/2017 12:00:00 AM,Cyberattack,,,"CoPilot Provider Support Services, Inc.",Other,1522.0,Health,,Health Insurance Policy or ID Number,2017,"1,000-9,999",Unknown,
9662,12/23/2015 12:00:00 AM,01/18/2017 12:00:00 AM,Cyberattack,,,"CoPilot Provider Support Services, Inc.",Other,1522.0,Health,,Full Date of Birth,2017,"1,000-9,999",Unknown,
9662,12/23/2015 12:00:00 AM,01/18/2017 12:00:00 AM,Cyberattack,,,"CoPilot Provider Support Services, Inc.",Other,1522.0,Health,,Social Security Number,2017,"1,000-9,999",Unknown,
9662,12/23/2015 12:00:00 AM,01/18/2017 12:00:00 AM,Cyberattack,,,"CoPilot Provider Support Services, Inc.",Other,1522.0,Health,,Name,2017,"1,000-9,999",Unknown,
9661,11/28/2016 12:00:00 AM,01/12/2017 12:00:00 AM,Cyberattack,2016-05-02T00:00:00,2016-11-22T00:00:00,"Spiraledge, Inc.",Malware,9700.0,Business,Retail,Other,2017,"1,000-9,999",200-299,
9661,11/28/2016 12:00:00 AM,01/12/2017 12:00:00 AM,Cyberattack,2016-05-02T00:00:00,2016-11-22T00:00:00,"Spiraledge, Inc.",Malware,9700.0,Business,Retail,Financial & Banking Information,2017,"1,000-9,999",200-299,
9661,11/28/2016 12:00:00 AM,01/12/2017 12:00:00 AM,Cyberattack,2016-05-02T00:00:00,2016-11-22T00:00:00,"Spiraledge, Inc.",Malware,9700.0,Business,Retail,Name,2017,"1,000-9,999",200-299,
9660,11/30/2016 12:00:00 AM,12/21/2016 12:00:00 AM,Unauthorized Access,2016-01-16T00:00:00,,Community Health Plan of Washington,,353388.0,Health,,Other,2017,"50,000-999,999",Unknown,
9660,11/30/2016 12:00:00 AM,12/21/2016 12:00:00 AM,Unauthorized Access,2016-01-16T00:00:00,,Community Health Plan of Washington,,353388.0,Health,,Health Insurance Policy or ID Number,2017,"50,000-999,999",Unknown,
9660,11/30/2016 12:00:00 AM,12/21/2016 12:00:00 AM,Unauthorized Access,2016-01-16T00:00:00,,Community Health Plan of Washington,,353388.0,Health,,Social Security Number,2017,"50,000-999,999",Unknown,
9660,11/30/2016 12:00:00 AM,12/21/2016 12:00:00 AM,Unauthorized Access,2016-01-16T00:00:00,,Community Health Plan of Washington,,353388.0,Health,,Name,2017,"50,000-999,999",Unknown,
9659,,12/20/2016 12:00:00 AM,Unauthorized Access,,,Western Union Financial Services,,2470.0,Finance,,Full Date of Birth,2017,"1,000-9,999",Unknown,
9659,,12/20/2016 12:00:00 AM,Unauthorized Access,,,Western Union Financial Services,,2470.0,Finance,,Driver's License or Washington ID Card Number,2017,"1,000-9,999",Unknown,
9659,,12/20/2016 12:00:00 AM,Unauthorized Access,,,Western Union Financial Services,,2470.0,Finance,,Social Security Number,2017,"1,000-9,999",Unknown,
9659,,12/20/2016 12:00:00 AM,Unauthorized Access,,,Western Union Financial Services,,2470.0,Finance,,Name,2017,"1,000-9,999",Unknown,
9658,10/18/2016 12:00:00 AM,11/30/2016 12:00:00 AM,Theft or Mistake,2016-10-18T00:00:00,2016-10-18T00:00:00,CHI Franciscan Health- Hospice Tacoma,,1223.0,Health,,Other,2017,"1,000-9,999",0,
9658,10/18/2016 12:00:00 AM,11/30/2016 12:00:00 AM,Theft or Mistake,2016-10-18T00:00:00,2016-10-18T00:00:00,CHI Franciscan Health- Hospice Tacoma,,1223.0,Health,,Medical Information,2017,"1,000-9,999",0,
9658,10/18/2016 12:00:00 AM,11/30/2016 12:00:00 AM,Theft or Mistake,2016-10-18T00:00:00,2016-10-18T00:00:00,CHI Franciscan Health- Hospice Tacoma,,1223.0,Health,,Health Insurance Policy or ID Number,2017,"1,000-9,999",0,
9658,10/18/2016 12:00:00 AM,11/30/2016 12:00:00 AM,Theft or Mistake,2016-10-18T00:00:00,2016-10-18T00:00:00,CHI Franciscan Health- Hospice Tacoma,,1223.0,Health,,Social Security Number,2017,"1,000-9,999",0,
9658,10/18/2016 12:00:00 AM,11/30/2016 12:00:00 AM,Theft or Mistake,2016-10-18T00:00:00,2016-10-18T00:00:00,CHI Franciscan Health- Hospice Tacoma,,1223.0,Health,,Name,2017,"1,000-9,999",0,
9657,10/27/2016 12:00:00 AM,11/22/2016 12:00:00 AM,Cyberattack,2015-11-09T00:00:00,2016-10-24T00:00:00,The Madison Square Garden Company,Malware,,Business,Entertainment,Financial & Banking Information,2017,Unknown,300-399,
9657,10/27/2016 12:00:00 AM,11/22/2016 12:00:00 AM,Cyberattack,2015-11-09T00:00:00,2016-10-24T00:00:00,The Madison Square Garden Company,Malware,,Business,Entertainment,Name,2017,Unknown,300-399,
9656,10/21/2016 12:00:00 AM,11/21/2016 12:00:00 AM,Cyberattack,2016-03-09T00:00:00,2016-10-22T00:00:00,Island Hotel Company Limited,Malware,,Business,Hospitality,Financial & Banking Information,2017,Unknown,200-299,
9656,10/21/2016 12:00:00 AM,11/21/2016 12:00:00 AM,Cyberattack,2016-03-09T00:00:00,2016-10-22T00:00:00,Island Hotel Company Limited,Malware,,Business,Hospitality,Name,2017,Unknown,200-299,
9655,,11/18/2016 12:00:00 AM,Unauthorized Access,2016-11-13T00:00:00,,Michigan State University,,,Education,,Other,2017,Unknown,Unknown,
9655,,11/18/2016 12:00:00 AM,Unauthorized Access,2016-11-13T00:00:00,,Michigan State University,,,Education,,Student ID Number,2017,Unknown,Unknown,
9655,,11/18/2016 12:00:00 AM,Unauthorized Access,2016-11-13T00:00:00,,Michigan State University,,,Education,,Full Date of Birth,2017,Unknown,Unknown,
9655,,11/18/2016 12:00:00 AM,Unauthorized Access,2016-11-13T00:00:00,,Michigan State University,,,Education,,Social Security Number,2017,Unknown,Unknown,
9655,,11/18/2016 12:00:00 AM,Unauthorized Access,2016-11-13T00:00:00,,Michigan State University,,,Education,,Name,2017,Unknown,Unknown,
9654,11/04/2016 12:00:00 AM,11/18/2016 12:00:00 AM,Cyberattack,2015-10-03T00:00:00,2016-10-09T00:00:00,Springfield Armory,Malware,512.0,Business,Other,Other,2017,500-999,300-399,
9654,11/04/2016 12:00:00 AM,11/18/2016 12:00:00 AM,Cyberattack,2015-10-03T00:00:00,2016-10-09T00:00:00,Springfield Armory,Malware,512.0,Business,Other,Financial & Banking Information,2017,500-999,300-399,
9654,11/04/2016 12:00:00 AM,11/18/2016 12:00:00 AM,Cyberattack,2015-10-03T00:00:00,2016-10-09T00:00:00,Springfield Armory,Malware,512.0,Business,Other,Name,2017,500-999,300-399,
9652,07/14/2016 12:00:00 AM,11/09/2016 12:00:00 AM,Cyberattack,,,UFCW Local 655 Food Employers Pension Plan,Ransomware,556.0,Finance,,Full Date of Birth,2017,500-999,Unknown,
9652,07/14/2016 12:00:00 AM,11/09/2016 12:00:00 AM,Cyberattack,,,UFCW Local 655 Food Employers Pension Plan,Ransomware,556.0,Finance,,Financial & Banking Information,2017,500-999,Unknown,
9652,07/14/2016 12:00:00 AM,11/09/2016 12:00:00 AM,Cyberattack,,,UFCW Local 655 Food Employers Pension Plan,Ransomware,556.0,Finance,,Social Security Number,2017,500-999,Unknown,
9652,07/14/2016 12:00:00 AM,11/09/2016 12:00:00 AM,Cyberattack,,,UFCW Local 655 Food Employers Pension Plan,Ransomware,556.0,Finance,,Name,2017,500-999,Unknown,
9651,,11/09/2016 12:00:00 AM,Cyberattack,2016-09-07T00:00:00,2016-10-24T00:00:00,Eileen Fisher Inc.,Malware,755.0,Business,Clothing,Other,2017,500-999,Unknown,
9651,,11/09/2016 12:00:00 AM,Cyberattack,2016-09-07T00:00:00,2016-10-24T00:00:00,Eileen Fisher Inc.,Malware,755.0,Business,Clothing,Financial & Banking Information,2017,500-999,Unknown,
9651,,11/09/2016 12:00:00 AM,Cyberattack,2016-09-07T00:00:00,2016-10-24T00:00:00,Eileen Fisher Inc.,Malware,755.0,Business,Clothing,Name,2017,500-999,Unknown,
9650,10/07/2016 12:00:00 AM,11/04/2016 12:00:00 AM,Cyberattack,,,Rebecca Minkoff LLC,Unclear/unknown,549.0,Business,Retail,Username and Password/Security Question Answers,2017,500-999,Unknown,
9650,10/07/2016 12:00:00 AM,11/04/2016 12:00:00 AM,Cyberattack,,,Rebecca Minkoff LLC,Unclear/unknown,549.0,Business,Retail,Financial & Banking Information,2017,500-999,Unknown,
9650,10/07/2016 12:00:00 AM,11/04/2016 12:00:00 AM,Cyberattack,,,Rebecca Minkoff LLC,Unclear/unknown,549.0,Business,Retail,Name,2017,500-999,Unknown,
9649,09/30/2016 12:00:00 AM,10/19/2016 12:00:00 AM,Cyberattack,2016-05-29T00:00:00,2016-07-22T00:00:00,Eastwood Company,Malware,633.0,Business,Other,Other,2017,500-999,100-199,
9649,09/30/2016 12:00:00 AM,10/19/2016 12:00:00 AM,Cyberattack,2016-05-29T00:00:00,2016-07-22T00:00:00,Eastwood Company,Malware,633.0,Business,Other,Financial & Banking Information,2017,500-999,100-199,
9649,09/30/2016 12:00:00 AM,10/19/2016 12:00:00 AM,Cyberattack,2016-05-29T00:00:00,2016-07-22T00:00:00,Eastwood Company,Malware,633.0,Business,Other,Name,2017,500-999,100-199,
9647,09/12/2016 12:00:00 AM,09/30/2016 12:00:00 AM,Unauthorized Access,2016-09-12T00:00:00,2016-09-12T00:00:00,Vaupell,,1198.0,Business,Manufacturing,Other,2017,"1,000-9,999",0,
9647,09/12/2016 12:00:00 AM,09/30/2016 12:00:00 AM,Unauthorized Access,2016-09-12T00:00:00,2016-09-12T00:00:00,Vaupell,,1198.0,Business,Manufacturing,Full Date of Birth,2017,"1,000-9,999",0,
9647,09/12/2016 12:00:00 AM,09/30/2016 12:00:00 AM,Unauthorized Access,2016-09-12T00:00:00,2016-09-12T00:00:00,Vaupell,,1198.0,Business,Manufacturing,Social Security Number,2017,"1,000-9,999",0,
9647,09/12/2016 12:00:00 AM,09/30/2016 12:00:00 AM,Unauthorized Access,2016-09-12T00:00:00,2016-09-12T00:00:00,Vaupell,,1198.0,Business,Manufacturing,Name,2017,"1,000-9,999",0,
9645,08/23/2016 12:00:00 AM,09/19/2016 12:00:00 AM,Theft or Mistake,,,"Ascensus, Inc.",,1505.0,Finance,,Other,2017,"1,000-9,999",Unknown,
9645,08/23/2016 12:00:00 AM,09/19/2016 12:00:00 AM,Theft or Mistake,,,"Ascensus, Inc.",,1505.0,Finance,,Full Date of Birth,2017,"1,000-9,999",Unknown,
9645,08/23/2016 12:00:00 AM,09/19/2016 12:00:00 AM,Theft or Mistake,,,"Ascensus, Inc.",,1505.0,Finance,,Social Security Number,2017,"1,000-9,999",Unknown,
9645,08/23/2016 12:00:00 AM,09/19/2016 12:00:00 AM,Theft or Mistake,,,"Ascensus, Inc.",,1505.0,Finance,,Name,2017,"1,000-9,999",Unknown,
9644,08/22/2016 12:00:00 AM,09/19/2016 12:00:00 AM,Unauthorized Access,,,ACTIVEOutdoors,,1449645.0,Government,,Other,2017,"1,000,000+",Unknown,
9644,08/22/2016 12:00:00 AM,09/19/2016 12:00:00 AM,Unauthorized Access,,,ACTIVEOutdoors,,1449645.0,Government,,Full Date of Birth,2017,"1,000,000+",Unknown,
9644,08/22/2016 12:00:00 AM,09/19/2016 12:00:00 AM,Unauthorized Access,,,ACTIVEOutdoors,,1449645.0,Government,,Driver's License or Washington ID Card Number,2017,"1,000,000+",Unknown,
9644,08/22/2016 12:00:00 AM,09/19/2016 12:00:00 AM,Unauthorized Access,,,ACTIVEOutdoors,,1449645.0,Government,,Social Security Number,2017,"1,000,000+",Unknown,
9644,08/22/2016 12:00:00 AM,09/19/2016 12:00:00 AM,Unauthorized Access,,,ACTIVEOutdoors,,1449645.0,Government,,Name,2017,"1,000,000+",Unknown,
9643,08/19/2016 12:00:00 AM,09/02/2016 12:00:00 AM,Cyberattack,2016-04-25T00:00:00,,Noble House Hotels,Skimmers,1463.0,Business,Hospitality,Financial & Banking Information,2017,"1,000-9,999",Unknown,
9643,08/19/2016 12:00:00 AM,09/02/2016 12:00:00 AM,Cyberattack,2016-04-25T00:00:00,,Noble House Hotels,Skimmers,1463.0,Business,Hospitality,Name,2017,"1,000-9,999",Unknown,
9642,07/22/2016 12:00:00 AM,08/31/2016 12:00:00 AM,Theft or Mistake,2016-04-21T00:00:00,2016-06-13T00:00:00,Highline Medical Center,,12724.0,Health,,Other,2017,"10,000-49,999",1-99,
9642,07/22/2016 12:00:00 AM,08/31/2016 12:00:00 AM,Theft or Mistake,2016-04-21T00:00:00,2016-06-13T00:00:00,Highline Medical Center,,12724.0,Health,,Health Insurance Policy or ID Number,2017,"10,000-49,999",1-99,
9642,07/22/2016 12:00:00 AM,08/31/2016 12:00:00 AM,Theft or Mistake,2016-04-21T00:00:00,2016-06-13T00:00:00,Highline Medical Center,,12724.0,Health,,Social Security Number,2017,"10,000-49,999",1-99,
9642,07/22/2016 12:00:00 AM,08/31/2016 12:00:00 AM,Theft or Mistake,2016-04-21T00:00:00,2016-06-13T00:00:00,Highline Medical Center,,12724.0,Health,,Name,2017,"10,000-49,999",1-99,
9641,07/15/2016 12:00:00 AM,08/31/2016 12:00:00 AM,Cyberattack,2016-02-16T00:00:00,2016-07-07T00:00:00,Kimpton Hotels & Restaurants,Malware,5428.0,Business,Hospitality,Financial & Banking Information,2017,"1,000-9,999",100-199,
9641,07/15/2016 12:00:00 AM,08/31/2016 12:00:00 AM,Cyberattack,2016-02-16T00:00:00,2016-07-07T00:00:00,Kimpton Hotels & Restaurants,Malware,5428.0,Business,Hospitality,Name,2017,"1,000-9,999",100-199,
9640,08/18/2016 12:00:00 AM,08/30/2016 12:00:00 AM,Unauthorized Access,2016-07-16T00:00:00,2016-08-18T00:00:00,"Presnell Gage, PLLC",,2613.0,Finance,,Financial & Banking Information,2017,"1,000-9,999",1-99,
9640,08/18/2016 12:00:00 AM,08/30/2016 12:00:00 AM,Unauthorized Access,2016-07-16T00:00:00,2016-08-18T00:00:00,"Presnell Gage, PLLC",,2613.0,Finance,,Social Security Number,2017,"1,000-9,999",1-99,
9640,08/18/2016 12:00:00 AM,08/30/2016 12:00:00 AM,Unauthorized Access,2016-07-16T00:00:00,2016-08-18T00:00:00,"Presnell Gage, PLLC",,2613.0,Finance,,Name,2017,"1,000-9,999",1-99,
9639,06/30/2016 12:00:00 AM,08/22/2016 12:00:00 AM,Cyberattack,2015-10-21T00:00:00,2016-04-07T00:00:00,KontrolFreek,Malware,625.0,Business,Other,Financial & Banking Information,2017,500-999,200-299,
9639,06/30/2016 12:00:00 AM,08/22/2016 12:00:00 AM,Cyberattack,2015-10-21T00:00:00,2016-04-07T00:00:00,KontrolFreek,Malware,625.0,Business,Other,Name,2017,500-999,200-299,
9638,07/15/2016 12:00:00 AM,08/18/2016 12:00:00 AM,Cyberattack,2016-01-02T00:00:00,2016-07-17T00:00:00,Eddie Bauer,Malware,73508.0,Business,Clothing,Financial & Banking Information,2017,"50,000-999,999",100-199,
9638,07/15/2016 12:00:00 AM,08/18/2016 12:00:00 AM,Cyberattack,2016-01-02T00:00:00,2016-07-17T00:00:00,Eddie Bauer,Malware,73508.0,Business,Clothing,Name,2017,"50,000-999,999",100-199,
9637,06/13/2016 12:00:00 AM,08/12/2016 12:00:00 AM,Unauthorized Access,2016-03-30T00:00:00,,"Valley Anesthesiology Consultants, Inc.",,611.0,Health,,Medical Information,2017,500-999,Unknown,
9637,06/13/2016 12:00:00 AM,08/12/2016 12:00:00 AM,Unauthorized Access,2016-03-30T00:00:00,,"Valley Anesthesiology Consultants, Inc.",,611.0,Health,,Health Insurance Policy or ID Number,2017,500-999,Unknown,
9637,06/13/2016 12:00:00 AM,08/12/2016 12:00:00 AM,Unauthorized Access,2016-03-30T00:00:00,,"Valley Anesthesiology Consultants, Inc.",,611.0,Health,,Social Security Number,2017,500-999,Unknown,
9637,06/13/2016 12:00:00 AM,08/12/2016 12:00:00 AM,Unauthorized Access,2016-03-30T00:00:00,,"Valley Anesthesiology Consultants, Inc.",,611.0,Health,,Name,2017,500-999,Unknown,
9635,07/13/2016 12:00:00 AM,08/03/2016 12:00:00 AM,Cyberattack,2016-06-17T00:00:00,,Banner Health,Malware,7916.0,Health,,Other,2017,"1,000-9,999",Unknown,
9635,07/13/2016 12:00:00 AM,08/03/2016 12:00:00 AM,Cyberattack,2016-06-17T00:00:00,,Banner Health,Malware,7916.0,Health,,Medical Information,2017,"1,000-9,999",Unknown,
9635,07/13/2016 12:00:00 AM,08/03/2016 12:00:00 AM,Cyberattack,2016-06-17T00:00:00,,Banner Health,Malware,7916.0,Health,,Full Date of Birth,2017,"1,000-9,999",Unknown,
9635,07/13/2016 12:00:00 AM,08/03/2016 12:00:00 AM,Cyberattack,2016-06-17T00:00:00,,Banner Health,Malware,7916.0,Health,,Social Security Number,2017,"1,000-9,999",Unknown,
9635,07/13/2016 12:00:00 AM,08/03/2016 12:00:00 AM,Cyberattack,2016-06-17T00:00:00,,Banner Health,Malware,7916.0,Health,,Name,2017,"1,000-9,999",Unknown,
9634,06/08/2016 12:00:00 AM,07/19/2016 12:00:00 AM,Cyberattack,2016-04-21T00:00:00,2016-06-13T00:00:00,San Antonio Shoemakers,Malware,511.0,Business,Retail,Financial & Banking Information,2016,500-999,1-99,
9634,06/08/2016 12:00:00 AM,07/19/2016 12:00:00 AM,Cyberattack,2016-04-21T00:00:00,2016-06-13T00:00:00,San Antonio Shoemakers,Malware,511.0,Business,Retail,Name,2016,500-999,1-99,
9633,07/19/2016 12:00:00 AM,07/19/2016 12:00:00 AM,Cyberattack,2016-03-01T00:00:00,2016-07-31T00:00:00,CiCi Enterprises,Malware,,Business,Hospitality,Financial & Banking Information,2016,Unknown,100-199,
9632,06/08/2016 12:00:00 AM,07/16/2016 12:00:00 AM,Unauthorized Access,2015-04-01T00:00:00,,"NLU Products, LLC",,2527.0,Business,Retail,Other,2016,"1,000-9,999",Unknown,
9632,06/08/2016 12:00:00 AM,07/16/2016 12:00:00 AM,Unauthorized Access,2015-04-01T00:00:00,,"NLU Products, LLC",,2527.0,Business,Retail,Financial & Banking Information,2016,"1,000-9,999",Unknown,
9632,06/08/2016 12:00:00 AM,07/16/2016 12:00:00 AM,Unauthorized Access,2015-04-01T00:00:00,,"NLU Products, LLC",,2527.0,Business,Retail,Name,2016,"1,000-9,999",Unknown,
9630,05/01/2016 12:00:00 AM,07/06/2016 12:00:00 AM,Cyberattack,2015-12-02T00:00:00,2016-06-08T00:00:00,Wendy's,Malware,,Business,Hospitality,Financial & Banking Information,2016,Unknown,100-199,
9629,05/17/2016 12:00:00 AM,06/28/2016 12:00:00 AM,Cyberattack,2016-01-31T00:00:00,2016-06-02T00:00:00,Noodles & Company,Malware,,Business,Hospitality,Financial & Banking Information,2016,Unknown,100-199,
9628,05/13/2016 12:00:00 AM,06/27/2016 12:00:00 AM,Cyberattack,2015-10-27T00:00:00,2016-03-21T00:00:00,Hard Rock Hotel & Casino Las Vegas,Malware,,Business,Hospitality,Financial & Banking Information,2016,Unknown,100-199,
9627,09/17/2014 12:00:00 AM,06/16/2016 12:00:00 AM,Unauthorized Access,2014-05-13T00:00:00,2014-05-13T00:00:00,Uber Technologies,,1355.0,Business,Transportation,Driver's License or Washington ID Card Number,2016,"1,000-9,999",100-199,
9627,09/17/2014 12:00:00 AM,06/16/2016 12:00:00 AM,Unauthorized Access,2014-05-13T00:00:00,2014-05-13T00:00:00,Uber Technologies,,1355.0,Business,Transportation,Name,2016,"1,000-9,999",100-199,
9626,06/01/2016 12:00:00 AM,06/13/2016 12:00:00 AM,Theft or Mistake,2016-05-27T00:00:00,2016-06-01T00:00:00,The Tax Shack,,1000.0,Finance,,Full Date of Birth,2016,"1,000-9,999",1-99,
9626,06/01/2016 12:00:00 AM,06/13/2016 12:00:00 AM,Theft or Mistake,2016-05-27T00:00:00,2016-06-01T00:00:00,The Tax Shack,,1000.0,Finance,,Financial & Banking Information,2016,"1,000-9,999",1-99,
9626,06/01/2016 12:00:00 AM,06/13/2016 12:00:00 AM,Theft or Mistake,2016-05-27T00:00:00,2016-06-01T00:00:00,The Tax Shack,,1000.0,Finance,,Social Security Number,2016,"1,000-9,999",1-99,
9626,06/01/2016 12:00:00 AM,06/13/2016 12:00:00 AM,Theft or Mistake,2016-05-27T00:00:00,2016-06-01T00:00:00,The Tax Shack,,1000.0,Finance,,Name,2016,"1,000-9,999",1-99,
9625,09/29/2015 12:00:00 AM,06/10/2016 12:00:00 AM,Unauthorized Access,2014-02-19T00:00:00,2015-08-06T00:00:00,Grand Sierra Resort,,1061.0,Business,Hospitality,Financial & Banking Information,2016,"1,000-9,999",500+,
9625,09/29/2015 12:00:00 AM,06/10/2016 12:00:00 AM,Unauthorized Access,2014-02-19T00:00:00,2015-08-06T00:00:00,Grand Sierra Resort,,1061.0,Business,Hospitality,Name,2016,"1,000-9,999",500+,
9623,01/30/2016 12:00:00 AM,06/06/2016 12:00:00 AM,Cyberattack,,2016-01-30T00:00:00,"Empathia, Inc.",Malware,602.0,Business,Professional Services,Other,2016,500-999,Unknown,
9623,01/30/2016 12:00:00 AM,06/06/2016 12:00:00 AM,Cyberattack,,2016-01-30T00:00:00,"Empathia, Inc.",Malware,602.0,Business,Professional Services,Full Date of Birth,2016,500-999,Unknown,
9623,01/30/2016 12:00:00 AM,06/06/2016 12:00:00 AM,Cyberattack,,2016-01-30T00:00:00,"Empathia, Inc.",Malware,602.0,Business,Professional Services,Social Security Number,2016,500-999,Unknown,
9623,01/30/2016 12:00:00 AM,06/06/2016 12:00:00 AM,Cyberattack,,2016-01-30T00:00:00,"Empathia, Inc.",Malware,602.0,Business,Professional Services,Name,2016,500-999,Unknown,
9622,,05/11/2016 12:00:00 AM,Unauthorized Access,2016-04-12T00:00:00,,Olympia School District,,2145.0,Government,,Other,2016,"1,000-9,999",Unknown,
9622,,05/11/2016 12:00:00 AM,Unauthorized Access,2016-04-12T00:00:00,,Olympia School District,,2145.0,Government,,Financial & Banking Information,2016,"1,000-9,999",Unknown,
9622,,05/11/2016 12:00:00 AM,Unauthorized Access,2016-04-12T00:00:00,,Olympia School District,,2145.0,Government,,Social Security Number,2016,"1,000-9,999",Unknown,
9622,,05/11/2016 12:00:00 AM,Unauthorized Access,2016-04-12T00:00:00,,Olympia School District,,2145.0,Government,,Name,2016,"1,000-9,999",Unknown,
9621,,05/10/2016 12:00:00 AM,Unauthorized Access,,,LendUp Processing Center,,708.0,Finance,,Other,2016,500-999,Unknown,
9621,,05/10/2016 12:00:00 AM,Unauthorized Access,,,LendUp Processing Center,,708.0,Finance,,Email Address and Password/Security Question Answers,2016,500-999,Unknown,
9621,,05/10/2016 12:00:00 AM,Unauthorized Access,,,LendUp Processing Center,,708.0,Finance,,Full Date of Birth,2016,500-999,Unknown,
9621,,05/10/2016 12:00:00 AM,Unauthorized Access,,,LendUp Processing Center,,708.0,Finance,,Social Security Number,2016,500-999,Unknown,
9621,,05/10/2016 12:00:00 AM,Unauthorized Access,,,LendUp Processing Center,,708.0,Finance,,Name,2016,500-999,Unknown,
9617,04/04/2016 12:00:00 AM,04/27/2016 12:00:00 AM,Unauthorized Access,,,AIM Inc.,,1639.0,Business,Retail,Passport Number,2016,"1,000-9,999",Unknown,
9617,04/04/2016 12:00:00 AM,04/27/2016 12:00:00 AM,Unauthorized Access,,,AIM Inc.,,1639.0,Business,Retail,Military ID Number,2016,"1,000-9,999",Unknown,
9617,04/04/2016 12:00:00 AM,04/27/2016 12:00:00 AM,Unauthorized Access,,,AIM Inc.,,1639.0,Business,Retail,Financial & Banking Information,2016,"1,000-9,999",Unknown,
9617,04/04/2016 12:00:00 AM,04/27/2016 12:00:00 AM,Unauthorized Access,,,AIM Inc.,,1639.0,Business,Retail,Driver's License or Washington ID Card Number,2016,"1,000-9,999",Unknown,
9617,04/04/2016 12:00:00 AM,04/27/2016 12:00:00 AM,Unauthorized Access,,,AIM Inc.,,1639.0,Business,Retail,Social Security Number,2016,"1,000-9,999",Unknown,
9617,04/04/2016 12:00:00 AM,04/27/2016 12:00:00 AM,Unauthorized Access,,,AIM Inc.,,1639.0,Business,Retail,Name,2016,"1,000-9,999",Unknown,
9616,,04/18/2016 12:00:00 AM,Unauthorized Access,2016-03-01T00:00:00,,doTERRA International LLC,,41485.0,Business,Consumable,Other,2016,"10,000-49,999",Unknown,
9616,,04/18/2016 12:00:00 AM,Unauthorized Access,2016-03-01T00:00:00,,doTERRA International LLC,,41485.0,Business,Consumable,Email Address and Password/Security Question Answers,2016,"10,000-49,999",Unknown,
9616,,04/18/2016 12:00:00 AM,Unauthorized Access,2016-03-01T00:00:00,,doTERRA International LLC,,41485.0,Business,Consumable,Username and Password/Security Question Answers,2016,"10,000-49,999",Unknown,
9616,,04/18/2016 12:00:00 AM,Unauthorized Access,2016-03-01T00:00:00,,doTERRA International LLC,,41485.0,Business,Consumable,Full Date of Birth,2016,"10,000-49,999",Unknown,
9616,,04/18/2016 12:00:00 AM,Unauthorized Access,2016-03-01T00:00:00,,doTERRA International LLC,,41485.0,Business,Consumable,Financial & Banking Information,2016,"10,000-49,999",Unknown,
9616,,04/18/2016 12:00:00 AM,Unauthorized Access,2016-03-01T00:00:00,,doTERRA International LLC,,41485.0,Business,Consumable,Driver's License or Washington ID Card Number,2016,"10,000-49,999",Unknown,
9616,,04/18/2016 12:00:00 AM,Unauthorized Access,2016-03-01T00:00:00,,doTERRA International LLC,,41485.0,Business,Consumable,Social Security Number,2016,"10,000-49,999",Unknown,
9616,,04/18/2016 12:00:00 AM,Unauthorized Access,2016-03-01T00:00:00,,doTERRA International LLC,,41485.0,Business,Consumable,Name,2016,"10,000-49,999",Unknown,
9615,,04/11/2016 12:00:00 AM,Cyberattack,2014-01-22T00:00:00,2016-02-08T00:00:00,"Schwaab, Inc.",Malware,2162.0,Business,Retail,Financial & Banking Information,2016,"1,000-9,999",Unknown,
9615,,04/11/2016 12:00:00 AM,Cyberattack,2014-01-22T00:00:00,2016-02-08T00:00:00,"Schwaab, Inc.",Malware,2162.0,Business,Retail,Name,2016,"1,000-9,999",Unknown,
9614,03/07/2016 12:00:00 AM,03/15/2016 12:00:00 AM,Cyberattack,2016-03-07T00:00:00,2016-03-07T00:00:00,Advance Auto Parts,Phishing,544.0,Business,Retail,Other,2016,500-999,0,
9614,03/07/2016 12:00:00 AM,03/15/2016 12:00:00 AM,Cyberattack,2016-03-07T00:00:00,2016-03-07T00:00:00,Advance Auto Parts,Phishing,544.0,Business,Retail,Financial & Banking Information,2016,500-999,0,
9614,03/07/2016 12:00:00 AM,03/15/2016 12:00:00 AM,Cyberattack,2016-03-07T00:00:00,2016-03-07T00:00:00,Advance Auto Parts,Phishing,544.0,Business,Retail,Social Security Number,2016,500-999,0,
9614,03/07/2016 12:00:00 AM,03/15/2016 12:00:00 AM,Cyberattack,2016-03-07T00:00:00,2016-03-07T00:00:00,Advance Auto Parts,Phishing,544.0,Business,Retail,Name,2016,500-999,0,
9613,,03/14/2016 12:00:00 AM,Cyberattack,2011-12-01T00:00:00,2016-01-26T00:00:00,"Bailey's, Inc.",Malware,8844.0,Business,Retail,Other,2016,"1,000-9,999",Unknown,
9613,,03/14/2016 12:00:00 AM,Cyberattack,2011-12-01T00:00:00,2016-01-26T00:00:00,"Bailey's, Inc.",Malware,8844.0,Business,Retail,Email Address and Password/Security Question Answers,2016,"1,000-9,999",Unknown,
9613,,03/14/2016 12:00:00 AM,Cyberattack,2011-12-01T00:00:00,2016-01-26T00:00:00,"Bailey's, Inc.",Malware,8844.0,Business,Retail,Username and Password/Security Question Answers,2016,"1,000-9,999",Unknown,
9613,,03/14/2016 12:00:00 AM,Cyberattack,2011-12-01T00:00:00,2016-01-26T00:00:00,"Bailey's, Inc.",Malware,8844.0,Business,Retail,Financial & Banking Information,2016,"1,000-9,999",Unknown,
9613,,03/14/2016 12:00:00 AM,Cyberattack,2011-12-01T00:00:00,2016-01-26T00:00:00,"Bailey's, Inc.",Malware,8844.0,Business,Retail,Name,2016,"1,000-9,999",Unknown,
9612,03/02/2016 12:00:00 AM,03/07/2016 12:00:00 AM,Unauthorized Access,2016-03-02T00:00:00,,Turner Construction Company,,566.0,Business,Construction,Other,2016,500-999,Unknown,
9612,03/02/2016 12:00:00 AM,03/07/2016 12:00:00 AM,Unauthorized Access,2016-03-02T00:00:00,,Turner Construction Company,,566.0,Business,Construction,Financial & Banking Information,2016,500-999,Unknown,
9612,03/02/2016 12:00:00 AM,03/07/2016 12:00:00 AM,Unauthorized Access,2016-03-02T00:00:00,,Turner Construction Company,,566.0,Business,Construction,Social Security Number,2016,500-999,Unknown,
9612,03/02/2016 12:00:00 AM,03/07/2016 12:00:00 AM,Unauthorized Access,2016-03-02T00:00:00,,Turner Construction Company,,566.0,Business,Construction,Name,2016,500-999,Unknown,
9611,11/13/2015 12:00:00 AM,03/04/2016 12:00:00 AM,Unauthorized Access,2015-10-03T00:00:00,,21st Century Oncology,,2802.0,Health,,Medical Information,2016,"1,000-9,999",Unknown,
9611,11/13/2015 12:00:00 AM,03/04/2016 12:00:00 AM,Unauthorized Access,2015-10-03T00:00:00,,21st Century Oncology,,2802.0,Health,,Health Insurance Policy or ID Number,2016,"1,000-9,999",Unknown,
9611,11/13/2015 12:00:00 AM,03/04/2016 12:00:00 AM,Unauthorized Access,2015-10-03T00:00:00,,21st Century Oncology,,2802.0,Health,,Social Security Number,2016,"1,000-9,999",Unknown,
9611,11/13/2015 12:00:00 AM,03/04/2016 12:00:00 AM,Unauthorized Access,2015-10-03T00:00:00,,21st Century Oncology,,2802.0,Health,,Name,2016,"1,000-9,999",Unknown,
9610,12/16/2015 12:00:00 AM,02/09/2016 12:00:00 AM,Unauthorized Access,2013-11-15T00:00:00,2015-12-24T00:00:00,Health Care Authority,,91187.0,Government,,Other,2016,"50,000-999,999",500+,
9610,12/16/2015 12:00:00 AM,02/09/2016 12:00:00 AM,Unauthorized Access,2013-11-15T00:00:00,2015-12-24T00:00:00,Health Care Authority,,91187.0,Government,,Medical Information,2016,"50,000-999,999",500+,
9610,12/16/2015 12:00:00 AM,02/09/2016 12:00:00 AM,Unauthorized Access,2013-11-15T00:00:00,2015-12-24T00:00:00,Health Care Authority,,91187.0,Government,,Full Date of Birth,2016,"50,000-999,999",500+,
9610,12/16/2015 12:00:00 AM,02/09/2016 12:00:00 AM,Unauthorized Access,2013-11-15T00:00:00,2015-12-24T00:00:00,Health Care Authority,,91187.0,Government,,Social Security Number,2016,"50,000-999,999",500+,
9610,12/16/2015 12:00:00 AM,02/09/2016 12:00:00 AM,Unauthorized Access,2013-11-15T00:00:00,2015-12-24T00:00:00,Health Care Authority,,91187.0,Government,,Name,2016,"50,000-999,999",500+,
9609,,02/04/2016 12:00:00 AM,Unauthorized Access,2015-10-03T00:00:00,2015-12-18T00:00:00,"Gyft, Inc.",,9042.0,Business,Retail,Other,2016,"1,000-9,999",Unknown,
9609,,02/04/2016 12:00:00 AM,Unauthorized Access,2015-10-03T00:00:00,2015-12-18T00:00:00,"Gyft, Inc.",,9042.0,Business,Retail,Email Address and Password/Security Question Answers,2016,"1,000-9,999",Unknown,
9609,,02/04/2016 12:00:00 AM,Unauthorized Access,2015-10-03T00:00:00,2015-12-18T00:00:00,"Gyft, Inc.",,9042.0,Business,Retail,Full Date of Birth,2016,"1,000-9,999",Unknown,
9609,,02/04/2016 12:00:00 AM,Unauthorized Access,2015-10-03T00:00:00,2015-12-18T00:00:00,"Gyft, Inc.",,9042.0,Business,Retail,Name,2016,"1,000-9,999",Unknown,
9608,12/03/2015 12:00:00 AM,01/29/2016 12:00:00 AM,Cyberattack,2014-05-04T00:00:00,2015-12-03T00:00:00,"Landry's, Inc.",Skimmers,,Business,Hospitality,Financial & Banking Information,2016,Unknown,500+,
9608,12/03/2015 12:00:00 AM,01/29/2016 12:00:00 AM,Cyberattack,2014-05-04T00:00:00,2015-12-03T00:00:00,"Landry's, Inc.",Skimmers,,Business,Hospitality,Name,2016,Unknown,500+,
9607,,01/22/2016 12:00:00 AM,Cyberattack,,,Starwood Hotels and Resorts,Malware,,Business,Hospitality,Financial & Banking Information,2016,Unknown,Unknown,
9607,,01/22/2016 12:00:00 AM,Cyberattack,,,Starwood Hotels and Resorts,Malware,,Business,Hospitality,Name,2016,Unknown,Unknown,
9605,11/24/2015 12:00:00 AM,01/14/2016 12:00:00 AM,Cyberattack,2015-08-13T00:00:00,2015-12-08T00:00:00,Hyatt Hotels Corporation,Malware,15.0,Business,Hospitality,Financial & Banking Information,2016,< 500,100-199,
9605,11/24/2015 12:00:00 AM,01/14/2016 12:00:00 AM,Cyberattack,2015-08-13T00:00:00,2015-12-08T00:00:00,Hyatt Hotels Corporation,Malware,15.0,Business,Hospitality,Name,2016,< 500,100-199,
9604,12/10/2015 12:00:00 AM,01/13/2016 12:00:00 AM,Unauthorized Access,2015-12-07T00:00:00,2015-12-08T00:00:00,HSBC Bank USA,,5270.0,Finance,,Other,2016,"1,000-9,999",1-99,
9604,12/10/2015 12:00:00 AM,01/13/2016 12:00:00 AM,Unauthorized Access,2015-12-07T00:00:00,2015-12-08T00:00:00,HSBC Bank USA,,5270.0,Finance,,Financial & Banking Information,2016,"1,000-9,999",1-99,
9604,12/10/2015 12:00:00 AM,01/13/2016 12:00:00 AM,Unauthorized Access,2015-12-07T00:00:00,2015-12-08T00:00:00,HSBC Bank USA,,5270.0,Finance,,Social Security Number,2016,"1,000-9,999",1-99,
9604,12/10/2015 12:00:00 AM,01/13/2016 12:00:00 AM,Unauthorized Access,2015-12-07T00:00:00,2015-12-08T00:00:00,HSBC Bank USA,,5270.0,Finance,,Name,2016,"1,000-9,999",1-99,
9602,12/07/2015 12:00:00 AM,12/23/2015 12:00:00 AM,Theft or Mistake,2015-11-09T00:00:00,,"Matson Navigation Company, Inc. and Horizon Lines",,2185.0,Business,Shipping,Other,2016,"1,000-9,999",Unknown,
9602,12/07/2015 12:00:00 AM,12/23/2015 12:00:00 AM,Theft or Mistake,2015-11-09T00:00:00,,"Matson Navigation Company, Inc. and Horizon Lines",,2185.0,Business,Shipping,Medical Information,2016,"1,000-9,999",Unknown,
9602,12/07/2015 12:00:00 AM,12/23/2015 12:00:00 AM,Theft or Mistake,2015-11-09T00:00:00,,"Matson Navigation Company, Inc. and Horizon Lines",,2185.0,Business,Shipping,Passport Number,2016,"1,000-9,999",Unknown,
9602,12/07/2015 12:00:00 AM,12/23/2015 12:00:00 AM,Theft or Mistake,2015-11-09T00:00:00,,"Matson Navigation Company, Inc. and Horizon Lines",,2185.0,Business,Shipping,Full Date of Birth,2016,"1,000-9,999",Unknown,
9602,12/07/2015 12:00:00 AM,12/23/2015 12:00:00 AM,Theft or Mistake,2015-11-09T00:00:00,,"Matson Navigation Company, Inc. and Horizon Lines",,2185.0,Business,Shipping,Financial & Banking Information,2016,"1,000-9,999",Unknown,
9602,12/07/2015 12:00:00 AM,12/23/2015 12:00:00 AM,Theft or Mistake,2015-11-09T00:00:00,,"Matson Navigation Company, Inc. and Horizon Lines",,2185.0,Business,Shipping,Social Security Number,2016,"1,000-9,999",Unknown,
9602,12/07/2015 12:00:00 AM,12/23/2015 12:00:00 AM,Theft or Mistake,2015-11-09T00:00:00,,"Matson Navigation Company, Inc. and Horizon Lines",,2185.0,Business,Shipping,Name,2016,"1,000-9,999",Unknown,
9601,08/04/2015 12:00:00 AM,12/18/2015 12:00:00 AM,Unauthorized Access,2014-07-15T00:00:00,2014-08-05T00:00:00,"Yapstone, Inc.",,5264.0,Business,Web Services,Financial & Banking Information,2016,"1,000-9,999",300-399,
9601,08/04/2015 12:00:00 AM,12/18/2015 12:00:00 AM,Unauthorized Access,2014-07-15T00:00:00,2014-08-05T00:00:00,"Yapstone, Inc.",,5264.0,Business,Web Services,Driver's License or Washington ID Card Number,2016,"1,000-9,999",300-399,
9601,08/04/2015 12:00:00 AM,12/18/2015 12:00:00 AM,Unauthorized Access,2014-07-15T00:00:00,2014-08-05T00:00:00,"Yapstone, Inc.",,5264.0,Business,Web Services,Social Security Number,2016,"1,000-9,999",300-399,
9601,08/04/2015 12:00:00 AM,12/18/2015 12:00:00 AM,Unauthorized Access,2014-07-15T00:00:00,2014-08-05T00:00:00,"Yapstone, Inc.",,5264.0,Business,Web Services,Name,2016,"1,000-9,999",300-399,
9599,,11/30/2015 12:00:00 AM,Cyberattack,2015-01-22T00:00:00,2015-07-20T00:00:00,Muji,Malware,664.0,Business,Retail,Other,2016,500-999,Unknown,
9599,,11/30/2015 12:00:00 AM,Cyberattack,2015-01-22T00:00:00,2015-07-20T00:00:00,Muji,Malware,664.0,Business,Retail,Financial & Banking Information,2016,500-999,Unknown,
9599,,11/30/2015 12:00:00 AM,Cyberattack,2015-01-22T00:00:00,2015-07-20T00:00:00,Muji,Malware,664.0,Business,Retail,Name,2016,500-999,Unknown,
9598,02/10/2015 12:00:00 AM,11/24/2015 12:00:00 AM,Cyberattack,,,"Hilton Worldwide, Inc.",Malware,,Business,Hospitality,Other,2016,Unknown,Unknown,
9598,02/10/2015 12:00:00 AM,11/24/2015 12:00:00 AM,Cyberattack,,,"Hilton Worldwide, Inc.",Malware,,Business,Hospitality,Financial & Banking Information,2016,Unknown,Unknown,
9598,02/10/2015 12:00:00 AM,11/24/2015 12:00:00 AM,Cyberattack,,,"Hilton Worldwide, Inc.",Malware,,Business,Hospitality,Name,2016,Unknown,Unknown,
9597,,11/13/2015 12:00:00 AM,Cyberattack,2014-12-29T00:00:00,2015-08-11T00:00:00,Noble House Hotels and Resorts,Malware,4555.0,Business,Hospitality,Financial & Banking Information,2016,"1,000-9,999",Unknown,
9597,,11/13/2015 12:00:00 AM,Cyberattack,2014-12-29T00:00:00,2015-08-11T00:00:00,Noble House Hotels and Resorts,Malware,4555.0,Business,Hospitality,Name,2016,"1,000-9,999",Unknown,
9653,03/17/2016 12:00:00 AM,11/11/2016 12:00:00 AM,Cyberattack,,,Charles Schwab,Other,975.0,Finance,,Other,2017,500-999,Unknown,
9653,03/17/2016 12:00:00 AM,11/11/2016 12:00:00 AM,Cyberattack,,,Charles Schwab,Other,975.0,Finance,,Financial & Banking Information,2017,500-999,Unknown,
9653,03/17/2016 12:00:00 AM,11/11/2016 12:00:00 AM,Cyberattack,,,Charles Schwab,Other,975.0,Finance,,Name,2017,500-999,Unknown,
9595,10/09/2015 12:00:00 AM,10/28/2015 12:00:00 AM,Cyberattack,2015-04-19T00:00:00,2015-09-30T00:00:00,"Digital Theatre, LLC",Malware,3230.0,Business,Entertainment,Other,2016,"1,000-9,999",100-199,
9595,10/09/2015 12:00:00 AM,10/28/2015 12:00:00 AM,Cyberattack,2015-04-19T00:00:00,2015-09-30T00:00:00,"Digital Theatre, LLC",Malware,3230.0,Business,Entertainment,Financial & Banking Information,2016,"1,000-9,999",100-199,
9595,10/09/2015 12:00:00 AM,10/28/2015 12:00:00 AM,Cyberattack,2015-04-19T00:00:00,2015-09-30T00:00:00,"Digital Theatre, LLC",Malware,3230.0,Business,Entertainment,Name,2016,"1,000-9,999",100-199,
9594,06/18/2015 12:00:00 AM,10/13/2015 12:00:00 AM,Cyberattack,2015-03-24T00:00:00,2015-05-20T00:00:00,"Service Systems Associates, Inc.",Malware,,Business,Hospitality,Financial & Banking Information,2016,Unknown,1-99,
9594,06/18/2015 12:00:00 AM,10/13/2015 12:00:00 AM,Cyberattack,2015-03-24T00:00:00,2015-05-20T00:00:00,"Service Systems Associates, Inc.",Malware,,Business,Hospitality,Name,2016,Unknown,1-99,
9591,09/21/2015 12:00:00 AM,10/01/2015 12:00:00 AM,Unauthorized Access,2015-09-15T00:00:00,,T-Mobile USA/Experian,,328889.0,Business,Telecommunications,Other,2016,"50,000-999,999",Unknown,
9591,09/21/2015 12:00:00 AM,10/01/2015 12:00:00 AM,Unauthorized Access,2015-09-15T00:00:00,,T-Mobile USA/Experian,,328889.0,Business,Telecommunications,Passport Number,2016,"50,000-999,999",Unknown,
9591,09/21/2015 12:00:00 AM,10/01/2015 12:00:00 AM,Unauthorized Access,2015-09-15T00:00:00,,T-Mobile USA/Experian,,328889.0,Business,Telecommunications,Military ID Number,2016,"50,000-999,999",Unknown,
9591,09/21/2015 12:00:00 AM,10/01/2015 12:00:00 AM,Unauthorized Access,2015-09-15T00:00:00,,T-Mobile USA/Experian,,328889.0,Business,Telecommunications,Full Date of Birth,2016,"50,000-999,999",Unknown,
9591,09/21/2015 12:00:00 AM,10/01/2015 12:00:00 AM,Unauthorized Access,2015-09-15T00:00:00,,T-Mobile USA/Experian,,328889.0,Business,Telecommunications,Driver's License or Washington ID Card Number,2016,"50,000-999,999",Unknown,
9591,09/21/2015 12:00:00 AM,10/01/2015 12:00:00 AM,Unauthorized Access,2015-09-15T00:00:00,,T-Mobile USA/Experian,,328889.0,Business,Telecommunications,Social Security Number,2016,"50,000-999,999",Unknown,
9591,09/21/2015 12:00:00 AM,10/01/2015 12:00:00 AM,Unauthorized Access,2015-09-15T00:00:00,,T-Mobile USA/Experian,,328889.0,Business,Telecommunications,Name,2016,"50,000-999,999",Unknown,
9589,,09/29/2015 12:00:00 AM,Unauthorized Access,2014-08-20T00:00:00,2015-07-14T00:00:00,Rite Aid Corporation,,2721.0,Business,Retail,Other,2016,"1,000-9,999",Unknown,
9589,,09/29/2015 12:00:00 AM,Unauthorized Access,2014-08-20T00:00:00,2015-07-14T00:00:00,Rite Aid Corporation,,2721.0,Business,Retail,Email Address and Password/Security Question Answers,2016,"1,000-9,999",Unknown,
9589,,09/29/2015 12:00:00 AM,Unauthorized Access,2014-08-20T00:00:00,2015-07-14T00:00:00,Rite Aid Corporation,,2721.0,Business,Retail,Financial & Banking Information,2016,"1,000-9,999",Unknown,
9589,,09/29/2015 12:00:00 AM,Unauthorized Access,2014-08-20T00:00:00,2015-07-14T00:00:00,Rite Aid Corporation,,2721.0,Business,Retail,Name,2016,"1,000-9,999",Unknown,
9588,08/23/2015 12:00:00 AM,09/26/2015 12:00:00 AM,Theft or Mistake,2015-08-23T00:00:00,,"Sterbick & Associates, P.S.",,500.0,Business,Legal,Social Security Number,2016,500-999,Unknown,
9588,08/23/2015 12:00:00 AM,09/26/2015 12:00:00 AM,Theft or Mistake,2015-08-23T00:00:00,,"Sterbick & Associates, P.S.",,500.0,Business,Legal,Name,2016,500-999,Unknown,
9587,07/17/2015 12:00:00 AM,09/22/2015 12:00:00 AM,Unauthorized Access,2014-06-19T00:00:00,2015-07-15T00:00:00,Costco,,29425.0,Business,Retail,Email Address and Password/Security Question Answers,2016,"10,000-49,999",300-399,
9587,07/17/2015 12:00:00 AM,09/22/2015 12:00:00 AM,Unauthorized Access,2014-06-19T00:00:00,2015-07-15T00:00:00,Costco,,29425.0,Business,Retail,Username and Password/Security Question Answers,2016,"10,000-49,999",300-399,
9587,07/17/2015 12:00:00 AM,09/22/2015 12:00:00 AM,Unauthorized Access,2014-06-19T00:00:00,2015-07-15T00:00:00,Costco,,29425.0,Business,Retail,Name,2016,"10,000-49,999",300-399,
9583,08/13/2015 12:00:00 AM,08/18/2015 12:00:00 AM,Cyberattack,,,Web.com Group,Unclear/unknown,1595.0,Business,Web Services,Other,2016,"1,000-9,999",Unknown,
9583,08/13/2015 12:00:00 AM,08/18/2015 12:00:00 AM,Cyberattack,,,Web.com Group,Unclear/unknown,1595.0,Business,Web Services,Financial & Banking Information,2016,"1,000-9,999",Unknown,
9583,08/13/2015 12:00:00 AM,08/18/2015 12:00:00 AM,Cyberattack,,,Web.com Group,Unclear/unknown,1595.0,Business,Web Services,Name,2016,"1,000-9,999",Unknown,
9582,05/30/2015 12:00:00 AM,08/11/2015 12:00:00 AM,Theft or Mistake,2015-05-29T00:00:00,2015-05-29T00:00:00,Sterling BackCheck,,1419.0,Business,Human Resources,Full Date of Birth,2016,"1,000-9,999",1-99,
9582,05/30/2015 12:00:00 AM,08/11/2015 12:00:00 AM,Theft or Mistake,2015-05-29T00:00:00,2015-05-29T00:00:00,Sterling BackCheck,,1419.0,Business,Human Resources,Social Security Number,2016,"1,000-9,999",1-99,
9582,05/30/2015 12:00:00 AM,08/11/2015 12:00:00 AM,Theft or Mistake,2015-05-29T00:00:00,2015-05-29T00:00:00,Sterling BackCheck,,1419.0,Business,Human Resources,Name,2016,"1,000-9,999",1-99,
9581,05/11/2018 12:00:00 AM,07/12/2018 12:00:00 AM,Cyberattack,2018-05-11T00:00:00,,Overlake Arthritis and Osteoporosis Center,Malware,627.0,Health,,Other,2018,500-999,Unknown,
9581,05/11/2018 12:00:00 AM,07/12/2018 12:00:00 AM,Cyberattack,2018-05-11T00:00:00,,Overlake Arthritis and Osteoporosis Center,Malware,627.0,Health,,Medical Information,2018,500-999,Unknown,
9581,05/11/2018 12:00:00 AM,07/12/2018 12:00:00 AM,Cyberattack,2018-05-11T00:00:00,,Overlake Arthritis and Osteoporosis Center,Malware,627.0,Health,,Social Security Number,2018,500-999,Unknown,
9581,05/11/2018 12:00:00 AM,07/12/2018 12:00:00 AM,Cyberattack,2018-05-11T00:00:00,,Overlake Arthritis and Osteoporosis Center,Malware,627.0,Health,,Name,2018,500-999,Unknown,
9578,06/11/2018 12:00:00 AM,07/01/2018 12:00:00 AM,Cyberattack,2018-04-26T00:00:00,2018-06-12T00:00:00,"Macy's, Inc.",Unclear/unknown,3564.0,Business,Retail,Other,2018,"1,000-9,999",1-99,
9578,06/11/2018 12:00:00 AM,07/01/2018 12:00:00 AM,Cyberattack,2018-04-26T00:00:00,2018-06-12T00:00:00,"Macy's, Inc.",Unclear/unknown,3564.0,Business,Retail,Financial & Banking Information,2018,"1,000-9,999",1-99,
9578,06/11/2018 12:00:00 AM,07/01/2018 12:00:00 AM,Cyberattack,2018-04-26T00:00:00,2018-06-12T00:00:00,"Macy's, Inc.",Unclear/unknown,3564.0,Business,Retail,Name,2018,"1,000-9,999",1-99,
9577,06/20/2018 12:00:00 AM,06/29/2018 12:00:00 AM,Unauthorized Access,,,Northwest University,,1434.0,Education,,Other,2018,"1,000-9,999",Unknown,
9577,06/20/2018 12:00:00 AM,06/29/2018 12:00:00 AM,Unauthorized Access,,,Northwest University,,1434.0,Education,,Medical Information,2018,"1,000-9,999",Unknown,
9577,06/20/2018 12:00:00 AM,06/29/2018 12:00:00 AM,Unauthorized Access,,,Northwest University,,1434.0,Education,,Social Security Number,2018,"1,000-9,999",Unknown,
9577,06/20/2018 12:00:00 AM,06/29/2018 12:00:00 AM,Unauthorized Access,,,Northwest University,,1434.0,Education,,Name,2018,"1,000-9,999",Unknown,
9576,05/01/2018 12:00:00 AM,06/23/2018 12:00:00 AM,Cyberattack,2018-05-01T00:00:00,2018-05-01T00:00:00,"Terteling Company, Inc.",Phishing,941.0,Business,Construction,Other,2018,500-999,0,
9576,05/01/2018 12:00:00 AM,06/23/2018 12:00:00 AM,Cyberattack,2018-05-01T00:00:00,2018-05-01T00:00:00,"Terteling Company, Inc.",Phishing,941.0,Business,Construction,Medical Information,2018,500-999,0,
9576,05/01/2018 12:00:00 AM,06/23/2018 12:00:00 AM,Cyberattack,2018-05-01T00:00:00,2018-05-01T00:00:00,"Terteling Company, Inc.",Phishing,941.0,Business,Construction,Financial & Banking Information,2018,500-999,0,
9576,05/01/2018 12:00:00 AM,06/23/2018 12:00:00 AM,Cyberattack,2018-05-01T00:00:00,2018-05-01T00:00:00,"Terteling Company, Inc.",Phishing,941.0,Business,Construction,Driver's License or Washington ID Card Number,2018,500-999,0,
9576,05/01/2018 12:00:00 AM,06/23/2018 12:00:00 AM,Cyberattack,2018-05-01T00:00:00,2018-05-01T00:00:00,"Terteling Company, Inc.",Phishing,941.0,Business,Construction,Social Security Number,2018,500-999,0,
9576,05/01/2018 12:00:00 AM,06/23/2018 12:00:00 AM,Cyberattack,2018-05-01T00:00:00,2018-05-01T00:00:00,"Terteling Company, Inc.",Phishing,941.0,Business,Construction,Name,2018,500-999,0,
9574,05/11/2018 12:00:00 AM,05/18/2018 12:00:00 AM,Cyberattack,2018-03-01T00:00:00,2018-04-01T00:00:00,Brinker International (Chilis),Malware,,Business,Hospitality,Financial & Banking Information,2018,Unknown,1-99,
9574,05/11/2018 12:00:00 AM,05/18/2018 12:00:00 AM,Cyberattack,2018-03-01T00:00:00,2018-04-01T00:00:00,Brinker International (Chilis),Malware,,Business,Hospitality,Name,2018,Unknown,1-99,
9573,04/05/2018 12:00:00 AM,05/17/2018 12:00:00 AM,Cyberattack,2017-11-25T00:00:00,2017-11-25T00:00:00,Corporation Service Company,Unclear/unknown,4631.0,Business,Legal,Social Security Number,2018,"1,000-9,999",100-199,
9573,04/05/2018 12:00:00 AM,05/17/2018 12:00:00 AM,Cyberattack,2017-11-25T00:00:00,2017-11-25T00:00:00,Corporation Service Company,Unclear/unknown,4631.0,Business,Legal,Name,2018,"1,000-9,999",100-199,
9572,04/12/2018 12:00:00 AM,05/09/2018 12:00:00 AM,Unauthorized Access,,,"TaskRabbit, Inc.",,77618.0,Business,Home,Username and Password/Security Question Answers,2018,"50,000-999,999",Unknown,
9572,04/12/2018 12:00:00 AM,05/09/2018 12:00:00 AM,Unauthorized Access,,,"TaskRabbit, Inc.",,77618.0,Business,Home,Financial & Banking Information,2018,"50,000-999,999",Unknown,
9572,04/12/2018 12:00:00 AM,05/09/2018 12:00:00 AM,Unauthorized Access,,,"TaskRabbit, Inc.",,77618.0,Business,Home,Social Security Number,2018,"50,000-999,999",Unknown,
9572,04/12/2018 12:00:00 AM,05/09/2018 12:00:00 AM,Unauthorized Access,,,"TaskRabbit, Inc.",,77618.0,Business,Home,Name,2018,"50,000-999,999",Unknown,
9571,04/21/2018 12:00:00 AM,05/09/2018 12:00:00 AM,Theft or Mistake,,,H&R Block,,2655.0,Finance,,Other,2018,"1,000-9,999",Unknown,
9571,04/21/2018 12:00:00 AM,05/09/2018 12:00:00 AM,Theft or Mistake,,,H&R Block,,2655.0,Finance,,Financial & Banking Information,2018,"1,000-9,999",Unknown,
9571,04/21/2018 12:00:00 AM,05/09/2018 12:00:00 AM,Theft or Mistake,,,H&R Block,,2655.0,Finance,,Social Security Number,2018,"1,000-9,999",Unknown,
9571,04/21/2018 12:00:00 AM,05/09/2018 12:00:00 AM,Theft or Mistake,,,H&R Block,,2655.0,Finance,,Name,2018,"1,000-9,999",Unknown,
9570,02/01/2018 12:00:00 AM,05/08/2018 12:00:00 AM,Theft or Mistake,2017-12-31T00:00:00,2018-01-31T00:00:00,Global University,,5679.0,Education,,Social Security Number,2018,"1,000-9,999",1-99,
9570,02/01/2018 12:00:00 AM,05/08/2018 12:00:00 AM,Theft or Mistake,2017-12-31T00:00:00,2018-01-31T00:00:00,Global University,,5679.0,Education,,Name,2018,"1,000-9,999",1-99,
9569,03/19/2018 12:00:00 AM,05/03/2018 12:00:00 AM,Cyberattack,2017-10-01T00:00:00,2017-12-22T00:00:00,Alaska Airlines,Unclear/unknown,1442.0,Business,Transportation,Other,2018,"1,000-9,999",100-199,
9569,03/19/2018 12:00:00 AM,05/03/2018 12:00:00 AM,Cyberattack,2017-10-01T00:00:00,2017-12-22T00:00:00,Alaska Airlines,Unclear/unknown,1442.0,Business,Transportation,Full Date of Birth,2018,"1,000-9,999",100-199,
9569,03/19/2018 12:00:00 AM,05/03/2018 12:00:00 AM,Cyberattack,2017-10-01T00:00:00,2017-12-22T00:00:00,Alaska Airlines,Unclear/unknown,1442.0,Business,Transportation,Financial & Banking Information,2018,"1,000-9,999",100-199,
9569,03/19/2018 12:00:00 AM,05/03/2018 12:00:00 AM,Cyberattack,2017-10-01T00:00:00,2017-12-22T00:00:00,Alaska Airlines,Unclear/unknown,1442.0,Business,Transportation,Name,2018,"1,000-9,999",100-199,
9567,02/16/2018 12:00:00 AM,04/30/2018 12:00:00 AM,Cyberattack,2017-11-29T00:00:00,2018-02-16T00:00:00,Rail Europe North America,Unclear/unknown,687.0,Business,Transportation,Other,2018,500-999,1-99,
9567,02/16/2018 12:00:00 AM,04/30/2018 12:00:00 AM,Cyberattack,2017-11-29T00:00:00,2018-02-16T00:00:00,Rail Europe North America,Unclear/unknown,687.0,Business,Transportation,Username and Password/Security Question Answers,2018,500-999,1-99,
9567,02/16/2018 12:00:00 AM,04/30/2018 12:00:00 AM,Cyberattack,2017-11-29T00:00:00,2018-02-16T00:00:00,Rail Europe North America,Unclear/unknown,687.0,Business,Transportation,Financial & Banking Information,2018,500-999,1-99,
9567,02/16/2018 12:00:00 AM,04/30/2018 12:00:00 AM,Cyberattack,2017-11-29T00:00:00,2018-02-16T00:00:00,Rail Europe North America,Unclear/unknown,687.0,Business,Transportation,Name,2018,500-999,1-99,
9566,03/29/2018 12:00:00 AM,04/26/2018 12:00:00 AM,Cyberattack,2017-07-01T00:00:00,2018-03-31T00:00:00,Hudson's Bay Company,Malware,,Business,Retail,Financial & Banking Information,2018,Unknown,200-299,
9566,03/29/2018 12:00:00 AM,04/26/2018 12:00:00 AM,Cyberattack,2017-07-01T00:00:00,2018-03-31T00:00:00,Hudson's Bay Company,Malware,,Business,Retail,Name,2018,Unknown,200-299,
9565,03/15/2018 12:00:00 AM,04/24/2018 12:00:00 AM,Cyberattack,2017-09-27T00:00:00,2017-10-12T00:00:00,Sears Holdings,Malware,2373.0,Business,Retail,Other,2018,"1,000-9,999",100-199,
9565,03/15/2018 12:00:00 AM,04/24/2018 12:00:00 AM,Cyberattack,2017-09-27T00:00:00,2017-10-12T00:00:00,Sears Holdings,Malware,2373.0,Business,Retail,Financial & Banking Information,2018,"1,000-9,999",100-199,
9565,03/15/2018 12:00:00 AM,04/24/2018 12:00:00 AM,Cyberattack,2017-09-27T00:00:00,2017-10-12T00:00:00,Sears Holdings,Malware,2373.0,Business,Retail,Name,2018,"1,000-9,999",100-199,
9563,03/14/2018 12:00:00 AM,04/13/2018 12:00:00 AM,Unauthorized Access,,,Inogen Inc.,,518.0,Health,,Other,2018,500-999,Unknown,
9563,03/14/2018 12:00:00 AM,04/13/2018 12:00:00 AM,Unauthorized Access,,,Inogen Inc.,,518.0,Health,,Medical Information,2018,500-999,Unknown,
9563,03/14/2018 12:00:00 AM,04/13/2018 12:00:00 AM,Unauthorized Access,,,Inogen Inc.,,518.0,Health,,Health Insurance Policy or ID Number,2018,500-999,Unknown,
9563,03/14/2018 12:00:00 AM,04/13/2018 12:00:00 AM,Unauthorized Access,,,Inogen Inc.,,518.0,Health,,Name,2018,500-999,Unknown,
9562,03/28/2018 12:00:00 AM,04/13/2018 12:00:00 AM,Cyberattack,2017-09-26T00:00:00,2017-10-12T00:00:00,"Best Buy Co, Inc.",Malware,8390.0,Business,Retail,Other,2018,"1,000-9,999",100-199,
9562,03/28/2018 12:00:00 AM,04/13/2018 12:00:00 AM,Cyberattack,2017-09-26T00:00:00,2017-10-12T00:00:00,"Best Buy Co, Inc.",Malware,8390.0,Business,Retail,Financial & Banking Information,2018,"1,000-9,999",100-199,
9562,03/28/2018 12:00:00 AM,04/13/2018 12:00:00 AM,Cyberattack,2017-09-26T00:00:00,2017-10-12T00:00:00,"Best Buy Co, Inc.",Malware,8390.0,Business,Retail,Name,2018,"1,000-9,999",100-199,
9561,03/28/2018 12:00:00 AM,04/11/2018 12:00:00 AM,Cyberattack,2017-09-26T00:00:00,2017-10-12T00:00:00,Delta Airlines,Malware,24563.0,Business,Software,Other,2018,"10,000-49,999",100-199,
9561,03/28/2018 12:00:00 AM,04/11/2018 12:00:00 AM,Cyberattack,2017-09-26T00:00:00,2017-10-12T00:00:00,Delta Airlines,Malware,24563.0,Business,Software,Financial & Banking Information,2018,"10,000-49,999",100-199,
9561,03/28/2018 12:00:00 AM,04/11/2018 12:00:00 AM,Cyberattack,2017-09-26T00:00:00,2017-10-12T00:00:00,Delta Airlines,Malware,24563.0,Business,Software,Name,2018,"10,000-49,999",100-199,
9720,06/13/2017 12:00:00 AM,07/10/2017 12:00:00 AM,Cyberattack,2017-06-13T00:00:00,2017-06-21T00:00:00,Pacific Science Center,Phishing,605.0,Business,Entertainment,Other,2017,500-999,1-99,
9723,06/06/2017 12:00:00 AM,08/03/2017 12:00:00 AM,Cyberattack,2016-08-10T00:00:00,2017-03-09T00:00:00,"Two Roads Hospitality, LLC",Malware,5401.0,Business,Hospitality,Name,2018,"1,000-9,999",300-399,
9723,06/06/2017 12:00:00 AM,08/03/2017 12:00:00 AM,Cyberattack,2016-08-10T00:00:00,2017-03-09T00:00:00,"Two Roads Hospitality, LLC",Malware,5401.0,Business,Hospitality,Financial & Banking Information,2018,"1,000-9,999",300-399,
9723,06/06/2017 12:00:00 AM,08/03/2017 12:00:00 AM,Cyberattack,2016-08-10T00:00:00,2017-03-09T00:00:00,"Two Roads Hospitality, LLC",Malware,5401.0,Business,Hospitality,Other,2018,"1,000-9,999",300-399,
9724,06/08/2017 12:00:00 AM,07/21/2017 12:00:00 AM,Cyberattack,,,Value Eyecare Network,Malware,2696.0,Business,Accessories,Name,2017,"1,000-9,999",Unknown,
9724,06/08/2017 12:00:00 AM,07/21/2017 12:00:00 AM,Cyberattack,,,Value Eyecare Network,Malware,2696.0,Business,Accessories,Financial & Banking Information,2017,"1,000-9,999",Unknown,
9724,06/08/2017 12:00:00 AM,07/21/2017 12:00:00 AM,Cyberattack,,,Value Eyecare Network,Malware,2696.0,Business,Accessories,Other,2017,"1,000-9,999",Unknown,
9725,06/25/2017 12:00:00 AM,07/18/2017 12:00:00 AM,Unauthorized Access,2017-05-06T00:00:00,2017-05-10T00:00:00,"Keller Williams Realty, Inc.",,9425.0,Business,Real Estate,Name,2017,"1,000-9,999",1-99,
9725,06/25/2017 12:00:00 AM,07/18/2017 12:00:00 AM,Unauthorized Access,2017-05-06T00:00:00,2017-05-10T00:00:00,"Keller Williams Realty, Inc.",,9425.0,Business,Real Estate,Social Security Number,2017,"1,000-9,999",1-99,
9725,06/25/2017 12:00:00 AM,07/18/2017 12:00:00 AM,Unauthorized Access,2017-05-06T00:00:00,2017-05-10T00:00:00,"Keller Williams Realty, Inc.",,9425.0,Business,Real Estate,Username and Password/Security Question Answers,2017,"1,000-9,999",1-99,
9725,06/25/2017 12:00:00 AM,07/18/2017 12:00:00 AM,Unauthorized Access,2017-05-06T00:00:00,2017-05-10T00:00:00,"Keller Williams Realty, Inc.",,9425.0,Business,Real Estate,Other,2017,"1,000-9,999",1-99,
9728,06/26/2017 12:00:00 AM,07/26/2017 12:00:00 AM,Cyberattack,2016-12-21T00:00:00,2017-04-11T00:00:00,Al J. Schneider Company (Galt House Hotel),Skimmers,791.0,Business,Hospitality,Name,2018,500-999,100-199,
9728,06/26/2017 12:00:00 AM,07/26/2017 12:00:00 AM,Cyberattack,2016-12-21T00:00:00,2017-04-11T00:00:00,Al J. Schneider Company (Galt House Hotel),Skimmers,791.0,Business,Hospitality,Financial & Banking Information,2018,500-999,100-199,
9729,05/02/2017 12:00:00 AM,07/26/2017 12:00:00 AM,Cyberattack,,,Steel Technologies LLC (Hydro Flask Brand),Other,1780.0,Business,Manufacturing,Name,2018,"1,000-9,999",Unknown,
9729,05/02/2017 12:00:00 AM,07/26/2017 12:00:00 AM,Cyberattack,,,Steel Technologies LLC (Hydro Flask Brand),Other,1780.0,Business,Manufacturing,Financial & Banking Information,2018,"1,000-9,999",Unknown,
9729,05/02/2017 12:00:00 AM,07/26/2017 12:00:00 AM,Cyberattack,,,Steel Technologies LLC (Hydro Flask Brand),Other,1780.0,Business,Manufacturing,Other,2018,"1,000-9,999",Unknown,
9730,06/06/2017 12:00:00 AM,07/28/2017 12:00:00 AM,Unauthorized Access,2016-08-10T00:00:00,2017-03-09T00:00:00,Noble House Hotels & Resorts,,523.0,Business,Hospitality,Name,2018,500-999,300-399,
9730,06/06/2017 12:00:00 AM,07/28/2017 12:00:00 AM,Unauthorized Access,2016-08-10T00:00:00,2017-03-09T00:00:00,Noble House Hotels & Resorts,,523.0,Business,Hospitality,Financial & Banking Information,2018,500-999,300-399,
9730,06/06/2017 12:00:00 AM,07/28/2017 12:00:00 AM,Unauthorized Access,2016-08-10T00:00:00,2017-03-09T00:00:00,Noble House Hotels & Resorts,,523.0,Business,Hospitality,Other,2018,500-999,300-399,
9731,06/06/2017 12:00:00 AM,08/03/2017 12:00:00 AM,Unauthorized Access,2016-08-10T00:00:00,2017-03-09T00:00:00,Silver Cloud Inns & Hotels,,1382.0,Business,Hospitality,Name,2018,"1,000-9,999",300-399,
9731,06/06/2017 12:00:00 AM,08/03/2017 12:00:00 AM,Unauthorized Access,2016-08-10T00:00:00,2017-03-09T00:00:00,Silver Cloud Inns & Hotels,,1382.0,Business,Hospitality,Financial & Banking Information,2018,"1,000-9,999",300-399,
9732,06/26/2017 12:00:00 AM,08/14/2017 12:00:00 AM,Cyberattack,,,TRUEbenefits LLC,Phishing,12327.0,Business,Human Resources,Name,2018,"10,000-49,999",Unknown,
9732,06/26/2017 12:00:00 AM,08/14/2017 12:00:00 AM,Cyberattack,,,TRUEbenefits LLC,Phishing,12327.0,Business,Human Resources,Social Security Number,2018,"10,000-49,999",Unknown,
9732,06/26/2017 12:00:00 AM,08/14/2017 12:00:00 AM,Cyberattack,,,TRUEbenefits LLC,Phishing,12327.0,Business,Human Resources,Health Insurance Policy or ID Number,2018,"10,000-49,999",Unknown,
9732,06/26/2017 12:00:00 AM,08/14/2017 12:00:00 AM,Cyberattack,,,TRUEbenefits LLC,Phishing,12327.0,Business,Human Resources,Medical Information,2018,"10,000-49,999",Unknown,
9733,08/15/2017 12:00:00 AM,08/24/2017 12:00:00 AM,Theft or Mistake,2016-12-01T00:00:00,2016-12-01T00:00:00,Green River Community College,,3399.0,Education,,Name,2018,"1,000-9,999",200-299,
9733,08/15/2017 12:00:00 AM,08/24/2017 12:00:00 AM,Theft or Mistake,2016-12-01T00:00:00,2016-12-01T00:00:00,Green River Community College,,3399.0,Education,,Social Security Number,2018,"1,000-9,999",200-299,
9734,07/18/2017 12:00:00 AM,08/31/2017 12:00:00 AM,Theft or Mistake,,,Timberland Bank,,5688.0,Finance,,Name,2018,"1,000-9,999",Unknown,
9734,07/18/2017 12:00:00 AM,08/31/2017 12:00:00 AM,Theft or Mistake,,,Timberland Bank,,5688.0,Finance,,Social Security Number,2018,"1,000-9,999",Unknown,
9734,07/18/2017 12:00:00 AM,08/31/2017 12:00:00 AM,Theft or Mistake,,,Timberland Bank,,5688.0,Finance,,Driver's License or Washington ID Card Number,2018,"1,000-9,999",Unknown,
9734,07/18/2017 12:00:00 AM,08/31/2017 12:00:00 AM,Theft or Mistake,,,Timberland Bank,,5688.0,Finance,,Financial & Banking Information,2018,"1,000-9,999",Unknown,
9734,07/18/2017 12:00:00 AM,08/31/2017 12:00:00 AM,Theft or Mistake,,,Timberland Bank,,5688.0,Finance,,Other,2018,"1,000-9,999",Unknown,
9737,08/23/2017 12:00:00 AM,09/18/2017 12:00:00 AM,Theft or Mistake,2017-08-23T00:00:00,2017-08-23T00:00:00,"W.W. Grainger, Inc.",,725.0,Business,Manufacturing,Name,2018,500-999,0,
9737,08/23/2017 12:00:00 AM,09/18/2017 12:00:00 AM,Theft or Mistake,2017-08-23T00:00:00,2017-08-23T00:00:00,"W.W. Grainger, Inc.",,725.0,Business,Manufacturing,Social Security Number,2018,500-999,0,
9737,08/23/2017 12:00:00 AM,09/18/2017 12:00:00 AM,Theft or Mistake,2017-08-23T00:00:00,2017-08-23T00:00:00,"W.W. Grainger, Inc.",,725.0,Business,Manufacturing,Other,2018,500-999,0,
9740,08/30/2017 12:00:00 AM,10/03/2017 12:00:00 AM,Unauthorized Access,,,"FlexShopper, LLC",,2396.0,Business,Retail,Name,2018,"1,000-9,999",Unknown,
9740,08/30/2017 12:00:00 AM,10/03/2017 12:00:00 AM,Unauthorized Access,,,"FlexShopper, LLC",,2396.0,Business,Retail,Social Security Number,2018,"1,000-9,999",Unknown,
9740,08/30/2017 12:00:00 AM,10/03/2017 12:00:00 AM,Unauthorized Access,,,"FlexShopper, LLC",,2396.0,Business,Retail,Financial & Banking Information,2018,"1,000-9,999",Unknown,
9740,08/30/2017 12:00:00 AM,10/03/2017 12:00:00 AM,Unauthorized Access,,,"FlexShopper, LLC",,2396.0,Business,Retail,Email Address and Password/Security Question Answers,2018,"1,000-9,999",Unknown,
9740,08/30/2017 12:00:00 AM,10/03/2017 12:00:00 AM,Unauthorized Access,,,"FlexShopper, LLC",,2396.0,Business,Retail,Other,2018,"1,000-9,999",Unknown,
9742,09/06/2017 12:00:00 AM,10/06/2017 12:00:00 AM,Cyberattack,2017-07-31T00:00:00,2017-08-28T00:00:00,Catholic United Financial,Malware,704.0,Finance,,Name,2018,500-999,1-99,
9742,09/06/2017 12:00:00 AM,10/06/2017 12:00:00 AM,Cyberattack,2017-07-31T00:00:00,2017-08-28T00:00:00,Catholic United Financial,Malware,704.0,Finance,,Social Security Number,2018,500-999,1-99,
9742,09/06/2017 12:00:00 AM,10/06/2017 12:00:00 AM,Cyberattack,2017-07-31T00:00:00,2017-08-28T00:00:00,Catholic United Financial,Malware,704.0,Finance,,Financial & Banking Information,2018,500-999,1-99,
9742,09/06/2017 12:00:00 AM,10/06/2017 12:00:00 AM,Cyberattack,2017-07-31T00:00:00,2017-08-28T00:00:00,Catholic United Financial,Malware,704.0,Finance,,Other,2018,500-999,1-99,
9743,09/13/2017 12:00:00 AM,10/06/2017 12:00:00 AM,Cyberattack,2017-05-27T00:00:00,2017-07-12T00:00:00,"Provo Craft & Novelty, Inc.",Unclear/unknown,773.0,Business,Manufacturing,Name,2018,500-999,100-199,
9743,09/13/2017 12:00:00 AM,10/06/2017 12:00:00 AM,Cyberattack,2017-05-27T00:00:00,2017-07-12T00:00:00,"Provo Craft & Novelty, Inc.",Unclear/unknown,773.0,Business,Manufacturing,Financial & Banking Information,2018,500-999,100-199,
9743,09/13/2017 12:00:00 AM,10/06/2017 12:00:00 AM,Cyberattack,2017-05-27T00:00:00,2017-07-12T00:00:00,"Provo Craft & Novelty, Inc.",Unclear/unknown,773.0,Business,Manufacturing,Other,2018,500-999,100-199,
9744,08/11/2017 12:00:00 AM,10/06/2017 12:00:00 AM,Cyberattack,2017-04-25T00:00:00,2017-08-29T00:00:00,Tommie Copper Inc.,Malware,695.0,Business,Clothing,Name,2018,500-999,100-199,
9744,08/11/2017 12:00:00 AM,10/06/2017 12:00:00 AM,Cyberattack,2017-04-25T00:00:00,2017-08-29T00:00:00,Tommie Copper Inc.,Malware,695.0,Business,Clothing,Financial & Banking Information,2018,500-999,100-199,
9745,10/05/2017 12:00:00 AM,10/16/2017 12:00:00 AM,Unauthorized Access,2017-10-01T00:00:00,2017-10-02T00:00:00,"Pizza Hut, LLC",,1896.0,Business,Hospitality,Name,2018,"1,000-9,999",1-99,
9745,10/05/2017 12:00:00 AM,10/16/2017 12:00:00 AM,Unauthorized Access,2017-10-01T00:00:00,2017-10-02T00:00:00,"Pizza Hut, LLC",,1896.0,Business,Hospitality,Financial & Banking Information,2018,"1,000-9,999",1-99,
9745,10/05/2017 12:00:00 AM,10/16/2017 12:00:00 AM,Unauthorized Access,2017-10-01T00:00:00,2017-10-02T00:00:00,"Pizza Hut, LLC",,1896.0,Business,Hospitality,Other,2018,"1,000-9,999",1-99,
9746,09/23/2017 12:00:00 AM,10/20/2017 12:00:00 AM,Cyberattack,2017-03-10T00:00:00,2017-09-28T00:00:00,"Whole Foods Market Services, Inc.",Malware,,Business,Retail,Name,2018,Unknown,200-299,
9746,09/23/2017 12:00:00 AM,10/20/2017 12:00:00 AM,Cyberattack,2017-03-10T00:00:00,2017-09-28T00:00:00,"Whole Foods Market Services, Inc.",Malware,,Business,Retail,Financial & Banking Information,2018,Unknown,200-299,
9748,09/07/2017 12:00:00 AM,11/03/2017 12:00:00 AM,Cyberattack,2017-09-07T00:00:00,2017-09-07T00:00:00,"Tween Brands, Inc.",Other,2477.0,Business,Clothing,Name,2018,"1,000-9,999",0,
9748,09/07/2017 12:00:00 AM,11/03/2017 12:00:00 AM,Cyberattack,2017-09-07T00:00:00,2017-09-07T00:00:00,"Tween Brands, Inc.",Other,2477.0,Business,Clothing,Social Security Number,2018,"1,000-9,999",0,
9750,09/20/2017 12:00:00 AM,11/15/2017 12:00:00 AM,Theft or Mistake,2017-09-20T00:00:00,2017-09-20T00:00:00,Western State Hospital,,515.0,Health,,Name,2018,500-999,0,
9750,09/20/2017 12:00:00 AM,11/15/2017 12:00:00 AM,Theft or Mistake,2017-09-20T00:00:00,2017-09-20T00:00:00,Western State Hospital,,515.0,Health,,Medical Information,2018,500-999,0,
9752,11/15/2016 12:00:00 AM,11/21/2017 12:00:00 AM,Cyberattack,2016-10-13T00:00:00,2016-11-15T00:00:00,"Uber Technologies, Inc.",Unclear/unknown,10888.0,Business,Transportation,Name,2018,"10,000-49,999",1-99,
9752,11/15/2016 12:00:00 AM,11/21/2017 12:00:00 AM,Cyberattack,2016-10-13T00:00:00,2016-11-15T00:00:00,"Uber Technologies, Inc.",Unclear/unknown,10888.0,Business,Transportation,Driver's License or Washington ID Card Number,2018,"10,000-49,999",1-99,
9753,,11/27/2017 12:00:00 AM,Cyberattack,2016-10-26T00:00:00,2017-10-19T00:00:00,"Bulletproof 360, Inc.",Malware,4077.0,Business,Consumable,Name,2018,"1,000-9,999",Unknown,
9753,,11/27/2017 12:00:00 AM,Cyberattack,2016-10-26T00:00:00,2017-10-19T00:00:00,"Bulletproof 360, Inc.",Malware,4077.0,Business,Consumable,Financial & Banking Information,2018,"1,000-9,999",Unknown,
9753,,11/27/2017 12:00:00 AM,Cyberattack,2016-10-26T00:00:00,2017-10-19T00:00:00,"Bulletproof 360, Inc.",Malware,4077.0,Business,Consumable,Other,2018,"1,000-9,999",Unknown,
9754,09/06/2017 12:00:00 AM,12/01/2017 12:00:00 AM,Unauthorized Access,2016-06-15T00:00:00,2017-11-06T00:00:00,JAM Paper & Envelope,,590.0,Business,Manufacturing,Name,2018,500-999,500+,
9754,09/06/2017 12:00:00 AM,12/01/2017 12:00:00 AM,Unauthorized Access,2016-06-15T00:00:00,2017-11-06T00:00:00,JAM Paper & Envelope,,590.0,Business,Manufacturing,Financial & Banking Information,2018,500-999,500+,
9754,09/06/2017 12:00:00 AM,12/01/2017 12:00:00 AM,Unauthorized Access,2016-06-15T00:00:00,2017-11-06T00:00:00,JAM Paper & Envelope,,590.0,Business,Manufacturing,Other,2018,500-999,500+,
9755,10/06/2017 12:00:00 AM,12/11/2017 12:00:00 AM,Cyberattack,2015-07-01T00:00:00,2017-10-06T00:00:00,"Combat Brands, LLC",Malware,956.0,Business,Fitness,Name,2018,500-999,500+,
9755,10/06/2017 12:00:00 AM,12/11/2017 12:00:00 AM,Cyberattack,2015-07-01T00:00:00,2017-10-06T00:00:00,"Combat Brands, LLC",Malware,956.0,Business,Fitness,Financial & Banking Information,2018,500-999,500+,
9756,12/11/2017 12:00:00 AM,12/22/2017 12:00:00 AM,Unauthorized Access,2017-04-25T00:00:00,,"LiveGlam, Inc.",,600.0,Business,Cosmetic,Name,2018,500-999,Unknown,
9756,12/11/2017 12:00:00 AM,12/22/2017 12:00:00 AM,Unauthorized Access,2017-04-25T00:00:00,,"LiveGlam, Inc.",,600.0,Business,Cosmetic,Financial & Banking Information,2018,500-999,Unknown,
9756,12/11/2017 12:00:00 AM,12/22/2017 12:00:00 AM,Unauthorized Access,2017-04-25T00:00:00,,"LiveGlam, Inc.",,600.0,Business,Cosmetic,Other,2018,500-999,Unknown,
9757,11/10/2017 12:00:00 AM,12/22/2017 12:00:00 AM,Unauthorized Access,,,"TIO Networks USA, Inc.",,1962.0,Finance,,Name,2018,"1,000-9,999",Unknown,
9757,11/10/2017 12:00:00 AM,12/22/2017 12:00:00 AM,Unauthorized Access,,,"TIO Networks USA, Inc.",,1962.0,Finance,,Social Security Number,2018,"1,000-9,999",Unknown,
9757,11/10/2017 12:00:00 AM,12/22/2017 12:00:00 AM,Unauthorized Access,,,"TIO Networks USA, Inc.",,1962.0,Finance,,Driver's License or Washington ID Card Number,2018,"1,000-9,999",Unknown,
9757,11/10/2017 12:00:00 AM,12/22/2017 12:00:00 AM,Unauthorized Access,,,"TIO Networks USA, Inc.",,1962.0,Finance,,Financial & Banking Information,2018,"1,000-9,999",Unknown,
9757,11/10/2017 12:00:00 AM,12/22/2017 12:00:00 AM,Unauthorized Access,,,"TIO Networks USA, Inc.",,1962.0,Finance,,Username and Password/Security Question Answers,2018,"1,000-9,999",Unknown,
9757,11/10/2017 12:00:00 AM,12/22/2017 12:00:00 AM,Unauthorized Access,,,"TIO Networks USA, Inc.",,1962.0,Finance,,Other,2018,"1,000-9,999",Unknown,
9759,12/05/2017 12:00:00 AM,01/02/2018 12:00:00 AM,Unauthorized Access,2017-12-02T00:00:00,2017-12-02T00:00:00,Multnomah Athletic Club,,661.0,Business,Fitness,Name,2018,500-999,1-99,
9759,12/05/2017 12:00:00 AM,01/02/2018 12:00:00 AM,Unauthorized Access,2017-12-02T00:00:00,2017-12-02T00:00:00,Multnomah Athletic Club,,661.0,Business,Fitness,Social Security Number,2018,500-999,1-99,
9759,12/05/2017 12:00:00 AM,01/02/2018 12:00:00 AM,Unauthorized Access,2017-12-02T00:00:00,2017-12-02T00:00:00,Multnomah Athletic Club,,661.0,Business,Fitness,Driver's License or Washington ID Card Number,2018,500-999,1-99,
9759,12/05/2017 12:00:00 AM,01/02/2018 12:00:00 AM,Unauthorized Access,2017-12-02T00:00:00,2017-12-02T00:00:00,Multnomah Athletic Club,,661.0,Business,Fitness,Financial & Banking Information,2018,500-999,1-99,
9759,12/05/2017 12:00:00 AM,01/02/2018 12:00:00 AM,Unauthorized Access,2017-12-02T00:00:00,2017-12-02T00:00:00,Multnomah Athletic Club,,661.0,Business,Fitness,Passport Number,2018,500-999,1-99,
9759,12/05/2017 12:00:00 AM,01/02/2018 12:00:00 AM,Unauthorized Access,2017-12-02T00:00:00,2017-12-02T00:00:00,Multnomah Athletic Club,,661.0,Business,Fitness,Other,2018,500-999,1-99,
9760,11/29/2017 12:00:00 AM,01/10/2018 12:00:00 AM,Unauthorized Access,,,"talentReef, Inc.",,604.0,Business,Human Resources,Name,2018,500-999,Unknown,
9760,11/29/2017 12:00:00 AM,01/10/2018 12:00:00 AM,Unauthorized Access,,,"talentReef, Inc.",,604.0,Business,Human Resources,Social Security Number,2018,500-999,Unknown,
9760,11/29/2017 12:00:00 AM,01/10/2018 12:00:00 AM,Unauthorized Access,,,"talentReef, Inc.",,604.0,Business,Human Resources,Driver's License or Washington ID Card Number,2018,500-999,Unknown,
9760,11/29/2017 12:00:00 AM,01/10/2018 12:00:00 AM,Unauthorized Access,,,"talentReef, Inc.",,604.0,Business,Human Resources,Financial & Banking Information,2018,500-999,Unknown,
9760,11/29/2017 12:00:00 AM,01/10/2018 12:00:00 AM,Unauthorized Access,,,"talentReef, Inc.",,604.0,Business,Human Resources,Other,2018,500-999,Unknown,
9761,12/22/2017 12:00:00 AM,01/11/2018 12:00:00 AM,Cyberattack,2017-06-08T00:00:00,2017-12-22T00:00:00,"Deli Management, Inc. (Jason's Deli)",Malware,,Business,Hospitality,Name,2018,Unknown,100-199,
9761,12/22/2017 12:00:00 AM,01/11/2018 12:00:00 AM,Cyberattack,2017-06-08T00:00:00,2017-12-22T00:00:00,"Deli Management, Inc. (Jason's Deli)",Malware,,Business,Hospitality,Financial & Banking Information,2018,Unknown,100-199,
9762,09/13/2017 12:00:00 AM,01/12/2018 12:00:00 AM,Cyberattack,2017-06-09T00:00:00,2017-10-02T00:00:00,"Guarenteed Rate, Inc.",Phishing,2545.0,Finance,,Name,2018,"1,000-9,999",100-199,
9762,09/13/2017 12:00:00 AM,01/12/2018 12:00:00 AM,Cyberattack,2017-06-09T00:00:00,2017-10-02T00:00:00,"Guarenteed Rate, Inc.",Phishing,2545.0,Finance,,Social Security Number,2018,"1,000-9,999",100-199,
9762,09/13/2017 12:00:00 AM,01/12/2018 12:00:00 AM,Cyberattack,2017-06-09T00:00:00,2017-10-02T00:00:00,"Guarenteed Rate, Inc.",Phishing,2545.0,Finance,,Financial & Banking Information,2018,"1,000-9,999",100-199,
9764,11/30/2017 12:00:00 AM,01/25/2018 12:00:00 AM,Theft or Mistake,2017-11-30T00:00:00,2017-11-30T00:00:00,Zachary E. Adkins DDS,,,Health,,Name,2018,Unknown,0,
9764,11/30/2017 12:00:00 AM,01/25/2018 12:00:00 AM,Theft or Mistake,2017-11-30T00:00:00,2017-11-30T00:00:00,Zachary E. Adkins DDS,,,Health,,Social Security Number,2018,Unknown,0,
9764,11/30/2017 12:00:00 AM,01/25/2018 12:00:00 AM,Theft or Mistake,2017-11-30T00:00:00,2017-11-30T00:00:00,Zachary E. Adkins DDS,,,Health,,Medical Information,2018,Unknown,0,
9764,11/30/2017 12:00:00 AM,01/25/2018 12:00:00 AM,Theft or Mistake,2017-11-30T00:00:00,2017-11-30T00:00:00,Zachary E. Adkins DDS,,,Health,,Other,2018,Unknown,0,
9765,01/31/2018 12:00:00 AM,02/01/2018 12:00:00 AM,Cyberattack,2018-01-30T00:00:00,2018-01-30T00:00:00,North Beach School District,Phishing,,Education,,Name,2018,Unknown,1-99,
9765,01/31/2018 12:00:00 AM,02/01/2018 12:00:00 AM,Cyberattack,2018-01-30T00:00:00,2018-01-30T00:00:00,North Beach School District,Phishing,,Education,,Social Security Number,2018,Unknown,1-99,
9765,01/31/2018 12:00:00 AM,02/01/2018 12:00:00 AM,Cyberattack,2018-01-30T00:00:00,2018-01-30T00:00:00,North Beach School District,Phishing,,Education,,Other,2018,Unknown,1-99,
9766,12/22/2017 12:00:00 AM,02/05/2018 12:00:00 AM,Theft or Mistake,2017-12-22T00:00:00,2017-12-22T00:00:00,"PAR Electrical Contractors, Inc.",,768.0,Business,Construction,Name,2018,500-999,0,
9766,12/22/2017 12:00:00 AM,02/05/2018 12:00:00 AM,Theft or Mistake,2017-12-22T00:00:00,2017-12-22T00:00:00,"PAR Electrical Contractors, Inc.",,768.0,Business,Construction,Social Security Number,2018,500-999,0,
9766,12/22/2017 12:00:00 AM,02/05/2018 12:00:00 AM,Theft or Mistake,2017-12-22T00:00:00,2017-12-22T00:00:00,"PAR Electrical Contractors, Inc.",,768.0,Business,Construction,Driver's License or Washington ID Card Number,2018,500-999,0,
9766,12/22/2017 12:00:00 AM,02/05/2018 12:00:00 AM,Theft or Mistake,2017-12-22T00:00:00,2017-12-22T00:00:00,"PAR Electrical Contractors, Inc.",,768.0,Business,Construction,Financial & Banking Information,2018,500-999,0,
9766,12/22/2017 12:00:00 AM,02/05/2018 12:00:00 AM,Theft or Mistake,2017-12-22T00:00:00,2017-12-22T00:00:00,"PAR Electrical Contractors, Inc.",,768.0,Business,Construction,Passport Number,2018,500-999,0,
9766,12/22/2017 12:00:00 AM,02/05/2018 12:00:00 AM,Theft or Mistake,2017-12-22T00:00:00,2017-12-22T00:00:00,"PAR Electrical Contractors, Inc.",,768.0,Business,Construction,Medical Information,2018,500-999,0,
9766,12/22/2017 12:00:00 AM,02/05/2018 12:00:00 AM,Theft or Mistake,2017-12-22T00:00:00,2017-12-22T00:00:00,"PAR Electrical Contractors, Inc.",,768.0,Business,Construction,Other,2018,500-999,0,
9767,01/10/2018 12:00:00 AM,02/23/2018 12:00:00 AM,Unauthorized Access,2017-01-20T00:00:00,2018-01-29T00:00:00,North 40 Outfitters,,2671.0,Business,Retail,Name,2018,"1,000-9,999",300-399,
9767,01/10/2018 12:00:00 AM,02/23/2018 12:00:00 AM,Unauthorized Access,2017-01-20T00:00:00,2018-01-29T00:00:00,North 40 Outfitters,,2671.0,Business,Retail,Financial & Banking Information,2018,"1,000-9,999",300-399,
9767,01/10/2018 12:00:00 AM,02/23/2018 12:00:00 AM,Unauthorized Access,2017-01-20T00:00:00,2018-01-29T00:00:00,North 40 Outfitters,,2671.0,Business,Retail,Username and Password/Security Question Answers,2018,"1,000-9,999",300-399,
9768,11/02/2017 12:00:00 AM,02/27/2018 12:00:00 AM,Unauthorized Access,2017-08-14T00:00:00,2017-08-18T00:00:00,FastHealth Corporation,,2876.0,Health,,Name,2018,"1,000-9,999",1-99,
9768,11/02/2017 12:00:00 AM,02/27/2018 12:00:00 AM,Unauthorized Access,2017-08-14T00:00:00,2017-08-18T00:00:00,FastHealth Corporation,,2876.0,Health,,Social Security Number,2018,"1,000-9,999",1-99,
9768,11/02/2017 12:00:00 AM,02/27/2018 12:00:00 AM,Unauthorized Access,2017-08-14T00:00:00,2017-08-18T00:00:00,FastHealth Corporation,,2876.0,Health,,Driver's License or Washington ID Card Number,2018,"1,000-9,999",1-99,
9768,11/02/2017 12:00:00 AM,02/27/2018 12:00:00 AM,Unauthorized Access,2017-08-14T00:00:00,2017-08-18T00:00:00,FastHealth Corporation,,2876.0,Health,,Financial & Banking Information,2018,"1,000-9,999",1-99,
9769,02/14/2018 12:00:00 AM,03/02/2018 12:00:00 AM,Cyberattack,2016-06-01T00:00:00,2017-11-30T00:00:00,Preferred Hotels & Resorts,Malware,21687.0,Business,Hospitality,Name,2018,"10,000-49,999",500+,
9769,02/14/2018 12:00:00 AM,03/02/2018 12:00:00 AM,Cyberattack,2016-06-01T00:00:00,2017-11-30T00:00:00,Preferred Hotels & Resorts,Malware,21687.0,Business,Hospitality,Financial & Banking Information,2018,"10,000-49,999",500+,
9770,08/01/2017 12:00:00 AM,03/08/2018 12:00:00 AM,Cyberattack,,,ABM Industries Incorporated,Phishing,1100.0,Business,Professional Services,Name,2018,"1,000-9,999",Unknown,
9770,08/01/2017 12:00:00 AM,03/08/2018 12:00:00 AM,Cyberattack,,,ABM Industries Incorporated,Phishing,1100.0,Business,Professional Services,Social Security Number,2018,"1,000-9,999",Unknown,
9770,08/01/2017 12:00:00 AM,03/08/2018 12:00:00 AM,Cyberattack,,,ABM Industries Incorporated,Phishing,1100.0,Business,Professional Services,Financial & Banking Information,2018,"1,000-9,999",Unknown,
9770,08/01/2017 12:00:00 AM,03/08/2018 12:00:00 AM,Cyberattack,,,ABM Industries Incorporated,Phishing,1100.0,Business,Professional Services,Medical Information,2018,"1,000-9,999",Unknown,
9770,08/01/2017 12:00:00 AM,03/08/2018 12:00:00 AM,Cyberattack,,,ABM Industries Incorporated,Phishing,1100.0,Business,Professional Services,Other,2018,"1,000-9,999",Unknown,
9771,02/15/2018 12:00:00 AM,03/15/2018 12:00:00 AM,Theft or Mistake,,,"Parker Staffing Services, LLC",,,Business,Human Resources,Name,2018,Unknown,Unknown,
9771,02/15/2018 12:00:00 AM,03/15/2018 12:00:00 AM,Theft or Mistake,,,"Parker Staffing Services, LLC",,,Business,Human Resources,Social Security Number,2018,Unknown,Unknown,
9771,02/15/2018 12:00:00 AM,03/15/2018 12:00:00 AM,Theft or Mistake,,,"Parker Staffing Services, LLC",,,Business,Human Resources,Other,2018,Unknown,Unknown,
9772,,03/19/2018 12:00:00 AM,Cyberattack,2017-05-15T00:00:00,2018-01-30T00:00:00,"Bronson Nutritionals, LLC",Malware,774.0,Business,Consumable,Name,2018,500-999,Unknown,
9772,,03/19/2018 12:00:00 AM,Cyberattack,2017-05-15T00:00:00,2018-01-30T00:00:00,"Bronson Nutritionals, LLC",Malware,774.0,Business,Consumable,Financial & Banking Information,2018,500-999,Unknown,
9772,,03/19/2018 12:00:00 AM,Cyberattack,2017-05-15T00:00:00,2018-01-30T00:00:00,"Bronson Nutritionals, LLC",Malware,774.0,Business,Consumable,Other,2018,500-999,Unknown,
9773,03/01/2018 12:00:00 AM,03/20/2018 12:00:00 AM,Cyberattack,2017-10-01T00:00:00,2017-12-22T00:00:00,Orbitz,Unclear/unknown,5013.0,Business,Hospitality,Name,2018,"1,000-9,999",100-199,
9773,03/01/2018 12:00:00 AM,03/20/2018 12:00:00 AM,Cyberattack,2017-10-01T00:00:00,2017-12-22T00:00:00,Orbitz,Unclear/unknown,5013.0,Business,Hospitality,Financial & Banking Information,2018,"1,000-9,999",100-199,
9773,03/01/2018 12:00:00 AM,03/20/2018 12:00:00 AM,Cyberattack,2017-10-01T00:00:00,2017-12-22T00:00:00,Orbitz,Unclear/unknown,5013.0,Business,Hospitality,Other,2018,"1,000-9,999",100-199,
9775,02/25/2018 12:00:00 AM,03/27/2018 12:00:00 AM,Cyberattack,2018-02-25T00:00:00,2018-02-25T00:00:00,Manduka,Malware,1634.0,Business,Fitness,Name,2018,"1,000-9,999",0,
9775,02/25/2018 12:00:00 AM,03/27/2018 12:00:00 AM,Cyberattack,2018-02-25T00:00:00,2018-02-25T00:00:00,Manduka,Malware,1634.0,Business,Fitness,Financial & Banking Information,2018,"1,000-9,999",0,
10172,10/08/2020 12:00:00 AM,07/23/2021 12:00:00 AM,Cyberattack,2018-04-05T00:00:00,2021-03-27T00:00:00,Savory Spice,Malware,2785.0,Business,Retail,Name,2021,"1,000-9,999",500+,CO
10172,10/08/2020 12:00:00 AM,07/23/2021 12:00:00 AM,Cyberattack,2018-04-05T00:00:00,2021-03-27T00:00:00,Savory Spice,Malware,2785.0,Business,Retail,Financial & Banking Information,2021,"1,000-9,999",500+,CO
10174,03/10/2021 12:00:00 AM,05/03/2021 12:00:00 AM,Cyberattack,2020-12-01T00:00:00,2021-03-08T00:00:00,"Divvy Up, Inc.",Malware,1012.0,Business,Retail,Name,2021,"1,000-9,999",1-99,FL
10174,03/10/2021 12:00:00 AM,05/03/2021 12:00:00 AM,Cyberattack,2020-12-01T00:00:00,2021-03-08T00:00:00,"Divvy Up, Inc.",Malware,1012.0,Business,Retail,Financial & Banking Information,2021,"1,000-9,999",1-99,FL
10176,08/15/2020 12:00:00 AM,01/14/2021 12:00:00 AM,Cyberattack,,,National Western Life Insurance Company,Malware,15556.0,Finance,,Name,2021,"10,000-49,999",Unknown,TX
10176,08/15/2020 12:00:00 AM,01/14/2021 12:00:00 AM,Cyberattack,,,National Western Life Insurance Company,Malware,15556.0,Finance,,Social Security Number,2021,"10,000-49,999",Unknown,TX
10176,08/15/2020 12:00:00 AM,01/14/2021 12:00:00 AM,Cyberattack,,,National Western Life Insurance Company,Malware,15556.0,Finance,,Financial & Banking Information,2021,"10,000-49,999",Unknown,TX
10176,08/15/2020 12:00:00 AM,01/14/2021 12:00:00 AM,Cyberattack,,,National Western Life Insurance Company,Malware,15556.0,Finance,,Full Date of Birth,2021,"10,000-49,999",Unknown,TX
10176,08/15/2020 12:00:00 AM,01/14/2021 12:00:00 AM,Cyberattack,,,National Western Life Insurance Company,Malware,15556.0,Finance,,Other,2021,"10,000-49,999",Unknown,TX
10192,07/16/2020 12:00:00 AM,09/14/2020 12:00:00 AM,Cyberattack,2019-09-24T00:00:00,2019-11-14T00:00:00,Baylor Genetics,Phishing,804.0,Health,,Name,2021,500-999,200-299,
10192,07/16/2020 12:00:00 AM,09/14/2020 12:00:00 AM,Cyberattack,2019-09-24T00:00:00,2019-11-14T00:00:00,Baylor Genetics,Phishing,804.0,Health,,Financial & Banking Information,2021,500-999,200-299,
10192,07/16/2020 12:00:00 AM,09/14/2020 12:00:00 AM,Cyberattack,2019-09-24T00:00:00,2019-11-14T00:00:00,Baylor Genetics,Phishing,804.0,Health,,Full Date of Birth,2021,500-999,200-299,
10192,07/16/2020 12:00:00 AM,09/14/2020 12:00:00 AM,Cyberattack,2019-09-24T00:00:00,2019-11-14T00:00:00,Baylor Genetics,Phishing,804.0,Health,,Medical Information,2021,500-999,200-299,
10195,09/07/2020 12:00:00 AM,12/30/2020 12:00:00 AM,Cyberattack,2018-07-01T00:00:00,,Zoetop Business Co. Ltd.,Unclear/unknown,148785.0,Business,Clothing,Name,2021,"50,000-999,999",Unknown,
10195,09/07/2020 12:00:00 AM,12/30/2020 12:00:00 AM,Cyberattack,2018-07-01T00:00:00,,Zoetop Business Co. Ltd.,Unclear/unknown,148785.0,Business,Clothing,Username and Password/Security Question Answers,2021,"50,000-999,999",Unknown,
10195,09/07/2020 12:00:00 AM,12/30/2020 12:00:00 AM,Cyberattack,2018-07-01T00:00:00,,Zoetop Business Co. Ltd.,Unclear/unknown,148785.0,Business,Clothing,Other,2021,"50,000-999,999",Unknown,
10199,08/10/2020 12:00:00 AM,08/24/2020 12:00:00 AM,Unauthorized Access,,,Arbiter Sports,,16465.0,Business,Software,Name,2021,"10,000-49,999",Unknown,UT
10199,08/10/2020 12:00:00 AM,08/24/2020 12:00:00 AM,Unauthorized Access,,,Arbiter Sports,,16465.0,Business,Software,Social Security Number,2021,"10,000-49,999",Unknown,UT
10199,08/10/2020 12:00:00 AM,08/24/2020 12:00:00 AM,Unauthorized Access,,,Arbiter Sports,,16465.0,Business,Software,Full Date of Birth,2021,"10,000-49,999",Unknown,UT
10199,08/10/2020 12:00:00 AM,08/24/2020 12:00:00 AM,Unauthorized Access,,,Arbiter Sports,,16465.0,Business,Software,Username and Password/Security Question Answers,2021,"10,000-49,999",Unknown,UT
10199,08/10/2020 12:00:00 AM,08/24/2020 12:00:00 AM,Unauthorized Access,,,Arbiter Sports,,16465.0,Business,Software,Email Address and Password/Security Question Answers,2021,"10,000-49,999",Unknown,UT
10200,06/26/2020 12:00:00 AM,07/24/2020 12:00:00 AM,Cyberattack,,,City of Redmond,Unclear/unknown,2851.0,Government,,Name,2021,"1,000-9,999",Unknown,
10200,06/26/2020 12:00:00 AM,07/24/2020 12:00:00 AM,Cyberattack,,,City of Redmond,Unclear/unknown,2851.0,Government,,Social Security Number,2021,"1,000-9,999",Unknown,
10200,06/26/2020 12:00:00 AM,07/24/2020 12:00:00 AM,Cyberattack,,,City of Redmond,Unclear/unknown,2851.0,Government,,Driver's License or Washington ID Card Number,2021,"1,000-9,999",Unknown,
10200,06/26/2020 12:00:00 AM,07/24/2020 12:00:00 AM,Cyberattack,,,City of Redmond,Unclear/unknown,2851.0,Government,,Full Date of Birth,2021,"1,000-9,999",Unknown,
10200,06/26/2020 12:00:00 AM,07/24/2020 12:00:00 AM,Cyberattack,,,City of Redmond,Unclear/unknown,2851.0,Government,,Username and Password/Security Question Answers,2021,"1,000-9,999",Unknown,
10200,06/26/2020 12:00:00 AM,07/24/2020 12:00:00 AM,Cyberattack,,,City of Redmond,Unclear/unknown,2851.0,Government,,Email Address and Password/Security Question Answers,2021,"1,000-9,999",Unknown,
10200,06/26/2020 12:00:00 AM,07/24/2020 12:00:00 AM,Cyberattack,,,City of Redmond,Unclear/unknown,2851.0,Government,,Other,2021,"1,000-9,999",Unknown,
10201,09/18/2019 12:00:00 AM,07/24/2020 12:00:00 AM,Theft or Mistake,2019-09-18T00:00:00,2019-09-18T00:00:00,Entercom Communications Corp.,,2730.0,Business,Entertainment,Name,2021,"1,000-9,999",0,
10201,09/18/2019 12:00:00 AM,07/24/2020 12:00:00 AM,Theft or Mistake,2019-09-18T00:00:00,2019-09-18T00:00:00,Entercom Communications Corp.,,2730.0,Business,Entertainment,Social Security Number,2021,"1,000-9,999",0,
10201,09/18/2019 12:00:00 AM,07/24/2020 12:00:00 AM,Theft or Mistake,2019-09-18T00:00:00,2019-09-18T00:00:00,Entercom Communications Corp.,,2730.0,Business,Entertainment,Driver's License or Washington ID Card Number,2021,"1,000-9,999",0,
10201,09/18/2019 12:00:00 AM,07/24/2020 12:00:00 AM,Theft or Mistake,2019-09-18T00:00:00,2019-09-18T00:00:00,Entercom Communications Corp.,,2730.0,Business,Entertainment,Financial & Banking Information,2021,"1,000-9,999",0,
10201,09/18/2019 12:00:00 AM,07/24/2020 12:00:00 AM,Theft or Mistake,2019-09-18T00:00:00,2019-09-18T00:00:00,Entercom Communications Corp.,,2730.0,Business,Entertainment,Other,2021,"1,000-9,999",0,
10202,06/25/2020 12:00:00 AM,07/24/2020 12:00:00 AM,Unauthorized Access,2019-07-26T00:00:00,2019-11-18T00:00:00,Ply Gem Residential Solutions,,2841.0,Business,Home,Name,2021,"1,000-9,999",300-399,
10202,06/25/2020 12:00:00 AM,07/24/2020 12:00:00 AM,Unauthorized Access,2019-07-26T00:00:00,2019-11-18T00:00:00,Ply Gem Residential Solutions,,2841.0,Business,Home,Social Security Number,2021,"1,000-9,999",300-399,
10202,06/25/2020 12:00:00 AM,07/24/2020 12:00:00 AM,Unauthorized Access,2019-07-26T00:00:00,2019-11-18T00:00:00,Ply Gem Residential Solutions,,2841.0,Business,Home,Driver's License or Washington ID Card Number,2021,"1,000-9,999",300-399,
10202,06/25/2020 12:00:00 AM,07/24/2020 12:00:00 AM,Unauthorized Access,2019-07-26T00:00:00,2019-11-18T00:00:00,Ply Gem Residential Solutions,,2841.0,Business,Home,Financial & Banking Information,2021,"1,000-9,999",300-399,
10202,06/25/2020 12:00:00 AM,07/24/2020 12:00:00 AM,Unauthorized Access,2019-07-26T00:00:00,2019-11-18T00:00:00,Ply Gem Residential Solutions,,2841.0,Business,Home,Full Date of Birth,2021,"1,000-9,999",300-399,
10202,06/25/2020 12:00:00 AM,07/24/2020 12:00:00 AM,Unauthorized Access,2019-07-26T00:00:00,2019-11-18T00:00:00,Ply Gem Residential Solutions,,2841.0,Business,Home,Medical Information,2021,"1,000-9,999",300-399,
10204,07/16/2020 12:00:00 AM,07/28/2020 12:00:00 AM,Cyberattack,2020-02-07T00:00:00,2020-05-20T00:00:00,French American School of Puget Sound,Ransomware,3172.0,Education,,Name,2021,"1,000-9,999",100-199,
10204,07/16/2020 12:00:00 AM,07/28/2020 12:00:00 AM,Cyberattack,2020-02-07T00:00:00,2020-05-20T00:00:00,French American School of Puget Sound,Ransomware,3172.0,Education,,Full Date of Birth,2021,"1,000-9,999",100-199,
10204,07/16/2020 12:00:00 AM,07/28/2020 12:00:00 AM,Cyberattack,2020-02-07T00:00:00,2020-05-20T00:00:00,French American School of Puget Sound,Ransomware,3172.0,Education,,Other,2021,"1,000-9,999",100-199,
10205,01/05/2020 12:00:00 AM,07/28/2020 12:00:00 AM,Theft or Mistake,2016-01-18T00:00:00,2020-01-08T00:00:00,"Front Rush, LLC",,1982.0,Business,Other,Social Security Number,2021,"1,000-9,999",500+,
10205,01/05/2020 12:00:00 AM,07/28/2020 12:00:00 AM,Theft or Mistake,2016-01-18T00:00:00,2020-01-08T00:00:00,"Front Rush, LLC",,1982.0,Business,Other,Driver's License or Washington ID Card Number,2021,"1,000-9,999",500+,
10205,01/05/2020 12:00:00 AM,07/28/2020 12:00:00 AM,Theft or Mistake,2016-01-18T00:00:00,2020-01-08T00:00:00,"Front Rush, LLC",,1982.0,Business,Other,Full Date of Birth,2021,"1,000-9,999",500+,
10205,01/05/2020 12:00:00 AM,07/28/2020 12:00:00 AM,Theft or Mistake,2016-01-18T00:00:00,2020-01-08T00:00:00,"Front Rush, LLC",,1982.0,Business,Other,Unique Private Key (e.g. used to authenticate or sign an electronic record),2021,"1,000-9,999",500+,
10205,01/05/2020 12:00:00 AM,07/28/2020 12:00:00 AM,Theft or Mistake,2016-01-18T00:00:00,2020-01-08T00:00:00,"Front Rush, LLC",,1982.0,Business,Other,Student ID Number,2021,"1,000-9,999",500+,
10205,01/05/2020 12:00:00 AM,07/28/2020 12:00:00 AM,Theft or Mistake,2016-01-18T00:00:00,2020-01-08T00:00:00,"Front Rush, LLC",,1982.0,Business,Other,Health Insurance Policy or ID Number,2021,"1,000-9,999",500+,
10205,01/05/2020 12:00:00 AM,07/28/2020 12:00:00 AM,Theft or Mistake,2016-01-18T00:00:00,2020-01-08T00:00:00,"Front Rush, LLC",,1982.0,Business,Other,Medical Information,2021,"1,000-9,999",500+,
10205,01/05/2020 12:00:00 AM,07/28/2020 12:00:00 AM,Theft or Mistake,2016-01-18T00:00:00,2020-01-08T00:00:00,"Front Rush, LLC",,1982.0,Business,Other,Username and Password/Security Question Answers,2021,"1,000-9,999",500+,
10205,01/05/2020 12:00:00 AM,07/28/2020 12:00:00 AM,Theft or Mistake,2016-01-18T00:00:00,2020-01-08T00:00:00,"Front Rush, LLC",,1982.0,Business,Other,Email Address and Password/Security Question Answers,2021,"1,000-9,999",500+,
10206,07/16/2020 12:00:00 AM,07/31/2020 12:00:00 AM,Cyberattack,2020-02-07T00:00:00,2020-05-20T00:00:00,Auburn University,Ransomware,1294.0,Education,,Name,2021,"1,000-9,999",100-199,
10206,07/16/2020 12:00:00 AM,07/31/2020 12:00:00 AM,Cyberattack,2020-02-07T00:00:00,2020-05-20T00:00:00,Auburn University,Ransomware,1294.0,Education,,Full Date of Birth,2021,"1,000-9,999",100-199,
10209,07/02/2020 12:00:00 AM,08/03/2020 12:00:00 AM,Cyberattack,2019-11-22T00:00:00,2020-02-12T00:00:00,"Wrkforce, Inc.",Unclear/unknown,527.0,Business,Other,Name,2021,500-999,200-299,
10209,07/02/2020 12:00:00 AM,08/03/2020 12:00:00 AM,Cyberattack,2019-11-22T00:00:00,2020-02-12T00:00:00,"Wrkforce, Inc.",Unclear/unknown,527.0,Business,Other,Social Security Number,2021,500-999,200-299,
10209,07/02/2020 12:00:00 AM,08/03/2020 12:00:00 AM,Cyberattack,2019-11-22T00:00:00,2020-02-12T00:00:00,"Wrkforce, Inc.",Unclear/unknown,527.0,Business,Other,Driver's License or Washington ID Card Number,2021,500-999,200-299,
10209,07/02/2020 12:00:00 AM,08/03/2020 12:00:00 AM,Cyberattack,2019-11-22T00:00:00,2020-02-12T00:00:00,"Wrkforce, Inc.",Unclear/unknown,527.0,Business,Other,Financial & Banking Information,2021,500-999,200-299,
10209,07/02/2020 12:00:00 AM,08/03/2020 12:00:00 AM,Cyberattack,2019-11-22T00:00:00,2020-02-12T00:00:00,"Wrkforce, Inc.",Unclear/unknown,527.0,Business,Other,Full Date of Birth,2021,500-999,200-299,
10209,07/02/2020 12:00:00 AM,08/03/2020 12:00:00 AM,Cyberattack,2019-11-22T00:00:00,2020-02-12T00:00:00,"Wrkforce, Inc.",Unclear/unknown,527.0,Business,Other,Health Insurance Policy or ID Number,2021,500-999,200-299,
10209,07/02/2020 12:00:00 AM,08/03/2020 12:00:00 AM,Cyberattack,2019-11-22T00:00:00,2020-02-12T00:00:00,"Wrkforce, Inc.",Unclear/unknown,527.0,Business,Other,Other,2021,500-999,200-299,
10212,07/16/2020 12:00:00 AM,08/07/2020 12:00:00 AM,Cyberattack,2020-02-07T00:00:00,2020-05-20T00:00:00,Pacific Northwest University of Health Sciences,Ransomware,1122.0,Education,,Name,2021,"1,000-9,999",100-199,
10212,07/16/2020 12:00:00 AM,08/07/2020 12:00:00 AM,Cyberattack,2020-02-07T00:00:00,2020-05-20T00:00:00,Pacific Northwest University of Health Sciences,Ransomware,1122.0,Education,,Full Date of Birth,2021,"1,000-9,999",100-199,
10212,07/16/2020 12:00:00 AM,08/07/2020 12:00:00 AM,Cyberattack,2020-02-07T00:00:00,2020-05-20T00:00:00,Pacific Northwest University of Health Sciences,Ransomware,1122.0,Education,,Student ID Number,2021,"1,000-9,999",100-199,
10213,07/16/2020 12:00:00 AM,08/09/2020 12:00:00 AM,Cyberattack,2020-02-07T00:00:00,2020-05-20T00:00:00,Planned Parenthood of the Rocky Mountains,Ransomware,526.0,Health,,Name,2021,500-999,100-199,
10213,07/16/2020 12:00:00 AM,08/09/2020 12:00:00 AM,Cyberattack,2020-02-07T00:00:00,2020-05-20T00:00:00,Planned Parenthood of the Rocky Mountains,Ransomware,526.0,Health,,Full Date of Birth,2021,500-999,100-199,
10213,07/16/2020 12:00:00 AM,08/09/2020 12:00:00 AM,Cyberattack,2020-02-07T00:00:00,2020-05-20T00:00:00,Planned Parenthood of the Rocky Mountains,Ransomware,526.0,Health,,Other,2021,500-999,100-199,
10214,05/16/2020 12:00:00 AM,08/10/2020 12:00:00 AM,Cyberattack,2020-05-16T00:00:00,2020-05-16T00:00:00,"Dynasplint Systems, Inc.",Ransomware,1364.0,Business,Manufacturing,Name,2021,"1,000-9,999",0,
10214,05/16/2020 12:00:00 AM,08/10/2020 12:00:00 AM,Cyberattack,2020-05-16T00:00:00,2020-05-16T00:00:00,"Dynasplint Systems, Inc.",Ransomware,1364.0,Business,Manufacturing,Full Date of Birth,2021,"1,000-9,999",0,
10214,05/16/2020 12:00:00 AM,08/10/2020 12:00:00 AM,Cyberattack,2020-05-16T00:00:00,2020-05-16T00:00:00,"Dynasplint Systems, Inc.",Ransomware,1364.0,Business,Manufacturing,Medical Information,2021,"1,000-9,999",0,
10214,05/16/2020 12:00:00 AM,08/10/2020 12:00:00 AM,Cyberattack,2020-05-16T00:00:00,2020-05-16T00:00:00,"Dynasplint Systems, Inc.",Ransomware,1364.0,Business,Manufacturing,Other,2021,"1,000-9,999",0,
10215,07/16/2020 12:00:00 AM,08/10/2020 12:00:00 AM,Cyberattack,2020-02-07T00:00:00,2020-05-20T00:00:00,Heritage University,Ransomware,7803.0,Education,,Name,2021,"1,000-9,999",100-199,
10215,07/16/2020 12:00:00 AM,08/10/2020 12:00:00 AM,Cyberattack,2020-02-07T00:00:00,2020-05-20T00:00:00,Heritage University,Ransomware,7803.0,Education,,Full Date of Birth,2021,"1,000-9,999",100-199,
10219,07/16/2020 12:00:00 AM,08/12/2020 12:00:00 AM,Cyberattack,2020-02-07T00:00:00,2020-05-20T00:00:00,Northeastern University,Ransomware,2602.0,Education,,Name,2021,"1,000-9,999",100-199,
10219,07/16/2020 12:00:00 AM,08/12/2020 12:00:00 AM,Cyberattack,2020-02-07T00:00:00,2020-05-20T00:00:00,Northeastern University,Ransomware,2602.0,Education,,Full Date of Birth,2021,"1,000-9,999",100-199,
10219,07/16/2020 12:00:00 AM,08/12/2020 12:00:00 AM,Cyberattack,2020-02-07T00:00:00,2020-05-20T00:00:00,Northeastern University,Ransomware,2602.0,Education,,Other,2021,"1,000-9,999",100-199,
10223,07/16/2020 12:00:00 AM,08/12/2020 12:00:00 AM,Cyberattack,2020-02-07T00:00:00,2020-05-20T00:00:00,The University of Florida,Ransomware,5075.0,Education,,Name,2021,"1,000-9,999",100-199,
10223,07/16/2020 12:00:00 AM,08/12/2020 12:00:00 AM,Cyberattack,2020-02-07T00:00:00,2020-05-20T00:00:00,The University of Florida,Ransomware,5075.0,Education,,Full Date of Birth,2021,"1,000-9,999",100-199,
10223,07/16/2020 12:00:00 AM,08/12/2020 12:00:00 AM,Cyberattack,2020-02-07T00:00:00,2020-05-20T00:00:00,The University of Florida,Ransomware,5075.0,Education,,Medical Information,2021,"1,000-9,999",100-199,
10223,07/16/2020 12:00:00 AM,08/12/2020 12:00:00 AM,Cyberattack,2020-02-07T00:00:00,2020-05-20T00:00:00,The University of Florida,Ransomware,5075.0,Education,,Other,2021,"1,000-9,999",100-199,
10226,07/16/2020 12:00:00 AM,08/14/2020 12:00:00 AM,Cyberattack,2020-02-07T00:00:00,2020-05-20T00:00:00,Assumption St. Bridget School,Ransomware,769.0,Education,,Name,2021,500-999,100-199,
10226,07/16/2020 12:00:00 AM,08/14/2020 12:00:00 AM,Cyberattack,2020-02-07T00:00:00,2020-05-20T00:00:00,Assumption St. Bridget School,Ransomware,769.0,Education,,Full Date of Birth,2021,500-999,100-199,
10226,07/16/2020 12:00:00 AM,08/14/2020 12:00:00 AM,Cyberattack,2020-02-07T00:00:00,2020-05-20T00:00:00,Assumption St. Bridget School,Ransomware,769.0,Education,,Other,2021,500-999,100-199,
10227,07/16/2020 12:00:00 AM,08/14/2020 12:00:00 AM,Cyberattack,2020-02-07T00:00:00,2020-05-20T00:00:00,Bishop Blanchet High School,Ransomware,3162.0,Education,,Name,2021,"1,000-9,999",100-199,
10227,07/16/2020 12:00:00 AM,08/14/2020 12:00:00 AM,Cyberattack,2020-02-07T00:00:00,2020-05-20T00:00:00,Bishop Blanchet High School,Ransomware,3162.0,Education,,Full Date of Birth,2021,"1,000-9,999",100-199,
10227,07/16/2020 12:00:00 AM,08/14/2020 12:00:00 AM,Cyberattack,2020-02-07T00:00:00,2020-05-20T00:00:00,Bishop Blanchet High School,Ransomware,3162.0,Education,,Other,2021,"1,000-9,999",100-199,
10228,07/16/2020 12:00:00 AM,08/14/2020 12:00:00 AM,Cyberattack,2020-02-07T00:00:00,2020-05-20T00:00:00,Boston University,Ransomware,7067.0,Education,,Name,2021,"1,000-9,999",100-199,
10228,07/16/2020 12:00:00 AM,08/14/2020 12:00:00 AM,Cyberattack,2020-02-07T00:00:00,2020-05-20T00:00:00,Boston University,Ransomware,7067.0,Education,,Full Date of Birth,2021,"1,000-9,999",100-199,
10229,07/16/2020 12:00:00 AM,08/14/2020 12:00:00 AM,Cyberattack,2020-02-07T00:00:00,2020-05-20T00:00:00,Confluence Health Foundation,Ransomware,1132.0,Health,,Name,2021,"1,000-9,999",100-199,
10229,07/16/2020 12:00:00 AM,08/14/2020 12:00:00 AM,Cyberattack,2020-02-07T00:00:00,2020-05-20T00:00:00,Confluence Health Foundation,Ransomware,1132.0,Health,,Full Date of Birth,2021,"1,000-9,999",100-199,
10231,07/16/2020 12:00:00 AM,08/14/2020 12:00:00 AM,Cyberattack,2020-02-07T00:00:00,2020-05-20T00:00:00,EMILY's List,Ransomware,9325.0,Business,Other,Name,2021,"1,000-9,999",100-199,
10231,07/16/2020 12:00:00 AM,08/14/2020 12:00:00 AM,Cyberattack,2020-02-07T00:00:00,2020-05-20T00:00:00,EMILY's List,Ransomware,9325.0,Business,Other,Financial & Banking Information,2021,"1,000-9,999",100-199,
10231,07/16/2020 12:00:00 AM,08/14/2020 12:00:00 AM,Cyberattack,2020-02-07T00:00:00,2020-05-20T00:00:00,EMILY's List,Ransomware,9325.0,Business,Other,Full Date of Birth,2021,"1,000-9,999",100-199,
10231,07/16/2020 12:00:00 AM,08/14/2020 12:00:00 AM,Cyberattack,2020-02-07T00:00:00,2020-05-20T00:00:00,EMILY's List,Ransomware,9325.0,Business,Other,Other,2021,"1,000-9,999",100-199,
10232,07/20/2020 12:00:00 AM,08/14/2020 12:00:00 AM,Cyberattack,2019-07-15T00:00:00,2020-07-10T00:00:00,"Filters Fast, LLC",Malware,6584.0,Business,Retail,Name,2021,"1,000-9,999",300-399,
10232,07/20/2020 12:00:00 AM,08/14/2020 12:00:00 AM,Cyberattack,2019-07-15T00:00:00,2020-07-10T00:00:00,"Filters Fast, LLC",Malware,6584.0,Business,Retail,Financial & Banking Information,2021,"1,000-9,999",300-399,
10232,07/20/2020 12:00:00 AM,08/14/2020 12:00:00 AM,Cyberattack,2019-07-15T00:00:00,2020-07-10T00:00:00,"Filters Fast, LLC",Malware,6584.0,Business,Retail,Other,2021,"1,000-9,999",300-399,
10239,07/16/2020 12:00:00 AM,08/14/2020 12:00:00 AM,Cyberattack,2020-02-07T00:00:00,2020-05-20T00:00:00,St. Joseph School,Ransomware,5142.0,Education,,Name,2021,"1,000-9,999",100-199,
10239,07/16/2020 12:00:00 AM,08/14/2020 12:00:00 AM,Cyberattack,2020-02-07T00:00:00,2020-05-20T00:00:00,St. Joseph School,Ransomware,5142.0,Education,,Full Date of Birth,2021,"1,000-9,999",100-199,
10239,07/16/2020 12:00:00 AM,08/14/2020 12:00:00 AM,Cyberattack,2020-02-07T00:00:00,2020-05-20T00:00:00,St. Joseph School,Ransomware,5142.0,Education,,Other,2021,"1,000-9,999",100-199,
10243,07/16/2020 12:00:00 AM,08/16/2020 12:00:00 AM,Cyberattack,2020-02-07T00:00:00,2020-05-20T00:00:00,Excelsior College,Ransomware,4069.0,Education,,Name,2021,"1,000-9,999",100-199,
10243,07/16/2020 12:00:00 AM,08/16/2020 12:00:00 AM,Cyberattack,2020-02-07T00:00:00,2020-05-20T00:00:00,Excelsior College,Ransomware,4069.0,Education,,Full Date of Birth,2021,"1,000-9,999",100-199,
10243,07/16/2020 12:00:00 AM,08/16/2020 12:00:00 AM,Cyberattack,2020-02-07T00:00:00,2020-05-20T00:00:00,Excelsior College,Ransomware,4069.0,Education,,Student ID Number,2021,"1,000-9,999",100-199,
10243,07/16/2020 12:00:00 AM,08/16/2020 12:00:00 AM,Cyberattack,2020-02-07T00:00:00,2020-05-20T00:00:00,Excelsior College,Ransomware,4069.0,Education,,Other,2021,"1,000-9,999",100-199,
10244,07/16/2020 12:00:00 AM,08/17/2020 12:00:00 AM,Cyberattack,2020-02-07T00:00:00,2020-05-20T00:00:00,Colby College,Ransomware,606.0,Education,,Name,2021,500-999,100-199,
10244,07/16/2020 12:00:00 AM,08/17/2020 12:00:00 AM,Cyberattack,2020-02-07T00:00:00,2020-05-20T00:00:00,Colby College,Ransomware,606.0,Education,,Full Date of Birth,2021,500-999,100-199,
10244,07/16/2020 12:00:00 AM,08/17/2020 12:00:00 AM,Cyberattack,2020-02-07T00:00:00,2020-05-20T00:00:00,Colby College,Ransomware,606.0,Education,,Other,2021,500-999,100-199,
10245,07/16/2020 12:00:00 AM,08/17/2020 12:00:00 AM,Cyberattack,2020-02-07T00:00:00,2020-05-20T00:00:00,Gonzaga Preparatory School,Ransomware,5000.0,Education,,Name,2021,"1,000-9,999",100-199,
10245,07/16/2020 12:00:00 AM,08/17/2020 12:00:00 AM,Cyberattack,2020-02-07T00:00:00,2020-05-20T00:00:00,Gonzaga Preparatory School,Ransomware,5000.0,Education,,Full Date of Birth,2021,"1,000-9,999",100-199,
10245,07/16/2020 12:00:00 AM,08/17/2020 12:00:00 AM,Cyberattack,2020-02-07T00:00:00,2020-05-20T00:00:00,Gonzaga Preparatory School,Ransomware,5000.0,Education,,Other,2021,"1,000-9,999",100-199,
10246,05/20/2020 12:00:00 AM,08/17/2020 12:00:00 AM,Cyberattack,2020-01-27T00:00:00,,"Mammoth Media, Inc.",Unclear/unknown,,Business,Software,Name,2021,Unknown,Unknown,
10246,05/20/2020 12:00:00 AM,08/17/2020 12:00:00 AM,Cyberattack,2020-01-27T00:00:00,,"Mammoth Media, Inc.",Unclear/unknown,,Business,Software,Full Date of Birth,2021,Unknown,Unknown,
10246,05/20/2020 12:00:00 AM,08/17/2020 12:00:00 AM,Cyberattack,2020-01-27T00:00:00,,"Mammoth Media, Inc.",Unclear/unknown,,Business,Software,Email Address and Password/Security Question Answers,2021,Unknown,Unknown,
10246,05/20/2020 12:00:00 AM,08/17/2020 12:00:00 AM,Cyberattack,2020-01-27T00:00:00,,"Mammoth Media, Inc.",Unclear/unknown,,Business,Software,Other,2021,Unknown,Unknown,
10247,07/17/2020 12:00:00 AM,08/17/2020 12:00:00 AM,Cyberattack,2020-02-07T00:00:00,2020-05-20T00:00:00,Phi Kappa Psi Fraternity,Ransomware,677.0,Finance,,Name,2021,500-999,100-199,
10247,07/17/2020 12:00:00 AM,08/17/2020 12:00:00 AM,Cyberattack,2020-02-07T00:00:00,2020-05-20T00:00:00,Phi Kappa Psi Fraternity,Ransomware,677.0,Finance,,Full Date of Birth,2021,500-999,100-199,
10247,07/17/2020 12:00:00 AM,08/17/2020 12:00:00 AM,Cyberattack,2020-02-07T00:00:00,2020-05-20T00:00:00,Phi Kappa Psi Fraternity,Ransomware,677.0,Finance,,Other,2021,500-999,100-199,
10249,07/16/2020 12:00:00 AM,08/18/2020 12:00:00 AM,Cyberattack,2020-02-07T00:00:00,2020-05-20T00:00:00,University of South Carolina,Ransomware,1165.0,Education,,Name,2021,"1,000-9,999",100-199,
10249,07/16/2020 12:00:00 AM,08/18/2020 12:00:00 AM,Cyberattack,2020-02-07T00:00:00,2020-05-20T00:00:00,University of South Carolina,Ransomware,1165.0,Education,,Full Date of Birth,2021,"1,000-9,999",100-199,
10249,07/16/2020 12:00:00 AM,08/18/2020 12:00:00 AM,Cyberattack,2020-02-07T00:00:00,2020-05-20T00:00:00,University of South Carolina,Ransomware,1165.0,Education,,Other,2021,"1,000-9,999",100-199,
10250,07/13/2020 12:00:00 AM,08/19/2020 12:00:00 AM,Cyberattack,2020-05-13T00:00:00,2020-07-13T00:00:00,American Payroll Association,Malware,548.0,Business,Other,Name,2021,500-999,1-99,
10250,07/13/2020 12:00:00 AM,08/19/2020 12:00:00 AM,Cyberattack,2020-05-13T00:00:00,2020-07-13T00:00:00,American Payroll Association,Malware,548.0,Business,Other,Financial & Banking Information,2021,500-999,1-99,
10250,07/13/2020 12:00:00 AM,08/19/2020 12:00:00 AM,Cyberattack,2020-05-13T00:00:00,2020-07-13T00:00:00,American Payroll Association,Malware,548.0,Business,Other,Full Date of Birth,2021,500-999,1-99,
10250,07/13/2020 12:00:00 AM,08/19/2020 12:00:00 AM,Cyberattack,2020-05-13T00:00:00,2020-07-13T00:00:00,American Payroll Association,Malware,548.0,Business,Other,Username and Password/Security Question Answers,2021,500-999,1-99,
10250,07/13/2020 12:00:00 AM,08/19/2020 12:00:00 AM,Cyberattack,2020-05-13T00:00:00,2020-07-13T00:00:00,American Payroll Association,Malware,548.0,Business,Other,Other,2021,500-999,1-99,
10251,07/16/2020 12:00:00 AM,08/19/2020 12:00:00 AM,Cyberattack,2020-02-07T00:00:00,2020-05-20T00:00:00,California Lutheran University,Ransomware,3549.0,Education,,Name,2021,"1,000-9,999",100-199,
10251,07/16/2020 12:00:00 AM,08/19/2020 12:00:00 AM,Cyberattack,2020-02-07T00:00:00,2020-05-20T00:00:00,California Lutheran University,Ransomware,3549.0,Education,,Full Date of Birth,2021,"1,000-9,999",100-199,
10251,07/16/2020 12:00:00 AM,08/19/2020 12:00:00 AM,Cyberattack,2020-02-07T00:00:00,2020-05-20T00:00:00,California Lutheran University,Ransomware,3549.0,Education,,Other,2021,"1,000-9,999",100-199,
10253,07/01/2020 12:00:00 AM,08/20/2020 12:00:00 AM,Unauthorized Access,2020-06-23T00:00:00,2020-07-01T00:00:00,"Dave, Inc.",,40998.0,Business,Software,Name,2021,"10,000-49,999",1-99,
10253,07/01/2020 12:00:00 AM,08/20/2020 12:00:00 AM,Unauthorized Access,2020-06-23T00:00:00,2020-07-01T00:00:00,"Dave, Inc.",,40998.0,Business,Software,Social Security Number,2021,"10,000-49,999",1-99,
10253,07/01/2020 12:00:00 AM,08/20/2020 12:00:00 AM,Unauthorized Access,2020-06-23T00:00:00,2020-07-01T00:00:00,"Dave, Inc.",,40998.0,Business,Software,Full Date of Birth,2021,"10,000-49,999",1-99,
10253,07/01/2020 12:00:00 AM,08/20/2020 12:00:00 AM,Unauthorized Access,2020-06-23T00:00:00,2020-07-01T00:00:00,"Dave, Inc.",,40998.0,Business,Software,Email Address and Password/Security Question Answers,2021,"10,000-49,999",1-99,
10253,07/01/2020 12:00:00 AM,08/20/2020 12:00:00 AM,Unauthorized Access,2020-06-23T00:00:00,2020-07-01T00:00:00,"Dave, Inc.",,40998.0,Business,Software,Other,2021,"10,000-49,999",1-99,
10256,04/06/2020 12:00:00 AM,08/21/2020 12:00:00 AM,Cyberattack,2020-04-06T00:00:00,2020-04-06T00:00:00,"Cetera Financial Group, Inc.",Unclear/unknown,2760.0,Finance,,Name,2021,"1,000-9,999",0,
10256,04/06/2020 12:00:00 AM,08/21/2020 12:00:00 AM,Cyberattack,2020-04-06T00:00:00,2020-04-06T00:00:00,"Cetera Financial Group, Inc.",Unclear/unknown,2760.0,Finance,,Social Security Number,2021,"1,000-9,999",0,
10256,04/06/2020 12:00:00 AM,08/21/2020 12:00:00 AM,Cyberattack,2020-04-06T00:00:00,2020-04-06T00:00:00,"Cetera Financial Group, Inc.",Unclear/unknown,2760.0,Finance,,Driver's License or Washington ID Card Number,2021,"1,000-9,999",0,
10256,04/06/2020 12:00:00 AM,08/21/2020 12:00:00 AM,Cyberattack,2020-04-06T00:00:00,2020-04-06T00:00:00,"Cetera Financial Group, Inc.",Unclear/unknown,2760.0,Finance,,Financial & Banking Information,2021,"1,000-9,999",0,
10259,07/16/2020 12:00:00 AM,08/21/2020 12:00:00 AM,Cyberattack,2020-02-07T00:00:00,2020-05-20T00:00:00,MultiCare Health System,Ransomware,302769.0,Health,,Name,2021,"50,000-999,999",100-199,
10259,07/16/2020 12:00:00 AM,08/21/2020 12:00:00 AM,Cyberattack,2020-02-07T00:00:00,2020-05-20T00:00:00,MultiCare Health System,Ransomware,302769.0,Health,,Full Date of Birth,2021,"50,000-999,999",100-199,
10259,07/16/2020 12:00:00 AM,08/21/2020 12:00:00 AM,Cyberattack,2020-02-07T00:00:00,2020-05-20T00:00:00,MultiCare Health System,Ransomware,302769.0,Health,,Medical Information,2021,"50,000-999,999",100-199,
10259,07/16/2020 12:00:00 AM,08/21/2020 12:00:00 AM,Cyberattack,2020-02-07T00:00:00,2020-05-20T00:00:00,MultiCare Health System,Ransomware,302769.0,Health,,Other,2021,"50,000-999,999",100-199,
10263,07/16/2020 12:00:00 AM,08/24/2020 12:00:00 AM,Cyberattack,2020-02-07T00:00:00,2020-05-20T00:00:00,Southern New Hampshire University,Ransomware,1826.0,Education,,Name,2021,"1,000-9,999",100-199,
10263,07/16/2020 12:00:00 AM,08/24/2020 12:00:00 AM,Cyberattack,2020-02-07T00:00:00,2020-05-20T00:00:00,Southern New Hampshire University,Ransomware,1826.0,Education,,Full Date of Birth,2021,"1,000-9,999",100-199,
10263,07/16/2020 12:00:00 AM,08/24/2020 12:00:00 AM,Cyberattack,2020-02-07T00:00:00,2020-05-20T00:00:00,Southern New Hampshire University,Ransomware,1826.0,Education,,Other,2021,"1,000-9,999",100-199,
10264,01/12/2020 12:00:00 AM,08/25/2020 12:00:00 AM,Cyberattack,,,Westcor Land Title Insurance Company,Malware,979.0,Finance,,Name,2021,500-999,Unknown,
10264,01/12/2020 12:00:00 AM,08/25/2020 12:00:00 AM,Cyberattack,,,Westcor Land Title Insurance Company,Malware,979.0,Finance,,Social Security Number,2021,500-999,Unknown,
10264,01/12/2020 12:00:00 AM,08/25/2020 12:00:00 AM,Cyberattack,,,Westcor Land Title Insurance Company,Malware,979.0,Finance,,Username and Password/Security Question Answers,2021,500-999,Unknown,
10265,07/27/2020 12:00:00 AM,08/26/2020 12:00:00 AM,Cyberattack,2019-10-01T00:00:00,2020-04-08T00:00:00,"Stericycle, Inc.",Malware,1284.0,Business,Professional Services,Name,2021,"1,000-9,999",300-399,
10265,07/27/2020 12:00:00 AM,08/26/2020 12:00:00 AM,Cyberattack,2019-10-01T00:00:00,2020-04-08T00:00:00,"Stericycle, Inc.",Malware,1284.0,Business,Professional Services,Social Security Number,2021,"1,000-9,999",300-399,
10265,07/27/2020 12:00:00 AM,08/26/2020 12:00:00 AM,Cyberattack,2019-10-01T00:00:00,2020-04-08T00:00:00,"Stericycle, Inc.",Malware,1284.0,Business,Professional Services,Driver's License or Washington ID Card Number,2021,"1,000-9,999",300-399,
10265,07/27/2020 12:00:00 AM,08/26/2020 12:00:00 AM,Cyberattack,2019-10-01T00:00:00,2020-04-08T00:00:00,"Stericycle, Inc.",Malware,1284.0,Business,Professional Services,Financial & Banking Information,2021,"1,000-9,999",300-399,
10265,07/27/2020 12:00:00 AM,08/26/2020 12:00:00 AM,Cyberattack,2019-10-01T00:00:00,2020-04-08T00:00:00,"Stericycle, Inc.",Malware,1284.0,Business,Professional Services,Passport Number,2021,"1,000-9,999",300-399,
10265,07/27/2020 12:00:00 AM,08/26/2020 12:00:00 AM,Cyberattack,2019-10-01T00:00:00,2020-04-08T00:00:00,"Stericycle, Inc.",Malware,1284.0,Business,Professional Services,Health Insurance Policy or ID Number,2021,"1,000-9,999",300-399,
10265,07/27/2020 12:00:00 AM,08/26/2020 12:00:00 AM,Cyberattack,2019-10-01T00:00:00,2020-04-08T00:00:00,"Stericycle, Inc.",Malware,1284.0,Business,Professional Services,Medical Information,2021,"1,000-9,999",300-399,
10267,07/16/2020 12:00:00 AM,08/27/2020 12:00:00 AM,Cyberattack,2020-02-07T00:00:00,2020-05-20T00:00:00,University of Puget Sound,Ransomware,1429.0,Education,,Name,2021,"1,000-9,999",100-199,
10267,07/16/2020 12:00:00 AM,08/27/2020 12:00:00 AM,Cyberattack,2020-02-07T00:00:00,2020-05-20T00:00:00,University of Puget Sound,Ransomware,1429.0,Education,,Full Date of Birth,2021,"1,000-9,999",100-199,
10267,07/16/2020 12:00:00 AM,08/27/2020 12:00:00 AM,Cyberattack,2020-02-07T00:00:00,2020-05-20T00:00:00,University of Puget Sound,Ransomware,1429.0,Education,,Other,2021,"1,000-9,999",100-199,
10268,07/27/2020 12:00:00 AM,08/28/2020 12:00:00 AM,Cyberattack,2019-06-01T00:00:00,2020-06-17T00:00:00,"AliMed, Inc.",Malware,672.0,Business,Manufacturing,Name,2021,500-999,400-499,
10268,07/27/2020 12:00:00 AM,08/28/2020 12:00:00 AM,Cyberattack,2019-06-01T00:00:00,2020-06-17T00:00:00,"AliMed, Inc.",Malware,672.0,Business,Manufacturing,Financial & Banking Information,2021,500-999,400-499,
10271,05/19/2020 12:00:00 AM,08/31/2020 12:00:00 AM,Cyberattack,2020-05-15T00:00:00,2020-05-17T00:00:00,Assured Imaging,Ransomware,37702.0,Health,,Name,2021,"10,000-49,999",1-99,
10271,05/19/2020 12:00:00 AM,08/31/2020 12:00:00 AM,Cyberattack,2020-05-15T00:00:00,2020-05-17T00:00:00,Assured Imaging,Ransomware,37702.0,Health,,Social Security Number,2021,"10,000-49,999",1-99,
10271,05/19/2020 12:00:00 AM,08/31/2020 12:00:00 AM,Cyberattack,2020-05-15T00:00:00,2020-05-17T00:00:00,Assured Imaging,Ransomware,37702.0,Health,,Driver's License or Washington ID Card Number,2021,"10,000-49,999",1-99,
10271,05/19/2020 12:00:00 AM,08/31/2020 12:00:00 AM,Cyberattack,2020-05-15T00:00:00,2020-05-17T00:00:00,Assured Imaging,Ransomware,37702.0,Health,,Financial & Banking Information,2021,"10,000-49,999",1-99,
10271,05/19/2020 12:00:00 AM,08/31/2020 12:00:00 AM,Cyberattack,2020-05-15T00:00:00,2020-05-17T00:00:00,Assured Imaging,Ransomware,37702.0,Health,,Full Date of Birth,2021,"10,000-49,999",1-99,
10271,05/19/2020 12:00:00 AM,08/31/2020 12:00:00 AM,Cyberattack,2020-05-15T00:00:00,2020-05-17T00:00:00,Assured Imaging,Ransomware,37702.0,Health,,Medical Information,2021,"10,000-49,999",1-99,
10271,05/19/2020 12:00:00 AM,08/31/2020 12:00:00 AM,Cyberattack,2020-05-15T00:00:00,2020-05-17T00:00:00,Assured Imaging,Ransomware,37702.0,Health,,Other,2021,"10,000-49,999",1-99,
10273,08/06/2020 12:00:00 AM,08/31/2020 12:00:00 AM,Cyberattack,2020-02-07T00:00:00,2020-05-20T00:00:00,The Open Window School,Ransomware,1929.0,Education,,Name,2021,"1,000-9,999",100-199,
10273,08/06/2020 12:00:00 AM,08/31/2020 12:00:00 AM,Cyberattack,2020-02-07T00:00:00,2020-05-20T00:00:00,The Open Window School,Ransomware,1929.0,Education,,Full Date of Birth,2021,"1,000-9,999",100-199,
10273,08/06/2020 12:00:00 AM,08/31/2020 12:00:00 AM,Cyberattack,2020-02-07T00:00:00,2020-05-20T00:00:00,The Open Window School,Ransomware,1929.0,Education,,Medical Information,2021,"1,000-9,999",100-199,
10278,07/16/2020 12:00:00 AM,09/02/2020 12:00:00 AM,Cyberattack,2020-02-07T00:00:00,2020-05-20T00:00:00,Hamline University,Ransomware,1066.0,Education,,Name,2021,"1,000-9,999",100-199,
10278,07/16/2020 12:00:00 AM,09/02/2020 12:00:00 AM,Cyberattack,2020-02-07T00:00:00,2020-05-20T00:00:00,Hamline University,Ransomware,1066.0,Education,,Full Date of Birth,2021,"1,000-9,999",100-199,
10278,07/16/2020 12:00:00 AM,09/02/2020 12:00:00 AM,Cyberattack,2020-02-07T00:00:00,2020-05-20T00:00:00,Hamline University,Ransomware,1066.0,Education,,Other,2021,"1,000-9,999",100-199,
10279,08/03/2020 12:00:00 AM,09/02/2020 12:00:00 AM,Cyberattack,2020-05-27T00:00:00,2020-08-03T00:00:00,Nutranext,Malware,580.0,Business,Consumable,Name,2021,500-999,1-99,
10279,08/03/2020 12:00:00 AM,09/02/2020 12:00:00 AM,Cyberattack,2020-05-27T00:00:00,2020-08-03T00:00:00,Nutranext,Malware,580.0,Business,Consumable,Financial & Banking Information,2021,500-999,1-99,
10279,08/03/2020 12:00:00 AM,09/02/2020 12:00:00 AM,Cyberattack,2020-05-27T00:00:00,2020-08-03T00:00:00,Nutranext,Malware,580.0,Business,Consumable,Other,2021,500-999,1-99,
10282,08/05/2020 12:00:00 AM,09/02/2020 12:00:00 AM,Cyberattack,2020-04-25T00:00:00,2020-08-05T00:00:00,Warner Music Group,Malware,3368.0,Business,Entertainment,Name,2021,"1,000-9,999",100-199,
10282,08/05/2020 12:00:00 AM,09/02/2020 12:00:00 AM,Cyberattack,2020-04-25T00:00:00,2020-08-05T00:00:00,Warner Music Group,Malware,3368.0,Business,Entertainment,Financial & Banking Information,2021,"1,000-9,999",100-199,
10282,08/05/2020 12:00:00 AM,09/02/2020 12:00:00 AM,Cyberattack,2020-04-25T00:00:00,2020-08-05T00:00:00,Warner Music Group,Malware,3368.0,Business,Entertainment,Other,2021,"1,000-9,999",100-199,
10283,07/11/2020 12:00:00 AM,09/03/2020 12:00:00 AM,Cyberattack,2020-06-19T00:00:00,2020-07-11T00:00:00,Live Auctioneers,Malware,38523.0,Business,Other,Name,2021,"10,000-49,999",1-99,
10283,07/11/2020 12:00:00 AM,09/03/2020 12:00:00 AM,Cyberattack,2020-06-19T00:00:00,2020-07-11T00:00:00,Live Auctioneers,Malware,38523.0,Business,Other,Email Address and Password/Security Question Answers,2021,"10,000-49,999",1-99,
10283,07/11/2020 12:00:00 AM,09/03/2020 12:00:00 AM,Cyberattack,2020-06-19T00:00:00,2020-07-11T00:00:00,Live Auctioneers,Malware,38523.0,Business,Other,Other,2021,"10,000-49,999",1-99,
10285,08/21/2020 12:00:00 AM,09/03/2020 12:00:00 AM,Unauthorized Access,2020-07-10T00:00:00,2020-07-10T00:00:00,"Osmose Utilities Services, Inc.",,577.0,Business,Construction,Name,2021,500-999,1-99,
10285,08/21/2020 12:00:00 AM,09/03/2020 12:00:00 AM,Unauthorized Access,2020-07-10T00:00:00,2020-07-10T00:00:00,"Osmose Utilities Services, Inc.",,577.0,Business,Construction,Social Security Number,2021,500-999,1-99,
10285,08/21/2020 12:00:00 AM,09/03/2020 12:00:00 AM,Unauthorized Access,2020-07-10T00:00:00,2020-07-10T00:00:00,"Osmose Utilities Services, Inc.",,577.0,Business,Construction,Financial & Banking Information,2021,500-999,1-99,
10285,08/21/2020 12:00:00 AM,09/03/2020 12:00:00 AM,Unauthorized Access,2020-07-10T00:00:00,2020-07-10T00:00:00,"Osmose Utilities Services, Inc.",,577.0,Business,Construction,Health Insurance Policy or ID Number,2021,500-999,1-99,
10287,01/15/2020 12:00:00 AM,09/04/2020 12:00:00 AM,Cyberattack,2020-01-05T00:00:00,2020-01-08T00:00:00,"Artech, L.L.C.",Ransomware,1664.0,Business,Human Resources,Name,2021,"1,000-9,999",1-99,
10287,01/15/2020 12:00:00 AM,09/04/2020 12:00:00 AM,Cyberattack,2020-01-05T00:00:00,2020-01-08T00:00:00,"Artech, L.L.C.",Ransomware,1664.0,Business,Human Resources,Social Security Number,2021,"1,000-9,999",1-99,
10287,01/15/2020 12:00:00 AM,09/04/2020 12:00:00 AM,Cyberattack,2020-01-05T00:00:00,2020-01-08T00:00:00,"Artech, L.L.C.",Ransomware,1664.0,Business,Human Resources,Driver's License or Washington ID Card Number,2021,"1,000-9,999",1-99,
10287,01/15/2020 12:00:00 AM,09/04/2020 12:00:00 AM,Cyberattack,2020-01-05T00:00:00,2020-01-08T00:00:00,"Artech, L.L.C.",Ransomware,1664.0,Business,Human Resources,Financial & Banking Information,2021,"1,000-9,999",1-99,
10287,01/15/2020 12:00:00 AM,09/04/2020 12:00:00 AM,Cyberattack,2020-01-05T00:00:00,2020-01-08T00:00:00,"Artech, L.L.C.",Ransomware,1664.0,Business,Human Resources,Full Date of Birth,2021,"1,000-9,999",1-99,
10287,01/15/2020 12:00:00 AM,09/04/2020 12:00:00 AM,Cyberattack,2020-01-05T00:00:00,2020-01-08T00:00:00,"Artech, L.L.C.",Ransomware,1664.0,Business,Human Resources,Unique Private Key (e.g. used to authenticate or sign an electronic record),2021,"1,000-9,999",1-99,
10287,01/15/2020 12:00:00 AM,09/04/2020 12:00:00 AM,Cyberattack,2020-01-05T00:00:00,2020-01-08T00:00:00,"Artech, L.L.C.",Ransomware,1664.0,Business,Human Resources,Passport Number,2021,"1,000-9,999",1-99,
10287,01/15/2020 12:00:00 AM,09/04/2020 12:00:00 AM,Cyberattack,2020-01-05T00:00:00,2020-01-08T00:00:00,"Artech, L.L.C.",Ransomware,1664.0,Business,Human Resources,Health Insurance Policy or ID Number,2021,"1,000-9,999",1-99,
10287,01/15/2020 12:00:00 AM,09/04/2020 12:00:00 AM,Cyberattack,2020-01-05T00:00:00,2020-01-08T00:00:00,"Artech, L.L.C.",Ransomware,1664.0,Business,Human Resources,Medical Information,2021,"1,000-9,999",1-99,
10289,08/05/2020 12:00:00 AM,09/04/2020 12:00:00 AM,Cyberattack,2020-02-07T00:00:00,2020-05-20T00:00:00,Drake University,Ransomware,1050.0,Education,,Name,2021,"1,000-9,999",100-199,
10289,08/05/2020 12:00:00 AM,09/04/2020 12:00:00 AM,Cyberattack,2020-02-07T00:00:00,2020-05-20T00:00:00,Drake University,Ransomware,1050.0,Education,,Full Date of Birth,2021,"1,000-9,999",100-199,
10292,08/05/2020 12:00:00 AM,09/04/2020 12:00:00 AM,Cyberattack,2020-02-07T00:00:00,2020-05-20T00:00:00,Southern Adventist University,Ransomware,1336.0,Education,,Name,2021,"1,000-9,999",100-199,
10292,08/05/2020 12:00:00 AM,09/04/2020 12:00:00 AM,Cyberattack,2020-02-07T00:00:00,2020-05-20T00:00:00,Southern Adventist University,Ransomware,1336.0,Education,,Full Date of Birth,2021,"1,000-9,999",100-199,
10292,08/05/2020 12:00:00 AM,09/04/2020 12:00:00 AM,Cyberattack,2020-02-07T00:00:00,2020-05-20T00:00:00,Southern Adventist University,Ransomware,1336.0,Education,,Student ID Number,2021,"1,000-9,999",100-199,
10292,08/05/2020 12:00:00 AM,09/04/2020 12:00:00 AM,Cyberattack,2020-02-07T00:00:00,2020-05-20T00:00:00,Southern Adventist University,Ransomware,1336.0,Education,,Other,2021,"1,000-9,999",100-199,
10294,08/11/2020 12:00:00 AM,09/08/2020 12:00:00 AM,Cyberattack,2020-02-07T00:00:00,2020-05-20T00:00:00,Florida International University Foundation,Ransomware,922.0,Education,,Name,2021,500-999,100-199,
10294,08/11/2020 12:00:00 AM,09/08/2020 12:00:00 AM,Cyberattack,2020-02-07T00:00:00,2020-05-20T00:00:00,Florida International University Foundation,Ransomware,922.0,Education,,Full Date of Birth,2021,500-999,100-199,
10296,11/17/2019 12:00:00 AM,09/11/2020 12:00:00 AM,Unauthorized Access,2019-11-07T00:00:00,2020-02-03T00:00:00,"CorePower Yoga, LLC",,618.0,Business,Fitness,Name,2021,500-999,1-99,
10296,11/17/2019 12:00:00 AM,09/11/2020 12:00:00 AM,Unauthorized Access,2019-11-07T00:00:00,2020-02-03T00:00:00,"CorePower Yoga, LLC",,618.0,Business,Fitness,Social Security Number,2021,500-999,1-99,
10296,11/17/2019 12:00:00 AM,09/11/2020 12:00:00 AM,Unauthorized Access,2019-11-07T00:00:00,2020-02-03T00:00:00,"CorePower Yoga, LLC",,618.0,Business,Fitness,Driver's License or Washington ID Card Number,2021,500-999,1-99,
10296,11/17/2019 12:00:00 AM,09/11/2020 12:00:00 AM,Unauthorized Access,2019-11-07T00:00:00,2020-02-03T00:00:00,"CorePower Yoga, LLC",,618.0,Business,Fitness,Financial & Banking Information,2021,500-999,1-99,
10296,11/17/2019 12:00:00 AM,09/11/2020 12:00:00 AM,Unauthorized Access,2019-11-07T00:00:00,2020-02-03T00:00:00,"CorePower Yoga, LLC",,618.0,Business,Fitness,Full Date of Birth,2021,500-999,1-99,
10296,11/17/2019 12:00:00 AM,09/11/2020 12:00:00 AM,Unauthorized Access,2019-11-07T00:00:00,2020-02-03T00:00:00,"CorePower Yoga, LLC",,618.0,Business,Fitness,Passport Number,2021,500-999,1-99,
10296,11/17/2019 12:00:00 AM,09/11/2020 12:00:00 AM,Unauthorized Access,2019-11-07T00:00:00,2020-02-03T00:00:00,"CorePower Yoga, LLC",,618.0,Business,Fitness,Health Insurance Policy or ID Number,2021,500-999,1-99,
10296,11/17/2019 12:00:00 AM,09/11/2020 12:00:00 AM,Unauthorized Access,2019-11-07T00:00:00,2020-02-03T00:00:00,"CorePower Yoga, LLC",,618.0,Business,Fitness,Medical Information,2021,500-999,1-99,
10298,08/14/2020 12:00:00 AM,09/08/2020 12:00:00 AM,Cyberattack,2020-02-07T00:00:00,2020-05-20T00:00:00,Saybrook University,Ransomware,935.0,Education,,Name,2021,500-999,100-199,
10298,08/14/2020 12:00:00 AM,09/08/2020 12:00:00 AM,Cyberattack,2020-02-07T00:00:00,2020-05-20T00:00:00,Saybrook University,Ransomware,935.0,Education,,Full Date of Birth,2021,500-999,100-199,
10298,08/14/2020 12:00:00 AM,09/08/2020 12:00:00 AM,Cyberattack,2020-02-07T00:00:00,2020-05-20T00:00:00,Saybrook University,Ransomware,935.0,Education,,Other,2021,500-999,100-199,
10299,08/11/2020 12:00:00 AM,09/08/2020 12:00:00 AM,Cyberattack,2020-02-07T00:00:00,2020-05-20T00:00:00,The University of Notre Dame,Ransomware,3209.0,Education,,Name,2021,"1,000-9,999",100-199,
10299,08/11/2020 12:00:00 AM,09/08/2020 12:00:00 AM,Cyberattack,2020-02-07T00:00:00,2020-05-20T00:00:00,The University of Notre Dame,Ransomware,3209.0,Education,,Full Date of Birth,2021,"1,000-9,999",100-199,
10299,08/11/2020 12:00:00 AM,09/08/2020 12:00:00 AM,Cyberattack,2020-02-07T00:00:00,2020-05-20T00:00:00,The University of Notre Dame,Ransomware,3209.0,Education,,Other,2021,"1,000-9,999",100-199,
10300,07/16/2020 12:00:00 AM,09/08/2020 12:00:00 AM,Cyberattack,2020-02-07T00:00:00,2020-05-20T00:00:00,Virginia Mason Medical Center,Ransomware,227371.0,Health,,Name,2021,"50,000-999,999",100-199,
10300,07/16/2020 12:00:00 AM,09/08/2020 12:00:00 AM,Cyberattack,2020-02-07T00:00:00,2020-05-20T00:00:00,Virginia Mason Medical Center,Ransomware,227371.0,Health,,Full Date of Birth,2021,"50,000-999,999",100-199,
10300,07/16/2020 12:00:00 AM,09/08/2020 12:00:00 AM,Cyberattack,2020-02-07T00:00:00,2020-05-20T00:00:00,Virginia Mason Medical Center,Ransomware,227371.0,Health,,Other,2021,"50,000-999,999",100-199,
10301,07/16/2020 12:00:00 AM,09/08/2020 12:00:00 AM,Cyberattack,2020-02-07T00:00:00,2020-05-20T00:00:00,Pacific University Oregon,Ransomware,9196.0,Education,,Name,2021,"1,000-9,999",100-199,
10301,07/16/2020 12:00:00 AM,09/08/2020 12:00:00 AM,Cyberattack,2020-02-07T00:00:00,2020-05-20T00:00:00,Pacific University Oregon,Ransomware,9196.0,Education,,Full Date of Birth,2021,"1,000-9,999",100-199,
10301,07/16/2020 12:00:00 AM,09/08/2020 12:00:00 AM,Cyberattack,2020-02-07T00:00:00,2020-05-20T00:00:00,Pacific University Oregon,Ransomware,9196.0,Education,,Other,2021,"1,000-9,999",100-199,
10302,08/10/2020 12:00:00 AM,09/09/2020 12:00:00 AM,Cyberattack,2020-02-07T00:00:00,2020-05-20T00:00:00,Inova Health System,Ransomware,2470.0,Health,,Name,2021,"1,000-9,999",100-199,
10302,08/10/2020 12:00:00 AM,09/09/2020 12:00:00 AM,Cyberattack,2020-02-07T00:00:00,2020-05-20T00:00:00,Inova Health System,Ransomware,2470.0,Health,,Full Date of Birth,2021,"1,000-9,999",100-199,
10302,08/10/2020 12:00:00 AM,09/09/2020 12:00:00 AM,Cyberattack,2020-02-07T00:00:00,2020-05-20T00:00:00,Inova Health System,Ransomware,2470.0,Health,,Medical Information,2021,"1,000-9,999",100-199,
10302,08/10/2020 12:00:00 AM,09/09/2020 12:00:00 AM,Cyberattack,2020-02-07T00:00:00,2020-05-20T00:00:00,Inova Health System,Ransomware,2470.0,Health,,Other,2021,"1,000-9,999",100-199,
10308,08/14/2020 12:00:00 AM,09/17/2020 12:00:00 AM,Cyberattack,2019-07-14T00:00:00,2020-06-30T00:00:00,Greenworks Tools,Malware,679.0,Business,Retail,Name,2021,500-999,300-399,
10308,08/14/2020 12:00:00 AM,09/17/2020 12:00:00 AM,Cyberattack,2019-07-14T00:00:00,2020-06-30T00:00:00,Greenworks Tools,Malware,679.0,Business,Retail,Financial & Banking Information,2021,500-999,300-399,
10308,08/14/2020 12:00:00 AM,09/17/2020 12:00:00 AM,Cyberattack,2019-07-14T00:00:00,2020-06-30T00:00:00,Greenworks Tools,Malware,679.0,Business,Retail,Other,2021,500-999,300-399,
10311,09/09/2020 12:00:00 AM,09/17/2020 12:00:00 AM,Cyberattack,2020-02-07T00:00:00,2020-05-20T00:00:00,Western Washington University Foundation,Ransomware,165000.0,Education,,Name,2021,"50,000-999,999",200-299,
10311,09/09/2020 12:00:00 AM,09/17/2020 12:00:00 AM,Cyberattack,2020-02-07T00:00:00,2020-05-20T00:00:00,Western Washington University Foundation,Ransomware,165000.0,Education,,Full Date of Birth,2021,"50,000-999,999",200-299,
10311,09/09/2020 12:00:00 AM,09/17/2020 12:00:00 AM,Cyberattack,2020-02-07T00:00:00,2020-05-20T00:00:00,Western Washington University Foundation,Ransomware,165000.0,Education,,Student ID Number,2021,"50,000-999,999",200-299,
10311,09/09/2020 12:00:00 AM,09/17/2020 12:00:00 AM,Cyberattack,2020-02-07T00:00:00,2020-05-20T00:00:00,Western Washington University Foundation,Ransomware,165000.0,Education,,Other,2021,"50,000-999,999",200-299,
10313,08/21/2020 12:00:00 AM,09/18/2020 12:00:00 AM,Cyberattack,2020-04-26T00:00:00,2020-08-03T00:00:00,"FabFitFun, Inc.",Malware,11094.0,Business,Retail,Name,2021,"10,000-49,999",100-199,
10313,08/21/2020 12:00:00 AM,09/18/2020 12:00:00 AM,Cyberattack,2020-04-26T00:00:00,2020-08-03T00:00:00,"FabFitFun, Inc.",Malware,11094.0,Business,Retail,Financial & Banking Information,2021,"10,000-49,999",100-199,
10313,08/21/2020 12:00:00 AM,09/18/2020 12:00:00 AM,Cyberattack,2020-04-26T00:00:00,2020-08-03T00:00:00,"FabFitFun, Inc.",Malware,11094.0,Business,Retail,Email Address and Password/Security Question Answers,2021,"10,000-49,999",100-199,
10313,08/21/2020 12:00:00 AM,09/18/2020 12:00:00 AM,Cyberattack,2020-04-26T00:00:00,2020-08-03T00:00:00,"FabFitFun, Inc.",Malware,11094.0,Business,Retail,Other,2021,"10,000-49,999",100-199,
10314,12/21/2020 12:00:00 AM,02/10/2021 12:00:00 AM,Cyberattack,,,"City of Ellensburg, Washington",Ransomware,8523.0,Government,,Name,2021,"1,000-9,999",Unknown,
10314,12/21/2020 12:00:00 AM,02/10/2021 12:00:00 AM,Cyberattack,,,"City of Ellensburg, Washington",Ransomware,8523.0,Government,,Social Security Number,2021,"1,000-9,999",Unknown,
10314,12/21/2020 12:00:00 AM,02/10/2021 12:00:00 AM,Cyberattack,,,"City of Ellensburg, Washington",Ransomware,8523.0,Government,,Driver's License or Washington ID Card Number,2021,"1,000-9,999",Unknown,
10314,12/21/2020 12:00:00 AM,02/10/2021 12:00:00 AM,Cyberattack,,,"City of Ellensburg, Washington",Ransomware,8523.0,Government,,Financial & Banking Information,2021,"1,000-9,999",Unknown,
10314,12/21/2020 12:00:00 AM,02/10/2021 12:00:00 AM,Cyberattack,,,"City of Ellensburg, Washington",Ransomware,8523.0,Government,,Full Date of Birth,2021,"1,000-9,999",Unknown,
10314,12/21/2020 12:00:00 AM,02/10/2021 12:00:00 AM,Cyberattack,,,"City of Ellensburg, Washington",Ransomware,8523.0,Government,,Passport Number,2021,"1,000-9,999",Unknown,
10314,12/21/2020 12:00:00 AM,02/10/2021 12:00:00 AM,Cyberattack,,,"City of Ellensburg, Washington",Ransomware,8523.0,Government,,Health Insurance Policy or ID Number,2021,"1,000-9,999",Unknown,
10314,12/21/2020 12:00:00 AM,02/10/2021 12:00:00 AM,Cyberattack,,,"City of Ellensburg, Washington",Ransomware,8523.0,Government,,Medical Information,2021,"1,000-9,999",Unknown,
10314,12/21/2020 12:00:00 AM,02/10/2021 12:00:00 AM,Cyberattack,,,"City of Ellensburg, Washington",Ransomware,8523.0,Government,,Other,2021,"1,000-9,999",Unknown,
10316,08/20/2020 12:00:00 AM,09/18/2020 12:00:00 AM,Cyberattack,2020-02-07T00:00:00,2020-05-20T00:00:00,Joslin Diabetes Center,Ransomware,1212.0,Health,,Name,2021,"1,000-9,999",100-199,
10316,08/20/2020 12:00:00 AM,09/18/2020 12:00:00 AM,Cyberattack,2020-02-07T00:00:00,2020-05-20T00:00:00,Joslin Diabetes Center,Ransomware,1212.0,Health,,Full Date of Birth,2021,"1,000-9,999",100-199,
10316,08/20/2020 12:00:00 AM,09/18/2020 12:00:00 AM,Cyberattack,2020-02-07T00:00:00,2020-05-20T00:00:00,Joslin Diabetes Center,Ransomware,1212.0,Health,,Medical Information,2021,"1,000-9,999",100-199,
10319,07/30/2020 12:00:00 AM,09/18/2020 12:00:00 AM,Theft or Mistake,2020-07-30T00:00:00,,U.S. Bank,,1292.0,Finance,,Name,2021,"1,000-9,999",Unknown,
10319,07/30/2020 12:00:00 AM,09/18/2020 12:00:00 AM,Theft or Mistake,2020-07-30T00:00:00,,U.S. Bank,,1292.0,Finance,,Social Security Number,2021,"1,000-9,999",Unknown,
10319,07/30/2020 12:00:00 AM,09/18/2020 12:00:00 AM,Theft or Mistake,2020-07-30T00:00:00,,U.S. Bank,,1292.0,Finance,,Driver's License or Washington ID Card Number,2021,"1,000-9,999",Unknown,
10319,07/30/2020 12:00:00 AM,09/18/2020 12:00:00 AM,Theft or Mistake,2020-07-30T00:00:00,,U.S. Bank,,1292.0,Finance,,Financial & Banking Information,2021,"1,000-9,999",Unknown,
10319,07/30/2020 12:00:00 AM,09/18/2020 12:00:00 AM,Theft or Mistake,2020-07-30T00:00:00,,U.S. Bank,,1292.0,Finance,,Other,2021,"1,000-9,999",Unknown,
10320,07/17/2020 12:00:00 AM,09/23/2020 12:00:00 AM,Cyberattack,2020-02-07T00:00:00,2020-05-20T00:00:00,Point Loma Nazarene University,Ransomware,1967.0,Education,,Name,2021,"1,000-9,999",100-199,
10320,07/17/2020 12:00:00 AM,09/23/2020 12:00:00 AM,Cyberattack,2020-02-07T00:00:00,2020-05-20T00:00:00,Point Loma Nazarene University,Ransomware,1967.0,Education,,Full Date of Birth,2021,"1,000-9,999",100-199,
10320,07/17/2020 12:00:00 AM,09/23/2020 12:00:00 AM,Cyberattack,2020-02-07T00:00:00,2020-05-20T00:00:00,Point Loma Nazarene University,Ransomware,1967.0,Education,,Student ID Number,2021,"1,000-9,999",100-199,
10321,09/17/2020 12:00:00 AM,09/25/2020 12:00:00 AM,Cyberattack,2020-07-14T00:00:00,2020-07-19T00:00:00,Bayley Construction,Ransomware,938.0,Business,Construction,Name,2021,500-999,1-99,
10321,09/17/2020 12:00:00 AM,09/25/2020 12:00:00 AM,Cyberattack,2020-07-14T00:00:00,2020-07-19T00:00:00,Bayley Construction,Ransomware,938.0,Business,Construction,Social Security Number,2021,500-999,1-99,
10321,09/17/2020 12:00:00 AM,09/25/2020 12:00:00 AM,Cyberattack,2020-07-14T00:00:00,2020-07-19T00:00:00,Bayley Construction,Ransomware,938.0,Business,Construction,Driver's License or Washington ID Card Number,2021,500-999,1-99,
10321,09/17/2020 12:00:00 AM,09/25/2020 12:00:00 AM,Cyberattack,2020-07-14T00:00:00,2020-07-19T00:00:00,Bayley Construction,Ransomware,938.0,Business,Construction,Financial & Banking Information,2021,500-999,1-99,
10321,09/17/2020 12:00:00 AM,09/25/2020 12:00:00 AM,Cyberattack,2020-07-14T00:00:00,2020-07-19T00:00:00,Bayley Construction,Ransomware,938.0,Business,Construction,Full Date of Birth,2021,500-999,1-99,
10321,09/17/2020 12:00:00 AM,09/25/2020 12:00:00 AM,Cyberattack,2020-07-14T00:00:00,2020-07-19T00:00:00,Bayley Construction,Ransomware,938.0,Business,Construction,Health Insurance Policy or ID Number,2021,500-999,1-99,
10326,08/20/2020 12:00:00 AM,09/29/2020 12:00:00 AM,Cyberattack,2020-03-30T00:00:00,2020-05-14T00:00:00,"CBD Industries, LLC",Malware,1088.0,Business,Consumable,Name,2021,"1,000-9,999",100-199,
10326,08/20/2020 12:00:00 AM,09/29/2020 12:00:00 AM,Cyberattack,2020-03-30T00:00:00,2020-05-14T00:00:00,"CBD Industries, LLC",Malware,1088.0,Business,Consumable,Financial & Banking Information,2021,"1,000-9,999",100-199,
10326,08/20/2020 12:00:00 AM,09/29/2020 12:00:00 AM,Cyberattack,2020-03-30T00:00:00,2020-05-14T00:00:00,"CBD Industries, LLC",Malware,1088.0,Business,Consumable,Other,2021,"1,000-9,999",100-199,
10327,07/10/2020 12:00:00 AM,09/29/2020 12:00:00 AM,Unauthorized Access,,,"Spire Hospitality, LLC",,516.0,Business,Hospitality,Name,2021,500-999,Unknown,
10327,07/10/2020 12:00:00 AM,09/29/2020 12:00:00 AM,Unauthorized Access,,,"Spire Hospitality, LLC",,516.0,Business,Hospitality,Social Security Number,2021,500-999,Unknown,
10327,07/10/2020 12:00:00 AM,09/29/2020 12:00:00 AM,Unauthorized Access,,,"Spire Hospitality, LLC",,516.0,Business,Hospitality,Full Date of Birth,2021,500-999,Unknown,
10327,07/10/2020 12:00:00 AM,09/29/2020 12:00:00 AM,Unauthorized Access,,,"Spire Hospitality, LLC",,516.0,Business,Hospitality,Unique Private Key (e.g. used to authenticate or sign an electronic record),2021,500-999,Unknown,
10327,07/10/2020 12:00:00 AM,09/29/2020 12:00:00 AM,Unauthorized Access,,,"Spire Hospitality, LLC",,516.0,Business,Hospitality,Other,2021,500-999,Unknown,
10328,08/31/2020 12:00:00 AM,09/30/2020 12:00:00 AM,Cyberattack,2020-02-01T00:00:00,2020-08-31T00:00:00,Made in Oregon,Unclear/unknown,537.0,Business,Retail,Name,2021,500-999,200-299,
10328,08/31/2020 12:00:00 AM,09/30/2020 12:00:00 AM,Cyberattack,2020-02-01T00:00:00,2020-08-31T00:00:00,Made in Oregon,Unclear/unknown,537.0,Business,Retail,Financial & Banking Information,2021,500-999,200-299,
10328,08/31/2020 12:00:00 AM,09/30/2020 12:00:00 AM,Cyberattack,2020-02-01T00:00:00,2020-08-31T00:00:00,Made in Oregon,Unclear/unknown,537.0,Business,Retail,Other,2021,500-999,200-299,
10329,05/01/2020 12:00:00 AM,09/30/2020 12:00:00 AM,Cyberattack,,,"Northwest Eye Surgeons, P.C. and Sight Partners LLC",Ransomware,6809.0,Health,,Name,2021,"1,000-9,999",Unknown,
10329,05/01/2020 12:00:00 AM,09/30/2020 12:00:00 AM,Cyberattack,,,"Northwest Eye Surgeons, P.C. and Sight Partners LLC",Ransomware,6809.0,Health,,Social Security Number,2021,"1,000-9,999",Unknown,
10329,05/01/2020 12:00:00 AM,09/30/2020 12:00:00 AM,Cyberattack,,,"Northwest Eye Surgeons, P.C. and Sight Partners LLC",Ransomware,6809.0,Health,,Driver's License or Washington ID Card Number,2021,"1,000-9,999",Unknown,
10329,05/01/2020 12:00:00 AM,09/30/2020 12:00:00 AM,Cyberattack,,,"Northwest Eye Surgeons, P.C. and Sight Partners LLC",Ransomware,6809.0,Health,,Full Date of Birth,2021,"1,000-9,999",Unknown,
10329,05/01/2020 12:00:00 AM,09/30/2020 12:00:00 AM,Cyberattack,,,"Northwest Eye Surgeons, P.C. and Sight Partners LLC",Ransomware,6809.0,Health,,Medical Information,2021,"1,000-9,999",Unknown,
10331,,10/01/2020 12:00:00 AM,Cyberattack,2020-02-07T00:00:00,2020-05-20T00:00:00,Gallaudet University,Ransomware,1195.0,Education,,Name,2021,"1,000-9,999",Unknown,
10331,,10/01/2020 12:00:00 AM,Cyberattack,2020-02-07T00:00:00,2020-05-20T00:00:00,Gallaudet University,Ransomware,1195.0,Education,,Full Date of Birth,2021,"1,000-9,999",Unknown,
10331,,10/01/2020 12:00:00 AM,Cyberattack,2020-02-07T00:00:00,2020-05-20T00:00:00,Gallaudet University,Ransomware,1195.0,Education,,Other,2021,"1,000-9,999",Unknown,
10333,09/18/2020 12:00:00 AM,10/06/2020 12:00:00 AM,Unauthorized Access,,,Gymshark Limited,,59769.0,Business,Clothing,Name,2021,"50,000-999,999",Unknown,
10333,09/18/2020 12:00:00 AM,10/06/2020 12:00:00 AM,Unauthorized Access,,,Gymshark Limited,,59769.0,Business,Clothing,Full Date of Birth,2021,"50,000-999,999",Unknown,
10333,09/18/2020 12:00:00 AM,10/06/2020 12:00:00 AM,Unauthorized Access,,,Gymshark Limited,,59769.0,Business,Clothing,Other,2021,"50,000-999,999",Unknown,
10334,09/24/2020 12:00:00 AM,10/12/2020 12:00:00 AM,Cyberattack,2020-09-14T00:00:00,2020-09-24T00:00:00,Evergreen Public Schools,Unclear/unknown,3585.0,Education,,Name,2021,"1,000-9,999",1-99,
10334,09/24/2020 12:00:00 AM,10/12/2020 12:00:00 AM,Cyberattack,2020-09-14T00:00:00,2020-09-24T00:00:00,Evergreen Public Schools,Unclear/unknown,3585.0,Education,,Social Security Number,2021,"1,000-9,999",1-99,
10338,07/01/2020 12:00:00 AM,10/12/2020 12:00:00 AM,Cyberattack,2020-06-24T00:00:00,2020-07-01T00:00:00,EyeMed Vision Care LLC,Phishing,19625.0,Health,,Name,2021,"10,000-49,999",1-99,
10338,07/01/2020 12:00:00 AM,10/12/2020 12:00:00 AM,Cyberattack,2020-06-24T00:00:00,2020-07-01T00:00:00,EyeMed Vision Care LLC,Phishing,19625.0,Health,,Social Security Number,2021,"10,000-49,999",1-99,
10338,07/01/2020 12:00:00 AM,10/12/2020 12:00:00 AM,Cyberattack,2020-06-24T00:00:00,2020-07-01T00:00:00,EyeMed Vision Care LLC,Phishing,19625.0,Health,,Driver's License or Washington ID Card Number,2021,"10,000-49,999",1-99,
10338,07/01/2020 12:00:00 AM,10/12/2020 12:00:00 AM,Cyberattack,2020-06-24T00:00:00,2020-07-01T00:00:00,EyeMed Vision Care LLC,Phishing,19625.0,Health,,Financial & Banking Information,2021,"10,000-49,999",1-99,
10338,07/01/2020 12:00:00 AM,10/12/2020 12:00:00 AM,Cyberattack,2020-06-24T00:00:00,2020-07-01T00:00:00,EyeMed Vision Care LLC,Phishing,19625.0,Health,,Full Date of Birth,2021,"10,000-49,999",1-99,
10338,07/01/2020 12:00:00 AM,10/12/2020 12:00:00 AM,Cyberattack,2020-06-24T00:00:00,2020-07-01T00:00:00,EyeMed Vision Care LLC,Phishing,19625.0,Health,,Passport Number,2021,"10,000-49,999",1-99,
10338,07/01/2020 12:00:00 AM,10/12/2020 12:00:00 AM,Cyberattack,2020-06-24T00:00:00,2020-07-01T00:00:00,EyeMed Vision Care LLC,Phishing,19625.0,Health,,Health Insurance Policy or ID Number,2021,"10,000-49,999",1-99,
10338,07/01/2020 12:00:00 AM,10/12/2020 12:00:00 AM,Cyberattack,2020-06-24T00:00:00,2020-07-01T00:00:00,EyeMed Vision Care LLC,Phishing,19625.0,Health,,Medical Information,2021,"10,000-49,999",1-99,
10338,07/01/2020 12:00:00 AM,10/12/2020 12:00:00 AM,Cyberattack,2020-06-24T00:00:00,2020-07-01T00:00:00,EyeMed Vision Care LLC,Phishing,19625.0,Health,,Other,2021,"10,000-49,999",1-99,
10339,07/16/2020 12:00:00 AM,10/13/2020 12:00:00 AM,Cyberattack,2020-02-07T00:00:00,2020-05-20T00:00:00,Forest Ridge School of the Sacred Heart,Ransomware,555.0,Education,,Name,2021,500-999,100-199,
10339,07/16/2020 12:00:00 AM,10/13/2020 12:00:00 AM,Cyberattack,2020-02-07T00:00:00,2020-05-20T00:00:00,Forest Ridge School of the Sacred Heart,Ransomware,555.0,Education,,Social Security Number,2021,500-999,100-199,
10339,07/16/2020 12:00:00 AM,10/13/2020 12:00:00 AM,Cyberattack,2020-02-07T00:00:00,2020-05-20T00:00:00,Forest Ridge School of the Sacred Heart,Ransomware,555.0,Education,,Full Date of Birth,2021,500-999,100-199,
10339,07/16/2020 12:00:00 AM,10/13/2020 12:00:00 AM,Cyberattack,2020-02-07T00:00:00,2020-05-20T00:00:00,Forest Ridge School of the Sacred Heart,Ransomware,555.0,Education,,Other,2021,500-999,100-199,
10340,09/14/2020 12:00:00 AM,10/15/2020 12:00:00 AM,Cyberattack,2020-02-07T00:00:00,2020-05-20T00:00:00,"University of Nevada, Reno",Ransomware,3361.0,Education,,Name,2021,"1,000-9,999",200-299,
10340,09/14/2020 12:00:00 AM,10/15/2020 12:00:00 AM,Cyberattack,2020-02-07T00:00:00,2020-05-20T00:00:00,"University of Nevada, Reno",Ransomware,3361.0,Education,,Full Date of Birth,2021,"1,000-9,999",200-299,
10341,08/31/2020 12:00:00 AM,10/16/2020 12:00:00 AM,Theft or Mistake,2020-08-29T00:00:00,2020-08-30T00:00:00,The Health & Wellness Clinic,,889.0,Health,,Name,2021,500-999,1-99,
10341,08/31/2020 12:00:00 AM,10/16/2020 12:00:00 AM,Theft or Mistake,2020-08-29T00:00:00,2020-08-30T00:00:00,The Health & Wellness Clinic,,889.0,Health,,Social Security Number,2021,500-999,1-99,
10341,08/31/2020 12:00:00 AM,10/16/2020 12:00:00 AM,Theft or Mistake,2020-08-29T00:00:00,2020-08-30T00:00:00,The Health & Wellness Clinic,,889.0,Health,,Driver's License or Washington ID Card Number,2021,500-999,1-99,
10341,08/31/2020 12:00:00 AM,10/16/2020 12:00:00 AM,Theft or Mistake,2020-08-29T00:00:00,2020-08-30T00:00:00,The Health & Wellness Clinic,,889.0,Health,,Full Date of Birth,2021,500-999,1-99,
10341,08/31/2020 12:00:00 AM,10/16/2020 12:00:00 AM,Theft or Mistake,2020-08-29T00:00:00,2020-08-30T00:00:00,The Health & Wellness Clinic,,889.0,Health,,Medical Information,2021,500-999,1-99,
10341,08/31/2020 12:00:00 AM,10/16/2020 12:00:00 AM,Theft or Mistake,2020-08-29T00:00:00,2020-08-30T00:00:00,The Health & Wellness Clinic,,889.0,Health,,Other,2021,500-999,1-99,
10342,09/18/2020 12:00:00 AM,10/16/2020 12:00:00 AM,Theft or Mistake,2020-09-18T00:00:00,2020-09-18T00:00:00,"Wyndham Capital Mortgage, Inc.",,569.0,Finance,,Name,2021,500-999,0,
10342,09/18/2020 12:00:00 AM,10/16/2020 12:00:00 AM,Theft or Mistake,2020-09-18T00:00:00,2020-09-18T00:00:00,"Wyndham Capital Mortgage, Inc.",,569.0,Finance,,Social Security Number,2021,500-999,0,
10342,09/18/2020 12:00:00 AM,10/16/2020 12:00:00 AM,Theft or Mistake,2020-09-18T00:00:00,2020-09-18T00:00:00,"Wyndham Capital Mortgage, Inc.",,569.0,Finance,,Other,2021,500-999,0,
10343,07/16/2020 12:00:00 AM,10/21/2020 12:00:00 AM,Cyberattack,2020-02-07T00:00:00,2020-05-20T00:00:00,Carroll College,Ransomware,2166.0,Education,,Name,2021,"1,000-9,999",100-199,
10343,07/16/2020 12:00:00 AM,10/21/2020 12:00:00 AM,Cyberattack,2020-02-07T00:00:00,2020-05-20T00:00:00,Carroll College,Ransomware,2166.0,Education,,Full Date of Birth,2021,"1,000-9,999",100-199,
10343,07/16/2020 12:00:00 AM,10/21/2020 12:00:00 AM,Cyberattack,2020-02-07T00:00:00,2020-05-20T00:00:00,Carroll College,Ransomware,2166.0,Education,,Other,2021,"1,000-9,999",100-199,
10344,09/24/2020 12:00:00 AM,10/21/2020 12:00:00 AM,Cyberattack,,2020-09-24T00:00:00,Sam's Club,Other,771.0,Business,Retail,Name,2021,500-999,Unknown,
10344,09/24/2020 12:00:00 AM,10/21/2020 12:00:00 AM,Cyberattack,,2020-09-24T00:00:00,Sam's Club,Other,771.0,Business,Retail,Email Address and Password/Security Question Answers,2021,500-999,Unknown,
10344,09/24/2020 12:00:00 AM,10/21/2020 12:00:00 AM,Cyberattack,,2020-09-24T00:00:00,Sam's Club,Other,771.0,Business,Retail,Other,2021,500-999,Unknown,
10346,09/27/2020 12:00:00 AM,10/25/2020 12:00:00 AM,Theft or Mistake,2020-09-27T00:00:00,,"Hi-Line Ranch, Harris Farms, Cherry River Farms",,852.0,Business,Other,Name,2021,500-999,Unknown,
10346,09/27/2020 12:00:00 AM,10/25/2020 12:00:00 AM,Theft or Mistake,2020-09-27T00:00:00,,"Hi-Line Ranch, Harris Farms, Cherry River Farms",,852.0,Business,Other,Social Security Number,2021,500-999,Unknown,
10347,05/31/2020 12:00:00 AM,10/27/2020 12:00:00 AM,Cyberattack,,,"Ascend Clinical, LLC",Phishing,1959.0,Health,,Name,2021,"1,000-9,999",Unknown,
10347,05/31/2020 12:00:00 AM,10/27/2020 12:00:00 AM,Cyberattack,,,"Ascend Clinical, LLC",Phishing,1959.0,Health,,Social Security Number,2021,"1,000-9,999",Unknown,
10347,05/31/2020 12:00:00 AM,10/27/2020 12:00:00 AM,Cyberattack,,,"Ascend Clinical, LLC",Phishing,1959.0,Health,,Medical Information,2021,"1,000-9,999",Unknown,
10347,05/31/2020 12:00:00 AM,10/27/2020 12:00:00 AM,Cyberattack,,,"Ascend Clinical, LLC",Phishing,1959.0,Health,,Other,2021,"1,000-9,999",Unknown,
10348,08/28/2020 12:00:00 AM,10/27/2020 12:00:00 AM,Cyberattack,2020-08-09T00:00:00,2020-08-09T00:00:00,Luxottica of America Inc.,Unclear/unknown,12166.0,Business,Accessories,Name,2021,"10,000-49,999",1-99,
10348,08/28/2020 12:00:00 AM,10/27/2020 12:00:00 AM,Cyberattack,2020-08-09T00:00:00,2020-08-09T00:00:00,Luxottica of America Inc.,Unclear/unknown,12166.0,Business,Accessories,Social Security Number,2021,"10,000-49,999",1-99,
10348,08/28/2020 12:00:00 AM,10/27/2020 12:00:00 AM,Cyberattack,2020-08-09T00:00:00,2020-08-09T00:00:00,Luxottica of America Inc.,Unclear/unknown,12166.0,Business,Accessories,Full Date of Birth,2021,"10,000-49,999",1-99,
10348,08/28/2020 12:00:00 AM,10/27/2020 12:00:00 AM,Cyberattack,2020-08-09T00:00:00,2020-08-09T00:00:00,Luxottica of America Inc.,Unclear/unknown,12166.0,Business,Accessories,Health Insurance Policy or ID Number,2021,"10,000-49,999",1-99,
10348,08/28/2020 12:00:00 AM,10/27/2020 12:00:00 AM,Cyberattack,2020-08-09T00:00:00,2020-08-09T00:00:00,Luxottica of America Inc.,Unclear/unknown,12166.0,Business,Accessories,Medical Information,2021,"10,000-49,999",1-99,
10349,07/28/2020 12:00:00 AM,10/27/2020 12:00:00 AM,Unauthorized Access,2020-02-21T00:00:00,2020-07-28T00:00:00,"TrueFire, LLC",,2633.0,Business,Manufacturing,Name,2021,"1,000-9,999",100-199,
10349,07/28/2020 12:00:00 AM,10/27/2020 12:00:00 AM,Unauthorized Access,2020-02-21T00:00:00,2020-07-28T00:00:00,"TrueFire, LLC",,2633.0,Business,Manufacturing,Full Date of Birth,2021,"1,000-9,999",100-199,
10349,07/28/2020 12:00:00 AM,10/27/2020 12:00:00 AM,Unauthorized Access,2020-02-21T00:00:00,2020-07-28T00:00:00,"TrueFire, LLC",,2633.0,Business,Manufacturing,Username and Password/Security Question Answers,2021,"1,000-9,999",100-199,
10349,07/28/2020 12:00:00 AM,10/27/2020 12:00:00 AM,Unauthorized Access,2020-02-21T00:00:00,2020-07-28T00:00:00,"TrueFire, LLC",,2633.0,Business,Manufacturing,Other,2021,"1,000-9,999",100-199,
10350,07/06/2020 12:00:00 AM,10/28/2020 12:00:00 AM,Cyberattack,2020-01-01T00:00:00,2020-07-17T00:00:00,"JM Bullion, Inc.",Malware,882.0,Business,Retail,Name,2021,500-999,100-199,
10350,07/06/2020 12:00:00 AM,10/28/2020 12:00:00 AM,Cyberattack,2020-01-01T00:00:00,2020-07-17T00:00:00,"JM Bullion, Inc.",Malware,882.0,Business,Retail,Financial & Banking Information,2021,500-999,100-199,
10350,07/06/2020 12:00:00 AM,10/28/2020 12:00:00 AM,Cyberattack,2020-01-01T00:00:00,2020-07-17T00:00:00,"JM Bullion, Inc.",Malware,882.0,Business,Retail,Other,2021,500-999,100-199,
10353,08/30/2020 12:00:00 AM,10/29/2020 12:00:00 AM,Cyberattack,,,MK Periodontics and Implants,Ransomware,8000.0,Health,,Name,2021,"1,000-9,999",Unknown,
10353,08/30/2020 12:00:00 AM,10/29/2020 12:00:00 AM,Cyberattack,,,MK Periodontics and Implants,Ransomware,8000.0,Health,,Social Security Number,2021,"1,000-9,999",Unknown,
10353,08/30/2020 12:00:00 AM,10/29/2020 12:00:00 AM,Cyberattack,,,MK Periodontics and Implants,Ransomware,8000.0,Health,,Financial & Banking Information,2021,"1,000-9,999",Unknown,
10353,08/30/2020 12:00:00 AM,10/29/2020 12:00:00 AM,Cyberattack,,,MK Periodontics and Implants,Ransomware,8000.0,Health,,Full Date of Birth,2021,"1,000-9,999",Unknown,
10353,08/30/2020 12:00:00 AM,10/29/2020 12:00:00 AM,Cyberattack,,,MK Periodontics and Implants,Ransomware,8000.0,Health,,Medical Information,2021,"1,000-9,999",Unknown,
10353,08/30/2020 12:00:00 AM,10/29/2020 12:00:00 AM,Cyberattack,,,MK Periodontics and Implants,Ransomware,8000.0,Health,,Other,2021,"1,000-9,999",Unknown,
10354,07/24/2020 12:00:00 AM,11/04/2020 12:00:00 AM,Unauthorized Access,,,Amtrak,,1208.0,Business,Transportation,Username and Password/Security Question Answers,2021,"1,000-9,999",Unknown,
10354,07/24/2020 12:00:00 AM,11/04/2020 12:00:00 AM,Unauthorized Access,,,Amtrak,,1208.0,Business,Transportation,Other,2021,"1,000-9,999",Unknown,
10356,11/29/2020 12:00:00 AM,01/29/2021 12:00:00 AM,Cyberattack,2019-05-06T00:00:00,2019-05-15T00:00:00,Grays Harbor Community Hospital,Ransomware,4984.0,Health,,Name,2021,"1,000-9,999",500+,
10356,11/29/2020 12:00:00 AM,01/29/2021 12:00:00 AM,Cyberattack,2019-05-06T00:00:00,2019-05-15T00:00:00,Grays Harbor Community Hospital,Ransomware,4984.0,Health,,Full Date of Birth,2021,"1,000-9,999",500+,
10356,11/29/2020 12:00:00 AM,01/29/2021 12:00:00 AM,Cyberattack,2019-05-06T00:00:00,2019-05-15T00:00:00,Grays Harbor Community Hospital,Ransomware,4984.0,Health,,Medical Information,2021,"1,000-9,999",500+,
10357,08/19/2020 12:00:00 AM,02/01/2021 12:00:00 AM,Cyberattack,2020-08-06T00:00:00,,Gonzaga University,Phishing,8041.0,Education,,Name,2021,"1,000-9,999",Unknown,
10357,08/19/2020 12:00:00 AM,02/01/2021 12:00:00 AM,Cyberattack,2020-08-06T00:00:00,,Gonzaga University,Phishing,8041.0,Education,,Social Security Number,2021,"1,000-9,999",Unknown,
10357,08/19/2020 12:00:00 AM,02/01/2021 12:00:00 AM,Cyberattack,2020-08-06T00:00:00,,Gonzaga University,Phishing,8041.0,Education,,Driver's License or Washington ID Card Number,2021,"1,000-9,999",Unknown,
10357,08/19/2020 12:00:00 AM,02/01/2021 12:00:00 AM,Cyberattack,2020-08-06T00:00:00,,Gonzaga University,Phishing,8041.0,Education,,Financial & Banking Information,2021,"1,000-9,999",Unknown,
10357,08/19/2020 12:00:00 AM,02/01/2021 12:00:00 AM,Cyberattack,2020-08-06T00:00:00,,Gonzaga University,Phishing,8041.0,Education,,Full Date of Birth,2021,"1,000-9,999",Unknown,
10357,08/19/2020 12:00:00 AM,02/01/2021 12:00:00 AM,Cyberattack,2020-08-06T00:00:00,,Gonzaga University,Phishing,8041.0,Education,,Student ID Number,2021,"1,000-9,999",Unknown,
10357,08/19/2020 12:00:00 AM,02/01/2021 12:00:00 AM,Cyberattack,2020-08-06T00:00:00,,Gonzaga University,Phishing,8041.0,Education,,Passport Number,2021,"1,000-9,999",Unknown,
10357,08/19/2020 12:00:00 AM,02/01/2021 12:00:00 AM,Cyberattack,2020-08-06T00:00:00,,Gonzaga University,Phishing,8041.0,Education,,Health Insurance Policy or ID Number,2021,"1,000-9,999",Unknown,
10357,08/19/2020 12:00:00 AM,02/01/2021 12:00:00 AM,Cyberattack,2020-08-06T00:00:00,,Gonzaga University,Phishing,8041.0,Education,,Medical Information,2021,"1,000-9,999",Unknown,
10357,08/19/2020 12:00:00 AM,02/01/2021 12:00:00 AM,Cyberattack,2020-08-06T00:00:00,,Gonzaga University,Phishing,8041.0,Education,,Username and Password/Security Question Answers,2021,"1,000-9,999",Unknown,
10359,05/01/2020 12:00:00 AM,11/10/2020 12:00:00 AM,Unauthorized Access,2020-03-02T00:00:00,2020-03-03T00:00:00,Woodruff Sawyer & Co.,,2393.0,Finance,,Name,2021,"1,000-9,999",1-99,
10359,05/01/2020 12:00:00 AM,11/10/2020 12:00:00 AM,Unauthorized Access,2020-03-02T00:00:00,2020-03-03T00:00:00,Woodruff Sawyer & Co.,,2393.0,Finance,,Full Date of Birth,2021,"1,000-9,999",1-99,
10359,05/01/2020 12:00:00 AM,11/10/2020 12:00:00 AM,Unauthorized Access,2020-03-02T00:00:00,2020-03-03T00:00:00,Woodruff Sawyer & Co.,,2393.0,Finance,,Medical Information,2021,"1,000-9,999",1-99,
10360,07/24/2020 12:00:00 AM,11/13/2020 12:00:00 AM,Cyberattack,2020-02-07T00:00:00,2020-05-20T00:00:00,Georgia Southern University,Ransomware,552.0,Education,,Name,2021,500-999,100-199,
10360,07/24/2020 12:00:00 AM,11/13/2020 12:00:00 AM,Cyberattack,2020-02-07T00:00:00,2020-05-20T00:00:00,Georgia Southern University,Ransomware,552.0,Education,,Social Security Number,2021,500-999,100-199,
10360,07/24/2020 12:00:00 AM,11/13/2020 12:00:00 AM,Cyberattack,2020-02-07T00:00:00,2020-05-20T00:00:00,Georgia Southern University,Ransomware,552.0,Education,,Full Date of Birth,2021,500-999,100-199,
10360,07/24/2020 12:00:00 AM,11/13/2020 12:00:00 AM,Cyberattack,2020-02-07T00:00:00,2020-05-20T00:00:00,Georgia Southern University,Ransomware,552.0,Education,,Other,2021,500-999,100-199,
10361,08/23/2020 12:00:00 AM,11/18/2020 12:00:00 AM,Cyberattack,2020-07-11T00:00:00,2020-08-23T00:00:00,"Windstream Holdings II, LLC",Unclear/unknown,643.0,Business,Telecommunications,Name,2021,500-999,1-99,
10361,08/23/2020 12:00:00 AM,11/18/2020 12:00:00 AM,Cyberattack,2020-07-11T00:00:00,2020-08-23T00:00:00,"Windstream Holdings II, LLC",Unclear/unknown,643.0,Business,Telecommunications,Social Security Number,2021,500-999,1-99,
10361,08/23/2020 12:00:00 AM,11/18/2020 12:00:00 AM,Cyberattack,2020-07-11T00:00:00,2020-08-23T00:00:00,"Windstream Holdings II, LLC",Unclear/unknown,643.0,Business,Telecommunications,Driver's License or Washington ID Card Number,2021,500-999,1-99,
10361,08/23/2020 12:00:00 AM,11/18/2020 12:00:00 AM,Cyberattack,2020-07-11T00:00:00,2020-08-23T00:00:00,"Windstream Holdings II, LLC",Unclear/unknown,643.0,Business,Telecommunications,Full Date of Birth,2021,500-999,1-99,
10361,08/23/2020 12:00:00 AM,11/18/2020 12:00:00 AM,Cyberattack,2020-07-11T00:00:00,2020-08-23T00:00:00,"Windstream Holdings II, LLC",Unclear/unknown,643.0,Business,Telecommunications,Medical Information,2021,500-999,1-99,
10362,10/24/2020 12:00:00 AM,11/20/2020 12:00:00 AM,Cyberattack,2020-10-21T00:00:00,2020-10-25T00:00:00,"Senior Operations, LLC (Senior Aerospace AMT & Damar AeroSystems)",Ransomware,2543.0,Business,Manufacturing,Name,2021,"1,000-9,999",1-99,
10362,10/24/2020 12:00:00 AM,11/20/2020 12:00:00 AM,Cyberattack,2020-10-21T00:00:00,2020-10-25T00:00:00,"Senior Operations, LLC (Senior Aerospace AMT & Damar AeroSystems)",Ransomware,2543.0,Business,Manufacturing,Social Security Number,2021,"1,000-9,999",1-99,
10362,10/24/2020 12:00:00 AM,11/20/2020 12:00:00 AM,Cyberattack,2020-10-21T00:00:00,2020-10-25T00:00:00,"Senior Operations, LLC (Senior Aerospace AMT & Damar AeroSystems)",Ransomware,2543.0,Business,Manufacturing,Financial & Banking Information,2021,"1,000-9,999",1-99,
10362,10/24/2020 12:00:00 AM,11/20/2020 12:00:00 AM,Cyberattack,2020-10-21T00:00:00,2020-10-25T00:00:00,"Senior Operations, LLC (Senior Aerospace AMT & Damar AeroSystems)",Ransomware,2543.0,Business,Manufacturing,Full Date of Birth,2021,"1,000-9,999",1-99,
10362,10/24/2020 12:00:00 AM,11/20/2020 12:00:00 AM,Cyberattack,2020-10-21T00:00:00,2020-10-25T00:00:00,"Senior Operations, LLC (Senior Aerospace AMT & Damar AeroSystems)",Ransomware,2543.0,Business,Manufacturing,Passport Number,2021,"1,000-9,999",1-99,
10362,10/24/2020 12:00:00 AM,11/20/2020 12:00:00 AM,Cyberattack,2020-10-21T00:00:00,2020-10-25T00:00:00,"Senior Operations, LLC (Senior Aerospace AMT & Damar AeroSystems)",Ransomware,2543.0,Business,Manufacturing,Other,2021,"1,000-9,999",1-99,
10363,10/14/2020 12:00:00 AM,12/01/2020 12:00:00 AM,Cyberattack,,,Matson Navigation Company,Unclear/unknown,2991.0,Business,Shipping,Name,2021,"1,000-9,999",Unknown,
10363,10/14/2020 12:00:00 AM,12/01/2020 12:00:00 AM,Cyberattack,,,Matson Navigation Company,Unclear/unknown,2991.0,Business,Shipping,Social Security Number,2021,"1,000-9,999",Unknown,
10363,10/14/2020 12:00:00 AM,12/01/2020 12:00:00 AM,Cyberattack,,,Matson Navigation Company,Unclear/unknown,2991.0,Business,Shipping,Full Date of Birth,2021,"1,000-9,999",Unknown,
10363,10/14/2020 12:00:00 AM,12/01/2020 12:00:00 AM,Cyberattack,,,Matson Navigation Company,Unclear/unknown,2991.0,Business,Shipping,Health Insurance Policy or ID Number,2021,"1,000-9,999",Unknown,
10363,10/14/2020 12:00:00 AM,12/01/2020 12:00:00 AM,Cyberattack,,,Matson Navigation Company,Unclear/unknown,2991.0,Business,Shipping,Other,2021,"1,000-9,999",Unknown,
10364,11/11/2020 12:00:00 AM,12/01/2020 12:00:00 AM,Cyberattack,2020-11-04T00:00:00,2020-11-19T00:00:00,Stride Inc.,Ransomware,742.0,Business,Other,Name,2021,500-999,1-99,
10364,11/11/2020 12:00:00 AM,12/01/2020 12:00:00 AM,Cyberattack,2020-11-04T00:00:00,2020-11-19T00:00:00,Stride Inc.,Ransomware,742.0,Business,Other,Social Security Number,2021,500-999,1-99,
10364,11/11/2020 12:00:00 AM,12/01/2020 12:00:00 AM,Cyberattack,2020-11-04T00:00:00,2020-11-19T00:00:00,Stride Inc.,Ransomware,742.0,Business,Other,Passport Number,2021,500-999,1-99,
10365,10/25/2020 12:00:00 AM,12/04/2020 12:00:00 AM,Cyberattack,2020-09-28T00:00:00,2020-10-25T00:00:00,"USNR, LLC",Ransomware,1368.0,Business,Manufacturing,Name,2021,"1,000-9,999",1-99,
10365,10/25/2020 12:00:00 AM,12/04/2020 12:00:00 AM,Cyberattack,2020-09-28T00:00:00,2020-10-25T00:00:00,"USNR, LLC",Ransomware,1368.0,Business,Manufacturing,Social Security Number,2021,"1,000-9,999",1-99,
10365,10/25/2020 12:00:00 AM,12/04/2020 12:00:00 AM,Cyberattack,2020-09-28T00:00:00,2020-10-25T00:00:00,"USNR, LLC",Ransomware,1368.0,Business,Manufacturing,Financial & Banking Information,2021,"1,000-9,999",1-99,
10365,10/25/2020 12:00:00 AM,12/04/2020 12:00:00 AM,Cyberattack,2020-09-28T00:00:00,2020-10-25T00:00:00,"USNR, LLC",Ransomware,1368.0,Business,Manufacturing,Full Date of Birth,2021,"1,000-9,999",1-99,
10365,10/25/2020 12:00:00 AM,12/04/2020 12:00:00 AM,Cyberattack,2020-09-28T00:00:00,2020-10-25T00:00:00,"USNR, LLC",Ransomware,1368.0,Business,Manufacturing,Other,2021,"1,000-9,999",1-99,
10366,05/01/2020 12:00:00 AM,12/09/2020 12:00:00 AM,Cyberattack,,,City University of Seattle,Unclear/unknown,1097.0,Education,,Name,2021,"1,000-9,999",Unknown,
10366,05/01/2020 12:00:00 AM,12/09/2020 12:00:00 AM,Cyberattack,,,City University of Seattle,Unclear/unknown,1097.0,Education,,Driver's License or Washington ID Card Number,2021,"1,000-9,999",Unknown,
10366,05/01/2020 12:00:00 AM,12/09/2020 12:00:00 AM,Cyberattack,,,City University of Seattle,Unclear/unknown,1097.0,Education,,Student ID Number,2021,"1,000-9,999",Unknown,
10366,05/01/2020 12:00:00 AM,12/09/2020 12:00:00 AM,Cyberattack,,,City University of Seattle,Unclear/unknown,1097.0,Education,,Military ID Number,2021,"1,000-9,999",Unknown,
10366,05/01/2020 12:00:00 AM,12/09/2020 12:00:00 AM,Cyberattack,,,City University of Seattle,Unclear/unknown,1097.0,Education,,Passport Number,2021,"1,000-9,999",Unknown,
10366,05/01/2020 12:00:00 AM,12/09/2020 12:00:00 AM,Cyberattack,,,City University of Seattle,Unclear/unknown,1097.0,Education,,Health Insurance Policy or ID Number,2021,"1,000-9,999",Unknown,
10366,05/01/2020 12:00:00 AM,12/09/2020 12:00:00 AM,Cyberattack,,,City University of Seattle,Unclear/unknown,1097.0,Education,,Medical Information,2021,"1,000-9,999",Unknown,
10366,05/01/2020 12:00:00 AM,12/09/2020 12:00:00 AM,Cyberattack,,,City University of Seattle,Unclear/unknown,1097.0,Education,,Other,2021,"1,000-9,999",Unknown,
10368,11/12/2020 12:00:00 AM,12/11/2020 12:00:00 AM,Cyberattack,2020-02-07T00:00:00,2020-05-20T00:00:00,Fairfield University,Ransomware,505.0,Education,,Name,2021,500-999,200-299,
10368,11/12/2020 12:00:00 AM,12/11/2020 12:00:00 AM,Cyberattack,2020-02-07T00:00:00,2020-05-20T00:00:00,Fairfield University,Ransomware,505.0,Education,,Full Date of Birth,2021,500-999,200-299,
10370,06/19/2020 12:00:00 AM,12/16/2020 12:00:00 AM,Cyberattack,2020-06-17T00:00:00,2020-06-22T00:00:00,"MEDNAX Services, Inc.",Phishing,29861.0,Health,,Name,2021,"10,000-49,999",1-99,
10370,06/19/2020 12:00:00 AM,12/16/2020 12:00:00 AM,Cyberattack,2020-06-17T00:00:00,2020-06-22T00:00:00,"MEDNAX Services, Inc.",Phishing,29861.0,Health,,Social Security Number,2021,"10,000-49,999",1-99,
10370,06/19/2020 12:00:00 AM,12/16/2020 12:00:00 AM,Cyberattack,2020-06-17T00:00:00,2020-06-22T00:00:00,"MEDNAX Services, Inc.",Phishing,29861.0,Health,,Driver's License or Washington ID Card Number,2021,"10,000-49,999",1-99,
10370,06/19/2020 12:00:00 AM,12/16/2020 12:00:00 AM,Cyberattack,2020-06-17T00:00:00,2020-06-22T00:00:00,"MEDNAX Services, Inc.",Phishing,29861.0,Health,,Financial & Banking Information,2021,"10,000-49,999",1-99,
10370,06/19/2020 12:00:00 AM,12/16/2020 12:00:00 AM,Cyberattack,2020-06-17T00:00:00,2020-06-22T00:00:00,"MEDNAX Services, Inc.",Phishing,29861.0,Health,,Full Date of Birth,2021,"10,000-49,999",1-99,
10370,06/19/2020 12:00:00 AM,12/16/2020 12:00:00 AM,Cyberattack,2020-06-17T00:00:00,2020-06-22T00:00:00,"MEDNAX Services, Inc.",Phishing,29861.0,Health,,Health Insurance Policy or ID Number,2021,"10,000-49,999",1-99,
10370,06/19/2020 12:00:00 AM,12/16/2020 12:00:00 AM,Cyberattack,2020-06-17T00:00:00,2020-06-22T00:00:00,"MEDNAX Services, Inc.",Phishing,29861.0,Health,,Medical Information,2021,"10,000-49,999",1-99,
10370,06/19/2020 12:00:00 AM,12/16/2020 12:00:00 AM,Cyberattack,2020-06-17T00:00:00,2020-06-22T00:00:00,"MEDNAX Services, Inc.",Phishing,29861.0,Health,,Other,2021,"10,000-49,999",1-99,
10371,11/06/2020 12:00:00 AM,12/16/2020 12:00:00 AM,Cyberattack,2018-05-13T00:00:00,2020-11-24T00:00:00,Paysafe Group Holdings Limited,Unclear/unknown,1877.0,Business,Other,Name,2021,"1,000-9,999",500+,
10371,11/06/2020 12:00:00 AM,12/16/2020 12:00:00 AM,Cyberattack,2018-05-13T00:00:00,2020-11-24T00:00:00,Paysafe Group Holdings Limited,Unclear/unknown,1877.0,Business,Other,Social Security Number,2021,"1,000-9,999",500+,
10371,11/06/2020 12:00:00 AM,12/16/2020 12:00:00 AM,Cyberattack,2018-05-13T00:00:00,2020-11-24T00:00:00,Paysafe Group Holdings Limited,Unclear/unknown,1877.0,Business,Other,Financial & Banking Information,2021,"1,000-9,999",500+,
10371,11/06/2020 12:00:00 AM,12/16/2020 12:00:00 AM,Cyberattack,2018-05-13T00:00:00,2020-11-24T00:00:00,Paysafe Group Holdings Limited,Unclear/unknown,1877.0,Business,Other,Other,2021,"1,000-9,999",500+,
10372,09/14/2020 12:00:00 AM,12/18/2020 12:00:00 AM,Unauthorized Access,2019-11-11T00:00:00,2019-12-09T00:00:00,Benton County of Washington,,820.0,Government,,Name,2021,500-999,300-399,
10372,09/14/2020 12:00:00 AM,12/18/2020 12:00:00 AM,Unauthorized Access,2019-11-11T00:00:00,2019-12-09T00:00:00,Benton County of Washington,,820.0,Government,,Social Security Number,2021,500-999,300-399,
10372,09/14/2020 12:00:00 AM,12/18/2020 12:00:00 AM,Unauthorized Access,2019-11-11T00:00:00,2019-12-09T00:00:00,Benton County of Washington,,820.0,Government,,Driver's License or Washington ID Card Number,2021,500-999,300-399,
10372,09/14/2020 12:00:00 AM,12/18/2020 12:00:00 AM,Unauthorized Access,2019-11-11T00:00:00,2019-12-09T00:00:00,Benton County of Washington,,820.0,Government,,Financial & Banking Information,2021,500-999,300-399,
10372,09/14/2020 12:00:00 AM,12/18/2020 12:00:00 AM,Unauthorized Access,2019-11-11T00:00:00,2019-12-09T00:00:00,Benton County of Washington,,820.0,Government,,Full Date of Birth,2021,500-999,300-399,
10372,09/14/2020 12:00:00 AM,12/18/2020 12:00:00 AM,Unauthorized Access,2019-11-11T00:00:00,2019-12-09T00:00:00,Benton County of Washington,,820.0,Government,,Student ID Number,2021,500-999,300-399,
10372,09/14/2020 12:00:00 AM,12/18/2020 12:00:00 AM,Unauthorized Access,2019-11-11T00:00:00,2019-12-09T00:00:00,Benton County of Washington,,820.0,Government,,Health Insurance Policy or ID Number,2021,500-999,300-399,
10372,09/14/2020 12:00:00 AM,12/18/2020 12:00:00 AM,Unauthorized Access,2019-11-11T00:00:00,2019-12-09T00:00:00,Benton County of Washington,,820.0,Government,,Medical Information,2021,500-999,300-399,
10372,09/14/2020 12:00:00 AM,12/18/2020 12:00:00 AM,Unauthorized Access,2019-11-11T00:00:00,2019-12-09T00:00:00,Benton County of Washington,,820.0,Government,,Other,2021,500-999,300-399,
10373,11/12/2020 12:00:00 AM,12/18/2020 12:00:00 AM,Cyberattack,2020-03-10T00:00:00,2020-11-12T00:00:00,Washington State Bar Association,Malware,4051.0,Government,,Name,2021,"1,000-9,999",200-299,
10373,11/12/2020 12:00:00 AM,12/18/2020 12:00:00 AM,Cyberattack,2020-03-10T00:00:00,2020-11-12T00:00:00,Washington State Bar Association,Malware,4051.0,Government,,Financial & Banking Information,2021,"1,000-9,999",200-299,
10374,11/23/2020 12:00:00 AM,12/22/2020 12:00:00 AM,Cyberattack,2020-02-07T00:00:00,2020-05-20T00:00:00,Cedarville University,Ransomware,1706.0,Education,,Name,2021,"1,000-9,999",200-299,
10374,11/23/2020 12:00:00 AM,12/22/2020 12:00:00 AM,Cyberattack,2020-02-07T00:00:00,2020-05-20T00:00:00,Cedarville University,Ransomware,1706.0,Education,,Full Date of Birth,2021,"1,000-9,999",200-299,
10374,11/23/2020 12:00:00 AM,12/22/2020 12:00:00 AM,Cyberattack,2020-02-07T00:00:00,2020-05-20T00:00:00,Cedarville University,Ransomware,1706.0,Education,,Student ID Number,2021,"1,000-9,999",200-299,
10374,11/23/2020 12:00:00 AM,12/22/2020 12:00:00 AM,Cyberattack,2020-02-07T00:00:00,2020-05-20T00:00:00,Cedarville University,Ransomware,1706.0,Education,,Other,2021,"1,000-9,999",200-299,
10375,12/02/2020 12:00:00 AM,12/23/2020 12:00:00 AM,Cyberattack,2020-02-07T00:00:00,2020-05-20T00:00:00,Bucknell University,Ransomware,710.0,Education,,Name,2021,500-999,200-299,
10375,12/02/2020 12:00:00 AM,12/23/2020 12:00:00 AM,Cyberattack,2020-02-07T00:00:00,2020-05-20T00:00:00,Bucknell University,Ransomware,710.0,Education,,Full Date of Birth,2021,500-999,200-299,
10375,12/02/2020 12:00:00 AM,12/23/2020 12:00:00 AM,Cyberattack,2020-02-07T00:00:00,2020-05-20T00:00:00,Bucknell University,Ransomware,710.0,Education,,Student ID Number,2021,500-999,200-299,
10375,12/02/2020 12:00:00 AM,12/23/2020 12:00:00 AM,Cyberattack,2020-02-07T00:00:00,2020-05-20T00:00:00,Bucknell University,Ransomware,710.0,Education,,Other,2021,500-999,200-299,
10376,09/29/2020 12:00:00 AM,12/23/2020 12:00:00 AM,Cyberattack,2019-10-01T00:00:00,2020-08-20T00:00:00,"Metabolic Maintenance Products, Inc.",Malware,709.0,Business,Consumable,Name,2021,500-999,300-399,
10376,09/29/2020 12:00:00 AM,12/23/2020 12:00:00 AM,Cyberattack,2019-10-01T00:00:00,2020-08-20T00:00:00,"Metabolic Maintenance Products, Inc.",Malware,709.0,Business,Consumable,Financial & Banking Information,2021,500-999,300-399,
10377,11/11/2020 12:00:00 AM,12/23/2020 12:00:00 AM,Cyberattack,,,"Tree Top, Inc.",Ransomware,9721.0,Business,Consumable,Name,2021,"1,000-9,999",Unknown,
10377,11/11/2020 12:00:00 AM,12/23/2020 12:00:00 AM,Cyberattack,,,"Tree Top, Inc.",Ransomware,9721.0,Business,Consumable,Social Security Number,2021,"1,000-9,999",Unknown,
10377,11/11/2020 12:00:00 AM,12/23/2020 12:00:00 AM,Cyberattack,,,"Tree Top, Inc.",Ransomware,9721.0,Business,Consumable,Financial & Banking Information,2021,"1,000-9,999",Unknown,
10377,11/11/2020 12:00:00 AM,12/23/2020 12:00:00 AM,Cyberattack,,,"Tree Top, Inc.",Ransomware,9721.0,Business,Consumable,Full Date of Birth,2021,"1,000-9,999",Unknown,
10377,11/11/2020 12:00:00 AM,12/23/2020 12:00:00 AM,Cyberattack,,,"Tree Top, Inc.",Ransomware,9721.0,Business,Consumable,Health Insurance Policy or ID Number,2021,"1,000-9,999",Unknown,
10377,11/11/2020 12:00:00 AM,12/23/2020 12:00:00 AM,Cyberattack,,,"Tree Top, Inc.",Ransomware,9721.0,Business,Consumable,Medical Information,2021,"1,000-9,999",Unknown,
10377,11/11/2020 12:00:00 AM,12/23/2020 12:00:00 AM,Cyberattack,,,"Tree Top, Inc.",Ransomware,9721.0,Business,Consumable,Other,2021,"1,000-9,999",Unknown,
10378,12/02/2020 12:00:00 AM,12/28/2020 12:00:00 AM,Theft or Mistake,2020-11-30T00:00:00,,Prime Therapeutics,,897.0,Health,,Name,2021,500-999,Unknown,
10378,12/02/2020 12:00:00 AM,12/28/2020 12:00:00 AM,Theft or Mistake,2020-11-30T00:00:00,,Prime Therapeutics,,897.0,Health,,Medical Information,2021,500-999,Unknown,
10380,10/20/2020 12:00:00 AM,12/31/2020 12:00:00 AM,Cyberattack,2020-10-20T00:00:00,,"Life Quotes, Inc.",Ransomware,626.0,Finance,,Name,2021,500-999,Unknown,
10380,10/20/2020 12:00:00 AM,12/31/2020 12:00:00 AM,Cyberattack,2020-10-20T00:00:00,,"Life Quotes, Inc.",Ransomware,626.0,Finance,,Social Security Number,2021,500-999,Unknown,
10380,10/20/2020 12:00:00 AM,12/31/2020 12:00:00 AM,Cyberattack,2020-10-20T00:00:00,,"Life Quotes, Inc.",Ransomware,626.0,Finance,,Driver's License or Washington ID Card Number,2021,500-999,Unknown,
10380,10/20/2020 12:00:00 AM,12/31/2020 12:00:00 AM,Cyberattack,2020-10-20T00:00:00,,"Life Quotes, Inc.",Ransomware,626.0,Finance,,Financial & Banking Information,2021,500-999,Unknown,
10380,10/20/2020 12:00:00 AM,12/31/2020 12:00:00 AM,Cyberattack,2020-10-20T00:00:00,,"Life Quotes, Inc.",Ransomware,626.0,Finance,,Full Date of Birth,2021,500-999,Unknown,
10380,10/20/2020 12:00:00 AM,12/31/2020 12:00:00 AM,Cyberattack,2020-10-20T00:00:00,,"Life Quotes, Inc.",Ransomware,626.0,Finance,,Medical Information,2021,500-999,Unknown,
10380,10/20/2020 12:00:00 AM,12/31/2020 12:00:00 AM,Cyberattack,2020-10-20T00:00:00,,"Life Quotes, Inc.",Ransomware,626.0,Finance,,Other,2021,500-999,Unknown,
10381,12/12/2020 12:00:00 AM,01/04/2021 12:00:00 AM,Cyberattack,2020-12-12T00:00:00,2020-12-26T00:00:00,"Peter Pan Seafoods, Inc.",Ransomware,1661.0,Business,Consumable,Name,2021,"1,000-9,999",1-99,
10381,12/12/2020 12:00:00 AM,01/04/2021 12:00:00 AM,Cyberattack,2020-12-12T00:00:00,2020-12-26T00:00:00,"Peter Pan Seafoods, Inc.",Ransomware,1661.0,Business,Consumable,Social Security Number,2021,"1,000-9,999",1-99,
10381,12/12/2020 12:00:00 AM,01/04/2021 12:00:00 AM,Cyberattack,2020-12-12T00:00:00,2020-12-26T00:00:00,"Peter Pan Seafoods, Inc.",Ransomware,1661.0,Business,Consumable,Full Date of Birth,2021,"1,000-9,999",1-99,
10381,12/12/2020 12:00:00 AM,01/04/2021 12:00:00 AM,Cyberattack,2020-12-12T00:00:00,2020-12-26T00:00:00,"Peter Pan Seafoods, Inc.",Ransomware,1661.0,Business,Consumable,Other,2021,"1,000-9,999",1-99,
10382,09/29/2020 12:00:00 AM,01/05/2021 12:00:00 AM,Cyberattack,2020-02-07T00:00:00,2020-05-20T00:00:00,Grinnell College,Ransomware,2465.0,Education,,Name,2021,"1,000-9,999",200-299,
10382,09/29/2020 12:00:00 AM,01/05/2021 12:00:00 AM,Cyberattack,2020-02-07T00:00:00,2020-05-20T00:00:00,Grinnell College,Ransomware,2465.0,Education,,Full Date of Birth,2021,"1,000-9,999",200-299,
10382,09/29/2020 12:00:00 AM,01/05/2021 12:00:00 AM,Cyberattack,2020-02-07T00:00:00,2020-05-20T00:00:00,Grinnell College,Ransomware,2465.0,Education,,Student ID Number,2021,"1,000-9,999",200-299,
10384,07/16/2020 12:00:00 AM,01/08/2021 12:00:00 AM,Cyberattack,2020-06-17T00:00:00,2020-06-22T00:00:00,North American Partners in Anesthesia,Phishing,505.0,Health,,Name,2021,500-999,1-99,
10384,07/16/2020 12:00:00 AM,01/08/2021 12:00:00 AM,Cyberattack,2020-06-17T00:00:00,2020-06-22T00:00:00,North American Partners in Anesthesia,Phishing,505.0,Health,,Social Security Number,2021,500-999,1-99,
10384,07/16/2020 12:00:00 AM,01/08/2021 12:00:00 AM,Cyberattack,2020-06-17T00:00:00,2020-06-22T00:00:00,North American Partners in Anesthesia,Phishing,505.0,Health,,Driver's License or Washington ID Card Number,2021,500-999,1-99,
10384,07/16/2020 12:00:00 AM,01/08/2021 12:00:00 AM,Cyberattack,2020-06-17T00:00:00,2020-06-22T00:00:00,North American Partners in Anesthesia,Phishing,505.0,Health,,Health Insurance Policy or ID Number,2021,500-999,1-99,
10384,07/16/2020 12:00:00 AM,01/08/2021 12:00:00 AM,Cyberattack,2020-06-17T00:00:00,2020-06-22T00:00:00,North American Partners in Anesthesia,Phishing,505.0,Health,,Medical Information,2021,500-999,1-99,
10384,07/16/2020 12:00:00 AM,01/08/2021 12:00:00 AM,Cyberattack,2020-06-17T00:00:00,2020-06-22T00:00:00,North American Partners in Anesthesia,Phishing,505.0,Health,,Other,2021,500-999,1-99,
10385,12/04/2020 12:00:00 AM,01/08/2021 12:00:00 AM,Cyberattack,2020-08-12T00:00:00,2020-09-14T00:00:00,"US Fertility, LLC (Seattle Reproductive Medicine)",Ransomware,47952.0,Health,,Name,2021,"10,000-49,999",100-199,
10385,12/04/2020 12:00:00 AM,01/08/2021 12:00:00 AM,Cyberattack,2020-08-12T00:00:00,2020-09-14T00:00:00,"US Fertility, LLC (Seattle Reproductive Medicine)",Ransomware,47952.0,Health,,Social Security Number,2021,"10,000-49,999",100-199,
10385,12/04/2020 12:00:00 AM,01/08/2021 12:00:00 AM,Cyberattack,2020-08-12T00:00:00,2020-09-14T00:00:00,"US Fertility, LLC (Seattle Reproductive Medicine)",Ransomware,47952.0,Health,,Driver's License or Washington ID Card Number,2021,"10,000-49,999",100-199,
10385,12/04/2020 12:00:00 AM,01/08/2021 12:00:00 AM,Cyberattack,2020-08-12T00:00:00,2020-09-14T00:00:00,"US Fertility, LLC (Seattle Reproductive Medicine)",Ransomware,47952.0,Health,,Financial & Banking Information,2021,"10,000-49,999",100-199,
10385,12/04/2020 12:00:00 AM,01/08/2021 12:00:00 AM,Cyberattack,2020-08-12T00:00:00,2020-09-14T00:00:00,"US Fertility, LLC (Seattle Reproductive Medicine)",Ransomware,47952.0,Health,,Passport Number,2021,"10,000-49,999",100-199,
10385,12/04/2020 12:00:00 AM,01/08/2021 12:00:00 AM,Cyberattack,2020-08-12T00:00:00,2020-09-14T00:00:00,"US Fertility, LLC (Seattle Reproductive Medicine)",Ransomware,47952.0,Health,,Health Insurance Policy or ID Number,2021,"10,000-49,999",100-199,
10385,12/04/2020 12:00:00 AM,01/08/2021 12:00:00 AM,Cyberattack,2020-08-12T00:00:00,2020-09-14T00:00:00,"US Fertility, LLC (Seattle Reproductive Medicine)",Ransomware,47952.0,Health,,Medical Information,2021,"10,000-49,999",100-199,
10385,12/04/2020 12:00:00 AM,01/08/2021 12:00:00 AM,Cyberattack,2020-08-12T00:00:00,2020-09-14T00:00:00,"US Fertility, LLC (Seattle Reproductive Medicine)",Ransomware,47952.0,Health,,Other,2021,"10,000-49,999",100-199,
10386,12/16/2020 12:00:00 AM,01/11/2021 12:00:00 AM,Cyberattack,2020-04-01T00:00:00,2020-06-30T00:00:00,"ALE Solutions, Inc.",Ransomware,736.0,Business,Other,Name,2021,500-999,200-299,
10386,12/16/2020 12:00:00 AM,01/11/2021 12:00:00 AM,Cyberattack,2020-04-01T00:00:00,2020-06-30T00:00:00,"ALE Solutions, Inc.",Ransomware,736.0,Business,Other,Social Security Number,2021,500-999,200-299,
10387,11/12/2020 12:00:00 AM,01/11/2021 12:00:00 AM,Cyberattack,2020-11-09T00:00:00,2020-11-12T00:00:00,Jefferson Healthcare,Phishing,2496.0,Health,,Name,2021,"1,000-9,999",1-99,
10387,11/12/2020 12:00:00 AM,01/11/2021 12:00:00 AM,Cyberattack,2020-11-09T00:00:00,2020-11-12T00:00:00,Jefferson Healthcare,Phishing,2496.0,Health,,Social Security Number,2021,"1,000-9,999",1-99,
10387,11/12/2020 12:00:00 AM,01/11/2021 12:00:00 AM,Cyberattack,2020-11-09T00:00:00,2020-11-12T00:00:00,Jefferson Healthcare,Phishing,2496.0,Health,,Driver's License or Washington ID Card Number,2021,"1,000-9,999",1-99,
10387,11/12/2020 12:00:00 AM,01/11/2021 12:00:00 AM,Cyberattack,2020-11-09T00:00:00,2020-11-12T00:00:00,Jefferson Healthcare,Phishing,2496.0,Health,,Full Date of Birth,2021,"1,000-9,999",1-99,
10387,11/12/2020 12:00:00 AM,01/11/2021 12:00:00 AM,Cyberattack,2020-11-09T00:00:00,2020-11-12T00:00:00,Jefferson Healthcare,Phishing,2496.0,Health,,Health Insurance Policy or ID Number,2021,"1,000-9,999",1-99,
10387,11/12/2020 12:00:00 AM,01/11/2021 12:00:00 AM,Cyberattack,2020-11-09T00:00:00,2020-11-12T00:00:00,Jefferson Healthcare,Phishing,2496.0,Health,,Medical Information,2021,"1,000-9,999",1-99,
10387,11/12/2020 12:00:00 AM,01/11/2021 12:00:00 AM,Cyberattack,2020-11-09T00:00:00,2020-11-12T00:00:00,Jefferson Healthcare,Phishing,2496.0,Health,,Other,2021,"1,000-9,999",1-99,
10389,07/16/2020 12:00:00 AM,01/13/2021 12:00:00 AM,Cyberattack,2020-02-07T00:00:00,2020-05-20T00:00:00,North Park University,Ransomware,1239.0,Education,,Name,2021,"1,000-9,999",100-199,
10389,07/16/2020 12:00:00 AM,01/13/2021 12:00:00 AM,Cyberattack,2020-02-07T00:00:00,2020-05-20T00:00:00,North Park University,Ransomware,1239.0,Education,,Full Date of Birth,2021,"1,000-9,999",100-199,
10389,07/16/2020 12:00:00 AM,01/13/2021 12:00:00 AM,Cyberattack,2020-02-07T00:00:00,2020-05-20T00:00:00,North Park University,Ransomware,1239.0,Education,,Other,2021,"1,000-9,999",100-199,
10390,12/10/2020 12:00:00 AM,01/13/2021 12:00:00 AM,Cyberattack,2019-12-05T00:00:00,2020-05-15T00:00:00,Waters & Kraus LLP,Phishing,522.0,Business,Legal,Name,2021,500-999,300-399,
10390,12/10/2020 12:00:00 AM,01/13/2021 12:00:00 AM,Cyberattack,2019-12-05T00:00:00,2020-05-15T00:00:00,Waters & Kraus LLP,Phishing,522.0,Business,Legal,Social Security Number,2021,500-999,300-399,
10390,12/10/2020 12:00:00 AM,01/13/2021 12:00:00 AM,Cyberattack,2019-12-05T00:00:00,2020-05-15T00:00:00,Waters & Kraus LLP,Phishing,522.0,Business,Legal,Driver's License or Washington ID Card Number,2021,500-999,300-399,
10390,12/10/2020 12:00:00 AM,01/13/2021 12:00:00 AM,Cyberattack,2019-12-05T00:00:00,2020-05-15T00:00:00,Waters & Kraus LLP,Phishing,522.0,Business,Legal,Medical Information,2021,500-999,300-399,
10391,10/14/2020 12:00:00 AM,01/15/2021 12:00:00 AM,Cyberattack,,,"Walla Walla County, WA",Unclear/unknown,577.0,Government,,Username and Password/Security Question Answers,2021,500-999,Unknown,
10393,12/14/2020 12:00:00 AM,01/21/2021 12:00:00 AM,Cyberattack,2020-11-08T00:00:00,2020-11-09T00:00:00,Cardinal Financial Company,Unclear/unknown,925.0,Finance,,Name,2021,500-999,1-99,
10393,12/14/2020 12:00:00 AM,01/21/2021 12:00:00 AM,Cyberattack,2020-11-08T00:00:00,2020-11-09T00:00:00,Cardinal Financial Company,Unclear/unknown,925.0,Finance,,Full Date of Birth,2021,500-999,1-99,
10393,12/14/2020 12:00:00 AM,01/21/2021 12:00:00 AM,Cyberattack,2020-11-08T00:00:00,2020-11-09T00:00:00,Cardinal Financial Company,Unclear/unknown,925.0,Finance,,Other,2021,500-999,1-99,
10394,08/01/2020 12:00:00 AM,01/25/2021 12:00:00 AM,Cyberattack,,,American Frame Corporation,Ransomware,954.0,Business,Retail,Name,2021,500-999,Unknown,
10394,08/01/2020 12:00:00 AM,01/25/2021 12:00:00 AM,Cyberattack,,,American Frame Corporation,Ransomware,954.0,Business,Retail,Social Security Number,2021,500-999,Unknown,
10394,08/01/2020 12:00:00 AM,01/25/2021 12:00:00 AM,Cyberattack,,,American Frame Corporation,Ransomware,954.0,Business,Retail,Financial & Banking Information,2021,500-999,Unknown,
10394,08/01/2020 12:00:00 AM,01/25/2021 12:00:00 AM,Cyberattack,,,American Frame Corporation,Ransomware,954.0,Business,Retail,Other,2021,500-999,Unknown,
10395,08/10/2020 12:00:00 AM,01/25/2021 12:00:00 AM,Cyberattack,2020-08-05T00:00:00,2020-08-17T00:00:00,Einstein Healthcare Network,Phishing,1197.0,Health,,Name,2021,"1,000-9,999",1-99,
10395,08/10/2020 12:00:00 AM,01/25/2021 12:00:00 AM,Cyberattack,2020-08-05T00:00:00,2020-08-17T00:00:00,Einstein Healthcare Network,Phishing,1197.0,Health,,Social Security Number,2021,"1,000-9,999",1-99,
10395,08/10/2020 12:00:00 AM,01/25/2021 12:00:00 AM,Cyberattack,2020-08-05T00:00:00,2020-08-17T00:00:00,Einstein Healthcare Network,Phishing,1197.0,Health,,Full Date of Birth,2021,"1,000-9,999",1-99,
10395,08/10/2020 12:00:00 AM,01/25/2021 12:00:00 AM,Cyberattack,2020-08-05T00:00:00,2020-08-17T00:00:00,Einstein Healthcare Network,Phishing,1197.0,Health,,Health Insurance Policy or ID Number,2021,"1,000-9,999",1-99,
10395,08/10/2020 12:00:00 AM,01/25/2021 12:00:00 AM,Cyberattack,2020-08-05T00:00:00,2020-08-17T00:00:00,Einstein Healthcare Network,Phishing,1197.0,Health,,Medical Information,2021,"1,000-9,999",1-99,
10396,08/17/2020 12:00:00 AM,01/26/2021 12:00:00 AM,Cyberattack,,,"Bosley, Inc.",Ransomware,1936.0,Business,Other,Name,2021,"1,000-9,999",Unknown,
10396,08/17/2020 12:00:00 AM,01/26/2021 12:00:00 AM,Cyberattack,,,"Bosley, Inc.",Ransomware,1936.0,Business,Other,Social Security Number,2021,"1,000-9,999",Unknown,
10396,08/17/2020 12:00:00 AM,01/26/2021 12:00:00 AM,Cyberattack,,,"Bosley, Inc.",Ransomware,1936.0,Business,Other,Driver's License or Washington ID Card Number,2021,"1,000-9,999",Unknown,
10396,08/17/2020 12:00:00 AM,01/26/2021 12:00:00 AM,Cyberattack,,,"Bosley, Inc.",Ransomware,1936.0,Business,Other,Financial & Banking Information,2021,"1,000-9,999",Unknown,
10397,07/25/2020 12:00:00 AM,01/26/2021 12:00:00 AM,Cyberattack,2020-04-05T00:00:00,2020-08-06T00:00:00,Puget Sound Educational Service District,Phishing,32419.0,Education,,Name,2021,"10,000-49,999",100-199,
10397,07/25/2020 12:00:00 AM,01/26/2021 12:00:00 AM,Cyberattack,2020-04-05T00:00:00,2020-08-06T00:00:00,Puget Sound Educational Service District,Phishing,32419.0,Education,,Social Security Number,2021,"10,000-49,999",100-199,
10397,07/25/2020 12:00:00 AM,01/26/2021 12:00:00 AM,Cyberattack,2020-04-05T00:00:00,2020-08-06T00:00:00,Puget Sound Educational Service District,Phishing,32419.0,Education,,Financial & Banking Information,2021,"10,000-49,999",100-199,
10397,07/25/2020 12:00:00 AM,01/26/2021 12:00:00 AM,Cyberattack,2020-04-05T00:00:00,2020-08-06T00:00:00,Puget Sound Educational Service District,Phishing,32419.0,Education,,Full Date of Birth,2021,"10,000-49,999",100-199,
10397,07/25/2020 12:00:00 AM,01/26/2021 12:00:00 AM,Cyberattack,2020-04-05T00:00:00,2020-08-06T00:00:00,Puget Sound Educational Service District,Phishing,32419.0,Education,,Unique Private Key (e.g. used to authenticate or sign an electronic record),2021,"10,000-49,999",100-199,
10397,07/25/2020 12:00:00 AM,01/26/2021 12:00:00 AM,Cyberattack,2020-04-05T00:00:00,2020-08-06T00:00:00,Puget Sound Educational Service District,Phishing,32419.0,Education,,Health Insurance Policy or ID Number,2021,"10,000-49,999",100-199,
10397,07/25/2020 12:00:00 AM,01/26/2021 12:00:00 AM,Cyberattack,2020-04-05T00:00:00,2020-08-06T00:00:00,Puget Sound Educational Service District,Phishing,32419.0,Education,,Medical Information,2021,"10,000-49,999",100-199,
10397,07/25/2020 12:00:00 AM,01/26/2021 12:00:00 AM,Cyberattack,2020-04-05T00:00:00,2020-08-06T00:00:00,Puget Sound Educational Service District,Phishing,32419.0,Education,,Username and Password/Security Question Answers,2021,"10,000-49,999",100-199,
10397,07/25/2020 12:00:00 AM,01/26/2021 12:00:00 AM,Cyberattack,2020-04-05T00:00:00,2020-08-06T00:00:00,Puget Sound Educational Service District,Phishing,32419.0,Education,,Other,2021,"10,000-49,999",100-199,
10398,08/31/2020 12:00:00 AM,01/27/2021 12:00:00 AM,Cyberattack,2020-08-28T00:00:00,2020-08-29T00:00:00,Absher Construction Company,Malware,1527.0,Business,Construction,Name,2021,"1,000-9,999",1-99,
10398,08/31/2020 12:00:00 AM,01/27/2021 12:00:00 AM,Cyberattack,2020-08-28T00:00:00,2020-08-29T00:00:00,Absher Construction Company,Malware,1527.0,Business,Construction,Social Security Number,2021,"1,000-9,999",1-99,
10398,08/31/2020 12:00:00 AM,01/27/2021 12:00:00 AM,Cyberattack,2020-08-28T00:00:00,2020-08-29T00:00:00,Absher Construction Company,Malware,1527.0,Business,Construction,Driver's License or Washington ID Card Number,2021,"1,000-9,999",1-99,
10398,08/31/2020 12:00:00 AM,01/27/2021 12:00:00 AM,Cyberattack,2020-08-28T00:00:00,2020-08-29T00:00:00,Absher Construction Company,Malware,1527.0,Business,Construction,Financial & Banking Information,2021,"1,000-9,999",1-99,
10398,08/31/2020 12:00:00 AM,01/27/2021 12:00:00 AM,Cyberattack,2020-08-28T00:00:00,2020-08-29T00:00:00,Absher Construction Company,Malware,1527.0,Business,Construction,Full Date of Birth,2021,"1,000-9,999",1-99,
10399,12/28/2020 12:00:00 AM,01/26/2021 12:00:00 AM,Cyberattack,2020-12-28T00:00:00,2020-12-28T00:00:00,thyssenkrupp Materials,Ransomware,1250.0,Business,Manufacturing,Name,2021,"1,000-9,999",0,
10399,12/28/2020 12:00:00 AM,01/26/2021 12:00:00 AM,Cyberattack,2020-12-28T00:00:00,2020-12-28T00:00:00,thyssenkrupp Materials,Ransomware,1250.0,Business,Manufacturing,Social Security Number,2021,"1,000-9,999",0,
10399,12/28/2020 12:00:00 AM,01/26/2021 12:00:00 AM,Cyberattack,2020-12-28T00:00:00,2020-12-28T00:00:00,thyssenkrupp Materials,Ransomware,1250.0,Business,Manufacturing,Financial & Banking Information,2021,"1,000-9,999",0,
10399,12/28/2020 12:00:00 AM,01/26/2021 12:00:00 AM,Cyberattack,2020-12-28T00:00:00,2020-12-28T00:00:00,thyssenkrupp Materials,Ransomware,1250.0,Business,Manufacturing,Full Date of Birth,2021,"1,000-9,999",0,
10399,12/28/2020 12:00:00 AM,01/26/2021 12:00:00 AM,Cyberattack,2020-12-28T00:00:00,2020-12-28T00:00:00,thyssenkrupp Materials,Ransomware,1250.0,Business,Manufacturing,Medical Information,2021,"1,000-9,999",0,
10399,12/28/2020 12:00:00 AM,01/26/2021 12:00:00 AM,Cyberattack,2020-12-28T00:00:00,2020-12-28T00:00:00,thyssenkrupp Materials,Ransomware,1250.0,Business,Manufacturing,Other,2021,"1,000-9,999",0,
10401,01/12/2021 12:00:00 AM,02/12/2021 12:00:00 AM,Cyberattack,,,Washington State Auditor's Office,Malware,1420520.0,Government,,Name,2021,"1,000,000+",Unknown,
10401,01/12/2021 12:00:00 AM,02/12/2021 12:00:00 AM,Cyberattack,,,Washington State Auditor's Office,Malware,1420520.0,Government,,Social Security Number,2021,"1,000,000+",Unknown,
10401,01/12/2021 12:00:00 AM,02/12/2021 12:00:00 AM,Cyberattack,,,Washington State Auditor's Office,Malware,1420520.0,Government,,Financial & Banking Information,2021,"1,000,000+",Unknown,
10401,01/12/2021 12:00:00 AM,02/12/2021 12:00:00 AM,Cyberattack,,,Washington State Auditor's Office,Malware,1420520.0,Government,,Full Date of Birth,2021,"1,000,000+",Unknown,
10401,01/12/2021 12:00:00 AM,02/12/2021 12:00:00 AM,Cyberattack,,,Washington State Auditor's Office,Malware,1420520.0,Government,,Student ID Number,2021,"1,000,000+",Unknown,
10401,01/12/2021 12:00:00 AM,02/12/2021 12:00:00 AM,Cyberattack,,,Washington State Auditor's Office,Malware,1420520.0,Government,,Health Insurance Policy or ID Number,2021,"1,000,000+",Unknown,
10401,01/12/2021 12:00:00 AM,02/12/2021 12:00:00 AM,Cyberattack,,,Washington State Auditor's Office,Malware,1420520.0,Government,,Other,2021,"1,000,000+",Unknown,
10402,01/14/2021 12:00:00 AM,02/17/2021 12:00:00 AM,Cyberattack,2020-12-03T00:00:00,2021-01-14T00:00:00,"Woodcreek Provider Services, LLC",Ransomware,25917.0,Health,,Name,2021,"10,000-49,999",1-99,
10402,01/14/2021 12:00:00 AM,02/17/2021 12:00:00 AM,Cyberattack,2020-12-03T00:00:00,2021-01-14T00:00:00,"Woodcreek Provider Services, LLC",Ransomware,25917.0,Health,,Social Security Number,2021,"10,000-49,999",1-99,
10402,01/14/2021 12:00:00 AM,02/17/2021 12:00:00 AM,Cyberattack,2020-12-03T00:00:00,2021-01-14T00:00:00,"Woodcreek Provider Services, LLC",Ransomware,25917.0,Health,,Financial & Banking Information,2021,"10,000-49,999",1-99,
10402,01/14/2021 12:00:00 AM,02/17/2021 12:00:00 AM,Cyberattack,2020-12-03T00:00:00,2021-01-14T00:00:00,"Woodcreek Provider Services, LLC",Ransomware,25917.0,Health,,Full Date of Birth,2021,"10,000-49,999",1-99,
10402,01/14/2021 12:00:00 AM,02/17/2021 12:00:00 AM,Cyberattack,2020-12-03T00:00:00,2021-01-14T00:00:00,"Woodcreek Provider Services, LLC",Ransomware,25917.0,Health,,Student ID Number,2021,"10,000-49,999",1-99,
10402,01/14/2021 12:00:00 AM,02/17/2021 12:00:00 AM,Cyberattack,2020-12-03T00:00:00,2021-01-14T00:00:00,"Woodcreek Provider Services, LLC",Ransomware,25917.0,Health,,Health Insurance Policy or ID Number,2021,"10,000-49,999",1-99,
10402,01/14/2021 12:00:00 AM,02/17/2021 12:00:00 AM,Cyberattack,2020-12-03T00:00:00,2021-01-14T00:00:00,"Woodcreek Provider Services, LLC",Ransomware,25917.0,Health,,Medical Information,2021,"10,000-49,999",1-99,
10402,01/14/2021 12:00:00 AM,02/17/2021 12:00:00 AM,Cyberattack,2020-12-03T00:00:00,2021-01-14T00:00:00,"Woodcreek Provider Services, LLC",Ransomware,25917.0,Health,,Other,2021,"10,000-49,999",1-99,
10405,01/23/2021 12:00:00 AM,02/19/2021 12:00:00 AM,Cyberattack,2020-12-24T00:00:00,2020-12-29T00:00:00,The Kroger Co.,Malware,153800.0,Business,Retail,Name,2021,"50,000-999,999",1-99,
10405,01/23/2021 12:00:00 AM,02/19/2021 12:00:00 AM,Cyberattack,2020-12-24T00:00:00,2020-12-29T00:00:00,The Kroger Co.,Malware,153800.0,Business,Retail,Social Security Number,2021,"50,000-999,999",1-99,
10405,01/23/2021 12:00:00 AM,02/19/2021 12:00:00 AM,Cyberattack,2020-12-24T00:00:00,2020-12-29T00:00:00,The Kroger Co.,Malware,153800.0,Business,Retail,Full Date of Birth,2021,"50,000-999,999",1-99,
10405,01/23/2021 12:00:00 AM,02/19/2021 12:00:00 AM,Cyberattack,2020-12-24T00:00:00,2020-12-29T00:00:00,The Kroger Co.,Malware,153800.0,Business,Retail,Medical Information,2021,"50,000-999,999",1-99,
10405,01/23/2021 12:00:00 AM,02/19/2021 12:00:00 AM,Cyberattack,2020-12-24T00:00:00,2020-12-29T00:00:00,The Kroger Co.,Malware,153800.0,Business,Retail,Other,2021,"50,000-999,999",1-99,
10406,12/22/2020 12:00:00 AM,02/23/2021 12:00:00 AM,Theft or Mistake,2020-10-12T00:00:00,2020-12-16T00:00:00,Humana,,675.0,Health,,Name,2021,500-999,1-99,
10406,12/22/2020 12:00:00 AM,02/23/2021 12:00:00 AM,Theft or Mistake,2020-10-12T00:00:00,2020-12-16T00:00:00,Humana,,675.0,Health,,Social Security Number,2021,500-999,1-99,
10406,12/22/2020 12:00:00 AM,02/23/2021 12:00:00 AM,Theft or Mistake,2020-10-12T00:00:00,2020-12-16T00:00:00,Humana,,675.0,Health,,Full Date of Birth,2021,500-999,1-99,
10406,12/22/2020 12:00:00 AM,02/23/2021 12:00:00 AM,Theft or Mistake,2020-10-12T00:00:00,2020-12-16T00:00:00,Humana,,675.0,Health,,Medical Information,2021,500-999,1-99,
10406,12/22/2020 12:00:00 AM,02/23/2021 12:00:00 AM,Theft or Mistake,2020-10-12T00:00:00,2020-12-16T00:00:00,Humana,,675.0,Health,,Other,2021,500-999,1-99,
10407,02/11/2021 12:00:00 AM,02/23/2021 12:00:00 AM,Cyberattack,2021-02-03T00:00:00,,Lakewood Water District,Ransomware,14877.0,Government,,Name,2021,"10,000-49,999",Unknown,
10407,02/11/2021 12:00:00 AM,02/23/2021 12:00:00 AM,Cyberattack,2021-02-03T00:00:00,,Lakewood Water District,Ransomware,14877.0,Government,,Financial & Banking Information,2021,"10,000-49,999",Unknown,
10407,02/11/2021 12:00:00 AM,02/23/2021 12:00:00 AM,Cyberattack,2021-02-03T00:00:00,,Lakewood Water District,Ransomware,14877.0,Government,,Other,2021,"10,000-49,999",Unknown,
10408,01/04/2021 12:00:00 AM,02/23/2021 12:00:00 AM,Cyberattack,,,Washington Education Association & Seattle Education Association,Ransomware,17415.0,Education,,Name,2021,"10,000-49,999",Unknown,
10408,01/04/2021 12:00:00 AM,02/23/2021 12:00:00 AM,Cyberattack,,,Washington Education Association & Seattle Education Association,Ransomware,17415.0,Education,,Social Security Number,2021,"10,000-49,999",Unknown,
10408,01/04/2021 12:00:00 AM,02/23/2021 12:00:00 AM,Cyberattack,,,Washington Education Association & Seattle Education Association,Ransomware,17415.0,Education,,Full Date of Birth,2021,"10,000-49,999",Unknown,
10408,01/04/2021 12:00:00 AM,02/23/2021 12:00:00 AM,Cyberattack,,,Washington Education Association & Seattle Education Association,Ransomware,17415.0,Education,,Other,2021,"10,000-49,999",Unknown,
10409,02/02/2021 12:00:00 AM,02/26/2021 12:00:00 AM,Cyberattack,,,"BSN Sports, LLC",Malware,523.0,Business,Accessories,Name,2021,500-999,Unknown,
10409,02/02/2021 12:00:00 AM,02/26/2021 12:00:00 AM,Cyberattack,,,"BSN Sports, LLC",Malware,523.0,Business,Accessories,Financial & Banking Information,2021,500-999,Unknown,
10410,01/28/2021 12:00:00 AM,02/27/2021 12:00:00 AM,Cyberattack,2020-07-01T00:00:00,2020-10-31T00:00:00,"Casemaker, LLC and Lawriter, LLC",Malware,1690.0,Business,Legal,Name,2021,"1,000-9,999",200-299,
10410,01/28/2021 12:00:00 AM,02/27/2021 12:00:00 AM,Cyberattack,2020-07-01T00:00:00,2020-10-31T00:00:00,"Casemaker, LLC and Lawriter, LLC",Malware,1690.0,Business,Legal,Email Address and Password/Security Question Answers,2021,"1,000-9,999",200-299,
10410,01/28/2021 12:00:00 AM,02/27/2021 12:00:00 AM,Cyberattack,2020-07-01T00:00:00,2020-10-31T00:00:00,"Casemaker, LLC and Lawriter, LLC",Malware,1690.0,Business,Legal,Other,2021,"1,000-9,999",200-299,
10411,10/20/2020 12:00:00 AM,03/02/2021 12:00:00 AM,Cyberattack,,,Cardinal Logistics Management Corp.,Ransomware,1308.0,Business,Shipping,Name,2021,"1,000-9,999",Unknown,
10411,10/20/2020 12:00:00 AM,03/02/2021 12:00:00 AM,Cyberattack,,,Cardinal Logistics Management Corp.,Ransomware,1308.0,Business,Shipping,Social Security Number,2021,"1,000-9,999",Unknown,
10411,10/20/2020 12:00:00 AM,03/02/2021 12:00:00 AM,Cyberattack,,,Cardinal Logistics Management Corp.,Ransomware,1308.0,Business,Shipping,Financial & Banking Information,2021,"1,000-9,999",Unknown,
10411,10/20/2020 12:00:00 AM,03/02/2021 12:00:00 AM,Cyberattack,,,Cardinal Logistics Management Corp.,Ransomware,1308.0,Business,Shipping,Full Date of Birth,2021,"1,000-9,999",Unknown,
10411,10/20/2020 12:00:00 AM,03/02/2021 12:00:00 AM,Cyberattack,,,Cardinal Logistics Management Corp.,Ransomware,1308.0,Business,Shipping,Health Insurance Policy or ID Number,2021,"1,000-9,999",Unknown,
10411,10/20/2020 12:00:00 AM,03/02/2021 12:00:00 AM,Cyberattack,,,Cardinal Logistics Management Corp.,Ransomware,1308.0,Business,Shipping,Medical Information,2021,"1,000-9,999",Unknown,
10411,10/20/2020 12:00:00 AM,03/02/2021 12:00:00 AM,Cyberattack,,,Cardinal Logistics Management Corp.,Ransomware,1308.0,Business,Shipping,Other,2021,"1,000-9,999",Unknown,
10412,02/09/2021 12:00:00 AM,03/02/2021 12:00:00 AM,Cyberattack,,,Northshore Utility District,Ransomware,4900.0,Government,,Name,2021,"1,000-9,999",Unknown,
10412,02/09/2021 12:00:00 AM,03/02/2021 12:00:00 AM,Cyberattack,,,Northshore Utility District,Ransomware,4900.0,Government,,Financial & Banking Information,2021,"1,000-9,999",Unknown,
10412,02/09/2021 12:00:00 AM,03/02/2021 12:00:00 AM,Cyberattack,,,Northshore Utility District,Ransomware,4900.0,Government,,Other,2021,"1,000-9,999",Unknown,
10413,11/16/2020 12:00:00 AM,03/04/2021 12:00:00 AM,Cyberattack,,,Americold Realty Trust,Ransomware,3337.0,Business,Real Estate,Name,2021,"1,000-9,999",Unknown,
10413,11/16/2020 12:00:00 AM,03/04/2021 12:00:00 AM,Cyberattack,,,Americold Realty Trust,Ransomware,3337.0,Business,Real Estate,Social Security Number,2021,"1,000-9,999",Unknown,
10413,11/16/2020 12:00:00 AM,03/04/2021 12:00:00 AM,Cyberattack,,,Americold Realty Trust,Ransomware,3337.0,Business,Real Estate,Driver's License or Washington ID Card Number,2021,"1,000-9,999",Unknown,
10413,11/16/2020 12:00:00 AM,03/04/2021 12:00:00 AM,Cyberattack,,,Americold Realty Trust,Ransomware,3337.0,Business,Real Estate,Financial & Banking Information,2021,"1,000-9,999",Unknown,
10413,11/16/2020 12:00:00 AM,03/04/2021 12:00:00 AM,Cyberattack,,,Americold Realty Trust,Ransomware,3337.0,Business,Real Estate,Full Date of Birth,2021,"1,000-9,999",Unknown,
10413,11/16/2020 12:00:00 AM,03/04/2021 12:00:00 AM,Cyberattack,,,Americold Realty Trust,Ransomware,3337.0,Business,Real Estate,Unique Private Key (e.g. used to authenticate or sign an electronic record),2021,"1,000-9,999",Unknown,
10413,11/16/2020 12:00:00 AM,03/04/2021 12:00:00 AM,Cyberattack,,,Americold Realty Trust,Ransomware,3337.0,Business,Real Estate,Health Insurance Policy or ID Number,2021,"1,000-9,999",Unknown,
10413,11/16/2020 12:00:00 AM,03/04/2021 12:00:00 AM,Cyberattack,,,Americold Realty Trust,Ransomware,3337.0,Business,Real Estate,Medical Information,2021,"1,000-9,999",Unknown,
10413,11/16/2020 12:00:00 AM,03/04/2021 12:00:00 AM,Cyberattack,,,Americold Realty Trust,Ransomware,3337.0,Business,Real Estate,Biometric Data,2021,"1,000-9,999",Unknown,
10413,11/16/2020 12:00:00 AM,03/04/2021 12:00:00 AM,Cyberattack,,,Americold Realty Trust,Ransomware,3337.0,Business,Real Estate,Username and Password/Security Question Answers,2021,"1,000-9,999",Unknown,
10413,11/16/2020 12:00:00 AM,03/04/2021 12:00:00 AM,Cyberattack,,,Americold Realty Trust,Ransomware,3337.0,Business,Real Estate,Other,2021,"1,000-9,999",Unknown,
10415,10/15/2020 12:00:00 AM,04/04/2021 12:00:00 AM,Cyberattack,2020-10-06T00:00:00,2020-10-15T00:00:00,"RXLTC, PLLC & Prescription Pharmacy, PLLC",Phishing,560.0,Health,,Name,2021,500-999,1-99,
10415,10/15/2020 12:00:00 AM,04/04/2021 12:00:00 AM,Cyberattack,2020-10-06T00:00:00,2020-10-15T00:00:00,"RXLTC, PLLC & Prescription Pharmacy, PLLC",Phishing,560.0,Health,,Social Security Number,2021,500-999,1-99,
10415,10/15/2020 12:00:00 AM,04/04/2021 12:00:00 AM,Cyberattack,2020-10-06T00:00:00,2020-10-15T00:00:00,"RXLTC, PLLC & Prescription Pharmacy, PLLC",Phishing,560.0,Health,,Driver's License or Washington ID Card Number,2021,500-999,1-99,
10415,10/15/2020 12:00:00 AM,04/04/2021 12:00:00 AM,Cyberattack,2020-10-06T00:00:00,2020-10-15T00:00:00,"RXLTC, PLLC & Prescription Pharmacy, PLLC",Phishing,560.0,Health,,Financial & Banking Information,2021,500-999,1-99,
10415,10/15/2020 12:00:00 AM,04/04/2021 12:00:00 AM,Cyberattack,2020-10-06T00:00:00,2020-10-15T00:00:00,"RXLTC, PLLC & Prescription Pharmacy, PLLC",Phishing,560.0,Health,,Full Date of Birth,2021,500-999,1-99,
10415,10/15/2020 12:00:00 AM,04/04/2021 12:00:00 AM,Cyberattack,2020-10-06T00:00:00,2020-10-15T00:00:00,"RXLTC, PLLC & Prescription Pharmacy, PLLC",Phishing,560.0,Health,,Medical Information,2021,500-999,1-99,
10415,10/15/2020 12:00:00 AM,04/04/2021 12:00:00 AM,Cyberattack,2020-10-06T00:00:00,2020-10-15T00:00:00,"RXLTC, PLLC & Prescription Pharmacy, PLLC",Phishing,560.0,Health,,Other,2021,500-999,1-99,
10416,10/16/2019 12:00:00 AM,11/14/2019 12:00:00 AM,Unauthorized Access,2019-07-09T00:00:00,2019-10-09T00:00:00,"Green Roads of Florida, LLC",,540.0,Business,Consumable,Name,2020,500-999,1-99,
10416,10/16/2019 12:00:00 AM,11/14/2019 12:00:00 AM,Unauthorized Access,2019-07-09T00:00:00,2019-10-09T00:00:00,"Green Roads of Florida, LLC",,540.0,Business,Consumable,Financial & Banking Information,2020,500-999,1-99,
10418,01/19/2021 12:00:00 AM,03/05/2021 12:00:00 AM,Cyberattack,2020-12-01T00:00:00,2021-01-20T00:00:00,Metromile Insurance Company,Malware,1400.0,Finance,,Name,2021,"1,000-9,999",1-99,
10418,01/19/2021 12:00:00 AM,03/05/2021 12:00:00 AM,Cyberattack,2020-12-01T00:00:00,2021-01-20T00:00:00,Metromile Insurance Company,Malware,1400.0,Finance,,Driver's License or Washington ID Card Number,2021,"1,000-9,999",1-99,
10418,01/19/2021 12:00:00 AM,03/05/2021 12:00:00 AM,Cyberattack,2020-12-01T00:00:00,2021-01-20T00:00:00,Metromile Insurance Company,Malware,1400.0,Finance,,Full Date of Birth,2021,"1,000-9,999",1-99,
10419,11/20/2020 12:00:00 AM,03/10/2021 12:00:00 AM,Unauthorized Access,2020-11-07T00:00:00,2020-11-08T00:00:00,"Mead Johnson & Company, LLC",,2828.0,Business,Consumable,Name,2021,"1,000-9,999",1-99,
10419,11/20/2020 12:00:00 AM,03/10/2021 12:00:00 AM,Unauthorized Access,2020-11-07T00:00:00,2020-11-08T00:00:00,"Mead Johnson & Company, LLC",,2828.0,Business,Consumable,Full Date of Birth,2021,"1,000-9,999",1-99,
10420,02/04/2021 12:00:00 AM,03/10/2021 12:00:00 AM,Cyberattack,,,Public Utility District No. 1 of Skagit County,Ransomware,23935.0,Government,,Name,2021,"10,000-49,999",Unknown,
10420,02/04/2021 12:00:00 AM,03/10/2021 12:00:00 AM,Cyberattack,,,Public Utility District No. 1 of Skagit County,Ransomware,23935.0,Government,,Financial & Banking Information,2021,"10,000-49,999",Unknown,
10420,02/04/2021 12:00:00 AM,03/10/2021 12:00:00 AM,Cyberattack,,,Public Utility District No. 1 of Skagit County,Ransomware,23935.0,Government,,Other,2021,"10,000-49,999",Unknown,
10421,03/09/2021 12:00:00 AM,03/11/2021 12:00:00 AM,Cyberattack,,,Pan-American Life Insurance Group,Phishing,599.0,Finance,,Name,2021,500-999,Unknown,
10421,03/09/2021 12:00:00 AM,03/11/2021 12:00:00 AM,Cyberattack,,,Pan-American Life Insurance Group,Phishing,599.0,Finance,,Social Security Number,2021,500-999,Unknown,
10421,03/09/2021 12:00:00 AM,03/11/2021 12:00:00 AM,Cyberattack,,,Pan-American Life Insurance Group,Phishing,599.0,Finance,,Driver's License or Washington ID Card Number,2021,500-999,Unknown,
10421,03/09/2021 12:00:00 AM,03/11/2021 12:00:00 AM,Cyberattack,,,Pan-American Life Insurance Group,Phishing,599.0,Finance,,Financial & Banking Information,2021,500-999,Unknown,
10421,03/09/2021 12:00:00 AM,03/11/2021 12:00:00 AM,Cyberattack,,,Pan-American Life Insurance Group,Phishing,599.0,Finance,,Full Date of Birth,2021,500-999,Unknown,
10421,03/09/2021 12:00:00 AM,03/11/2021 12:00:00 AM,Cyberattack,,,Pan-American Life Insurance Group,Phishing,599.0,Finance,,Passport Number,2021,500-999,Unknown,
10421,03/09/2021 12:00:00 AM,03/11/2021 12:00:00 AM,Cyberattack,,,Pan-American Life Insurance Group,Phishing,599.0,Finance,,Medical Information,2021,500-999,Unknown,
10421,03/09/2021 12:00:00 AM,03/11/2021 12:00:00 AM,Cyberattack,,,Pan-American Life Insurance Group,Phishing,599.0,Finance,,Other,2021,500-999,Unknown,
10422,12/03/2020 12:00:00 AM,03/11/2021 12:00:00 AM,Cyberattack,2020-11-08T00:00:00,2020-12-03T00:00:00,Perkins & Co,Ransomware,41871.0,Finance,,Name,2021,"10,000-49,999",1-99,
10422,12/03/2020 12:00:00 AM,03/11/2021 12:00:00 AM,Cyberattack,2020-11-08T00:00:00,2020-12-03T00:00:00,Perkins & Co,Ransomware,41871.0,Finance,,Social Security Number,2021,"10,000-49,999",1-99,
10422,12/03/2020 12:00:00 AM,03/11/2021 12:00:00 AM,Cyberattack,2020-11-08T00:00:00,2020-12-03T00:00:00,Perkins & Co,Ransomware,41871.0,Finance,,Driver's License or Washington ID Card Number,2021,"10,000-49,999",1-99,
10422,12/03/2020 12:00:00 AM,03/11/2021 12:00:00 AM,Cyberattack,2020-11-08T00:00:00,2020-12-03T00:00:00,Perkins & Co,Ransomware,41871.0,Finance,,Financial & Banking Information,2021,"10,000-49,999",1-99,
10422,12/03/2020 12:00:00 AM,03/11/2021 12:00:00 AM,Cyberattack,2020-11-08T00:00:00,2020-12-03T00:00:00,Perkins & Co,Ransomware,41871.0,Finance,,Full Date of Birth,2021,"10,000-49,999",1-99,
10422,12/03/2020 12:00:00 AM,03/11/2021 12:00:00 AM,Cyberattack,2020-11-08T00:00:00,2020-12-03T00:00:00,Perkins & Co,Ransomware,41871.0,Finance,,Passport Number,2021,"10,000-49,999",1-99,
10422,12/03/2020 12:00:00 AM,03/11/2021 12:00:00 AM,Cyberattack,2020-11-08T00:00:00,2020-12-03T00:00:00,Perkins & Co,Ransomware,41871.0,Finance,,Other,2021,"10,000-49,999",1-99,
10423,06/01/2020 12:00:00 AM,03/11/2021 12:00:00 AM,Cyberattack,,,Security Industry Specialists,Ransomware,2264.0,Business,Other,Name,2021,"1,000-9,999",Unknown,
10423,06/01/2020 12:00:00 AM,03/11/2021 12:00:00 AM,Cyberattack,,,Security Industry Specialists,Ransomware,2264.0,Business,Other,Financial & Banking Information,2021,"1,000-9,999",Unknown,
10424,11/29/2020 12:00:00 AM,03/15/2021 12:00:00 AM,Cyberattack,,,American Health Care Academy,Malware,1211.0,Health,,Name,2021,"1,000-9,999",Unknown,
10424,11/29/2020 12:00:00 AM,03/15/2021 12:00:00 AM,Cyberattack,,,American Health Care Academy,Malware,1211.0,Health,,Financial & Banking Information,2021,"1,000-9,999",Unknown,
10425,01/24/2021 12:00:00 AM,03/15/2021 12:00:00 AM,Cyberattack,,,"Flagstar Bank, FSB",Malware,61006.0,Finance,,Name,2021,"50,000-999,999",Unknown,
10425,01/24/2021 12:00:00 AM,03/15/2021 12:00:00 AM,Cyberattack,,,"Flagstar Bank, FSB",Malware,61006.0,Finance,,Social Security Number,2021,"50,000-999,999",Unknown,
10425,01/24/2021 12:00:00 AM,03/15/2021 12:00:00 AM,Cyberattack,,,"Flagstar Bank, FSB",Malware,61006.0,Finance,,Full Date of Birth,2021,"50,000-999,999",Unknown,
10425,01/24/2021 12:00:00 AM,03/15/2021 12:00:00 AM,Cyberattack,,,"Flagstar Bank, FSB",Malware,61006.0,Finance,,Other,2021,"50,000-999,999",Unknown,
10426,12/26/2020 12:00:00 AM,03/16/2021 12:00:00 AM,Unauthorized Access,,2020-12-26T00:00:00,Infinity Insurance Company,,606.0,Finance,,Name,2021,500-999,Unknown,
10426,12/26/2020 12:00:00 AM,03/16/2021 12:00:00 AM,Unauthorized Access,,2020-12-26T00:00:00,Infinity Insurance Company,,606.0,Finance,,Social Security Number,2021,500-999,Unknown,
10426,12/26/2020 12:00:00 AM,03/16/2021 12:00:00 AM,Unauthorized Access,,2020-12-26T00:00:00,Infinity Insurance Company,,606.0,Finance,,Driver's License or Washington ID Card Number,2021,500-999,Unknown,
10427,02/04/2021 12:00:00 AM,03/17/2021 12:00:00 AM,Cyberattack,2021-02-04T00:00:00,2021-02-08T00:00:00,Automatic Funds Transfer Services Inc.,Ransomware,695.0,Finance,,Name,2021,500-999,1-99,
10427,02/04/2021 12:00:00 AM,03/17/2021 12:00:00 AM,Cyberattack,2021-02-04T00:00:00,2021-02-08T00:00:00,Automatic Funds Transfer Services Inc.,Ransomware,695.0,Finance,,Financial & Banking Information,2021,500-999,1-99,
10427,02/04/2021 12:00:00 AM,03/17/2021 12:00:00 AM,Cyberattack,2021-02-04T00:00:00,2021-02-08T00:00:00,Automatic Funds Transfer Services Inc.,Ransomware,695.0,Finance,,Other,2021,500-999,1-99,
10428,12/20/2019 12:00:00 AM,03/17/2021 12:00:00 AM,Cyberattack,,,PCS Revenue Control Systems,Phishing,11807.0,Business,Professional Services,Name,2021,"10,000-49,999",Unknown,
10428,12/20/2019 12:00:00 AM,03/17/2021 12:00:00 AM,Cyberattack,,,PCS Revenue Control Systems,Phishing,11807.0,Business,Professional Services,Social Security Number,2021,"10,000-49,999",Unknown,
10428,12/20/2019 12:00:00 AM,03/17/2021 12:00:00 AM,Cyberattack,,,PCS Revenue Control Systems,Phishing,11807.0,Business,Professional Services,Full Date of Birth,2021,"10,000-49,999",Unknown,
10428,12/20/2019 12:00:00 AM,03/17/2021 12:00:00 AM,Cyberattack,,,PCS Revenue Control Systems,Phishing,11807.0,Business,Professional Services,Student ID Number,2021,"10,000-49,999",Unknown,
10429,02/22/2021 12:00:00 AM,03/17/2021 12:00:00 AM,Cyberattack,2020-12-24T00:00:00,2020-12-29T00:00:00,Western Union Retail Money Transfer Partner,Malware,1555.0,Finance,,Name,2021,"1,000-9,999",1-99,
10429,02/22/2021 12:00:00 AM,03/17/2021 12:00:00 AM,Cyberattack,2020-12-24T00:00:00,2020-12-29T00:00:00,Western Union Retail Money Transfer Partner,Malware,1555.0,Finance,,Social Security Number,2021,"1,000-9,999",1-99,
10429,02/22/2021 12:00:00 AM,03/17/2021 12:00:00 AM,Cyberattack,2020-12-24T00:00:00,2020-12-29T00:00:00,Western Union Retail Money Transfer Partner,Malware,1555.0,Finance,,Driver's License or Washington ID Card Number,2021,"1,000-9,999",1-99,
10429,02/22/2021 12:00:00 AM,03/17/2021 12:00:00 AM,Cyberattack,2020-12-24T00:00:00,2020-12-29T00:00:00,Western Union Retail Money Transfer Partner,Malware,1555.0,Finance,,Full Date of Birth,2021,"1,000-9,999",1-99,
10429,02/22/2021 12:00:00 AM,03/17/2021 12:00:00 AM,Cyberattack,2020-12-24T00:00:00,2020-12-29T00:00:00,Western Union Retail Money Transfer Partner,Malware,1555.0,Finance,,Other,2021,"1,000-9,999",1-99,
10430,05/24/2020 12:00:00 AM,03/18/2021 12:00:00 AM,Cyberattack,2020-05-24T00:00:00,,Manson Counstruction Co.,Unclear/unknown,1049.0,Business,Construction,Name,2021,"1,000-9,999",Unknown,
10430,05/24/2020 12:00:00 AM,03/18/2021 12:00:00 AM,Cyberattack,2020-05-24T00:00:00,,Manson Counstruction Co.,Unclear/unknown,1049.0,Business,Construction,Social Security Number,2021,"1,000-9,999",Unknown,
10430,05/24/2020 12:00:00 AM,03/18/2021 12:00:00 AM,Cyberattack,2020-05-24T00:00:00,,Manson Counstruction Co.,Unclear/unknown,1049.0,Business,Construction,Full Date of Birth,2021,"1,000-9,999",Unknown,
10430,05/24/2020 12:00:00 AM,03/18/2021 12:00:00 AM,Cyberattack,2020-05-24T00:00:00,,Manson Counstruction Co.,Unclear/unknown,1049.0,Business,Construction,Other,2021,"1,000-9,999",Unknown,
10431,01/18/2021 12:00:00 AM,03/19/2021 12:00:00 AM,Cyberattack,2021-01-12T00:00:00,2021-01-18T00:00:00,Cancer Treatment Centers of America,Phishing,579.0,Health,,Name,2021,500-999,1-99,
10431,01/18/2021 12:00:00 AM,03/19/2021 12:00:00 AM,Cyberattack,2021-01-12T00:00:00,2021-01-18T00:00:00,Cancer Treatment Centers of America,Phishing,579.0,Health,,Health Insurance Policy or ID Number,2021,500-999,1-99,
10431,01/18/2021 12:00:00 AM,03/19/2021 12:00:00 AM,Cyberattack,2021-01-12T00:00:00,2021-01-18T00:00:00,Cancer Treatment Centers of America,Phishing,579.0,Health,,Medical Information,2021,500-999,1-99,
10431,01/18/2021 12:00:00 AM,03/19/2021 12:00:00 AM,Cyberattack,2021-01-12T00:00:00,2021-01-18T00:00:00,Cancer Treatment Centers of America,Phishing,579.0,Health,,Other,2021,500-999,1-99,
10432,11/29/2020 12:00:00 AM,03/19/2021 12:00:00 AM,Cyberattack,2020-11-18T00:00:00,2020-11-29T00:00:00,"Citywide Home Loans, LLC",Ransomware,2407.0,Finance,,Name,2021,"1,000-9,999",1-99,
10432,11/29/2020 12:00:00 AM,03/19/2021 12:00:00 AM,Cyberattack,2020-11-18T00:00:00,2020-11-29T00:00:00,"Citywide Home Loans, LLC",Ransomware,2407.0,Finance,,Social Security Number,2021,"1,000-9,999",1-99,
10432,11/29/2020 12:00:00 AM,03/19/2021 12:00:00 AM,Cyberattack,2020-11-18T00:00:00,2020-11-29T00:00:00,"Citywide Home Loans, LLC",Ransomware,2407.0,Finance,,Driver's License or Washington ID Card Number,2021,"1,000-9,999",1-99,
10432,11/29/2020 12:00:00 AM,03/19/2021 12:00:00 AM,Cyberattack,2020-11-18T00:00:00,2020-11-29T00:00:00,"Citywide Home Loans, LLC",Ransomware,2407.0,Finance,,Financial & Banking Information,2021,"1,000-9,999",1-99,
10432,11/29/2020 12:00:00 AM,03/19/2021 12:00:00 AM,Cyberattack,2020-11-18T00:00:00,2020-11-29T00:00:00,"Citywide Home Loans, LLC",Ransomware,2407.0,Finance,,Full Date of Birth,2021,"1,000-9,999",1-99,
10432,11/29/2020 12:00:00 AM,03/19/2021 12:00:00 AM,Cyberattack,2020-11-18T00:00:00,2020-11-29T00:00:00,"Citywide Home Loans, LLC",Ransomware,2407.0,Finance,,Passport Number,2021,"1,000-9,999",1-99,
10432,11/29/2020 12:00:00 AM,03/19/2021 12:00:00 AM,Cyberattack,2020-11-18T00:00:00,2020-11-29T00:00:00,"Citywide Home Loans, LLC",Ransomware,2407.0,Finance,,Health Insurance Policy or ID Number,2021,"1,000-9,999",1-99,
10432,11/29/2020 12:00:00 AM,03/19/2021 12:00:00 AM,Cyberattack,2020-11-18T00:00:00,2020-11-29T00:00:00,"Citywide Home Loans, LLC",Ransomware,2407.0,Finance,,Other,2021,"1,000-9,999",1-99,
10433,02/24/2021 12:00:00 AM,03/22/2021 12:00:00 AM,Theft or Mistake,2021-02-22T00:00:00,2021-02-24T00:00:00,"On Q Fiancial, Inc.",,18066.0,Finance,,Name,2021,"10,000-49,999",1-99,
10433,02/24/2021 12:00:00 AM,03/22/2021 12:00:00 AM,Theft or Mistake,2021-02-22T00:00:00,2021-02-24T00:00:00,"On Q Fiancial, Inc.",,18066.0,Finance,,Social Security Number,2021,"10,000-49,999",1-99,
10433,02/24/2021 12:00:00 AM,03/22/2021 12:00:00 AM,Theft or Mistake,2021-02-22T00:00:00,2021-02-24T00:00:00,"On Q Fiancial, Inc.",,18066.0,Finance,,Other,2021,"10,000-49,999",1-99,
10435,03/02/2021 12:00:00 AM,04/01/2021 12:00:00 AM,Cyberattack,2021-02-01T00:00:00,,"MHNext, LLC",Unclear/unknown,7714.0,Business,Software,Username and Password/Security Question Answers,2021,"1,000-9,999",Unknown,
10435,03/02/2021 12:00:00 AM,04/01/2021 12:00:00 AM,Cyberattack,2021-02-01T00:00:00,,"MHNext, LLC",Unclear/unknown,7714.0,Business,Software,Email Address and Password/Security Question Answers,2021,"1,000-9,999",Unknown,
10436,08/14/2020 12:00:00 AM,04/02/2021 12:00:00 AM,Cyberattack,,,FPI Management,Unclear/unknown,1022.0,Business,Real Estate,Name,2021,"1,000-9,999",Unknown,
10436,08/14/2020 12:00:00 AM,04/02/2021 12:00:00 AM,Cyberattack,,,FPI Management,Unclear/unknown,1022.0,Business,Real Estate,Social Security Number,2021,"1,000-9,999",Unknown,
10436,08/14/2020 12:00:00 AM,04/02/2021 12:00:00 AM,Cyberattack,,,FPI Management,Unclear/unknown,1022.0,Business,Real Estate,Driver's License or Washington ID Card Number,2021,"1,000-9,999",Unknown,
10436,08/14/2020 12:00:00 AM,04/02/2021 12:00:00 AM,Cyberattack,,,FPI Management,Unclear/unknown,1022.0,Business,Real Estate,Financial & Banking Information,2021,"1,000-9,999",Unknown,
10436,08/14/2020 12:00:00 AM,04/02/2021 12:00:00 AM,Cyberattack,,,FPI Management,Unclear/unknown,1022.0,Business,Real Estate,Full Date of Birth,2021,"1,000-9,999",Unknown,
10436,08/14/2020 12:00:00 AM,04/02/2021 12:00:00 AM,Cyberattack,,,FPI Management,Unclear/unknown,1022.0,Business,Real Estate,Unique Private Key (e.g. used to authenticate or sign an electronic record),2021,"1,000-9,999",Unknown,
10436,08/14/2020 12:00:00 AM,04/02/2021 12:00:00 AM,Cyberattack,,,FPI Management,Unclear/unknown,1022.0,Business,Real Estate,Medical Information,2021,"1,000-9,999",Unknown,
10436,08/14/2020 12:00:00 AM,04/02/2021 12:00:00 AM,Cyberattack,,,FPI Management,Unclear/unknown,1022.0,Business,Real Estate,Username and Password/Security Question Answers,2021,"1,000-9,999",Unknown,
10436,08/14/2020 12:00:00 AM,04/02/2021 12:00:00 AM,Cyberattack,,,FPI Management,Unclear/unknown,1022.0,Business,Real Estate,Other,2021,"1,000-9,999",Unknown,
10437,01/07/2021 12:00:00 AM,04/02/2021 12:00:00 AM,Cyberattack,2020-03-01T00:00:00,2021-01-07T00:00:00,"Slate & Tell, LLC",Malware,624.0,Business,Accessories,Name,2021,500-999,300-399,
10437,01/07/2021 12:00:00 AM,04/02/2021 12:00:00 AM,Cyberattack,2020-03-01T00:00:00,2021-01-07T00:00:00,"Slate & Tell, LLC",Malware,624.0,Business,Accessories,Financial & Banking Information,2021,500-999,300-399,
10437,01/07/2021 12:00:00 AM,04/02/2021 12:00:00 AM,Cyberattack,2020-03-01T00:00:00,2021-01-07T00:00:00,"Slate & Tell, LLC",Malware,624.0,Business,Accessories,Other,2021,500-999,300-399,
10439,12/29/2020 12:00:00 AM,04/06/2021 12:00:00 AM,Cyberattack,2020-11-25T00:00:00,2020-12-25T00:00:00,"Minnetonka Moccasin Company, Inc.",Malware,821.0,Business,Accessories,Name,2021,500-999,1-99,
10439,12/29/2020 12:00:00 AM,04/06/2021 12:00:00 AM,Cyberattack,2020-11-25T00:00:00,2020-12-25T00:00:00,"Minnetonka Moccasin Company, Inc.",Malware,821.0,Business,Accessories,Financial & Banking Information,2021,500-999,1-99,
10441,03/11/2021 12:00:00 AM,04/07/2021 12:00:00 AM,Cyberattack,2020-03-30T00:00:00,2020-11-06T00:00:00,American Society for Clinical Pathology,Malware,703.0,Health,,Name,2021,500-999,300-399,
10441,03/11/2021 12:00:00 AM,04/07/2021 12:00:00 AM,Cyberattack,2020-03-30T00:00:00,2020-11-06T00:00:00,American Society for Clinical Pathology,Malware,703.0,Health,,Financial & Banking Information,2021,500-999,300-399,
10442,11/24/2020 12:00:00 AM,04/08/2021 12:00:00 AM,Cyberattack,,,MailMyPrescriptions.com,Phishing,507.0,Health,,Name,2021,500-999,Unknown,
10442,11/24/2020 12:00:00 AM,04/08/2021 12:00:00 AM,Cyberattack,,,MailMyPrescriptions.com,Phishing,507.0,Health,,Full Date of Birth,2021,500-999,Unknown,
10442,11/24/2020 12:00:00 AM,04/08/2021 12:00:00 AM,Cyberattack,,,MailMyPrescriptions.com,Phishing,507.0,Health,,Health Insurance Policy or ID Number,2021,500-999,Unknown,
10442,11/24/2020 12:00:00 AM,04/08/2021 12:00:00 AM,Cyberattack,,,MailMyPrescriptions.com,Phishing,507.0,Health,,Medical Information,2021,500-999,Unknown,
10442,11/24/2020 12:00:00 AM,04/08/2021 12:00:00 AM,Cyberattack,,,MailMyPrescriptions.com,Phishing,507.0,Health,,Other,2021,500-999,Unknown,
10443,11/08/2020 12:00:00 AM,04/08/2021 12:00:00 AM,Cyberattack,,,Nexelis Group,Ransomware,957.0,Health,,Name,2021,500-999,Unknown,
10443,11/08/2020 12:00:00 AM,04/08/2021 12:00:00 AM,Cyberattack,,,Nexelis Group,Ransomware,957.0,Health,,Social Security Number,2021,500-999,Unknown,
10443,11/08/2020 12:00:00 AM,04/08/2021 12:00:00 AM,Cyberattack,,,Nexelis Group,Ransomware,957.0,Health,,Driver's License or Washington ID Card Number,2021,500-999,Unknown,
10443,11/08/2020 12:00:00 AM,04/08/2021 12:00:00 AM,Cyberattack,,,Nexelis Group,Ransomware,957.0,Health,,Financial & Banking Information,2021,500-999,Unknown,
10443,11/08/2020 12:00:00 AM,04/08/2021 12:00:00 AM,Cyberattack,,,Nexelis Group,Ransomware,957.0,Health,,Full Date of Birth,2021,500-999,Unknown,
10443,11/08/2020 12:00:00 AM,04/08/2021 12:00:00 AM,Cyberattack,,,Nexelis Group,Ransomware,957.0,Health,,Unique Private Key (e.g. used to authenticate or sign an electronic record),2021,500-999,Unknown,
10443,11/08/2020 12:00:00 AM,04/08/2021 12:00:00 AM,Cyberattack,,,Nexelis Group,Ransomware,957.0,Health,,Passport Number,2021,500-999,Unknown,
10443,11/08/2020 12:00:00 AM,04/08/2021 12:00:00 AM,Cyberattack,,,Nexelis Group,Ransomware,957.0,Health,,Health Insurance Policy or ID Number,2021,500-999,Unknown,
10443,11/08/2020 12:00:00 AM,04/08/2021 12:00:00 AM,Cyberattack,,,Nexelis Group,Ransomware,957.0,Health,,Medical Information,2021,500-999,Unknown,
10443,11/08/2020 12:00:00 AM,04/08/2021 12:00:00 AM,Cyberattack,,,Nexelis Group,Ransomware,957.0,Health,,Email Address and Password/Security Question Answers,2021,500-999,Unknown,
10444,09/07/2020 12:00:00 AM,04/09/2021 12:00:00 AM,Cyberattack,2020-04-08T00:00:00,2020-09-21T00:00:00,American College of Emergency Physicians,Unclear/unknown,4148.0,Health,,Name,2021,"1,000-9,999",100-199,
10444,09/07/2020 12:00:00 AM,04/09/2021 12:00:00 AM,Cyberattack,2020-04-08T00:00:00,2020-09-21T00:00:00,American College of Emergency Physicians,Unclear/unknown,4148.0,Health,,Social Security Number,2021,"1,000-9,999",100-199,
10444,09/07/2020 12:00:00 AM,04/09/2021 12:00:00 AM,Cyberattack,2020-04-08T00:00:00,2020-09-21T00:00:00,American College of Emergency Physicians,Unclear/unknown,4148.0,Health,,Financial & Banking Information,2021,"1,000-9,999",100-199,
10444,09/07/2020 12:00:00 AM,04/09/2021 12:00:00 AM,Cyberattack,2020-04-08T00:00:00,2020-09-21T00:00:00,American College of Emergency Physicians,Unclear/unknown,4148.0,Health,,Full Date of Birth,2021,"1,000-9,999",100-199,
10444,09/07/2020 12:00:00 AM,04/09/2021 12:00:00 AM,Cyberattack,2020-04-08T00:00:00,2020-09-21T00:00:00,American College of Emergency Physicians,Unclear/unknown,4148.0,Health,,Username and Password/Security Question Answers,2021,"1,000-9,999",100-199,
10444,09/07/2020 12:00:00 AM,04/09/2021 12:00:00 AM,Cyberattack,2020-04-08T00:00:00,2020-09-21T00:00:00,American College of Emergency Physicians,Unclear/unknown,4148.0,Health,,Email Address and Password/Security Question Answers,2021,"1,000-9,999",100-199,
10444,09/07/2020 12:00:00 AM,04/09/2021 12:00:00 AM,Cyberattack,2020-04-08T00:00:00,2020-09-21T00:00:00,American College of Emergency Physicians,Unclear/unknown,4148.0,Health,,Other,2021,"1,000-9,999",100-199,
10445,01/11/2021 12:00:00 AM,04/09/2021 12:00:00 AM,Cyberattack,,,"McDougall & Sons, Inc.",Ransomware,5885.0,Business,Other,Name,2021,"1,000-9,999",Unknown,
10445,01/11/2021 12:00:00 AM,04/09/2021 12:00:00 AM,Cyberattack,,,"McDougall & Sons, Inc.",Ransomware,5885.0,Business,Other,Social Security Number,2021,"1,000-9,999",Unknown,
10445,01/11/2021 12:00:00 AM,04/09/2021 12:00:00 AM,Cyberattack,,,"McDougall & Sons, Inc.",Ransomware,5885.0,Business,Other,Full Date of Birth,2021,"1,000-9,999",Unknown,
10446,02/11/2021 12:00:00 AM,04/13/2021 12:00:00 AM,Cyberattack,,,FloForm Industries LLC,Ransomware,970.0,Business,Home,Name,2021,500-999,Unknown,
10446,02/11/2021 12:00:00 AM,04/13/2021 12:00:00 AM,Cyberattack,,,FloForm Industries LLC,Ransomware,970.0,Business,Home,Social Security Number,2021,500-999,Unknown,
10446,02/11/2021 12:00:00 AM,04/13/2021 12:00:00 AM,Cyberattack,,,FloForm Industries LLC,Ransomware,970.0,Business,Home,Other,2021,500-999,Unknown,
10447,01/25/2021 12:00:00 AM,04/13/2021 12:00:00 AM,Cyberattack,2021-01-06T00:00:00,2021-01-25T00:00:00,University of Colorado,Malware,3511.0,Education,,Name,2021,"1,000-9,999",1-99,
10447,01/25/2021 12:00:00 AM,04/13/2021 12:00:00 AM,Cyberattack,2021-01-06T00:00:00,2021-01-25T00:00:00,University of Colorado,Malware,3511.0,Education,,Full Date of Birth,2021,"1,000-9,999",1-99,
10447,01/25/2021 12:00:00 AM,04/13/2021 12:00:00 AM,Cyberattack,2021-01-06T00:00:00,2021-01-25T00:00:00,University of Colorado,Malware,3511.0,Education,,Student ID Number,2021,"1,000-9,999",1-99,
10447,01/25/2021 12:00:00 AM,04/13/2021 12:00:00 AM,Cyberattack,2021-01-06T00:00:00,2021-01-25T00:00:00,University of Colorado,Malware,3511.0,Education,,Health Insurance Policy or ID Number,2021,"1,000-9,999",1-99,
10447,01/25/2021 12:00:00 AM,04/13/2021 12:00:00 AM,Cyberattack,2021-01-06T00:00:00,2021-01-25T00:00:00,University of Colorado,Malware,3511.0,Education,,Medical Information,2021,"1,000-9,999",1-99,
10448,04/12/2021 12:00:00 AM,04/15/2021 12:00:00 AM,Cyberattack,2020-12-02T00:00:00,2020-12-10T00:00:00,"AmeriFirst Financial, Inc.",Unclear/unknown,757.0,Finance,,Name,2021,500-999,100-199,
10448,04/12/2021 12:00:00 AM,04/15/2021 12:00:00 AM,Cyberattack,2020-12-02T00:00:00,2020-12-10T00:00:00,"AmeriFirst Financial, Inc.",Unclear/unknown,757.0,Finance,,Social Security Number,2021,500-999,100-199,
10448,04/12/2021 12:00:00 AM,04/15/2021 12:00:00 AM,Cyberattack,2020-12-02T00:00:00,2020-12-10T00:00:00,"AmeriFirst Financial, Inc.",Unclear/unknown,757.0,Finance,,Driver's License or Washington ID Card Number,2021,500-999,100-199,
10448,04/12/2021 12:00:00 AM,04/15/2021 12:00:00 AM,Cyberattack,2020-12-02T00:00:00,2020-12-10T00:00:00,"AmeriFirst Financial, Inc.",Unclear/unknown,757.0,Finance,,Financial & Banking Information,2021,500-999,100-199,
10448,04/12/2021 12:00:00 AM,04/15/2021 12:00:00 AM,Cyberattack,2020-12-02T00:00:00,2020-12-10T00:00:00,"AmeriFirst Financial, Inc.",Unclear/unknown,757.0,Finance,,Full Date of Birth,2021,500-999,100-199,
10448,04/12/2021 12:00:00 AM,04/15/2021 12:00:00 AM,Cyberattack,2020-12-02T00:00:00,2020-12-10T00:00:00,"AmeriFirst Financial, Inc.",Unclear/unknown,757.0,Finance,,Passport Number,2021,500-999,100-199,
10449,03/18/2021 12:00:00 AM,04/19/2021 12:00:00 AM,Cyberattack,2021-01-07T00:00:00,2021-04-11T00:00:00,"Blade HQ, LLC",Malware,3090.0,Business,Retail,Name,2021,"1,000-9,999",1-99,
10449,03/18/2021 12:00:00 AM,04/19/2021 12:00:00 AM,Cyberattack,2021-01-07T00:00:00,2021-04-11T00:00:00,"Blade HQ, LLC",Malware,3090.0,Business,Retail,Financial & Banking Information,2021,"1,000-9,999",1-99,
10449,03/18/2021 12:00:00 AM,04/19/2021 12:00:00 AM,Cyberattack,2021-01-07T00:00:00,2021-04-11T00:00:00,"Blade HQ, LLC",Malware,3090.0,Business,Retail,Other,2021,"1,000-9,999",1-99,
10451,04/17/2021 12:00:00 AM,04/28/2021 12:00:00 AM,Unauthorized Access,2015-09-17T00:00:00,2021-04-17T00:00:00,"ClearVoice Research.com, LLC",,21564.0,Business,Professional Services,Name,2021,"10,000-49,999",500+,
10451,04/17/2021 12:00:00 AM,04/28/2021 12:00:00 AM,Unauthorized Access,2015-09-17T00:00:00,2021-04-17T00:00:00,"ClearVoice Research.com, LLC",,21564.0,Business,Professional Services,Full Date of Birth,2021,"10,000-49,999",500+,
10451,04/17/2021 12:00:00 AM,04/28/2021 12:00:00 AM,Unauthorized Access,2015-09-17T00:00:00,2021-04-17T00:00:00,"ClearVoice Research.com, LLC",,21564.0,Business,Professional Services,Email Address and Password/Security Question Answers,2021,"10,000-49,999",500+,
10451,04/17/2021 12:00:00 AM,04/28/2021 12:00:00 AM,Unauthorized Access,2015-09-17T00:00:00,2021-04-17T00:00:00,"ClearVoice Research.com, LLC",,21564.0,Business,Professional Services,Other,2021,"10,000-49,999",500+,
10453,02/27/2021 12:00:00 AM,04/29/2021 12:00:00 AM,Unauthorized Access,2021-02-27T00:00:00,,Insurance Technologies Corporation,,3925.0,Business,Software,Name,2021,"1,000-9,999",Unknown,
10453,02/27/2021 12:00:00 AM,04/29/2021 12:00:00 AM,Unauthorized Access,2021-02-27T00:00:00,,Insurance Technologies Corporation,,3925.0,Business,Software,Social Security Number,2021,"1,000-9,999",Unknown,
10453,02/27/2021 12:00:00 AM,04/29/2021 12:00:00 AM,Unauthorized Access,2021-02-27T00:00:00,,Insurance Technologies Corporation,,3925.0,Business,Software,Driver's License or Washington ID Card Number,2021,"1,000-9,999",Unknown,
10453,02/27/2021 12:00:00 AM,04/29/2021 12:00:00 AM,Unauthorized Access,2021-02-27T00:00:00,,Insurance Technologies Corporation,,3925.0,Business,Software,Full Date of Birth,2021,"1,000-9,999",Unknown,
10453,02/27/2021 12:00:00 AM,04/29/2021 12:00:00 AM,Unauthorized Access,2021-02-27T00:00:00,,Insurance Technologies Corporation,,3925.0,Business,Software,Username and Password/Security Question Answers,2021,"1,000-9,999",Unknown,
10454,01/07/2021 12:00:00 AM,04/30/2021 12:00:00 AM,Cyberattack,2020-11-03T00:00:00,2020-12-07T00:00:00,Kettle Cuisine,Ransomware,950.0,Business,Consumable,Name,2021,500-999,1-99,
10454,01/07/2021 12:00:00 AM,04/30/2021 12:00:00 AM,Cyberattack,2020-11-03T00:00:00,2020-12-07T00:00:00,Kettle Cuisine,Ransomware,950.0,Business,Consumable,Social Security Number,2021,500-999,1-99,
10454,01/07/2021 12:00:00 AM,04/30/2021 12:00:00 AM,Cyberattack,2020-11-03T00:00:00,2020-12-07T00:00:00,Kettle Cuisine,Ransomware,950.0,Business,Consumable,Driver's License or Washington ID Card Number,2021,500-999,1-99,
10454,01/07/2021 12:00:00 AM,04/30/2021 12:00:00 AM,Cyberattack,2020-11-03T00:00:00,2020-12-07T00:00:00,Kettle Cuisine,Ransomware,950.0,Business,Consumable,Full Date of Birth,2021,500-999,1-99,
10454,01/07/2021 12:00:00 AM,04/30/2021 12:00:00 AM,Cyberattack,2020-11-03T00:00:00,2020-12-07T00:00:00,Kettle Cuisine,Ransomware,950.0,Business,Consumable,Health Insurance Policy or ID Number,2021,500-999,1-99,
10455,03/10/2021 12:00:00 AM,05/03/2021 12:00:00 AM,Cyberattack,2020-12-01T00:00:00,2021-03-08T00:00:00,"Divvy Up, Inc.",Malware,1137.0,Business,Software,Name,2021,"1,000-9,999",1-99,FL
10455,03/10/2021 12:00:00 AM,05/03/2021 12:00:00 AM,Cyberattack,2020-12-01T00:00:00,2021-03-08T00:00:00,"Divvy Up, Inc.",Malware,1137.0,Business,Software,Financial & Banking Information,2021,"1,000-9,999",1-99,FL
10455,03/10/2021 12:00:00 AM,05/03/2021 12:00:00 AM,Cyberattack,2020-12-01T00:00:00,2021-03-08T00:00:00,"Divvy Up, Inc.",Malware,1137.0,Business,Software,Other,2021,"1,000-9,999",1-99,FL
10457,02/19/2021 12:00:00 AM,05/05/2021 12:00:00 AM,Unauthorized Access,2021-02-06T00:00:00,2021-02-06T00:00:00,NEC Networks dba CaptureRx,,126193.0,Health,,Name,2021,"50,000-999,999",1-99,
10457,02/19/2021 12:00:00 AM,05/05/2021 12:00:00 AM,Unauthorized Access,2021-02-06T00:00:00,2021-02-06T00:00:00,NEC Networks dba CaptureRx,,126193.0,Health,,Full Date of Birth,2021,"50,000-999,999",1-99,
10457,02/19/2021 12:00:00 AM,05/05/2021 12:00:00 AM,Unauthorized Access,2021-02-06T00:00:00,2021-02-06T00:00:00,NEC Networks dba CaptureRx,,126193.0,Health,,Medical Information,2021,"50,000-999,999",1-99,
10458,01/20/2021 12:00:00 AM,05/05/2021 12:00:00 AM,Cyberattack,2020-08-21T00:00:00,2021-01-25T00:00:00,Timberland Regional Library,Phishing,26209.0,Government,,Name,2021,"10,000-49,999",100-199,
10458,01/20/2021 12:00:00 AM,05/05/2021 12:00:00 AM,Cyberattack,2020-08-21T00:00:00,2021-01-25T00:00:00,Timberland Regional Library,Phishing,26209.0,Government,,Social Security Number,2021,"10,000-49,999",100-199,
10458,01/20/2021 12:00:00 AM,05/05/2021 12:00:00 AM,Cyberattack,2020-08-21T00:00:00,2021-01-25T00:00:00,Timberland Regional Library,Phishing,26209.0,Government,,Driver's License or Washington ID Card Number,2021,"10,000-49,999",100-199,
10458,01/20/2021 12:00:00 AM,05/05/2021 12:00:00 AM,Cyberattack,2020-08-21T00:00:00,2021-01-25T00:00:00,Timberland Regional Library,Phishing,26209.0,Government,,Full Date of Birth,2021,"10,000-49,999",100-199,
10458,01/20/2021 12:00:00 AM,05/05/2021 12:00:00 AM,Cyberattack,2020-08-21T00:00:00,2021-01-25T00:00:00,Timberland Regional Library,Phishing,26209.0,Government,,Medical Information,2021,"10,000-49,999",100-199,
10459,03/22/2021 12:00:00 AM,05/07/2021 12:00:00 AM,Cyberattack,2021-03-04T00:00:00,2021-03-22T00:00:00,"JHT Holdings, Inc.",Ransomware,511.0,Business,Transportation,Name,2021,500-999,1-99,
10459,03/22/2021 12:00:00 AM,05/07/2021 12:00:00 AM,Cyberattack,2021-03-04T00:00:00,2021-03-22T00:00:00,"JHT Holdings, Inc.",Ransomware,511.0,Business,Transportation,Social Security Number,2021,500-999,1-99,
10459,03/22/2021 12:00:00 AM,05/07/2021 12:00:00 AM,Cyberattack,2021-03-04T00:00:00,2021-03-22T00:00:00,"JHT Holdings, Inc.",Ransomware,511.0,Business,Transportation,Other,2021,500-999,1-99,
10462,08/13/2020 12:00:00 AM,05/07/2021 12:00:00 AM,Theft or Mistake,,,"Telmate, LLC",,4257.0,Business,Telecommunications,Name,2021,"1,000-9,999",Unknown,
10462,08/13/2020 12:00:00 AM,05/07/2021 12:00:00 AM,Theft or Mistake,,,"Telmate, LLC",,4257.0,Business,Telecommunications,Social Security Number,2021,"1,000-9,999",Unknown,
10462,08/13/2020 12:00:00 AM,05/07/2021 12:00:00 AM,Theft or Mistake,,,"Telmate, LLC",,4257.0,Business,Telecommunications,Driver's License or Washington ID Card Number,2021,"1,000-9,999",Unknown,
10462,08/13/2020 12:00:00 AM,05/07/2021 12:00:00 AM,Theft or Mistake,,,"Telmate, LLC",,4257.0,Business,Telecommunications,Financial & Banking Information,2021,"1,000-9,999",Unknown,
10462,08/13/2020 12:00:00 AM,05/07/2021 12:00:00 AM,Theft or Mistake,,,"Telmate, LLC",,4257.0,Business,Telecommunications,Full Date of Birth,2021,"1,000-9,999",Unknown,
10462,08/13/2020 12:00:00 AM,05/07/2021 12:00:00 AM,Theft or Mistake,,,"Telmate, LLC",,4257.0,Business,Telecommunications,Health Insurance Policy or ID Number,2021,"1,000-9,999",Unknown,
10462,08/13/2020 12:00:00 AM,05/07/2021 12:00:00 AM,Theft or Mistake,,,"Telmate, LLC",,4257.0,Business,Telecommunications,Medical Information,2021,"1,000-9,999",Unknown,
10462,08/13/2020 12:00:00 AM,05/07/2021 12:00:00 AM,Theft or Mistake,,,"Telmate, LLC",,4257.0,Business,Telecommunications,Username and Password/Security Question Answers,2021,"1,000-9,999",Unknown,
10462,08/13/2020 12:00:00 AM,05/07/2021 12:00:00 AM,Theft or Mistake,,,"Telmate, LLC",,4257.0,Business,Telecommunications,Email Address and Password/Security Question Answers,2021,"1,000-9,999",Unknown,
10463,12/13/2020 12:00:00 AM,05/10/2021 12:00:00 AM,Cyberattack,2020-12-13T00:00:00,2020-12-13T00:00:00,"Aspen Education Group, Inc.",Malware,1958.0,Business,Other,Name,2021,"1,000-9,999",0,
10463,12/13/2020 12:00:00 AM,05/10/2021 12:00:00 AM,Cyberattack,2020-12-13T00:00:00,2020-12-13T00:00:00,"Aspen Education Group, Inc.",Malware,1958.0,Business,Other,Social Security Number,2021,"1,000-9,999",0,
10463,12/13/2020 12:00:00 AM,05/10/2021 12:00:00 AM,Cyberattack,2020-12-13T00:00:00,2020-12-13T00:00:00,"Aspen Education Group, Inc.",Malware,1958.0,Business,Other,Full Date of Birth,2021,"1,000-9,999",0,
10463,12/13/2020 12:00:00 AM,05/10/2021 12:00:00 AM,Cyberattack,2020-12-13T00:00:00,2020-12-13T00:00:00,"Aspen Education Group, Inc.",Malware,1958.0,Business,Other,Health Insurance Policy or ID Number,2021,"1,000-9,999",0,
10463,12/13/2020 12:00:00 AM,05/10/2021 12:00:00 AM,Cyberattack,2020-12-13T00:00:00,2020-12-13T00:00:00,"Aspen Education Group, Inc.",Malware,1958.0,Business,Other,Other,2021,"1,000-9,999",0,
10464,01/28/2021 12:00:00 AM,05/10/2021 12:00:00 AM,Cyberattack,2020-11-01T00:00:00,2021-02-01T00:00:00,"Cougar Den, Inc.",Phishing,757.0,Business,Other,Name,2021,500-999,1-99,
10464,01/28/2021 12:00:00 AM,05/10/2021 12:00:00 AM,Cyberattack,2020-11-01T00:00:00,2021-02-01T00:00:00,"Cougar Den, Inc.",Phishing,757.0,Business,Other,Social Security Number,2021,500-999,1-99,
10464,01/28/2021 12:00:00 AM,05/10/2021 12:00:00 AM,Cyberattack,2020-11-01T00:00:00,2021-02-01T00:00:00,"Cougar Den, Inc.",Phishing,757.0,Business,Other,Driver's License or Washington ID Card Number,2021,500-999,1-99,
10464,01/28/2021 12:00:00 AM,05/10/2021 12:00:00 AM,Cyberattack,2020-11-01T00:00:00,2021-02-01T00:00:00,"Cougar Den, Inc.",Phishing,757.0,Business,Other,Financial & Banking Information,2021,500-999,1-99,
10464,01/28/2021 12:00:00 AM,05/10/2021 12:00:00 AM,Cyberattack,2020-11-01T00:00:00,2021-02-01T00:00:00,"Cougar Den, Inc.",Phishing,757.0,Business,Other,Full Date of Birth,2021,500-999,1-99,
10464,01/28/2021 12:00:00 AM,05/10/2021 12:00:00 AM,Cyberattack,2020-11-01T00:00:00,2021-02-01T00:00:00,"Cougar Den, Inc.",Phishing,757.0,Business,Other,Passport Number,2021,500-999,1-99,
10464,01/28/2021 12:00:00 AM,05/10/2021 12:00:00 AM,Cyberattack,2020-11-01T00:00:00,2021-02-01T00:00:00,"Cougar Den, Inc.",Phishing,757.0,Business,Other,Medical Information,2021,500-999,1-99,
10464,01/28/2021 12:00:00 AM,05/10/2021 12:00:00 AM,Cyberattack,2020-11-01T00:00:00,2021-02-01T00:00:00,"Cougar Den, Inc.",Phishing,757.0,Business,Other,Biometric Data,2021,500-999,1-99,
10464,01/28/2021 12:00:00 AM,05/10/2021 12:00:00 AM,Cyberattack,2020-11-01T00:00:00,2021-02-01T00:00:00,"Cougar Den, Inc.",Phishing,757.0,Business,Other,Username and Password/Security Question Answers,2021,500-999,1-99,
10465,03/18/2021 12:00:00 AM,05/13/2021 12:00:00 AM,Cyberattack,2021-02-06T00:00:00,2021-03-19T00:00:00,"American Family Mutual Insurance Company, S.I.",Other,5246.0,Finance,,Name,2021,"1,000-9,999",1-99,
10465,03/18/2021 12:00:00 AM,05/13/2021 12:00:00 AM,Cyberattack,2021-02-06T00:00:00,2021-03-19T00:00:00,"American Family Mutual Insurance Company, S.I.",Other,5246.0,Finance,,Driver's License or Washington ID Card Number,2021,"1,000-9,999",1-99,
10467,02/16/2021 12:00:00 AM,05/19/2021 12:00:00 AM,Unauthorized Access,2021-01-21T00:00:00,2021-02-05T00:00:00,Rehoboth McKinley Christian Health Care Services,,1186.0,Health,,Name,2021,"1,000-9,999",1-99,
10467,02/16/2021 12:00:00 AM,05/19/2021 12:00:00 AM,Unauthorized Access,2021-01-21T00:00:00,2021-02-05T00:00:00,Rehoboth McKinley Christian Health Care Services,,1186.0,Health,,Social Security Number,2021,"1,000-9,999",1-99,
10467,02/16/2021 12:00:00 AM,05/19/2021 12:00:00 AM,Unauthorized Access,2021-01-21T00:00:00,2021-02-05T00:00:00,Rehoboth McKinley Christian Health Care Services,,1186.0,Health,,Driver's License or Washington ID Card Number,2021,"1,000-9,999",1-99,
10467,02/16/2021 12:00:00 AM,05/19/2021 12:00:00 AM,Unauthorized Access,2021-01-21T00:00:00,2021-02-05T00:00:00,Rehoboth McKinley Christian Health Care Services,,1186.0,Health,,Financial & Banking Information,2021,"1,000-9,999",1-99,
10467,02/16/2021 12:00:00 AM,05/19/2021 12:00:00 AM,Unauthorized Access,2021-01-21T00:00:00,2021-02-05T00:00:00,Rehoboth McKinley Christian Health Care Services,,1186.0,Health,,Full Date of Birth,2021,"1,000-9,999",1-99,
10467,02/16/2021 12:00:00 AM,05/19/2021 12:00:00 AM,Unauthorized Access,2021-01-21T00:00:00,2021-02-05T00:00:00,Rehoboth McKinley Christian Health Care Services,,1186.0,Health,,Passport Number,2021,"1,000-9,999",1-99,
10467,02/16/2021 12:00:00 AM,05/19/2021 12:00:00 AM,Unauthorized Access,2021-01-21T00:00:00,2021-02-05T00:00:00,Rehoboth McKinley Christian Health Care Services,,1186.0,Health,,Health Insurance Policy or ID Number,2021,"1,000-9,999",1-99,
10467,02/16/2021 12:00:00 AM,05/19/2021 12:00:00 AM,Unauthorized Access,2021-01-21T00:00:00,2021-02-05T00:00:00,Rehoboth McKinley Christian Health Care Services,,1186.0,Health,,Medical Information,2021,"1,000-9,999",1-99,
10467,02/16/2021 12:00:00 AM,05/19/2021 12:00:00 AM,Unauthorized Access,2021-01-21T00:00:00,2021-02-05T00:00:00,Rehoboth McKinley Christian Health Care Services,,1186.0,Health,,Other,2021,"1,000-9,999",1-99,
10468,04/15/2021 12:00:00 AM,05/21/2021 12:00:00 AM,Cyberattack,,,"Defender Industries, Inc.",Malware,1208.0,Business,Retail,Name,2021,"1,000-9,999",Unknown,
10468,04/15/2021 12:00:00 AM,05/21/2021 12:00:00 AM,Cyberattack,,,"Defender Industries, Inc.",Malware,1208.0,Business,Retail,Financial & Banking Information,2021,"1,000-9,999",Unknown,
10468,04/15/2021 12:00:00 AM,05/21/2021 12:00:00 AM,Cyberattack,,,"Defender Industries, Inc.",Malware,1208.0,Business,Retail,Other,2021,"1,000-9,999",Unknown,
10469,04/25/2021 12:00:00 AM,05/25/2021 12:00:00 AM,Cyberattack,2021-01-07T00:00:00,2021-04-04T00:00:00,Infinity Insurance Company,Other,639.0,Finance,,Name,2021,500-999,100-199,
10469,04/25/2021 12:00:00 AM,05/25/2021 12:00:00 AM,Cyberattack,2021-01-07T00:00:00,2021-04-04T00:00:00,Infinity Insurance Company,Other,639.0,Finance,,Driver's License or Washington ID Card Number,2021,500-999,100-199,
10470,01/15/2021 12:00:00 AM,05/25/2021 12:00:00 AM,Cyberattack,2019-11-01T00:00:00,2020-09-03T00:00:00,"Sugarfina USA, LLC",Malware,1019.0,Business,Consumable,Name,2021,"1,000-9,999",400-499,
10470,01/15/2021 12:00:00 AM,05/25/2021 12:00:00 AM,Cyberattack,2019-11-01T00:00:00,2020-09-03T00:00:00,"Sugarfina USA, LLC",Malware,1019.0,Business,Consumable,Financial & Banking Information,2021,"1,000-9,999",400-499,
10470,01/15/2021 12:00:00 AM,05/25/2021 12:00:00 AM,Cyberattack,2019-11-01T00:00:00,2020-09-03T00:00:00,"Sugarfina USA, LLC",Malware,1019.0,Business,Consumable,Username and Password/Security Question Answers,2021,"1,000-9,999",400-499,
10470,01/15/2021 12:00:00 AM,05/25/2021 12:00:00 AM,Cyberattack,2019-11-01T00:00:00,2020-09-03T00:00:00,"Sugarfina USA, LLC",Malware,1019.0,Business,Consumable,Other,2021,"1,000-9,999",400-499,
10471,12/16/2020 12:00:00 AM,05/27/2021 12:00:00 AM,Cyberattack,2020-05-25T00:00:00,2020-12-16T00:00:00,Accucom Corporation,Malware,6829.0,Business,Professional Services,Name,2021,"1,000-9,999",200-299,
10471,12/16/2020 12:00:00 AM,05/27/2021 12:00:00 AM,Cyberattack,2020-05-25T00:00:00,2020-12-16T00:00:00,Accucom Corporation,Malware,6829.0,Business,Professional Services,Financial & Banking Information,2021,"1,000-9,999",200-299,
10471,12/16/2020 12:00:00 AM,05/27/2021 12:00:00 AM,Cyberattack,2020-05-25T00:00:00,2020-12-16T00:00:00,Accucom Corporation,Malware,6829.0,Business,Professional Services,Other,2021,"1,000-9,999",200-299,
10472,01/11/2021 12:00:00 AM,05/28/2021 12:00:00 AM,Cyberattack,2021-01-11T00:00:00,2021-01-11T00:00:00,"20/20 Eye Care Network, Inc.",Unclear/unknown,690.0,Health,,Name,2021,500-999,0,
10472,01/11/2021 12:00:00 AM,05/28/2021 12:00:00 AM,Cyberattack,2021-01-11T00:00:00,2021-01-11T00:00:00,"20/20 Eye Care Network, Inc.",Unclear/unknown,690.0,Health,,Social Security Number,2021,500-999,0,
10472,01/11/2021 12:00:00 AM,05/28/2021 12:00:00 AM,Cyberattack,2021-01-11T00:00:00,2021-01-11T00:00:00,"20/20 Eye Care Network, Inc.",Unclear/unknown,690.0,Health,,Full Date of Birth,2021,500-999,0,
10472,01/11/2021 12:00:00 AM,05/28/2021 12:00:00 AM,Cyberattack,2021-01-11T00:00:00,2021-01-11T00:00:00,"20/20 Eye Care Network, Inc.",Unclear/unknown,690.0,Health,,Health Insurance Policy or ID Number,2021,500-999,0,
10472,01/11/2021 12:00:00 AM,05/28/2021 12:00:00 AM,Cyberattack,2021-01-11T00:00:00,2021-01-11T00:00:00,"20/20 Eye Care Network, Inc.",Unclear/unknown,690.0,Health,,Other,2021,500-999,0,
10473,01/21/2021 12:00:00 AM,05/28/2021 12:00:00 AM,Unauthorized Access,2021-01-21T00:00:00,2021-01-23T00:00:00,"USA Waste-Management Resources, LLC",,6225.0,Business,Cleaning,Name,2021,"1,000-9,999",1-99,
10473,01/21/2021 12:00:00 AM,05/28/2021 12:00:00 AM,Unauthorized Access,2021-01-21T00:00:00,2021-01-23T00:00:00,"USA Waste-Management Resources, LLC",,6225.0,Business,Cleaning,Social Security Number,2021,"1,000-9,999",1-99,
10473,01/21/2021 12:00:00 AM,05/28/2021 12:00:00 AM,Unauthorized Access,2021-01-21T00:00:00,2021-01-23T00:00:00,"USA Waste-Management Resources, LLC",,6225.0,Business,Cleaning,Driver's License or Washington ID Card Number,2021,"1,000-9,999",1-99,
10473,01/21/2021 12:00:00 AM,05/28/2021 12:00:00 AM,Unauthorized Access,2021-01-21T00:00:00,2021-01-23T00:00:00,"USA Waste-Management Resources, LLC",,6225.0,Business,Cleaning,Full Date of Birth,2021,"1,000-9,999",1-99,
10473,01/21/2021 12:00:00 AM,05/28/2021 12:00:00 AM,Unauthorized Access,2021-01-21T00:00:00,2021-01-23T00:00:00,"USA Waste-Management Resources, LLC",,6225.0,Business,Cleaning,Other,2021,"1,000-9,999",1-99,
10475,06/09/2021 12:00:00 AM,07/06/2021 12:00:00 AM,Theft or Mistake,2021-06-09T00:00:00,,UniBank,,11276.0,Finance,,Name,2021,"10,000-49,999",Unknown,
10475,06/09/2021 12:00:00 AM,07/06/2021 12:00:00 AM,Theft or Mistake,2021-06-09T00:00:00,,UniBank,,11276.0,Finance,,Social Security Number,2021,"10,000-49,999",Unknown,
10475,06/09/2021 12:00:00 AM,07/06/2021 12:00:00 AM,Theft or Mistake,2021-06-09T00:00:00,,UniBank,,11276.0,Finance,,Driver's License or Washington ID Card Number,2021,"10,000-49,999",Unknown,
10476,03/21/2021 12:00:00 AM,07/08/2021 12:00:00 AM,Cyberattack,2021-03-05T00:00:00,2021-03-21T00:00:00,CNA Financial Corporation,Ransomware,823.0,Finance,,Name,2021,500-999,1-99,
10476,03/21/2021 12:00:00 AM,07/08/2021 12:00:00 AM,Cyberattack,2021-03-05T00:00:00,2021-03-21T00:00:00,CNA Financial Corporation,Ransomware,823.0,Finance,,Social Security Number,2021,500-999,1-99,
10476,03/21/2021 12:00:00 AM,07/08/2021 12:00:00 AM,Cyberattack,2021-03-05T00:00:00,2021-03-21T00:00:00,CNA Financial Corporation,Ransomware,823.0,Finance,,Full Date of Birth,2021,500-999,1-99,
10476,03/21/2021 12:00:00 AM,07/08/2021 12:00:00 AM,Cyberattack,2021-03-05T00:00:00,2021-03-21T00:00:00,CNA Financial Corporation,Ransomware,823.0,Finance,,Medical Information,2021,500-999,1-99,
10476,03/21/2021 12:00:00 AM,07/08/2021 12:00:00 AM,Cyberattack,2021-03-05T00:00:00,2021-03-21T00:00:00,CNA Financial Corporation,Ransomware,823.0,Finance,,Other,2021,500-999,1-99,
10478,03/01/2021 12:00:00 AM,06/02/2021 12:00:00 AM,Cyberattack,2021-03-01T00:00:00,2021-03-01T00:00:00,"Asarco, LLC",Ransomware,670.0,Business,Other,Name,2021,500-999,0,
10478,03/01/2021 12:00:00 AM,06/02/2021 12:00:00 AM,Cyberattack,2021-03-01T00:00:00,2021-03-01T00:00:00,"Asarco, LLC",Ransomware,670.0,Business,Other,Social Security Number,2021,500-999,0,
10478,03/01/2021 12:00:00 AM,06/02/2021 12:00:00 AM,Cyberattack,2021-03-01T00:00:00,2021-03-01T00:00:00,"Asarco, LLC",Ransomware,670.0,Business,Other,Driver's License or Washington ID Card Number,2021,500-999,0,
10478,03/01/2021 12:00:00 AM,06/02/2021 12:00:00 AM,Cyberattack,2021-03-01T00:00:00,2021-03-01T00:00:00,"Asarco, LLC",Ransomware,670.0,Business,Other,Financial & Banking Information,2021,500-999,0,
10478,03/01/2021 12:00:00 AM,06/02/2021 12:00:00 AM,Cyberattack,2021-03-01T00:00:00,2021-03-01T00:00:00,"Asarco, LLC",Ransomware,670.0,Business,Other,Full Date of Birth,2021,500-999,0,
10478,03/01/2021 12:00:00 AM,06/02/2021 12:00:00 AM,Cyberattack,2021-03-01T00:00:00,2021-03-01T00:00:00,"Asarco, LLC",Ransomware,670.0,Business,Other,Health Insurance Policy or ID Number,2021,500-999,0,
10478,03/01/2021 12:00:00 AM,06/02/2021 12:00:00 AM,Cyberattack,2021-03-01T00:00:00,2021-03-01T00:00:00,"Asarco, LLC",Ransomware,670.0,Business,Other,Other,2021,500-999,0,
10479,04/25/2021 12:00:00 AM,06/03/2021 12:00:00 AM,Cyberattack,2021-03-22T00:00:00,2021-04-21T00:00:00,Supplemental Income 401(k) Plan,Phishing,1085.0,Finance,,Name,2021,"1,000-9,999",1-99,
10479,04/25/2021 12:00:00 AM,06/03/2021 12:00:00 AM,Cyberattack,2021-03-22T00:00:00,2021-04-21T00:00:00,Supplemental Income 401(k) Plan,Phishing,1085.0,Finance,,Social Security Number,2021,"1,000-9,999",1-99,
10479,04/25/2021 12:00:00 AM,06/03/2021 12:00:00 AM,Cyberattack,2021-03-22T00:00:00,2021-04-21T00:00:00,Supplemental Income 401(k) Plan,Phishing,1085.0,Finance,,Full Date of Birth,2021,"1,000-9,999",1-99,
10479,04/25/2021 12:00:00 AM,06/03/2021 12:00:00 AM,Cyberattack,2021-03-22T00:00:00,2021-04-21T00:00:00,Supplemental Income 401(k) Plan,Phishing,1085.0,Finance,,Other,2021,"1,000-9,999",1-99,
10480,05/07/2021 12:00:00 AM,06/04/2021 12:00:00 AM,Theft or Mistake,2021-05-07T00:00:00,,"Pediatrix Cardiology of Washington, P.C. d/b/a NorthWest Congenital Heart Care",,1136.0,Health,,Name,2021,"1,000-9,999",Unknown,
10480,05/07/2021 12:00:00 AM,06/04/2021 12:00:00 AM,Theft or Mistake,2021-05-07T00:00:00,,"Pediatrix Cardiology of Washington, P.C. d/b/a NorthWest Congenital Heart Care",,1136.0,Health,,Full Date of Birth,2021,"1,000-9,999",Unknown,
10480,05/07/2021 12:00:00 AM,06/04/2021 12:00:00 AM,Theft or Mistake,2021-05-07T00:00:00,,"Pediatrix Cardiology of Washington, P.C. d/b/a NorthWest Congenital Heart Care",,1136.0,Health,,Health Insurance Policy or ID Number,2021,"1,000-9,999",Unknown,
10480,05/07/2021 12:00:00 AM,06/04/2021 12:00:00 AM,Theft or Mistake,2021-05-07T00:00:00,,"Pediatrix Cardiology of Washington, P.C. d/b/a NorthWest Congenital Heart Care",,1136.0,Health,,Medical Information,2021,"1,000-9,999",Unknown,
10480,05/07/2021 12:00:00 AM,06/04/2021 12:00:00 AM,Theft or Mistake,2021-05-07T00:00:00,,"Pediatrix Cardiology of Washington, P.C. d/b/a NorthWest Congenital Heart Care",,1136.0,Health,,Other,2021,"1,000-9,999",Unknown,
10485,04/07/2021 12:00:00 AM,06/18/2021 12:00:00 AM,Cyberattack,2020-08-16T00:00:00,2021-04-29T00:00:00,"Herff Jones, LLC",Malware,17316.0,Business,Retail,Name,2021,"10,000-49,999",200-299,
10485,04/07/2021 12:00:00 AM,06/18/2021 12:00:00 AM,Cyberattack,2020-08-16T00:00:00,2021-04-29T00:00:00,"Herff Jones, LLC",Malware,17316.0,Business,Retail,Financial & Banking Information,2021,"10,000-49,999",200-299,
10485,04/07/2021 12:00:00 AM,06/18/2021 12:00:00 AM,Cyberattack,2020-08-16T00:00:00,2021-04-29T00:00:00,"Herff Jones, LLC",Malware,17316.0,Business,Retail,Other,2021,"10,000-49,999",200-299,
10486,05/19/2021 12:00:00 AM,06/18/2021 12:00:00 AM,Unauthorized Access,2021-05-17T00:00:00,2021-05-19T00:00:00,"Maximus, Inc.",,2560.0,Business,Professional Services,Name,2021,"1,000-9,999",1-99,
10486,05/19/2021 12:00:00 AM,06/18/2021 12:00:00 AM,Unauthorized Access,2021-05-17T00:00:00,2021-05-19T00:00:00,"Maximus, Inc.",,2560.0,Business,Professional Services,Social Security Number,2021,"1,000-9,999",1-99,
10486,05/19/2021 12:00:00 AM,06/18/2021 12:00:00 AM,Unauthorized Access,2021-05-17T00:00:00,2021-05-19T00:00:00,"Maximus, Inc.",,2560.0,Business,Professional Services,Full Date of Birth,2021,"1,000-9,999",1-99,
10486,05/19/2021 12:00:00 AM,06/18/2021 12:00:00 AM,Unauthorized Access,2021-05-17T00:00:00,2021-05-19T00:00:00,"Maximus, Inc.",,2560.0,Business,Professional Services,Other,2021,"1,000-9,999",1-99,
10488,02/12/2021 12:00:00 AM,06/22/2021 12:00:00 AM,Cyberattack,,,Royal Caribbean Group,Phishing,502.0,Business,Hospitality,Name,2021,500-999,Unknown,
10488,02/12/2021 12:00:00 AM,06/22/2021 12:00:00 AM,Cyberattack,,,Royal Caribbean Group,Phishing,502.0,Business,Hospitality,Driver's License or Washington ID Card Number,2021,500-999,Unknown,
10488,02/12/2021 12:00:00 AM,06/22/2021 12:00:00 AM,Cyberattack,,,Royal Caribbean Group,Phishing,502.0,Business,Hospitality,Financial & Banking Information,2021,500-999,Unknown,
10488,02/12/2021 12:00:00 AM,06/22/2021 12:00:00 AM,Cyberattack,,,Royal Caribbean Group,Phishing,502.0,Business,Hospitality,Full Date of Birth,2021,500-999,Unknown,
10488,02/12/2021 12:00:00 AM,06/22/2021 12:00:00 AM,Cyberattack,,,Royal Caribbean Group,Phishing,502.0,Business,Hospitality,Passport Number,2021,500-999,Unknown,
10488,02/12/2021 12:00:00 AM,06/22/2021 12:00:00 AM,Cyberattack,,,Royal Caribbean Group,Phishing,502.0,Business,Hospitality,Other,2021,500-999,Unknown,
10489,05/03/2021 12:00:00 AM,06/23/2021 12:00:00 AM,Cyberattack,2020-05-21T00:00:00,2021-05-03T00:00:00,"Asset Marketing Services, LLC d/b/a GovMint.com",Malware,1332.0,Business,Retail,Name,2021,"1,000-9,999",300-399,
10489,05/03/2021 12:00:00 AM,06/23/2021 12:00:00 AM,Cyberattack,2020-05-21T00:00:00,2021-05-03T00:00:00,"Asset Marketing Services, LLC d/b/a GovMint.com",Malware,1332.0,Business,Retail,Financial & Banking Information,2021,"1,000-9,999",300-399,
10489,05/03/2021 12:00:00 AM,06/23/2021 12:00:00 AM,Cyberattack,2020-05-21T00:00:00,2021-05-03T00:00:00,"Asset Marketing Services, LLC d/b/a GovMint.com",Malware,1332.0,Business,Retail,Other,2021,"1,000-9,999",300-399,
10490,06/04/2021 12:00:00 AM,06/24/2021 12:00:00 AM,Cyberattack,,,Washington State Department of Labor & Industries,Unclear/unknown,16466.0,Government,,Name,2021,"10,000-49,999",Unknown,
10490,06/04/2021 12:00:00 AM,06/24/2021 12:00:00 AM,Cyberattack,,,Washington State Department of Labor & Industries,Unclear/unknown,16466.0,Government,,Full Date of Birth,2021,"10,000-49,999",Unknown,
10490,06/04/2021 12:00:00 AM,06/24/2021 12:00:00 AM,Cyberattack,,,Washington State Department of Labor & Industries,Unclear/unknown,16466.0,Government,,Other,2021,"10,000-49,999",Unknown,
10491,04/26/2021 12:00:00 AM,06/28/2021 12:00:00 AM,Cyberattack,2021-04-25T00:00:00,,"Ankle and Foot Physicians and Surgeons, PLLC",Ransomware,4996.0,Health,,Name,2021,"1,000-9,999",Unknown,
10491,04/26/2021 12:00:00 AM,06/28/2021 12:00:00 AM,Cyberattack,2021-04-25T00:00:00,,"Ankle and Foot Physicians and Surgeons, PLLC",Ransomware,4996.0,Health,,Social Security Number,2021,"1,000-9,999",Unknown,
10491,04/26/2021 12:00:00 AM,06/28/2021 12:00:00 AM,Cyberattack,2021-04-25T00:00:00,,"Ankle and Foot Physicians and Surgeons, PLLC",Ransomware,4996.0,Health,,Full Date of Birth,2021,"1,000-9,999",Unknown,
10491,04/26/2021 12:00:00 AM,06/28/2021 12:00:00 AM,Cyberattack,2021-04-25T00:00:00,,"Ankle and Foot Physicians and Surgeons, PLLC",Ransomware,4996.0,Health,,Other,2021,"1,000-9,999",Unknown,
10492,04/26/2021 12:00:00 AM,06/30/2021 12:00:00 AM,Cyberattack,2021-04-22T00:00:00,2021-04-30T00:00:00,Marsh McLennan,Other,2550.0,Finance,,Name,2021,"1,000-9,999",1-99,
10492,04/26/2021 12:00:00 AM,06/30/2021 12:00:00 AM,Cyberattack,2021-04-22T00:00:00,2021-04-30T00:00:00,Marsh McLennan,Other,2550.0,Finance,,Social Security Number,2021,"1,000-9,999",1-99,
10492,04/26/2021 12:00:00 AM,06/30/2021 12:00:00 AM,Cyberattack,2021-04-22T00:00:00,2021-04-30T00:00:00,Marsh McLennan,Other,2550.0,Finance,,Driver's License or Washington ID Card Number,2021,"1,000-9,999",1-99,
10492,04/26/2021 12:00:00 AM,06/30/2021 12:00:00 AM,Cyberattack,2021-04-22T00:00:00,2021-04-30T00:00:00,Marsh McLennan,Other,2550.0,Finance,,Passport Number,2021,"1,000-9,999",1-99,
10492,04/26/2021 12:00:00 AM,06/30/2021 12:00:00 AM,Cyberattack,2021-04-22T00:00:00,2021-04-30T00:00:00,Marsh McLennan,Other,2550.0,Finance,,Health Insurance Policy or ID Number,2021,"1,000-9,999",1-99,
10492,04/26/2021 12:00:00 AM,06/30/2021 12:00:00 AM,Cyberattack,2021-04-22T00:00:00,2021-04-30T00:00:00,Marsh McLennan,Other,2550.0,Finance,,Other,2021,"1,000-9,999",1-99,
10493,01/01/2021 12:00:00 AM,07/01/2021 12:00:00 AM,Cyberattack,,2021-01-16T00:00:00,"Nevada Restaurant Services, Inc.",Malware,3241.0,Business,Professional Services,Name,2021,"1,000-9,999",Unknown,
10493,01/01/2021 12:00:00 AM,07/01/2021 12:00:00 AM,Cyberattack,,2021-01-16T00:00:00,"Nevada Restaurant Services, Inc.",Malware,3241.0,Business,Professional Services,Social Security Number,2021,"1,000-9,999",Unknown,
10493,01/01/2021 12:00:00 AM,07/01/2021 12:00:00 AM,Cyberattack,,2021-01-16T00:00:00,"Nevada Restaurant Services, Inc.",Malware,3241.0,Business,Professional Services,Driver's License or Washington ID Card Number,2021,"1,000-9,999",Unknown,
10493,01/01/2021 12:00:00 AM,07/01/2021 12:00:00 AM,Cyberattack,,2021-01-16T00:00:00,"Nevada Restaurant Services, Inc.",Malware,3241.0,Business,Professional Services,Full Date of Birth,2021,"1,000-9,999",Unknown,
10493,01/01/2021 12:00:00 AM,07/01/2021 12:00:00 AM,Cyberattack,,2021-01-16T00:00:00,"Nevada Restaurant Services, Inc.",Malware,3241.0,Business,Professional Services,Passport Number,2021,"1,000-9,999",Unknown,
10493,01/01/2021 12:00:00 AM,07/01/2021 12:00:00 AM,Cyberattack,,2021-01-16T00:00:00,"Nevada Restaurant Services, Inc.",Malware,3241.0,Business,Professional Services,Health Insurance Policy or ID Number,2021,"1,000-9,999",Unknown,
10494,05/20/2021 12:00:00 AM,07/02/2021 12:00:00 AM,Cyberattack,,,Morgan Stanley,Malware,2080.0,Finance,,Name,2021,"1,000-9,999",Unknown,
10494,05/20/2021 12:00:00 AM,07/02/2021 12:00:00 AM,Cyberattack,,,Morgan Stanley,Malware,2080.0,Finance,,Social Security Number,2021,"1,000-9,999",Unknown,
10494,05/20/2021 12:00:00 AM,07/02/2021 12:00:00 AM,Cyberattack,,,Morgan Stanley,Malware,2080.0,Finance,,Full Date of Birth,2021,"1,000-9,999",Unknown,
10494,05/20/2021 12:00:00 AM,07/02/2021 12:00:00 AM,Cyberattack,,,Morgan Stanley,Malware,2080.0,Finance,,Other,2021,"1,000-9,999",Unknown,
10495,10/12/2020 12:00:00 AM,07/02/2021 12:00:00 AM,Cyberattack,2020-10-08T00:00:00,2020-10-13T00:00:00,"The Paradies Shops, LLC",Ransomware,657.0,Business,Hospitality,Name,2021,500-999,1-99,
10495,10/12/2020 12:00:00 AM,07/02/2021 12:00:00 AM,Cyberattack,2020-10-08T00:00:00,2020-10-13T00:00:00,"The Paradies Shops, LLC",Ransomware,657.0,Business,Hospitality,Financial & Banking Information,2021,500-999,1-99,
10496,04/26/2021 12:00:00 AM,07/09/2021 12:00:00 AM,Cyberattack,2021-03-08T00:00:00,2021-04-26T00:00:00,"CSI Financial Services, LLC",Phishing,4255.0,Finance,,Name,2021,"1,000-9,999",1-99,
10496,04/26/2021 12:00:00 AM,07/09/2021 12:00:00 AM,Cyberattack,2021-03-08T00:00:00,2021-04-26T00:00:00,"CSI Financial Services, LLC",Phishing,4255.0,Finance,,Social Security Number,2021,"1,000-9,999",1-99,
10496,04/26/2021 12:00:00 AM,07/09/2021 12:00:00 AM,Cyberattack,2021-03-08T00:00:00,2021-04-26T00:00:00,"CSI Financial Services, LLC",Phishing,4255.0,Finance,,Driver's License or Washington ID Card Number,2021,"1,000-9,999",1-99,
10496,04/26/2021 12:00:00 AM,07/09/2021 12:00:00 AM,Cyberattack,2021-03-08T00:00:00,2021-04-26T00:00:00,"CSI Financial Services, LLC",Phishing,4255.0,Finance,,Financial & Banking Information,2021,"1,000-9,999",1-99,
10496,04/26/2021 12:00:00 AM,07/09/2021 12:00:00 AM,Cyberattack,2021-03-08T00:00:00,2021-04-26T00:00:00,"CSI Financial Services, LLC",Phishing,4255.0,Finance,,Full Date of Birth,2021,"1,000-9,999",1-99,
10496,04/26/2021 12:00:00 AM,07/09/2021 12:00:00 AM,Cyberattack,2021-03-08T00:00:00,2021-04-26T00:00:00,"CSI Financial Services, LLC",Phishing,4255.0,Finance,,Health Insurance Policy or ID Number,2021,"1,000-9,999",1-99,
10496,04/26/2021 12:00:00 AM,07/09/2021 12:00:00 AM,Cyberattack,2021-03-08T00:00:00,2021-04-26T00:00:00,"CSI Financial Services, LLC",Phishing,4255.0,Finance,,Other,2021,"1,000-9,999",1-99,
10497,09/26/2020 12:00:00 AM,07/13/2021 12:00:00 AM,Cyberattack,2020-06-03T00:00:00,2020-09-26T00:00:00,Arthur J. Gallagher & Co.,Ransomware,72378.0,Finance,,Name,2021,"50,000-999,999",100-199,
10497,09/26/2020 12:00:00 AM,07/13/2021 12:00:00 AM,Cyberattack,2020-06-03T00:00:00,2020-09-26T00:00:00,Arthur J. Gallagher & Co.,Ransomware,72378.0,Finance,,Social Security Number,2021,"50,000-999,999",100-199,
10497,09/26/2020 12:00:00 AM,07/13/2021 12:00:00 AM,Cyberattack,2020-06-03T00:00:00,2020-09-26T00:00:00,Arthur J. Gallagher & Co.,Ransomware,72378.0,Finance,,Driver's License or Washington ID Card Number,2021,"50,000-999,999",100-199,
10497,09/26/2020 12:00:00 AM,07/13/2021 12:00:00 AM,Cyberattack,2020-06-03T00:00:00,2020-09-26T00:00:00,Arthur J. Gallagher & Co.,Ransomware,72378.0,Finance,,Financial & Banking Information,2021,"50,000-999,999",100-199,
10497,09/26/2020 12:00:00 AM,07/13/2021 12:00:00 AM,Cyberattack,2020-06-03T00:00:00,2020-09-26T00:00:00,Arthur J. Gallagher & Co.,Ransomware,72378.0,Finance,,Full Date of Birth,2021,"50,000-999,999",100-199,
10497,09/26/2020 12:00:00 AM,07/13/2021 12:00:00 AM,Cyberattack,2020-06-03T00:00:00,2020-09-26T00:00:00,Arthur J. Gallagher & Co.,Ransomware,72378.0,Finance,,Health Insurance Policy or ID Number,2021,"50,000-999,999",100-199,
10497,09/26/2020 12:00:00 AM,07/13/2021 12:00:00 AM,Cyberattack,2020-06-03T00:00:00,2020-09-26T00:00:00,Arthur J. Gallagher & Co.,Ransomware,72378.0,Finance,,Medical Information,2021,"50,000-999,999",100-199,
10498,06/06/2017 12:00:00 AM,10/16/2017 12:00:00 AM,Cyberattack,2017-03-10T00:00:00,2017-06-07T00:00:00,Capital One Merchants (Spark Pay Online),Malware,1352.0,Business,Web Services,Name,2018,"1,000-9,999",1-99,
10498,06/06/2017 12:00:00 AM,10/16/2017 12:00:00 AM,Cyberattack,2017-03-10T00:00:00,2017-06-07T00:00:00,Capital One Merchants (Spark Pay Online),Malware,1352.0,Business,Web Services,Financial & Banking Information,2018,"1,000-9,999",1-99,
10498,06/06/2017 12:00:00 AM,10/16/2017 12:00:00 AM,Cyberattack,2017-03-10T00:00:00,2017-06-07T00:00:00,Capital One Merchants (Spark Pay Online),Malware,1352.0,Business,Web Services,Other,2018,"1,000-9,999",1-99,
10499,07/07/2017 12:00:00 AM,10/12/2017 12:00:00 AM,Cyberattack,2017-03-18T00:00:00,2017-07-02T00:00:00,Hyatt Hotels Corporation,Skimmers,640.0,Business,Hospitality,Name,2018,500-999,100-199,
10499,07/07/2017 12:00:00 AM,10/12/2017 12:00:00 AM,Cyberattack,2017-03-18T00:00:00,2017-07-02T00:00:00,Hyatt Hotels Corporation,Skimmers,640.0,Business,Hospitality,Financial & Banking Information,2018,500-999,100-199,
10500,05/15/2019 12:00:00 AM,07/24/2019 12:00:00 AM,Cyberattack,2019-03-21T00:00:00,,"Laboratory Medicine Consultants, LTD",Unclear/unknown,684.0,Health,,Name,2020,500-999,Unknown,
10500,05/15/2019 12:00:00 AM,07/24/2019 12:00:00 AM,Cyberattack,2019-03-21T00:00:00,,"Laboratory Medicine Consultants, LTD",Unclear/unknown,684.0,Health,,Full Date of Birth,2020,500-999,Unknown,
10500,05/15/2019 12:00:00 AM,07/24/2019 12:00:00 AM,Cyberattack,2019-03-21T00:00:00,,"Laboratory Medicine Consultants, LTD",Unclear/unknown,684.0,Health,,Medical Information,2020,500-999,Unknown,
10500,05/15/2019 12:00:00 AM,07/24/2019 12:00:00 AM,Cyberattack,2019-03-21T00:00:00,,"Laboratory Medicine Consultants, LTD",Unclear/unknown,684.0,Health,,Other,2020,500-999,Unknown,
10501,05/26/2019 12:00:00 AM,07/26/2019 12:00:00 AM,Cyberattack,2018-09-23T00:00:00,2019-07-16T00:00:00,Sark Technologies LLC,Malware,762.0,Business,Software,Name,2020,500-999,200-299,
10501,05/26/2019 12:00:00 AM,07/26/2019 12:00:00 AM,Cyberattack,2018-09-23T00:00:00,2019-07-16T00:00:00,Sark Technologies LLC,Malware,762.0,Business,Software,Financial & Banking Information,2020,500-999,200-299,
10501,05/26/2019 12:00:00 AM,07/26/2019 12:00:00 AM,Cyberattack,2018-09-23T00:00:00,2019-07-16T00:00:00,Sark Technologies LLC,Malware,762.0,Business,Software,Other,2020,500-999,200-299,
10502,03/12/2019 12:00:00 AM,07/27/2019 12:00:00 AM,Cyberattack,2019-03-12T00:00:00,2019-05-29T00:00:00,Community Psychiatric Clinic,Other,6600.0,Health,,Name,2020,"1,000-9,999",1-99,
10502,03/12/2019 12:00:00 AM,07/27/2019 12:00:00 AM,Cyberattack,2019-03-12T00:00:00,2019-05-29T00:00:00,Community Psychiatric Clinic,Other,6600.0,Health,,Social Security Number,2020,"1,000-9,999",1-99,
10502,03/12/2019 12:00:00 AM,07/27/2019 12:00:00 AM,Cyberattack,2019-03-12T00:00:00,2019-05-29T00:00:00,Community Psychiatric Clinic,Other,6600.0,Health,,Financial & Banking Information,2020,"1,000-9,999",1-99,
10502,03/12/2019 12:00:00 AM,07/27/2019 12:00:00 AM,Cyberattack,2019-03-12T00:00:00,2019-05-29T00:00:00,Community Psychiatric Clinic,Other,6600.0,Health,,Full Date of Birth,2020,"1,000-9,999",1-99,
10502,03/12/2019 12:00:00 AM,07/27/2019 12:00:00 AM,Cyberattack,2019-03-12T00:00:00,2019-05-29T00:00:00,Community Psychiatric Clinic,Other,6600.0,Health,,Health Insurance Policy or ID Number,2020,"1,000-9,999",1-99,
10502,03/12/2019 12:00:00 AM,07/27/2019 12:00:00 AM,Cyberattack,2019-03-12T00:00:00,2019-05-29T00:00:00,Community Psychiatric Clinic,Other,6600.0,Health,,Medical Information,2020,"1,000-9,999",1-99,
10503,06/25/2019 12:00:00 AM,07/29/2019 12:00:00 AM,Cyberattack,2019-03-24T00:00:00,2019-06-27T00:00:00,"Trusted Tours & Attractions, LLC",Malware,706.0,Business,Entertainment,Name,2020,500-999,1-99,
10503,06/25/2019 12:00:00 AM,07/29/2019 12:00:00 AM,Cyberattack,2019-03-24T00:00:00,2019-06-27T00:00:00,"Trusted Tours & Attractions, LLC",Malware,706.0,Business,Entertainment,Financial & Banking Information,2020,500-999,1-99,
10503,06/25/2019 12:00:00 AM,07/29/2019 12:00:00 AM,Cyberattack,2019-03-24T00:00:00,2019-06-27T00:00:00,"Trusted Tours & Attractions, LLC",Malware,706.0,Business,Entertainment,Email Address and Password/Security Question Answers,2020,500-999,1-99,
10503,06/25/2019 12:00:00 AM,07/29/2019 12:00:00 AM,Cyberattack,2019-03-24T00:00:00,2019-06-27T00:00:00,"Trusted Tours & Attractions, LLC",Malware,706.0,Business,Entertainment,Other,2020,500-999,1-99,
10504,06/15/2019 12:00:00 AM,08/14/2019 12:00:00 AM,Cyberattack,2019-06-15T00:00:00,,Grays Harbor Community Hospital,Ransomware,88000.0,Health,,Name,2020,"50,000-999,999",Unknown,
10504,06/15/2019 12:00:00 AM,08/14/2019 12:00:00 AM,Cyberattack,2019-06-15T00:00:00,,Grays Harbor Community Hospital,Ransomware,88000.0,Health,,Social Security Number,2020,"50,000-999,999",Unknown,
10504,06/15/2019 12:00:00 AM,08/14/2019 12:00:00 AM,Cyberattack,2019-06-15T00:00:00,,Grays Harbor Community Hospital,Ransomware,88000.0,Health,,Full Date of Birth,2020,"50,000-999,999",Unknown,
10504,06/15/2019 12:00:00 AM,08/14/2019 12:00:00 AM,Cyberattack,2019-06-15T00:00:00,,Grays Harbor Community Hospital,Ransomware,88000.0,Health,,Medical Information,2020,"50,000-999,999",Unknown,
10504,06/15/2019 12:00:00 AM,08/14/2019 12:00:00 AM,Cyberattack,2019-06-15T00:00:00,,Grays Harbor Community Hospital,Ransomware,88000.0,Health,,Other,2020,"50,000-999,999",Unknown,
10505,07/26/2019 12:00:00 AM,08/16/2019 12:00:00 AM,Theft or Mistake,2019-07-25T00:00:00,,Regence,,642.0,Health,,Name,2020,500-999,Unknown,
10505,07/26/2019 12:00:00 AM,08/16/2019 12:00:00 AM,Theft or Mistake,2019-07-25T00:00:00,,Regence,,642.0,Health,,Social Security Number,2020,500-999,Unknown,
10506,03/18/2019 12:00:00 AM,08/26/2019 12:00:00 AM,Cyberattack,2018-02-01T00:00:00,2018-10-10T00:00:00,"Creation Entertainment, Inc.",Malware,2467.0,Business,Entertainment,Name,2020,"1,000-9,999",400-499,
10506,03/18/2019 12:00:00 AM,08/26/2019 12:00:00 AM,Cyberattack,2018-02-01T00:00:00,2018-10-10T00:00:00,"Creation Entertainment, Inc.",Malware,2467.0,Business,Entertainment,Financial & Banking Information,2020,"1,000-9,999",400-499,
10507,08/06/2019 12:00:00 AM,09/04/2019 12:00:00 AM,Unauthorized Access,2019-02-19T00:00:00,2019-02-19T00:00:00,"CafePress, Inc.",,5863.0,Business,Accessories,Name,2020,"1,000-9,999",100-199,
10507,08/06/2019 12:00:00 AM,09/04/2019 12:00:00 AM,Unauthorized Access,2019-02-19T00:00:00,2019-02-19T00:00:00,"CafePress, Inc.",,5863.0,Business,Accessories,Social Security Number,2020,"1,000-9,999",100-199,
10507,08/06/2019 12:00:00 AM,09/04/2019 12:00:00 AM,Unauthorized Access,2019-02-19T00:00:00,2019-02-19T00:00:00,"CafePress, Inc.",,5863.0,Business,Accessories,Email Address and Password/Security Question Answers,2020,"1,000-9,999",100-199,
10507,08/06/2019 12:00:00 AM,09/04/2019 12:00:00 AM,Unauthorized Access,2019-02-19T00:00:00,2019-02-19T00:00:00,"CafePress, Inc.",,5863.0,Business,Accessories,Other,2020,"1,000-9,999",100-199,
10508,04/23/2019 12:00:00 AM,09/12/2019 12:00:00 AM,Cyberattack,2019-04-22T00:00:00,2019-04-23T00:00:00,Peoples Injury Network Northwest,Ransomware,12502.0,Health,,Name,2020,"10,000-49,999",1-99,
10508,04/23/2019 12:00:00 AM,09/12/2019 12:00:00 AM,Cyberattack,2019-04-22T00:00:00,2019-04-23T00:00:00,Peoples Injury Network Northwest,Ransomware,12502.0,Health,,Driver's License or Washington ID Card Number,2020,"10,000-49,999",1-99,
10508,04/23/2019 12:00:00 AM,09/12/2019 12:00:00 AM,Cyberattack,2019-04-22T00:00:00,2019-04-23T00:00:00,Peoples Injury Network Northwest,Ransomware,12502.0,Health,,Full Date of Birth,2020,"10,000-49,999",1-99,
10508,04/23/2019 12:00:00 AM,09/12/2019 12:00:00 AM,Cyberattack,2019-04-22T00:00:00,2019-04-23T00:00:00,Peoples Injury Network Northwest,Ransomware,12502.0,Health,,Medical Information,2020,"10,000-49,999",1-99,
10508,04/23/2019 12:00:00 AM,09/12/2019 12:00:00 AM,Cyberattack,2019-04-22T00:00:00,2019-04-23T00:00:00,Peoples Injury Network Northwest,Ransomware,12502.0,Health,,Other,2020,"10,000-49,999",1-99,
10510,07/24/2019 12:00:00 AM,09/24/2019 12:00:00 AM,Cyberattack,,2019-07-24T00:00:00,"Majoris Health Systems, Inc.",Malware,516.0,Health,,Name,2020,500-999,Unknown,
10510,07/24/2019 12:00:00 AM,09/24/2019 12:00:00 AM,Cyberattack,,2019-07-24T00:00:00,"Majoris Health Systems, Inc.",Malware,516.0,Health,,Social Security Number,2020,500-999,Unknown,
10510,07/24/2019 12:00:00 AM,09/24/2019 12:00:00 AM,Cyberattack,,2019-07-24T00:00:00,"Majoris Health Systems, Inc.",Malware,516.0,Health,,Full Date of Birth,2020,500-999,Unknown,
10510,07/24/2019 12:00:00 AM,09/24/2019 12:00:00 AM,Cyberattack,,2019-07-24T00:00:00,"Majoris Health Systems, Inc.",Malware,516.0,Health,,Other,2020,500-999,Unknown,
10511,09/05/2019 12:00:00 AM,09/26/2019 12:00:00 AM,Unauthorized Access,2019-05-04T00:00:00,2019-05-04T00:00:00,DoorDash Inc,,2243.0,Business,Transportation,Name,2020,"1,000-9,999",100-199,
10511,09/05/2019 12:00:00 AM,09/26/2019 12:00:00 AM,Unauthorized Access,2019-05-04T00:00:00,2019-05-04T00:00:00,DoorDash Inc,,2243.0,Business,Transportation,Driver's License or Washington ID Card Number,2020,"1,000-9,999",100-199,
10511,09/05/2019 12:00:00 AM,09/26/2019 12:00:00 AM,Unauthorized Access,2019-05-04T00:00:00,2019-05-04T00:00:00,DoorDash Inc,,2243.0,Business,Transportation,Email Address and Password/Security Question Answers,2020,"1,000-9,999",100-199,
10511,09/05/2019 12:00:00 AM,09/26/2019 12:00:00 AM,Unauthorized Access,2019-05-04T00:00:00,2019-05-04T00:00:00,DoorDash Inc,,2243.0,Business,Transportation,Other,2020,"1,000-9,999",100-199,
10513,04/16/2019 12:00:00 AM,10/10/2019 12:00:00 AM,Cyberattack,2019-03-11T00:00:00,2019-05-07T00:00:00,Calibre CPA Group,Unclear/unknown,983.0,Finance,,Name,2020,500-999,1-99,
10513,04/16/2019 12:00:00 AM,10/10/2019 12:00:00 AM,Cyberattack,2019-03-11T00:00:00,2019-05-07T00:00:00,Calibre CPA Group,Unclear/unknown,983.0,Finance,,Social Security Number,2020,500-999,1-99,
10513,04/16/2019 12:00:00 AM,10/10/2019 12:00:00 AM,Cyberattack,2019-03-11T00:00:00,2019-05-07T00:00:00,Calibre CPA Group,Unclear/unknown,983.0,Finance,,Financial & Banking Information,2020,500-999,1-99,
10514,06/01/2019 12:00:00 AM,10/15/2019 12:00:00 AM,Cyberattack,2018-09-01T00:00:00,2019-09-28T00:00:00,"Eye Buy Direct, Inc.",Unclear/unknown,17031.0,Business,Retail,Name,2020,"10,000-49,999",300-399,
10514,06/01/2019 12:00:00 AM,10/15/2019 12:00:00 AM,Cyberattack,2018-09-01T00:00:00,2019-09-28T00:00:00,"Eye Buy Direct, Inc.",Unclear/unknown,17031.0,Business,Retail,Financial & Banking Information,2020,"10,000-49,999",300-399,
10514,06/01/2019 12:00:00 AM,10/15/2019 12:00:00 AM,Cyberattack,2018-09-01T00:00:00,2019-09-28T00:00:00,"Eye Buy Direct, Inc.",Unclear/unknown,17031.0,Business,Retail,Medical Information,2020,"10,000-49,999",300-399,
10514,06/01/2019 12:00:00 AM,10/15/2019 12:00:00 AM,Cyberattack,2018-09-01T00:00:00,2019-09-28T00:00:00,"Eye Buy Direct, Inc.",Unclear/unknown,17031.0,Business,Retail,Email Address and Password/Security Question Answers,2020,"10,000-49,999",300-399,
10514,06/01/2019 12:00:00 AM,10/15/2019 12:00:00 AM,Cyberattack,2018-09-01T00:00:00,2019-09-28T00:00:00,"Eye Buy Direct, Inc.",Unclear/unknown,17031.0,Business,Retail,Other,2020,"10,000-49,999",300-399,
10515,09/11/2019 12:00:00 AM,10/16/2019 12:00:00 AM,Cyberattack,,,"Neutraceutical Wellness, Inc",Unclear/unknown,518.0,Business,Cosmetic,Name,2020,500-999,Unknown,
10515,09/11/2019 12:00:00 AM,10/16/2019 12:00:00 AM,Cyberattack,,,"Neutraceutical Wellness, Inc",Unclear/unknown,518.0,Business,Cosmetic,Financial & Banking Information,2020,500-999,Unknown,
10515,09/11/2019 12:00:00 AM,10/16/2019 12:00:00 AM,Cyberattack,,,"Neutraceutical Wellness, Inc",Unclear/unknown,518.0,Business,Cosmetic,Other,2020,500-999,Unknown,
10516,08/21/2019 12:00:00 AM,11/08/2019 12:00:00 AM,Cyberattack,2019-04-15T00:00:00,2019-10-25T00:00:00,First Aid Beauty Limited,Malware,663.0,Business,Cosmetic,Name,2020,500-999,100-199,
10516,08/21/2019 12:00:00 AM,11/08/2019 12:00:00 AM,Cyberattack,2019-04-15T00:00:00,2019-10-25T00:00:00,First Aid Beauty Limited,Malware,663.0,Business,Cosmetic,Financial & Banking Information,2020,500-999,100-199,
10516,08/21/2019 12:00:00 AM,11/08/2019 12:00:00 AM,Cyberattack,2019-04-15T00:00:00,2019-10-25T00:00:00,First Aid Beauty Limited,Malware,663.0,Business,Cosmetic,Email Address and Password/Security Question Answers,2020,500-999,100-199,
10516,08/21/2019 12:00:00 AM,11/08/2019 12:00:00 AM,Cyberattack,2019-04-15T00:00:00,2019-10-25T00:00:00,First Aid Beauty Limited,Malware,663.0,Business,Cosmetic,Other,2020,500-999,100-199,
10517,10/15/2019 12:00:00 AM,11/14/2019 12:00:00 AM,Cyberattack,2019-10-07T00:00:00,2019-10-15T00:00:00,Macy's Inc.,Malware,3810.0,Business,Retail,Name,2020,"1,000-9,999",1-99,
10517,10/15/2019 12:00:00 AM,11/14/2019 12:00:00 AM,Cyberattack,2019-10-07T00:00:00,2019-10-15T00:00:00,Macy's Inc.,Malware,3810.0,Business,Retail,Financial & Banking Information,2020,"1,000-9,999",1-99,
10517,10/15/2019 12:00:00 AM,11/14/2019 12:00:00 AM,Cyberattack,2019-10-07T00:00:00,2019-10-15T00:00:00,Macy's Inc.,Malware,3810.0,Business,Retail,Email Address and Password/Security Question Answers,2020,"1,000-9,999",1-99,
10517,10/15/2019 12:00:00 AM,11/14/2019 12:00:00 AM,Cyberattack,2019-10-07T00:00:00,2019-10-15T00:00:00,Macy's Inc.,Malware,3810.0,Business,Retail,Other,2020,"1,000-9,999",1-99,
10518,10/24/2019 12:00:00 AM,11/15/2019 12:00:00 AM,Cyberattack,2019-08-27T00:00:00,2019-10-28T00:00:00,City of Lacey,Malware,6209.0,Government,,Name,2020,"1,000-9,999",1-99,
10518,10/24/2019 12:00:00 AM,11/15/2019 12:00:00 AM,Cyberattack,2019-08-27T00:00:00,2019-10-28T00:00:00,City of Lacey,Malware,6209.0,Government,,Financial & Banking Information,2020,"1,000-9,999",1-99,
10521,10/18/2019 12:00:00 AM,11/26/2019 12:00:00 AM,Cyberattack,2019-10-11T00:00:00,2019-10-22T00:00:00,"The UPS Store, Inc.",Phishing,506.0,Business,Shipping,Name,2020,500-999,1-99,
10521,10/18/2019 12:00:00 AM,11/26/2019 12:00:00 AM,Cyberattack,2019-10-11T00:00:00,2019-10-22T00:00:00,"The UPS Store, Inc.",Phishing,506.0,Business,Shipping,Social Security Number,2020,500-999,1-99,
10521,10/18/2019 12:00:00 AM,11/26/2019 12:00:00 AM,Cyberattack,2019-10-11T00:00:00,2019-10-22T00:00:00,"The UPS Store, Inc.",Phishing,506.0,Business,Shipping,Driver's License or Washington ID Card Number,2020,500-999,1-99,
10521,10/18/2019 12:00:00 AM,11/26/2019 12:00:00 AM,Cyberattack,2019-10-11T00:00:00,2019-10-22T00:00:00,"The UPS Store, Inc.",Phishing,506.0,Business,Shipping,Financial & Banking Information,2020,500-999,1-99,
10523,11/12/2019 12:00:00 AM,11/29/2019 12:00:00 AM,Theft or Mistake,2015-06-01T00:00:00,2019-11-12T00:00:00,Choice Hotels International Inc.,,1684.0,Business,Hospitality,Name,2020,"1,000-9,999",500+,
10523,11/12/2019 12:00:00 AM,11/29/2019 12:00:00 AM,Theft or Mistake,2015-06-01T00:00:00,2019-11-12T00:00:00,Choice Hotels International Inc.,,1684.0,Business,Hospitality,Financial & Banking Information,2020,"1,000-9,999",500+,
10523,11/12/2019 12:00:00 AM,11/29/2019 12:00:00 AM,Theft or Mistake,2015-06-01T00:00:00,2019-11-12T00:00:00,Choice Hotels International Inc.,,1684.0,Business,Hospitality,Email Address and Password/Security Question Answers,2020,"1,000-9,999",500+,
10523,11/12/2019 12:00:00 AM,11/29/2019 12:00:00 AM,Theft or Mistake,2015-06-01T00:00:00,2019-11-12T00:00:00,Choice Hotels International Inc.,,1684.0,Business,Hospitality,Other,2020,"1,000-9,999",500+,
10525,08/19/2019 12:00:00 AM,12/19/2019 12:00:00 AM,Cyberattack,2019-08-16T00:00:00,2019-08-21T00:00:00,Vimly Benefits Solution,Phishing,91807.0,Business,Software,Name,2020,"50,000-999,999",1-99,
10525,08/19/2019 12:00:00 AM,12/19/2019 12:00:00 AM,Cyberattack,2019-08-16T00:00:00,2019-08-21T00:00:00,Vimly Benefits Solution,Phishing,91807.0,Business,Software,Social Security Number,2020,"50,000-999,999",1-99,
10525,08/19/2019 12:00:00 AM,12/19/2019 12:00:00 AM,Cyberattack,2019-08-16T00:00:00,2019-08-21T00:00:00,Vimly Benefits Solution,Phishing,91807.0,Business,Software,Full Date of Birth,2020,"50,000-999,999",1-99,
10525,08/19/2019 12:00:00 AM,12/19/2019 12:00:00 AM,Cyberattack,2019-08-16T00:00:00,2019-08-21T00:00:00,Vimly Benefits Solution,Phishing,91807.0,Business,Software,Other,2020,"50,000-999,999",1-99,
10526,11/22/2019 12:00:00 AM,12/31/2019 12:00:00 AM,Cyberattack,2019-01-18T00:00:00,2019-10-17T00:00:00,Landry's Inc.,Malware,,Business,Hospitality,Name,2020,Unknown,300-399,
10526,11/22/2019 12:00:00 AM,12/31/2019 12:00:00 AM,Cyberattack,2019-01-18T00:00:00,2019-10-17T00:00:00,Landry's Inc.,Malware,,Business,Hospitality,Financial & Banking Information,2020,Unknown,300-399,
10527,12/03/2019 12:00:00 AM,12/31/2019 12:00:00 AM,Cyberattack,2019-11-08T00:00:00,2019-12-05T00:00:00,Evolucion Innovations Inc. (evo.com),Malware,4899.0,Business,Retail,Name,2020,"1,000-9,999",1-99,
10527,12/03/2019 12:00:00 AM,12/31/2019 12:00:00 AM,Cyberattack,2019-11-08T00:00:00,2019-12-05T00:00:00,Evolucion Innovations Inc. (evo.com),Malware,4899.0,Business,Retail,Financial & Banking Information,2020,"1,000-9,999",1-99,
10527,12/03/2019 12:00:00 AM,12/31/2019 12:00:00 AM,Cyberattack,2019-11-08T00:00:00,2019-12-05T00:00:00,Evolucion Innovations Inc. (evo.com),Malware,4899.0,Business,Retail,Email Address and Password/Security Question Answers,2020,"1,000-9,999",1-99,
10527,12/03/2019 12:00:00 AM,12/31/2019 12:00:00 AM,Cyberattack,2019-11-08T00:00:00,2019-12-05T00:00:00,Evolucion Innovations Inc. (evo.com),Malware,4899.0,Business,Retail,Other,2020,"1,000-9,999",1-99,
10528,12/05/2019 12:00:00 AM,01/15/2020 12:00:00 AM,Cyberattack,2019-09-16T00:00:00,2019-11-11T00:00:00,"Hanna Andersson, LLC",Malware,8816.0,Business,Clothing,Name,2020,"1,000-9,999",1-99,
10528,12/05/2019 12:00:00 AM,01/15/2020 12:00:00 AM,Cyberattack,2019-09-16T00:00:00,2019-11-11T00:00:00,"Hanna Andersson, LLC",Malware,8816.0,Business,Clothing,Financial & Banking Information,2020,"1,000-9,999",1-99,
10528,12/05/2019 12:00:00 AM,01/15/2020 12:00:00 AM,Cyberattack,2019-09-16T00:00:00,2019-11-11T00:00:00,"Hanna Andersson, LLC",Malware,8816.0,Business,Clothing,Other,2020,"1,000-9,999",1-99,
10530,12/18/2019 12:00:00 AM,01/20/2020 12:00:00 AM,Cyberattack,2019-09-29T00:00:00,2020-01-13T00:00:00,"The UPS Store, Inc.",Phishing,963.0,Business,Shipping,Name,2020,500-999,100-199,
10530,12/18/2019 12:00:00 AM,01/20/2020 12:00:00 AM,Cyberattack,2019-09-29T00:00:00,2020-01-13T00:00:00,"The UPS Store, Inc.",Phishing,963.0,Business,Shipping,Social Security Number,2020,500-999,100-199,
10530,12/18/2019 12:00:00 AM,01/20/2020 12:00:00 AM,Cyberattack,2019-09-29T00:00:00,2020-01-13T00:00:00,"The UPS Store, Inc.",Phishing,963.0,Business,Shipping,Driver's License or Washington ID Card Number,2020,500-999,100-199,
10530,12/18/2019 12:00:00 AM,01/20/2020 12:00:00 AM,Cyberattack,2019-09-29T00:00:00,2020-01-13T00:00:00,"The UPS Store, Inc.",Phishing,963.0,Business,Shipping,Financial & Banking Information,2020,500-999,100-199,
10530,12/18/2019 12:00:00 AM,01/20/2020 12:00:00 AM,Cyberattack,2019-09-29T00:00:00,2020-01-13T00:00:00,"The UPS Store, Inc.",Phishing,963.0,Business,Shipping,Medical Information,2020,500-999,100-199,
10530,12/18/2019 12:00:00 AM,01/20/2020 12:00:00 AM,Cyberattack,2019-09-29T00:00:00,2020-01-13T00:00:00,"The UPS Store, Inc.",Phishing,963.0,Business,Shipping,Username and Password/Security Question Answers,2020,500-999,100-199,
10530,12/18/2019 12:00:00 AM,01/20/2020 12:00:00 AM,Cyberattack,2019-09-29T00:00:00,2020-01-13T00:00:00,"The UPS Store, Inc.",Phishing,963.0,Business,Shipping,Email Address and Password/Security Question Answers,2020,500-999,100-199,
10531,12/26/2019 12:00:00 AM,01/24/2020 12:00:00 AM,Cyberattack,2019-12-26T00:00:00,2019-12-26T00:00:00,"Oostra Rouw & Associates, Inc. (ORA, Inc.)",Ransomware,2376.0,Finance,,Name,2020,"1,000-9,999",0,
10531,12/26/2019 12:00:00 AM,01/24/2020 12:00:00 AM,Cyberattack,2019-12-26T00:00:00,2019-12-26T00:00:00,"Oostra Rouw & Associates, Inc. (ORA, Inc.)",Ransomware,2376.0,Finance,,Social Security Number,2020,"1,000-9,999",0,
10531,12/26/2019 12:00:00 AM,01/24/2020 12:00:00 AM,Cyberattack,2019-12-26T00:00:00,2019-12-26T00:00:00,"Oostra Rouw & Associates, Inc. (ORA, Inc.)",Ransomware,2376.0,Finance,,Other,2020,"1,000-9,999",0,
10532,08/24/2019 12:00:00 AM,02/14/2020 12:00:00 AM,Cyberattack,2019-07-09T00:00:00,2019-08-24T00:00:00,Aveanna Healthcare,Unclear/unknown,2444.0,Health,,Name,2020,"1,000-9,999",1-99,
10532,08/24/2019 12:00:00 AM,02/14/2020 12:00:00 AM,Cyberattack,2019-07-09T00:00:00,2019-08-24T00:00:00,Aveanna Healthcare,Unclear/unknown,2444.0,Health,,Social Security Number,2020,"1,000-9,999",1-99,
10532,08/24/2019 12:00:00 AM,02/14/2020 12:00:00 AM,Cyberattack,2019-07-09T00:00:00,2019-08-24T00:00:00,Aveanna Healthcare,Unclear/unknown,2444.0,Health,,Driver's License or Washington ID Card Number,2020,"1,000-9,999",1-99,
10532,08/24/2019 12:00:00 AM,02/14/2020 12:00:00 AM,Cyberattack,2019-07-09T00:00:00,2019-08-24T00:00:00,Aveanna Healthcare,Unclear/unknown,2444.0,Health,,Financial & Banking Information,2020,"1,000-9,999",1-99,
10533,09/01/2019 12:00:00 AM,02/14/2020 12:00:00 AM,Cyberattack,2019-08-19T00:00:00,2019-09-20T00:00:00,Smile Surfers,Unclear/unknown,532.0,Health,,Name,2020,500-999,1-99,
10533,09/01/2019 12:00:00 AM,02/14/2020 12:00:00 AM,Cyberattack,2019-08-19T00:00:00,2019-09-20T00:00:00,Smile Surfers,Unclear/unknown,532.0,Health,,Driver's License or Washington ID Card Number,2020,500-999,1-99,
10533,09/01/2019 12:00:00 AM,02/14/2020 12:00:00 AM,Cyberattack,2019-08-19T00:00:00,2019-09-20T00:00:00,Smile Surfers,Unclear/unknown,532.0,Health,,Financial & Banking Information,2020,500-999,1-99,
10533,09/01/2019 12:00:00 AM,02/14/2020 12:00:00 AM,Cyberattack,2019-08-19T00:00:00,2019-09-20T00:00:00,Smile Surfers,Unclear/unknown,532.0,Health,,Full Date of Birth,2020,500-999,1-99,
10533,09/01/2019 12:00:00 AM,02/14/2020 12:00:00 AM,Cyberattack,2019-08-19T00:00:00,2019-09-20T00:00:00,Smile Surfers,Unclear/unknown,532.0,Health,,Medical Information,2020,500-999,1-99,
10533,09/01/2019 12:00:00 AM,02/14/2020 12:00:00 AM,Cyberattack,2019-08-19T00:00:00,2019-09-20T00:00:00,Smile Surfers,Unclear/unknown,532.0,Health,,Other,2020,500-999,1-99,
10535,01/27/2020 12:00:00 AM,02/27/2020 12:00:00 AM,Cyberattack,,,Railworks Corporation,Ransomware,1286.0,Business,Construction,Name,2020,"1,000-9,999",Unknown,
10535,01/27/2020 12:00:00 AM,02/27/2020 12:00:00 AM,Cyberattack,,,Railworks Corporation,Ransomware,1286.0,Business,Construction,Social Security Number,2020,"1,000-9,999",Unknown,
10535,01/27/2020 12:00:00 AM,02/27/2020 12:00:00 AM,Cyberattack,,,Railworks Corporation,Ransomware,1286.0,Business,Construction,Driver's License or Washington ID Card Number,2020,"1,000-9,999",Unknown,
10535,01/27/2020 12:00:00 AM,02/27/2020 12:00:00 AM,Cyberattack,,,Railworks Corporation,Ransomware,1286.0,Business,Construction,Full Date of Birth,2020,"1,000-9,999",Unknown,
10535,01/27/2020 12:00:00 AM,02/27/2020 12:00:00 AM,Cyberattack,,,Railworks Corporation,Ransomware,1286.0,Business,Construction,Other,2020,"1,000-9,999",Unknown,
10536,05/31/2019 12:00:00 AM,03/02/2020 12:00:00 AM,Unauthorized Access,2019-04-11T00:00:00,2019-07-23T00:00:00,Carnival Corporation & PLC,,11346.0,Business,Transportation,Name,2020,"10,000-49,999",100-199,
10536,05/31/2019 12:00:00 AM,03/02/2020 12:00:00 AM,Unauthorized Access,2019-04-11T00:00:00,2019-07-23T00:00:00,Carnival Corporation & PLC,,11346.0,Business,Transportation,Social Security Number,2020,"10,000-49,999",100-199,
10536,05/31/2019 12:00:00 AM,03/02/2020 12:00:00 AM,Unauthorized Access,2019-04-11T00:00:00,2019-07-23T00:00:00,Carnival Corporation & PLC,,11346.0,Business,Transportation,Driver's License or Washington ID Card Number,2020,"10,000-49,999",100-199,
10536,05/31/2019 12:00:00 AM,03/02/2020 12:00:00 AM,Unauthorized Access,2019-04-11T00:00:00,2019-07-23T00:00:00,Carnival Corporation & PLC,,11346.0,Business,Transportation,Financial & Banking Information,2020,"10,000-49,999",100-199,
10536,05/31/2019 12:00:00 AM,03/02/2020 12:00:00 AM,Unauthorized Access,2019-04-11T00:00:00,2019-07-23T00:00:00,Carnival Corporation & PLC,,11346.0,Business,Transportation,Passport Number,2020,"10,000-49,999",100-199,
10536,05/31/2019 12:00:00 AM,03/02/2020 12:00:00 AM,Unauthorized Access,2019-04-11T00:00:00,2019-07-23T00:00:00,Carnival Corporation & PLC,,11346.0,Business,Transportation,Medical Information,2020,"10,000-49,999",100-199,
10536,05/31/2019 12:00:00 AM,03/02/2020 12:00:00 AM,Unauthorized Access,2019-04-11T00:00:00,2019-07-23T00:00:00,Carnival Corporation & PLC,,11346.0,Business,Transportation,Other,2020,"10,000-49,999",100-199,
10538,12/05/2019 12:00:00 AM,03/10/2020 12:00:00 AM,Unauthorized Access,2019-12-03T00:00:00,2019-12-05T00:00:00,Wichita State University,,2649.0,Education,,Name,2020,"1,000-9,999",1-99,
10538,12/05/2019 12:00:00 AM,03/10/2020 12:00:00 AM,Unauthorized Access,2019-12-03T00:00:00,2019-12-05T00:00:00,Wichita State University,,2649.0,Education,,Social Security Number,2020,"1,000-9,999",1-99,
10538,12/05/2019 12:00:00 AM,03/10/2020 12:00:00 AM,Unauthorized Access,2019-12-03T00:00:00,2019-12-05T00:00:00,Wichita State University,,2649.0,Education,,Full Date of Birth,2020,"1,000-9,999",1-99,
10538,12/05/2019 12:00:00 AM,03/10/2020 12:00:00 AM,Unauthorized Access,2019-12-03T00:00:00,2019-12-05T00:00:00,Wichita State University,,2649.0,Education,,Email Address and Password/Security Question Answers,2020,"1,000-9,999",1-99,
10539,07/09/2019 12:00:00 AM,03/16/2020 12:00:00 AM,Unauthorized Access,,,"Avalon Health Care Management, Inc.",,1861.0,Health,,Name,2020,"1,000-9,999",Unknown,
10539,07/09/2019 12:00:00 AM,03/16/2020 12:00:00 AM,Unauthorized Access,,,"Avalon Health Care Management, Inc.",,1861.0,Health,,Social Security Number,2020,"1,000-9,999",Unknown,
10539,07/09/2019 12:00:00 AM,03/16/2020 12:00:00 AM,Unauthorized Access,,,"Avalon Health Care Management, Inc.",,1861.0,Health,,Medical Information,2020,"1,000-9,999",Unknown,
10544,01/22/2020 12:00:00 AM,04/17/2020 12:00:00 AM,Cyberattack,2020-01-22T00:00:00,2020-01-24T00:00:00,Ambry Genetics Corporation,Phishing,2152.0,Health,,Name,2020,"1,000-9,999",1-99,
10544,01/22/2020 12:00:00 AM,04/17/2020 12:00:00 AM,Cyberattack,2020-01-22T00:00:00,2020-01-24T00:00:00,Ambry Genetics Corporation,Phishing,2152.0,Health,,Social Security Number,2020,"1,000-9,999",1-99,
10544,01/22/2020 12:00:00 AM,04/17/2020 12:00:00 AM,Cyberattack,2020-01-22T00:00:00,2020-01-24T00:00:00,Ambry Genetics Corporation,Phishing,2152.0,Health,,Medical Information,2020,"1,000-9,999",1-99,
10545,01/01/2020 12:00:00 AM,04/20/2020 12:00:00 AM,Cyberattack,2019-03-07T00:00:00,2020-02-13T00:00:00,"Kandy Pens, Inc.",Malware,1112.0,Business,Retail,Name,2020,"1,000-9,999",300-399,
10545,01/01/2020 12:00:00 AM,04/20/2020 12:00:00 AM,Cyberattack,2019-03-07T00:00:00,2020-02-13T00:00:00,"Kandy Pens, Inc.",Malware,1112.0,Business,Retail,Financial & Banking Information,2020,"1,000-9,999",300-399,
10546,10/08/2019 12:00:00 AM,04/20/2020 12:00:00 AM,Cyberattack,2019-09-07T00:00:00,2019-10-08T00:00:00,"Volusion, LLC",Malware,14111.0,Business,Web Services,Name,2020,"10,000-49,999",1-99,
10546,10/08/2019 12:00:00 AM,04/20/2020 12:00:00 AM,Cyberattack,2019-09-07T00:00:00,2019-10-08T00:00:00,"Volusion, LLC",Malware,14111.0,Business,Web Services,Financial & Banking Information,2020,"10,000-49,999",1-99,
10546,10/08/2019 12:00:00 AM,04/20/2020 12:00:00 AM,Cyberattack,2019-09-07T00:00:00,2019-10-08T00:00:00,"Volusion, LLC",Malware,14111.0,Business,Web Services,Email Address and Password/Security Question Answers,2020,"10,000-49,999",1-99,
10546,10/08/2019 12:00:00 AM,04/20/2020 12:00:00 AM,Cyberattack,2019-09-07T00:00:00,2019-10-08T00:00:00,"Volusion, LLC",Malware,14111.0,Business,Web Services,Other,2020,"10,000-49,999",1-99,
10547,01/06/2020 12:00:00 AM,05/07/2020 12:00:00 AM,Theft or Mistake,2019-11-23T00:00:00,2020-01-06T00:00:00,"Principal Financial Services, Inc.",,583.0,Finance,,Name,2020,500-999,1-99,
10547,01/06/2020 12:00:00 AM,05/07/2020 12:00:00 AM,Theft or Mistake,2019-11-23T00:00:00,2020-01-06T00:00:00,"Principal Financial Services, Inc.",,583.0,Finance,,Social Security Number,2020,500-999,1-99,
10547,01/06/2020 12:00:00 AM,05/07/2020 12:00:00 AM,Theft or Mistake,2019-11-23T00:00:00,2020-01-06T00:00:00,"Principal Financial Services, Inc.",,583.0,Finance,,Full Date of Birth,2020,500-999,1-99,
10548,03/26/2020 12:00:00 AM,05/07/2020 12:00:00 AM,Unauthorized Access,2019-12-03T00:00:00,,Atria Wealth Solutions,,574.0,Finance,,Name,2020,500-999,Unknown,
10548,03/26/2020 12:00:00 AM,05/07/2020 12:00:00 AM,Unauthorized Access,2019-12-03T00:00:00,,Atria Wealth Solutions,,574.0,Finance,,Social Security Number,2020,500-999,Unknown,
10548,03/26/2020 12:00:00 AM,05/07/2020 12:00:00 AM,Unauthorized Access,2019-12-03T00:00:00,,Atria Wealth Solutions,,574.0,Finance,,Full Date of Birth,2020,500-999,Unknown,
10549,04/11/2020 12:00:00 AM,05/11/2020 12:00:00 AM,Cyberattack,2020-04-06T00:00:00,2020-04-12T00:00:00,Magellan Health Inc.,Ransomware,5119.0,Health,,Name,2020,"1,000-9,999",1-99,
10549,04/11/2020 12:00:00 AM,05/11/2020 12:00:00 AM,Cyberattack,2020-04-06T00:00:00,2020-04-12T00:00:00,Magellan Health Inc.,Ransomware,5119.0,Health,,Social Security Number,2020,"1,000-9,999",1-99,
10549,04/11/2020 12:00:00 AM,05/11/2020 12:00:00 AM,Cyberattack,2020-04-06T00:00:00,2020-04-12T00:00:00,Magellan Health Inc.,Ransomware,5119.0,Health,,Username and Password/Security Question Answers,2020,"1,000-9,999",1-99,
10549,04/11/2020 12:00:00 AM,05/11/2020 12:00:00 AM,Cyberattack,2020-04-06T00:00:00,2020-04-12T00:00:00,Magellan Health Inc.,Ransomware,5119.0,Health,,Other,2020,"1,000-9,999",1-99,
10550,02/24/2020 12:00:00 AM,05/21/2020 12:00:00 AM,Unauthorized Access,,,Capital Accounting & Tax,,1277.0,Finance,,Name,2020,"1,000-9,999",Unknown,
10550,02/24/2020 12:00:00 AM,05/21/2020 12:00:00 AM,Unauthorized Access,,,Capital Accounting & Tax,,1277.0,Finance,,Social Security Number,2020,"1,000-9,999",Unknown,
10550,02/24/2020 12:00:00 AM,05/21/2020 12:00:00 AM,Unauthorized Access,,,Capital Accounting & Tax,,1277.0,Finance,,Financial & Banking Information,2020,"1,000-9,999",Unknown,
10550,02/24/2020 12:00:00 AM,05/21/2020 12:00:00 AM,Unauthorized Access,,,Capital Accounting & Tax,,1277.0,Finance,,Full Date of Birth,2020,"1,000-9,999",Unknown,
10550,02/24/2020 12:00:00 AM,05/21/2020 12:00:00 AM,Unauthorized Access,,,Capital Accounting & Tax,,1277.0,Finance,,Other,2020,"1,000-9,999",Unknown,
10551,05/15/2020 12:00:00 AM,05/22/2020 12:00:00 AM,Cyberattack,,,"Mathway, LLC",Unclear/unknown,,Business,Other,Email Address and Password/Security Question Answers,2020,Unknown,Unknown,
10552,04/28/2020 12:00:00 AM,05/27/2020 12:00:00 AM,Unauthorized Access,2019-10-30T00:00:00,2020-01-14T00:00:00,"Car Wash Partners, Inc.",,805.0,Business,Cleaning,Name,2020,500-999,100-199,
10552,04/28/2020 12:00:00 AM,05/27/2020 12:00:00 AM,Unauthorized Access,2019-10-30T00:00:00,2020-01-14T00:00:00,"Car Wash Partners, Inc.",,805.0,Business,Cleaning,Social Security Number,2020,500-999,100-199,
10552,04/28/2020 12:00:00 AM,05/27/2020 12:00:00 AM,Unauthorized Access,2019-10-30T00:00:00,2020-01-14T00:00:00,"Car Wash Partners, Inc.",,805.0,Business,Cleaning,Driver's License or Washington ID Card Number,2020,500-999,100-199,
10552,04/28/2020 12:00:00 AM,05/27/2020 12:00:00 AM,Unauthorized Access,2019-10-30T00:00:00,2020-01-14T00:00:00,"Car Wash Partners, Inc.",,805.0,Business,Cleaning,Full Date of Birth,2020,500-999,100-199,
10553,05/15/2020 12:00:00 AM,05/27/2020 12:00:00 AM,Unauthorized Access,2020-05-06T00:00:00,,"Minted, LLC",,68900.0,Business,Retail,Name,2020,"50,000-999,999",Unknown,
10553,05/15/2020 12:00:00 AM,05/27/2020 12:00:00 AM,Unauthorized Access,2020-05-06T00:00:00,,"Minted, LLC",,68900.0,Business,Retail,Full Date of Birth,2020,"50,000-999,999",Unknown,
10553,05/15/2020 12:00:00 AM,05/27/2020 12:00:00 AM,Unauthorized Access,2020-05-06T00:00:00,,"Minted, LLC",,68900.0,Business,Retail,Username and Password/Security Question Answers,2020,"50,000-999,999",Unknown,
10553,05/15/2020 12:00:00 AM,05/27/2020 12:00:00 AM,Unauthorized Access,2020-05-06T00:00:00,,"Minted, LLC",,68900.0,Business,Retail,Email Address and Password/Security Question Answers,2020,"50,000-999,999",Unknown,
10553,05/15/2020 12:00:00 AM,05/27/2020 12:00:00 AM,Unauthorized Access,2020-05-06T00:00:00,,"Minted, LLC",,68900.0,Business,Retail,Other,2020,"50,000-999,999",Unknown,
10554,01/15/2020 12:00:00 AM,05/29/2020 12:00:00 AM,Unauthorized Access,2019-12-18T00:00:00,2019-12-18T00:00:00,Swedish Health Services,,12573.0,Health,,Name,2020,"10,000-49,999",1-99,
10554,01/15/2020 12:00:00 AM,05/29/2020 12:00:00 AM,Unauthorized Access,2019-12-18T00:00:00,2019-12-18T00:00:00,Swedish Health Services,,12573.0,Health,,Social Security Number,2020,"10,000-49,999",1-99,
10554,01/15/2020 12:00:00 AM,05/29/2020 12:00:00 AM,Unauthorized Access,2019-12-18T00:00:00,2019-12-18T00:00:00,Swedish Health Services,,12573.0,Health,,Full Date of Birth,2020,"10,000-49,999",1-99,
10554,01/15/2020 12:00:00 AM,05/29/2020 12:00:00 AM,Unauthorized Access,2019-12-18T00:00:00,2019-12-18T00:00:00,Swedish Health Services,,12573.0,Health,,Email Address and Password/Security Question Answers,2020,"10,000-49,999",1-99,
10554,01/15/2020 12:00:00 AM,05/29/2020 12:00:00 AM,Unauthorized Access,2019-12-18T00:00:00,2019-12-18T00:00:00,Swedish Health Services,,12573.0,Health,,Other,2020,"10,000-49,999",1-99,
10555,12/26/2018 12:00:00 AM,06/03/2020 12:00:00 AM,Cyberattack,2016-11-11T00:00:00,2017-02-16T00:00:00,Bombas LLC,Malware,2313.0,Business,Clothing,Name,2020,"1,000-9,999",500+,
10555,12/26/2018 12:00:00 AM,06/03/2020 12:00:00 AM,Cyberattack,2016-11-11T00:00:00,2017-02-16T00:00:00,Bombas LLC,Malware,2313.0,Business,Clothing,Financial & Banking Information,2020,"1,000-9,999",500+,
10555,12/26/2018 12:00:00 AM,06/03/2020 12:00:00 AM,Cyberattack,2016-11-11T00:00:00,2017-02-16T00:00:00,Bombas LLC,Malware,2313.0,Business,Clothing,Other,2020,"1,000-9,999",500+,
10556,05/11/2020 12:00:00 AM,06/10/2020 12:00:00 AM,Unauthorized Access,2020-01-12T00:00:00,2020-01-12T00:00:00,"Zoosk, Inc.",,115158.0,Business,Software,Name,2020,"50,000-999,999",100-199,
10556,05/11/2020 12:00:00 AM,06/10/2020 12:00:00 AM,Unauthorized Access,2020-01-12T00:00:00,2020-01-12T00:00:00,"Zoosk, Inc.",,115158.0,Business,Software,Full Date of Birth,2020,"50,000-999,999",100-199,
10556,05/11/2020 12:00:00 AM,06/10/2020 12:00:00 AM,Unauthorized Access,2020-01-12T00:00:00,2020-01-12T00:00:00,"Zoosk, Inc.",,115158.0,Business,Software,Username and Password/Security Question Answers,2020,"50,000-999,999",100-199,
10556,05/11/2020 12:00:00 AM,06/10/2020 12:00:00 AM,Unauthorized Access,2020-01-12T00:00:00,2020-01-12T00:00:00,"Zoosk, Inc.",,115158.0,Business,Software,Email Address and Password/Security Question Answers,2020,"50,000-999,999",100-199,
10556,05/11/2020 12:00:00 AM,06/10/2020 12:00:00 AM,Unauthorized Access,2020-01-12T00:00:00,2020-01-12T00:00:00,"Zoosk, Inc.",,115158.0,Business,Software,Other,2020,"50,000-999,999",100-199,
10558,10/30/2018 12:00:00 AM,11/30/2018 12:00:00 AM,Cyberattack,2014-08-15T00:00:00,2018-09-15T00:00:00,Ontario Inc.,Unclear/unknown,540.0,Business,Retail,Name,2019,500-999,500+,
10558,10/30/2018 12:00:00 AM,11/30/2018 12:00:00 AM,Cyberattack,2014-08-15T00:00:00,2018-09-15T00:00:00,Ontario Inc.,Unclear/unknown,540.0,Business,Retail,Financial & Banking Information,2019,500-999,500+,
10559,03/04/2019 12:00:00 AM,04/05/2019 12:00:00 AM,Cyberattack,2018-10-29T00:00:00,2019-03-04T00:00:00,AeroGrow International Inc.,Malware,667.0,Business,Manufacturing,Name,2019,500-999,100-199,
10559,03/04/2019 12:00:00 AM,04/05/2019 12:00:00 AM,Cyberattack,2018-10-29T00:00:00,2019-03-04T00:00:00,AeroGrow International Inc.,Malware,667.0,Business,Manufacturing,Financial & Banking Information,2019,500-999,100-199,
10561,04/17/2020 12:00:00 AM,06/16/2020 12:00:00 AM,Unauthorized Access,2019-05-01T00:00:00,2019-11-30T00:00:00,Providence Health Plan,,3324.0,Health,,Name,2020,"1,000-9,999",300-399,OR
10561,04/17/2020 12:00:00 AM,06/16/2020 12:00:00 AM,Unauthorized Access,2019-05-01T00:00:00,2019-11-30T00:00:00,Providence Health Plan,,3324.0,Health,,Full Date of Birth,2020,"1,000-9,999",300-399,OR
10561,04/17/2020 12:00:00 AM,06/16/2020 12:00:00 AM,Unauthorized Access,2019-05-01T00:00:00,2019-11-30T00:00:00,Providence Health Plan,,3324.0,Health,,Other,2020,"1,000-9,999",300-399,OR
10563,05/14/2020 12:00:00 AM,06/25/2020 12:00:00 AM,Unauthorized Access,2020-05-14T00:00:00,2020-05-14T00:00:00,"BlockFi, Inc.",,696.0,Business,Cryptocurrency,Name,2020,500-999,0,
10563,05/14/2020 12:00:00 AM,06/25/2020 12:00:00 AM,Unauthorized Access,2020-05-14T00:00:00,2020-05-14T00:00:00,"BlockFi, Inc.",,696.0,Business,Cryptocurrency,Full Date of Birth,2020,500-999,0,
10563,05/14/2020 12:00:00 AM,06/25/2020 12:00:00 AM,Unauthorized Access,2020-05-14T00:00:00,2020-05-14T00:00:00,"BlockFi, Inc.",,696.0,Business,Cryptocurrency,Email Address and Password/Security Question Answers,2020,500-999,0,
10563,05/14/2020 12:00:00 AM,06/25/2020 12:00:00 AM,Unauthorized Access,2020-05-14T00:00:00,2020-05-14T00:00:00,"BlockFi, Inc.",,696.0,Business,Cryptocurrency,Other,2020,500-999,0,
10565,05/20/2020 12:00:00 AM,07/07/2020 12:00:00 AM,Cyberattack,,,Federal Home Loan Mortgage Corporation (Freddie Mac),Ransomware,596.0,Government,,Name,2020,500-999,Unknown,
10565,05/20/2020 12:00:00 AM,07/07/2020 12:00:00 AM,Cyberattack,,,Federal Home Loan Mortgage Corporation (Freddie Mac),Ransomware,596.0,Government,,Social Security Number,2020,500-999,Unknown,
10565,05/20/2020 12:00:00 AM,07/07/2020 12:00:00 AM,Cyberattack,,,Federal Home Loan Mortgage Corporation (Freddie Mac),Ransomware,596.0,Government,,Financial & Banking Information,2020,500-999,Unknown,
10565,05/20/2020 12:00:00 AM,07/07/2020 12:00:00 AM,Cyberattack,,,Federal Home Loan Mortgage Corporation (Freddie Mac),Ransomware,596.0,Government,,Full Date of Birth,2020,500-999,Unknown,
10565,05/20/2020 12:00:00 AM,07/07/2020 12:00:00 AM,Cyberattack,,,Federal Home Loan Mortgage Corporation (Freddie Mac),Ransomware,596.0,Government,,Other,2020,500-999,Unknown,
10566,06/11/2020 12:00:00 AM,07/08/2020 12:00:00 AM,Cyberattack,2020-04-07T00:00:00,2020-06-12T00:00:00,"Claire's Stores, Inc.",Malware,1166.0,Business,Retail,Name,2020,"1,000-9,999",1-99,
10566,06/11/2020 12:00:00 AM,07/08/2020 12:00:00 AM,Cyberattack,2020-04-07T00:00:00,2020-06-12T00:00:00,"Claire's Stores, Inc.",Malware,1166.0,Business,Retail,Financial & Banking Information,2020,"1,000-9,999",1-99,
10566,06/11/2020 12:00:00 AM,07/08/2020 12:00:00 AM,Cyberattack,2020-04-07T00:00:00,2020-06-12T00:00:00,"Claire's Stores, Inc.",Malware,1166.0,Business,Retail,Email Address and Password/Security Question Answers,2020,"1,000-9,999",1-99,
10566,06/11/2020 12:00:00 AM,07/08/2020 12:00:00 AM,Cyberattack,2020-04-07T00:00:00,2020-06-12T00:00:00,"Claire's Stores, Inc.",Malware,1166.0,Business,Retail,Other,2020,"1,000-9,999",1-99,
10567,04/01/2020 12:00:00 AM,07/09/2020 12:00:00 AM,Cyberattack,2020-04-01T00:00:00,2020-06-30T00:00:00,Boeing Emlpoyees' Credit Union,Skimmers,4883.0,Finance,,Name,2020,"1,000-9,999",1-99,
10567,04/01/2020 12:00:00 AM,07/09/2020 12:00:00 AM,Cyberattack,2020-04-01T00:00:00,2020-06-30T00:00:00,Boeing Emlpoyees' Credit Union,Skimmers,4883.0,Finance,,Financial & Banking Information,2020,"1,000-9,999",1-99,
10568,06/10/2020 12:00:00 AM,07/09/2020 12:00:00 AM,Cyberattack,2020-05-24T00:00:00,2020-06-08T00:00:00,"Collabera, Inc.",Ransomware,,Business,Professional Services,Name,2020,Unknown,1-99,
10568,06/10/2020 12:00:00 AM,07/09/2020 12:00:00 AM,Cyberattack,2020-05-24T00:00:00,2020-06-08T00:00:00,"Collabera, Inc.",Ransomware,,Business,Professional Services,Social Security Number,2020,Unknown,1-99,
10568,06/10/2020 12:00:00 AM,07/09/2020 12:00:00 AM,Cyberattack,2020-05-24T00:00:00,2020-06-08T00:00:00,"Collabera, Inc.",Ransomware,,Business,Professional Services,Full Date of Birth,2020,Unknown,1-99,
10568,06/10/2020 12:00:00 AM,07/09/2020 12:00:00 AM,Cyberattack,2020-05-24T00:00:00,2020-06-08T00:00:00,"Collabera, Inc.",Ransomware,,Business,Professional Services,Passport Number,2020,Unknown,1-99,
10568,06/10/2020 12:00:00 AM,07/09/2020 12:00:00 AM,Cyberattack,2020-05-24T00:00:00,2020-06-08T00:00:00,"Collabera, Inc.",Ransomware,,Business,Professional Services,Other,2020,Unknown,1-99,
10569,06/09/2020 12:00:00 AM,07/10/2020 12:00:00 AM,Unauthorized Access,2020-06-06T00:00:00,2020-06-10T00:00:00,"Fetch Rewards, Inc.",,128598.0,Business,Retail,Name,2020,"50,000-999,999",1-99,
10569,06/09/2020 12:00:00 AM,07/10/2020 12:00:00 AM,Unauthorized Access,2020-06-06T00:00:00,2020-06-10T00:00:00,"Fetch Rewards, Inc.",,128598.0,Business,Retail,Full Date of Birth,2020,"50,000-999,999",1-99,
10569,06/09/2020 12:00:00 AM,07/10/2020 12:00:00 AM,Unauthorized Access,2020-06-06T00:00:00,2020-06-10T00:00:00,"Fetch Rewards, Inc.",,128598.0,Business,Retail,Email Address and Password/Security Question Answers,2020,"50,000-999,999",1-99,
10569,06/09/2020 12:00:00 AM,07/10/2020 12:00:00 AM,Unauthorized Access,2020-06-06T00:00:00,2020-06-10T00:00:00,"Fetch Rewards, Inc.",,128598.0,Business,Retail,Other,2020,"50,000-999,999",1-99,
10570,,07/10/2020 12:00:00 AM,Unauthorized Access,,,Morgan Stanley,,401246.0,Finance,,Name,2020,"50,000-999,999",Unknown,
10570,,07/10/2020 12:00:00 AM,Unauthorized Access,,,Morgan Stanley,,401246.0,Finance,,Social Security Number,2020,"50,000-999,999",Unknown,
10570,,07/10/2020 12:00:00 AM,Unauthorized Access,,,Morgan Stanley,,401246.0,Finance,,Full Date of Birth,2020,"50,000-999,999",Unknown,
10570,,07/10/2020 12:00:00 AM,Unauthorized Access,,,Morgan Stanley,,401246.0,Finance,,Passport Number,2020,"50,000-999,999",Unknown,
10570,,07/10/2020 12:00:00 AM,Unauthorized Access,,,Morgan Stanley,,401246.0,Finance,,Other,2020,"50,000-999,999",Unknown,
10571,,07/14/2020 12:00:00 AM,Cyberattack,2017-02-16T00:00:00,2020-05-20T00:00:00,"Merani Hospitality, Inc.",Skimmers,,Business,Hospitality,Name,2020,Unknown,Unknown,
10571,,07/14/2020 12:00:00 AM,Cyberattack,2017-02-16T00:00:00,2020-05-20T00:00:00,"Merani Hospitality, Inc.",Skimmers,,Business,Hospitality,Financial & Banking Information,2020,Unknown,Unknown,
10572,06/16/2020 12:00:00 AM,07/16/2020 12:00:00 AM,Unauthorized Access,2020-05-28T00:00:00,2020-06-02T00:00:00,"Gonzales, Gonzales, & Gonzales Immigration Law Offices",,1098.0,Business,Legal,Name,2020,"1,000-9,999",1-99,
10572,06/16/2020 12:00:00 AM,07/16/2020 12:00:00 AM,Unauthorized Access,2020-05-28T00:00:00,2020-06-02T00:00:00,"Gonzales, Gonzales, & Gonzales Immigration Law Offices",,1098.0,Business,Legal,Social Security Number,2020,"1,000-9,999",1-99,
10572,06/16/2020 12:00:00 AM,07/16/2020 12:00:00 AM,Unauthorized Access,2020-05-28T00:00:00,2020-06-02T00:00:00,"Gonzales, Gonzales, & Gonzales Immigration Law Offices",,1098.0,Business,Legal,Financial & Banking Information,2020,"1,000-9,999",1-99,
10572,06/16/2020 12:00:00 AM,07/16/2020 12:00:00 AM,Unauthorized Access,2020-05-28T00:00:00,2020-06-02T00:00:00,"Gonzales, Gonzales, & Gonzales Immigration Law Offices",,1098.0,Business,Legal,Passport Number,2020,"1,000-9,999",1-99,
10572,06/16/2020 12:00:00 AM,07/16/2020 12:00:00 AM,Unauthorized Access,2020-05-28T00:00:00,2020-06-02T00:00:00,"Gonzales, Gonzales, & Gonzales Immigration Law Offices",,1098.0,Business,Legal,Other,2020,"1,000-9,999",1-99,
10575,06/16/2018 12:00:00 AM,07/27/2018 12:00:00 AM,Cyberattack,2008-04-01T00:00:00,2009-01-01T00:00:00,Yale University,Unclear/unknown,1742.0,Education,,Name,2019,"1,000-9,999",500+,
10575,06/16/2018 12:00:00 AM,07/27/2018 12:00:00 AM,Cyberattack,2008-04-01T00:00:00,2009-01-01T00:00:00,Yale University,Unclear/unknown,1742.0,Education,,Social Security Number,2019,"1,000-9,999",500+,
10575,06/16/2018 12:00:00 AM,07/27/2018 12:00:00 AM,Cyberattack,2008-04-01T00:00:00,2009-01-01T00:00:00,Yale University,Unclear/unknown,1742.0,Education,,Full Date of Birth,2019,"1,000-9,999",500+,
10575,06/16/2018 12:00:00 AM,07/27/2018 12:00:00 AM,Cyberattack,2008-04-01T00:00:00,2009-01-01T00:00:00,Yale University,Unclear/unknown,1742.0,Education,,Other,2019,"1,000-9,999",500+,
10576,06/14/2018 12:00:00 AM,08/03/2018 12:00:00 AM,Cyberattack,2018-03-28T00:00:00,2018-04-13T00:00:00,Colorado Bankers Life Insurance Company,Phishing,956.0,Finance,,Name,2019,500-999,1-99,
10576,06/14/2018 12:00:00 AM,08/03/2018 12:00:00 AM,Cyberattack,2018-03-28T00:00:00,2018-04-13T00:00:00,Colorado Bankers Life Insurance Company,Phishing,956.0,Finance,,Social Security Number,2019,500-999,1-99,
10576,06/14/2018 12:00:00 AM,08/03/2018 12:00:00 AM,Cyberattack,2018-03-28T00:00:00,2018-04-13T00:00:00,Colorado Bankers Life Insurance Company,Phishing,956.0,Finance,,Financial & Banking Information,2019,500-999,1-99,
10577,08/16/2018 12:00:00 AM,08/22/2018 12:00:00 AM,Cyberattack,2017-11-03T00:00:00,2018-01-02T00:00:00,Cheddar's Scratch Kitchen,Unclear/unknown,,Business,Hospitality,Name,2019,Unknown,200-299,
10577,08/16/2018 12:00:00 AM,08/22/2018 12:00:00 AM,Cyberattack,2017-11-03T00:00:00,2018-01-02T00:00:00,Cheddar's Scratch Kitchen,Unclear/unknown,,Business,Hospitality,Financial & Banking Information,2019,Unknown,200-299,
10578,06/01/2018 12:00:00 AM,08/29/2018 12:00:00 AM,Cyberattack,2016-06-01T00:00:00,2018-07-09T00:00:00,LILLEbaby,Malware,1557.0,Business,Accessories,Name,2019,"1,000-9,999",500+,
10578,06/01/2018 12:00:00 AM,08/29/2018 12:00:00 AM,Cyberattack,2016-06-01T00:00:00,2018-07-09T00:00:00,LILLEbaby,Malware,1557.0,Business,Accessories,Financial & Banking Information,2019,"1,000-9,999",500+,
10579,06/12/2018 12:00:00 AM,09/12/2018 12:00:00 AM,Unauthorized Access,,2018-06-12T00:00:00,Skagit Bancorp Inc.,,519.0,Finance,,Name,2019,500-999,Unknown,
10579,06/12/2018 12:00:00 AM,09/12/2018 12:00:00 AM,Unauthorized Access,,2018-06-12T00:00:00,Skagit Bancorp Inc.,,519.0,Finance,,Social Security Number,2019,500-999,Unknown,
10579,06/12/2018 12:00:00 AM,09/12/2018 12:00:00 AM,Unauthorized Access,,2018-06-12T00:00:00,Skagit Bancorp Inc.,,519.0,Finance,,Driver's License or Washington ID Card Number,2019,500-999,Unknown,
10579,06/12/2018 12:00:00 AM,09/12/2018 12:00:00 AM,Unauthorized Access,,2018-06-12T00:00:00,Skagit Bancorp Inc.,,519.0,Finance,,Financial & Banking Information,2019,500-999,Unknown,
10579,06/12/2018 12:00:00 AM,09/12/2018 12:00:00 AM,Unauthorized Access,,2018-06-12T00:00:00,Skagit Bancorp Inc.,,519.0,Finance,,Full Date of Birth,2019,500-999,Unknown,
10579,06/12/2018 12:00:00 AM,09/12/2018 12:00:00 AM,Unauthorized Access,,2018-06-12T00:00:00,Skagit Bancorp Inc.,,519.0,Finance,,Username and Password/Security Question Answers,2019,500-999,Unknown,
10579,06/12/2018 12:00:00 AM,09/12/2018 12:00:00 AM,Unauthorized Access,,2018-06-12T00:00:00,Skagit Bancorp Inc.,,519.0,Finance,,Other,2019,500-999,Unknown,
10580,05/22/2018 12:00:00 AM,10/05/2018 12:00:00 AM,Unauthorized Access,2018-05-22T00:00:00,,Rebound Orthopedics & Neurosurgery,,1607.0,Health,,Name,2019,"1,000-9,999",Unknown,WA
10580,05/22/2018 12:00:00 AM,10/05/2018 12:00:00 AM,Unauthorized Access,2018-05-22T00:00:00,,Rebound Orthopedics & Neurosurgery,,1607.0,Health,,Social Security Number,2019,"1,000-9,999",Unknown,WA
10580,05/22/2018 12:00:00 AM,10/05/2018 12:00:00 AM,Unauthorized Access,2018-05-22T00:00:00,,Rebound Orthopedics & Neurosurgery,,1607.0,Health,,Driver's License or Washington ID Card Number,2019,"1,000-9,999",Unknown,WA
10580,05/22/2018 12:00:00 AM,10/05/2018 12:00:00 AM,Unauthorized Access,2018-05-22T00:00:00,,Rebound Orthopedics & Neurosurgery,,1607.0,Health,,Financial & Banking Information,2019,"1,000-9,999",Unknown,WA
10580,05/22/2018 12:00:00 AM,10/05/2018 12:00:00 AM,Unauthorized Access,2018-05-22T00:00:00,,Rebound Orthopedics & Neurosurgery,,1607.0,Health,,Full Date of Birth,2019,"1,000-9,999",Unknown,WA
10580,05/22/2018 12:00:00 AM,10/05/2018 12:00:00 AM,Unauthorized Access,2018-05-22T00:00:00,,Rebound Orthopedics & Neurosurgery,,1607.0,Health,,Medical Information,2019,"1,000-9,999",Unknown,WA
10582,06/13/2018 12:00:00 AM,10/18/2018 12:00:00 AM,Cyberattack,2018-06-05T00:00:00,2018-06-13T00:00:00,Renaissance Philanthropic Solutions Group,Phishing,609.0,Business,Professional Services,Name,2019,500-999,1-99,
10582,06/13/2018 12:00:00 AM,10/18/2018 12:00:00 AM,Cyberattack,2018-06-05T00:00:00,2018-06-13T00:00:00,Renaissance Philanthropic Solutions Group,Phishing,609.0,Business,Professional Services,Social Security Number,2019,500-999,1-99,
10582,06/13/2018 12:00:00 AM,10/18/2018 12:00:00 AM,Cyberattack,2018-06-05T00:00:00,2018-06-13T00:00:00,Renaissance Philanthropic Solutions Group,Phishing,609.0,Business,Professional Services,Driver's License or Washington ID Card Number,2019,500-999,1-99,
10582,06/13/2018 12:00:00 AM,10/18/2018 12:00:00 AM,Cyberattack,2018-06-05T00:00:00,2018-06-13T00:00:00,Renaissance Philanthropic Solutions Group,Phishing,609.0,Business,Professional Services,Financial & Banking Information,2019,500-999,1-99,
10582,06/13/2018 12:00:00 AM,10/18/2018 12:00:00 AM,Cyberattack,2018-06-05T00:00:00,2018-06-13T00:00:00,Renaissance Philanthropic Solutions Group,Phishing,609.0,Business,Professional Services,Other,2019,500-999,1-99,
10583,09/12/2018 12:00:00 AM,10/22/2018 12:00:00 AM,Cyberattack,2018-08-26T00:00:00,2018-08-29T00:00:00,Challenger Sports Inc.,Unclear/unknown,516.0,Business,Clothing,Name,2019,500-999,1-99,
10583,09/12/2018 12:00:00 AM,10/22/2018 12:00:00 AM,Cyberattack,2018-08-26T00:00:00,2018-08-29T00:00:00,Challenger Sports Inc.,Unclear/unknown,516.0,Business,Clothing,Financial & Banking Information,2019,500-999,1-99,
10583,09/12/2018 12:00:00 AM,10/22/2018 12:00:00 AM,Cyberattack,2018-08-26T00:00:00,2018-08-29T00:00:00,Challenger Sports Inc.,Unclear/unknown,516.0,Business,Clothing,Other,2019,500-999,1-99,
10587,10/09/2018 12:00:00 AM,11/05/2018 12:00:00 AM,Theft or Mistake,2018-10-09T00:00:00,2018-10-09T00:00:00,Nordstrom Inc.,,13442.0,Business,Retail,Name,2019,"10,000-49,999",0,
10587,10/09/2018 12:00:00 AM,11/05/2018 12:00:00 AM,Theft or Mistake,2018-10-09T00:00:00,2018-10-09T00:00:00,Nordstrom Inc.,,13442.0,Business,Retail,Social Security Number,2019,"10,000-49,999",0,
10587,10/09/2018 12:00:00 AM,11/05/2018 12:00:00 AM,Theft or Mistake,2018-10-09T00:00:00,2018-10-09T00:00:00,Nordstrom Inc.,,13442.0,Business,Retail,Financial & Banking Information,2019,"10,000-49,999",0,
10587,10/09/2018 12:00:00 AM,11/05/2018 12:00:00 AM,Theft or Mistake,2018-10-09T00:00:00,2018-10-09T00:00:00,Nordstrom Inc.,,13442.0,Business,Retail,Full Date of Birth,2019,"10,000-49,999",0,
10587,10/09/2018 12:00:00 AM,11/05/2018 12:00:00 AM,Theft or Mistake,2018-10-09T00:00:00,2018-10-09T00:00:00,Nordstrom Inc.,,13442.0,Business,Retail,Other,2019,"10,000-49,999",0,
10588,09/25/2018 12:00:00 AM,11/06/2018 12:00:00 AM,Cyberattack,2018-05-27T00:00:00,2018-08-13T00:00:00,"Southwest Washington Regional Surgery Center, LLC",Phishing,1690.0,Health,,Name,2019,"1,000-9,999",100-199,
10588,09/25/2018 12:00:00 AM,11/06/2018 12:00:00 AM,Cyberattack,2018-05-27T00:00:00,2018-08-13T00:00:00,"Southwest Washington Regional Surgery Center, LLC",Phishing,1690.0,Health,,Social Security Number,2019,"1,000-9,999",100-199,
10588,09/25/2018 12:00:00 AM,11/06/2018 12:00:00 AM,Cyberattack,2018-05-27T00:00:00,2018-08-13T00:00:00,"Southwest Washington Regional Surgery Center, LLC",Phishing,1690.0,Health,,Driver's License or Washington ID Card Number,2019,"1,000-9,999",100-199,
10588,09/25/2018 12:00:00 AM,11/06/2018 12:00:00 AM,Cyberattack,2018-05-27T00:00:00,2018-08-13T00:00:00,"Southwest Washington Regional Surgery Center, LLC",Phishing,1690.0,Health,,Financial & Banking Information,2019,"1,000-9,999",100-199,
10588,09/25/2018 12:00:00 AM,11/06/2018 12:00:00 AM,Cyberattack,2018-05-27T00:00:00,2018-08-13T00:00:00,"Southwest Washington Regional Surgery Center, LLC",Phishing,1690.0,Health,,Full Date of Birth,2019,"1,000-9,999",100-199,
10588,09/25/2018 12:00:00 AM,11/06/2018 12:00:00 AM,Cyberattack,2018-05-27T00:00:00,2018-08-13T00:00:00,"Southwest Washington Regional Surgery Center, LLC",Phishing,1690.0,Health,,Health Insurance Policy or ID Number,2019,"1,000-9,999",100-199,
10588,09/25/2018 12:00:00 AM,11/06/2018 12:00:00 AM,Cyberattack,2018-05-27T00:00:00,2018-08-13T00:00:00,"Southwest Washington Regional Surgery Center, LLC",Phishing,1690.0,Health,,Medical Information,2019,"1,000-9,999",100-199,
10589,08/01/2018 12:00:00 AM,11/07/2018 12:00:00 AM,Unauthorized Access,2017-12-06T00:00:00,2018-02-25T00:00:00,"Unified Trust Company, N.A.",,1196.0,Finance,,Name,2019,"1,000-9,999",200-299,
10589,08/01/2018 12:00:00 AM,11/07/2018 12:00:00 AM,Unauthorized Access,2017-12-06T00:00:00,2018-02-25T00:00:00,"Unified Trust Company, N.A.",,1196.0,Finance,,Social Security Number,2019,"1,000-9,999",200-299,
10589,08/01/2018 12:00:00 AM,11/07/2018 12:00:00 AM,Unauthorized Access,2017-12-06T00:00:00,2018-02-25T00:00:00,"Unified Trust Company, N.A.",,1196.0,Finance,,Financial & Banking Information,2019,"1,000-9,999",200-299,
10589,08/01/2018 12:00:00 AM,11/07/2018 12:00:00 AM,Unauthorized Access,2017-12-06T00:00:00,2018-02-25T00:00:00,"Unified Trust Company, N.A.",,1196.0,Finance,,Other,2019,"1,000-9,999",200-299,
10590,09/20/2018 12:00:00 AM,11/09/2018 12:00:00 AM,Cyberattack,2017-12-06T00:00:00,2018-06-27T00:00:00,Thesy LLC,Malware,5907.0,Business,Retail,Name,2019,"1,000-9,999",200-299,
10590,09/20/2018 12:00:00 AM,11/09/2018 12:00:00 AM,Cyberattack,2017-12-06T00:00:00,2018-06-27T00:00:00,Thesy LLC,Malware,5907.0,Business,Retail,Financial & Banking Information,2019,"1,000-9,999",200-299,
10591,08/06/2018 12:00:00 AM,11/12/2018 12:00:00 AM,Cyberattack,2017-12-28T00:00:00,2018-07-09T00:00:00,"Title Nine Sports, Inc.",Malware,4837.0,Business,Clothing,Name,2019,"1,000-9,999",200-299,
10591,08/06/2018 12:00:00 AM,11/12/2018 12:00:00 AM,Cyberattack,2017-12-28T00:00:00,2018-07-09T00:00:00,"Title Nine Sports, Inc.",Malware,4837.0,Business,Clothing,Financial & Banking Information,2019,"1,000-9,999",200-299,
10591,08/06/2018 12:00:00 AM,11/12/2018 12:00:00 AM,Cyberattack,2017-12-28T00:00:00,2018-07-09T00:00:00,"Title Nine Sports, Inc.",Malware,4837.0,Business,Clothing,Other,2019,"1,000-9,999",200-299,
10592,09/27/2018 12:00:00 AM,11/12/2018 12:00:00 AM,Unauthorized Access,,,Collier Heggerness & Bronk CPA's PS Inc.,,2194.0,Business,Professional Services,Name,2019,"1,000-9,999",Unknown,
10592,09/27/2018 12:00:00 AM,11/12/2018 12:00:00 AM,Unauthorized Access,,,Collier Heggerness & Bronk CPA's PS Inc.,,2194.0,Business,Professional Services,Social Security Number,2019,"1,000-9,999",Unknown,
10592,09/27/2018 12:00:00 AM,11/12/2018 12:00:00 AM,Unauthorized Access,,,Collier Heggerness & Bronk CPA's PS Inc.,,2194.0,Business,Professional Services,Driver's License or Washington ID Card Number,2019,"1,000-9,999",Unknown,
10592,09/27/2018 12:00:00 AM,11/12/2018 12:00:00 AM,Unauthorized Access,,,Collier Heggerness & Bronk CPA's PS Inc.,,2194.0,Business,Professional Services,Financial & Banking Information,2019,"1,000-9,999",Unknown,
10592,09/27/2018 12:00:00 AM,11/12/2018 12:00:00 AM,Unauthorized Access,,,Collier Heggerness & Bronk CPA's PS Inc.,,2194.0,Business,Professional Services,Other,2019,"1,000-9,999",Unknown,
10593,08/06/2018 12:00:00 AM,11/13/2018 12:00:00 AM,Cyberattack,2017-12-28T00:00:00,2018-07-09T00:00:00,Stein Mart Inc.,Malware,680.0,Business,Retail,Name,2019,500-999,200-299,
10593,08/06/2018 12:00:00 AM,11/13/2018 12:00:00 AM,Cyberattack,2017-12-28T00:00:00,2018-07-09T00:00:00,Stein Mart Inc.,Malware,680.0,Business,Retail,Financial & Banking Information,2019,500-999,200-299,
10593,08/06/2018 12:00:00 AM,11/13/2018 12:00:00 AM,Cyberattack,2017-12-28T00:00:00,2018-07-09T00:00:00,Stein Mart Inc.,Malware,680.0,Business,Retail,Other,2019,500-999,200-299,
10594,09/17/2018 12:00:00 AM,11/13/2018 12:00:00 AM,Unauthorized Access,2018-05-11T00:00:00,2018-07-06T00:00:00,"Pharmacy Times Office of Continuing Professional Education, LLC",,797.0,Education,,Name,2019,500-999,100-199,
10594,09/17/2018 12:00:00 AM,11/13/2018 12:00:00 AM,Unauthorized Access,2018-05-11T00:00:00,2018-07-06T00:00:00,"Pharmacy Times Office of Continuing Professional Education, LLC",,797.0,Education,,Social Security Number,2019,500-999,100-199,
10595,09/18/2018 12:00:00 AM,11/15/2018 12:00:00 AM,Cyberattack,2018-08-13T00:00:00,2018-09-19T00:00:00,Newegg Inc.,Malware,5931.0,Business,Retail,Name,2019,"1,000-9,999",1-99,
10595,09/18/2018 12:00:00 AM,11/15/2018 12:00:00 AM,Cyberattack,2018-08-13T00:00:00,2018-09-19T00:00:00,Newegg Inc.,Malware,5931.0,Business,Retail,Financial & Banking Information,2019,"1,000-9,999",1-99,
10595,09/18/2018 12:00:00 AM,11/15/2018 12:00:00 AM,Cyberattack,2018-08-13T00:00:00,2018-09-19T00:00:00,Newegg Inc.,Malware,5931.0,Business,Retail,Other,2019,"1,000-9,999",1-99,
10596,10/05/2018 12:00:00 AM,11/15/2018 12:00:00 AM,Cyberattack,2018-09-04T00:00:00,2018-10-05T00:00:00,HealthEquity Inc.,Phishing,27175.0,Health,,Name,2019,"10,000-49,999",1-99,
10596,10/05/2018 12:00:00 AM,11/15/2018 12:00:00 AM,Cyberattack,2018-09-04T00:00:00,2018-10-05T00:00:00,HealthEquity Inc.,Phishing,27175.0,Health,,Social Security Number,2019,"10,000-49,999",1-99,
10596,10/05/2018 12:00:00 AM,11/15/2018 12:00:00 AM,Cyberattack,2018-09-04T00:00:00,2018-10-05T00:00:00,HealthEquity Inc.,Phishing,27175.0,Health,,Other,2019,"10,000-49,999",1-99,
10597,11/05/2018 12:00:00 AM,11/16/2018 12:00:00 AM,Cyberattack,2018-10-01T00:00:00,2018-10-31T00:00:00,Washington State Employees Credit Union,Skimmers,2560.0,Finance,,Name,2019,"1,000-9,999",1-99,
10597,11/05/2018 12:00:00 AM,11/16/2018 12:00:00 AM,Cyberattack,2018-10-01T00:00:00,2018-10-31T00:00:00,Washington State Employees Credit Union,Skimmers,2560.0,Finance,,Financial & Banking Information,2019,"1,000-9,999",1-99,
10598,11/01/2018 12:00:00 AM,11/16/2018 12:00:00 AM,Cyberattack,2018-11-01T00:00:00,2018-11-01T00:00:00,LPL Financial LLC,Unclear/unknown,8127.0,Finance,,Name,2019,"1,000-9,999",0,
10598,11/01/2018 12:00:00 AM,11/16/2018 12:00:00 AM,Cyberattack,2018-11-01T00:00:00,2018-11-01T00:00:00,LPL Financial LLC,Unclear/unknown,8127.0,Finance,,Social Security Number,2019,"1,000-9,999",0,
10598,11/01/2018 12:00:00 AM,11/16/2018 12:00:00 AM,Cyberattack,2018-11-01T00:00:00,2018-11-01T00:00:00,LPL Financial LLC,Unclear/unknown,8127.0,Finance,,Other,2019,"1,000-9,999",0,
10599,11/08/2018 12:00:00 AM,11/19/2018 12:00:00 AM,Cyberattack,2017-12-28T00:00:00,2018-07-09T00:00:00,Francesca's Services Corporation,Malware,1148.0,Business,Retail,Name,2019,"1,000-9,999",300-399,
10599,11/08/2018 12:00:00 AM,11/19/2018 12:00:00 AM,Cyberattack,2017-12-28T00:00:00,2018-07-09T00:00:00,Francesca's Services Corporation,Malware,1148.0,Business,Retail,Financial & Banking Information,2019,"1,000-9,999",300-399,
10599,11/08/2018 12:00:00 AM,11/19/2018 12:00:00 AM,Cyberattack,2017-12-28T00:00:00,2018-07-09T00:00:00,Francesca's Services Corporation,Malware,1148.0,Business,Retail,Username and Password/Security Question Answers,2019,"1,000-9,999",300-399,
10599,11/08/2018 12:00:00 AM,11/19/2018 12:00:00 AM,Cyberattack,2017-12-28T00:00:00,2018-07-09T00:00:00,Francesca's Services Corporation,Malware,1148.0,Business,Retail,Other,2019,"1,000-9,999",300-399,
10600,09/05/2018 12:00:00 AM,11/21/2018 12:00:00 AM,Cyberattack,2018-08-21T00:00:00,2018-09-05T00:00:00,British Airways PLC,Malware,1588.0,Business,Transportation,Name,2019,"1,000-9,999",1-99,
10600,09/05/2018 12:00:00 AM,11/21/2018 12:00:00 AM,Cyberattack,2018-08-21T00:00:00,2018-09-05T00:00:00,British Airways PLC,Malware,1588.0,Business,Transportation,Financial & Banking Information,2019,"1,000-9,999",1-99,
10600,09/05/2018 12:00:00 AM,11/21/2018 12:00:00 AM,Cyberattack,2018-08-21T00:00:00,2018-09-05T00:00:00,British Airways PLC,Malware,1588.0,Business,Transportation,Other,2019,"1,000-9,999",1-99,
10601,08/22/2018 12:00:00 AM,11/27/2018 12:00:00 AM,Cyberattack,2017-08-01T00:00:00,2018-09-30T00:00:00,Burgerville LLC,Malware,,Business,Hospitality,Name,2019,Unknown,400-499,
10601,08/22/2018 12:00:00 AM,11/27/2018 12:00:00 AM,Cyberattack,2017-08-01T00:00:00,2018-09-30T00:00:00,Burgerville LLC,Malware,,Business,Hospitality,Financial & Banking Information,2019,Unknown,400-499,
10602,10/14/2018 12:00:00 AM,11/27/2018 12:00:00 AM,Theft or Mistake,2018-10-14T00:00:00,2018-10-14T00:00:00,Washington State Patrol,,1171.0,Government,,Name,2019,"1,000-9,999",0,
10602,10/14/2018 12:00:00 AM,11/27/2018 12:00:00 AM,Theft or Mistake,2018-10-14T00:00:00,2018-10-14T00:00:00,Washington State Patrol,,1171.0,Government,,Social Security Number,2019,"1,000-9,999",0,
10602,10/14/2018 12:00:00 AM,11/27/2018 12:00:00 AM,Theft or Mistake,2018-10-14T00:00:00,2018-10-14T00:00:00,Washington State Patrol,,1171.0,Government,,Driver's License or Washington ID Card Number,2019,"1,000-9,999",0,
10604,08/10/2018 12:00:00 AM,12/05/2018 12:00:00 AM,Cyberattack,2018-02-05T00:00:00,2018-08-21T00:00:00,San Diego Hardware,Malware,604.0,Business,Home,Name,2019,500-999,100-199,
10604,08/10/2018 12:00:00 AM,12/05/2018 12:00:00 AM,Cyberattack,2018-02-05T00:00:00,2018-08-21T00:00:00,San Diego Hardware,Malware,604.0,Business,Home,Financial & Banking Information,2019,500-999,100-199,
10604,08/10/2018 12:00:00 AM,12/05/2018 12:00:00 AM,Cyberattack,2018-02-05T00:00:00,2018-08-21T00:00:00,San Diego Hardware,Malware,604.0,Business,Home,Other,2019,500-999,100-199,
10605,05/02/2018 12:00:00 AM,12/07/2018 12:00:00 AM,Cyberattack,,,Titan Manufacturing and Distributing Inc.,Malware,1838.0,Business,Manufacturing,Name,2019,"1,000-9,999",Unknown,
10605,05/02/2018 12:00:00 AM,12/07/2018 12:00:00 AM,Cyberattack,,,Titan Manufacturing and Distributing Inc.,Malware,1838.0,Business,Manufacturing,Financial & Banking Information,2019,"1,000-9,999",Unknown,
10605,05/02/2018 12:00:00 AM,12/07/2018 12:00:00 AM,Cyberattack,,,Titan Manufacturing and Distributing Inc.,Malware,1838.0,Business,Manufacturing,Other,2019,"1,000-9,999",Unknown,
10606,12/20/2018 12:00:00 AM,12/26/2018 12:00:00 AM,Cyberattack,2018-08-05T00:00:00,2018-11-16T00:00:00,Bel USA LLC,Malware,1553.0,Business,Retail,Name,2019,"1,000-9,999",100-199,
10606,12/20/2018 12:00:00 AM,12/26/2018 12:00:00 AM,Cyberattack,2018-08-05T00:00:00,2018-11-16T00:00:00,Bel USA LLC,Malware,1553.0,Business,Retail,Financial & Banking Information,2019,"1,000-9,999",100-199,
10607,09/14/2018 12:00:00 AM,12/31/2018 12:00:00 AM,Cyberattack,2018-06-07T00:00:00,2018-09-24T00:00:00,Aimbridge Hospitality Holdings LLC,Phishing,647.0,Business,Hospitality,Name,2019,500-999,100-199,
10607,09/14/2018 12:00:00 AM,12/31/2018 12:00:00 AM,Cyberattack,2018-06-07T00:00:00,2018-09-24T00:00:00,Aimbridge Hospitality Holdings LLC,Phishing,647.0,Business,Hospitality,Social Security Number,2019,500-999,100-199,
10607,09/14/2018 12:00:00 AM,12/31/2018 12:00:00 AM,Cyberattack,2018-06-07T00:00:00,2018-09-24T00:00:00,Aimbridge Hospitality Holdings LLC,Phishing,647.0,Business,Hospitality,Driver's License or Washington ID Card Number,2019,500-999,100-199,
10607,09/14/2018 12:00:00 AM,12/31/2018 12:00:00 AM,Cyberattack,2018-06-07T00:00:00,2018-09-24T00:00:00,Aimbridge Hospitality Holdings LLC,Phishing,647.0,Business,Hospitality,Financial & Banking Information,2019,500-999,100-199,
10609,08/17/2018 12:00:00 AM,01/09/2019 12:00:00 AM,Cyberattack,2017-08-15T00:00:00,2019-01-04T00:00:00,A&A Global Imports Inc.,Malware,2783.0,Business,Manufacturing,Name,2019,"1,000-9,999",500+,
10609,08/17/2018 12:00:00 AM,01/09/2019 12:00:00 AM,Cyberattack,2017-08-15T00:00:00,2019-01-04T00:00:00,A&A Global Imports Inc.,Malware,2783.0,Business,Manufacturing,Financial & Banking Information,2019,"1,000-9,999",500+,
10609,08/17/2018 12:00:00 AM,01/09/2019 12:00:00 AM,Cyberattack,2017-08-15T00:00:00,2019-01-04T00:00:00,A&A Global Imports Inc.,Malware,2783.0,Business,Manufacturing,Username and Password/Security Question Answers,2019,"1,000-9,999",500+,
10609,08/17/2018 12:00:00 AM,01/09/2019 12:00:00 AM,Cyberattack,2017-08-15T00:00:00,2019-01-04T00:00:00,A&A Global Imports Inc.,Malware,2783.0,Business,Manufacturing,Other,2019,"1,000-9,999",500+,
10611,12/19/2018 12:00:00 AM,01/18/2019 12:00:00 AM,Cyberattack,2018-07-19T00:00:00,2018-12-12T00:00:00,"Pharmaca Integrative Pharmacy, LLC",Malware,,Business,Cosmetic,Name,2019,Unknown,100-199,
10611,12/19/2018 12:00:00 AM,01/18/2019 12:00:00 AM,Cyberattack,2018-07-19T00:00:00,2018-12-12T00:00:00,"Pharmaca Integrative Pharmacy, LLC",Malware,,Business,Cosmetic,Financial & Banking Information,2019,Unknown,100-199,
10612,12/20/2018 12:00:00 AM,01/30/2019 12:00:00 AM,Unauthorized Access,2018-11-01T00:00:00,2018-11-15T00:00:00,Image-I-Nation Technologies Inc.,,3695.0,Business,Software,Name,2019,"1,000-9,999",1-99,
10612,12/20/2018 12:00:00 AM,01/30/2019 12:00:00 AM,Unauthorized Access,2018-11-01T00:00:00,2018-11-15T00:00:00,Image-I-Nation Technologies Inc.,,3695.0,Business,Software,Social Security Number,2019,"1,000-9,999",1-99,
10612,12/20/2018 12:00:00 AM,01/30/2019 12:00:00 AM,Unauthorized Access,2018-11-01T00:00:00,2018-11-15T00:00:00,Image-I-Nation Technologies Inc.,,3695.0,Business,Software,Full Date of Birth,2019,"1,000-9,999",1-99,
10613,01/25/2019 12:00:00 AM,02/12/2019 12:00:00 AM,Cyberattack,2018-02-01T00:00:00,2019-01-01T00:00:00,Stanwich Mortgage Loan Trust,Unclear/unknown,702.0,Finance,,Name,2019,500-999,300-399,
10613,01/25/2019 12:00:00 AM,02/12/2019 12:00:00 AM,Cyberattack,2018-02-01T00:00:00,2019-01-01T00:00:00,Stanwich Mortgage Loan Trust,Unclear/unknown,702.0,Finance,,Social Security Number,2019,500-999,300-399,
10613,01/25/2019 12:00:00 AM,02/12/2019 12:00:00 AM,Cyberattack,2018-02-01T00:00:00,2019-01-01T00:00:00,Stanwich Mortgage Loan Trust,Unclear/unknown,702.0,Finance,,Driver's License or Washington ID Card Number,2019,500-999,300-399,
10613,01/25/2019 12:00:00 AM,02/12/2019 12:00:00 AM,Cyberattack,2018-02-01T00:00:00,2019-01-01T00:00:00,Stanwich Mortgage Loan Trust,Unclear/unknown,702.0,Finance,,Financial & Banking Information,2019,500-999,300-399,
10613,01/25/2019 12:00:00 AM,02/12/2019 12:00:00 AM,Cyberattack,2018-02-01T00:00:00,2019-01-01T00:00:00,Stanwich Mortgage Loan Trust,Unclear/unknown,702.0,Finance,,Full Date of Birth,2019,500-999,300-399,
10613,01/25/2019 12:00:00 AM,02/12/2019 12:00:00 AM,Cyberattack,2018-02-01T00:00:00,2019-01-01T00:00:00,Stanwich Mortgage Loan Trust,Unclear/unknown,702.0,Finance,,Medical Information,2019,500-999,300-399,
10613,01/25/2019 12:00:00 AM,02/12/2019 12:00:00 AM,Cyberattack,2018-02-01T00:00:00,2019-01-01T00:00:00,Stanwich Mortgage Loan Trust,Unclear/unknown,702.0,Finance,,Other,2019,500-999,300-399,
10614,12/14/2018 12:00:00 AM,02/14/2019 12:00:00 AM,Cyberattack,2018-02-02T00:00:00,2018-11-20T00:00:00,North 40 Outfitters,Unclear/unknown,2632.0,Business,Retail,Name,2019,"1,000-9,999",300-399,
10614,12/14/2018 12:00:00 AM,02/14/2019 12:00:00 AM,Cyberattack,2018-02-02T00:00:00,2018-11-20T00:00:00,North 40 Outfitters,Unclear/unknown,2632.0,Business,Retail,Financial & Banking Information,2019,"1,000-9,999",300-399,
10614,12/14/2018 12:00:00 AM,02/14/2019 12:00:00 AM,Cyberattack,2018-02-02T00:00:00,2018-11-20T00:00:00,North 40 Outfitters,Unclear/unknown,2632.0,Business,Retail,Username and Password/Security Question Answers,2019,"1,000-9,999",300-399,
10617,01/09/2019 12:00:00 AM,03/07/2019 12:00:00 AM,Cyberattack,2019-01-09T00:00:00,,Columbia Surgical Specialists,Ransomware,131260.0,Health,,Name,2019,"50,000-999,999",Unknown,
10617,01/09/2019 12:00:00 AM,03/07/2019 12:00:00 AM,Cyberattack,2019-01-09T00:00:00,,Columbia Surgical Specialists,Ransomware,131260.0,Health,,Social Security Number,2019,"50,000-999,999",Unknown,
10617,01/09/2019 12:00:00 AM,03/07/2019 12:00:00 AM,Cyberattack,2019-01-09T00:00:00,,Columbia Surgical Specialists,Ransomware,131260.0,Health,,Driver's License or Washington ID Card Number,2019,"50,000-999,999",Unknown,
10617,01/09/2019 12:00:00 AM,03/07/2019 12:00:00 AM,Cyberattack,2019-01-09T00:00:00,,Columbia Surgical Specialists,Ransomware,131260.0,Health,,Medical Information,2019,"50,000-999,999",Unknown,
10618,06/14/2018 12:00:00 AM,03/12/2019 12:00:00 AM,Cyberattack,2018-01-08T00:00:00,2018-08-07T00:00:00,ABM Industries Incorporated,Phishing,846.0,Business,Other,Name,2019,500-999,200-299,
10618,06/14/2018 12:00:00 AM,03/12/2019 12:00:00 AM,Cyberattack,2018-01-08T00:00:00,2018-08-07T00:00:00,ABM Industries Incorporated,Phishing,846.0,Business,Other,Social Security Number,2019,500-999,200-299,
10618,06/14/2018 12:00:00 AM,03/12/2019 12:00:00 AM,Cyberattack,2018-01-08T00:00:00,2018-08-07T00:00:00,ABM Industries Incorporated,Phishing,846.0,Business,Other,Driver's License or Washington ID Card Number,2019,500-999,200-299,
10618,06/14/2018 12:00:00 AM,03/12/2019 12:00:00 AM,Cyberattack,2018-01-08T00:00:00,2018-08-07T00:00:00,ABM Industries Incorporated,Phishing,846.0,Business,Other,Financial & Banking Information,2019,500-999,200-299,
10618,06/14/2018 12:00:00 AM,03/12/2019 12:00:00 AM,Cyberattack,2018-01-08T00:00:00,2018-08-07T00:00:00,ABM Industries Incorporated,Phishing,846.0,Business,Other,Medical Information,2019,500-999,200-299,
10619,12/14/2018 12:00:00 AM,03/15/2019 12:00:00 AM,Cyberattack,2018-12-07T00:00:00,2018-12-07T00:00:00,flexPath Strategies LLC,Phishing,1398.0,Business,Professional Services,Name,2019,"1,000-9,999",1-99,
10619,12/14/2018 12:00:00 AM,03/15/2019 12:00:00 AM,Cyberattack,2018-12-07T00:00:00,2018-12-07T00:00:00,flexPath Strategies LLC,Phishing,1398.0,Business,Professional Services,Social Security Number,2019,"1,000-9,999",1-99,
10621,02/17/2019 12:00:00 AM,04/02/2019 12:00:00 AM,Unauthorized Access,2018-12-01T00:00:00,2018-12-31T00:00:00,New Bit Ventures Ltd. (Coinmama.com),,1221.0,Business,Cryptocurrency,Name,2019,"1,000-9,999",1-99,
10621,02/17/2019 12:00:00 AM,04/02/2019 12:00:00 AM,Unauthorized Access,2018-12-01T00:00:00,2018-12-31T00:00:00,New Bit Ventures Ltd. (Coinmama.com),,1221.0,Business,Cryptocurrency,Driver's License or Washington ID Card Number,2019,"1,000-9,999",1-99,
10621,02/17/2019 12:00:00 AM,04/02/2019 12:00:00 AM,Unauthorized Access,2018-12-01T00:00:00,2018-12-31T00:00:00,New Bit Ventures Ltd. (Coinmama.com),,1221.0,Business,Cryptocurrency,Full Date of Birth,2019,"1,000-9,999",1-99,
10621,02/17/2019 12:00:00 AM,04/02/2019 12:00:00 AM,Unauthorized Access,2018-12-01T00:00:00,2018-12-31T00:00:00,New Bit Ventures Ltd. (Coinmama.com),,1221.0,Business,Cryptocurrency,Other,2019,"1,000-9,999",1-99,
10622,02/20/2019 12:00:00 AM,04/05/2019 12:00:00 AM,Cyberattack,,,Archbright,Phishing,1568.0,Business,Human Resources,Name,2019,"1,000-9,999",Unknown,
10622,02/20/2019 12:00:00 AM,04/05/2019 12:00:00 AM,Cyberattack,,,Archbright,Phishing,1568.0,Business,Human Resources,Social Security Number,2019,"1,000-9,999",Unknown,
10622,02/20/2019 12:00:00 AM,04/05/2019 12:00:00 AM,Cyberattack,,,Archbright,Phishing,1568.0,Business,Human Resources,Driver's License or Washington ID Card Number,2019,"1,000-9,999",Unknown,
10622,02/20/2019 12:00:00 AM,04/05/2019 12:00:00 AM,Cyberattack,,,Archbright,Phishing,1568.0,Business,Human Resources,Medical Information,2019,"1,000-9,999",Unknown,
10622,02/20/2019 12:00:00 AM,04/05/2019 12:00:00 AM,Cyberattack,,,Archbright,Phishing,1568.0,Business,Human Resources,Other,2019,"1,000-9,999",Unknown,
10624,08/21/2018 12:00:00 AM,04/03/2019 12:00:00 AM,Unauthorized Access,2018-05-08T00:00:00,2018-05-08T00:00:00,Jobscience Inc.,,1787.0,Business,Software,Name,2019,"1,000-9,999",100-199,
10624,08/21/2018 12:00:00 AM,04/03/2019 12:00:00 AM,Unauthorized Access,2018-05-08T00:00:00,2018-05-08T00:00:00,Jobscience Inc.,,1787.0,Business,Software,Social Security Number,2019,"1,000-9,999",100-199,
10624,08/21/2018 12:00:00 AM,04/03/2019 12:00:00 AM,Unauthorized Access,2018-05-08T00:00:00,2018-05-08T00:00:00,Jobscience Inc.,,1787.0,Business,Software,Driver's License or Washington ID Card Number,2019,"1,000-9,999",100-199,
10624,08/21/2018 12:00:00 AM,04/03/2019 12:00:00 AM,Unauthorized Access,2018-05-08T00:00:00,2018-05-08T00:00:00,Jobscience Inc.,,1787.0,Business,Software,Username and Password/Security Question Answers,2019,"1,000-9,999",100-199,
10624,08/21/2018 12:00:00 AM,04/03/2019 12:00:00 AM,Unauthorized Access,2018-05-08T00:00:00,2018-05-08T00:00:00,Jobscience Inc.,,1787.0,Business,Software,Other,2019,"1,000-9,999",100-199,
10626,03/28/2019 12:00:00 AM,04/23/2019 12:00:00 AM,Theft or Mistake,2019-03-26T00:00:00,2019-03-26T00:00:00,Seattle University,,2064.0,Education,,Name,2019,"1,000-9,999",1-99,
10626,03/28/2019 12:00:00 AM,04/23/2019 12:00:00 AM,Theft or Mistake,2019-03-26T00:00:00,2019-03-26T00:00:00,Seattle University,,2064.0,Education,,Social Security Number,2019,"1,000-9,999",1-99,
10627,04/03/2019 12:00:00 AM,04/26/2019 12:00:00 AM,Cyberattack,2018-07-04T00:00:00,2019-02-16T00:00:00,"Lancaster Archery Supply, Inc.",Unclear/unknown,1151.0,Business,Fitness,Name,2019,"1,000-9,999",200-299,
10627,04/03/2019 12:00:00 AM,04/26/2019 12:00:00 AM,Cyberattack,2018-07-04T00:00:00,2019-02-16T00:00:00,"Lancaster Archery Supply, Inc.",Unclear/unknown,1151.0,Business,Fitness,Financial & Banking Information,2019,"1,000-9,999",200-299,
10628,08/06/2018 12:00:00 AM,04/26/2019 12:00:00 AM,Unauthorized Access,,,Port of Seattle,,3357.0,Government,,Name,2019,"1,000-9,999",Unknown,
10628,08/06/2018 12:00:00 AM,04/26/2019 12:00:00 AM,Unauthorized Access,,,Port of Seattle,,3357.0,Government,,Social Security Number,2019,"1,000-9,999",Unknown,
10628,08/06/2018 12:00:00 AM,04/26/2019 12:00:00 AM,Unauthorized Access,,,Port of Seattle,,3357.0,Government,,Driver's License or Washington ID Card Number,2019,"1,000-9,999",Unknown,
10629,05/07/2019 12:00:00 AM,05/09/2019 12:00:00 AM,Cyberattack,2019-02-12T00:00:00,2019-03-26T00:00:00,Sage Advisors LLC,Phishing,1026.0,Business,Professional Services,Name,2019,"1,000-9,999",1-99,
10629,05/07/2019 12:00:00 AM,05/09/2019 12:00:00 AM,Cyberattack,2019-02-12T00:00:00,2019-03-26T00:00:00,Sage Advisors LLC,Phishing,1026.0,Business,Professional Services,Social Security Number,2019,"1,000-9,999",1-99,
10629,05/07/2019 12:00:00 AM,05/09/2019 12:00:00 AM,Cyberattack,2019-02-12T00:00:00,2019-03-26T00:00:00,Sage Advisors LLC,Phishing,1026.0,Business,Professional Services,Driver's License or Washington ID Card Number,2019,"1,000-9,999",1-99,
10629,05/07/2019 12:00:00 AM,05/09/2019 12:00:00 AM,Cyberattack,2019-02-12T00:00:00,2019-03-26T00:00:00,Sage Advisors LLC,Phishing,1026.0,Business,Professional Services,Financial & Banking Information,2019,"1,000-9,999",1-99,
10630,12/11/2018 12:00:00 AM,05/10/2019 12:00:00 AM,Unauthorized Access,,2018-12-11T00:00:00,Oklahoma Department of Securities,,2793.0,Government,,Name,2019,"1,000-9,999",Unknown,
10630,12/11/2018 12:00:00 AM,05/10/2019 12:00:00 AM,Unauthorized Access,,2018-12-11T00:00:00,Oklahoma Department of Securities,,2793.0,Government,,Social Security Number,2019,"1,000-9,999",Unknown,
10630,12/11/2018 12:00:00 AM,05/10/2019 12:00:00 AM,Unauthorized Access,,2018-12-11T00:00:00,Oklahoma Department of Securities,,2793.0,Government,,Driver's License or Washington ID Card Number,2019,"1,000-9,999",Unknown,
10630,12/11/2018 12:00:00 AM,05/10/2019 12:00:00 AM,Unauthorized Access,,2018-12-11T00:00:00,Oklahoma Department of Securities,,2793.0,Government,,Financial & Banking Information,2019,"1,000-9,999",Unknown,
10630,12/11/2018 12:00:00 AM,05/10/2019 12:00:00 AM,Unauthorized Access,,2018-12-11T00:00:00,Oklahoma Department of Securities,,2793.0,Government,,Full Date of Birth,2019,"1,000-9,999",Unknown,
10630,12/11/2018 12:00:00 AM,05/10/2019 12:00:00 AM,Unauthorized Access,,2018-12-11T00:00:00,Oklahoma Department of Securities,,2793.0,Government,,Medical Information,2019,"1,000-9,999",Unknown,
10631,05/14/2019 12:00:00 AM,05/21/2019 12:00:00 AM,Cyberattack,2019-05-14T00:00:00,2019-05-14T00:00:00,Service Linen Supply,Unclear/unknown,1210.0,Business,Cleaning,Name,2019,"1,000-9,999",0,
10631,05/14/2019 12:00:00 AM,05/21/2019 12:00:00 AM,Cyberattack,2019-05-14T00:00:00,2019-05-14T00:00:00,Service Linen Supply,Unclear/unknown,1210.0,Business,Cleaning,Social Security Number,2019,"1,000-9,999",0,
10631,05/14/2019 12:00:00 AM,05/21/2019 12:00:00 AM,Cyberattack,2019-05-14T00:00:00,2019-05-14T00:00:00,Service Linen Supply,Unclear/unknown,1210.0,Business,Cleaning,Driver's License or Washington ID Card Number,2019,"1,000-9,999",0,
10631,05/14/2019 12:00:00 AM,05/21/2019 12:00:00 AM,Cyberattack,2019-05-14T00:00:00,2019-05-14T00:00:00,Service Linen Supply,Unclear/unknown,1210.0,Business,Cleaning,Financial & Banking Information,2019,"1,000-9,999",0,
10631,05/14/2019 12:00:00 AM,05/21/2019 12:00:00 AM,Cyberattack,2019-05-14T00:00:00,2019-05-14T00:00:00,Service Linen Supply,Unclear/unknown,1210.0,Business,Cleaning,Full Date of Birth,2019,"1,000-9,999",0,
10631,05/14/2019 12:00:00 AM,05/21/2019 12:00:00 AM,Cyberattack,2019-05-14T00:00:00,2019-05-14T00:00:00,Service Linen Supply,Unclear/unknown,1210.0,Business,Cleaning,Medical Information,2019,"1,000-9,999",0,
10632,04/02/2019 12:00:00 AM,05/22/2019 12:00:00 AM,Cyberattack,2018-12-14T00:00:00,2019-03-22T00:00:00,Georgia Institute of Technology,Other,8577.0,Education,,Name,2019,"1,000-9,999",100-199,
10632,04/02/2019 12:00:00 AM,05/22/2019 12:00:00 AM,Cyberattack,2018-12-14T00:00:00,2019-03-22T00:00:00,Georgia Institute of Technology,Other,8577.0,Education,,Social Security Number,2019,"1,000-9,999",100-199,
10632,04/02/2019 12:00:00 AM,05/22/2019 12:00:00 AM,Cyberattack,2018-12-14T00:00:00,2019-03-22T00:00:00,Georgia Institute of Technology,Other,8577.0,Education,,Full Date of Birth,2019,"1,000-9,999",100-199,
10632,04/02/2019 12:00:00 AM,05/22/2019 12:00:00 AM,Cyberattack,2018-12-14T00:00:00,2019-03-22T00:00:00,Georgia Institute of Technology,Other,8577.0,Education,,Other,2019,"1,000-9,999",100-199,
10634,03/26/2019 12:00:00 AM,05/24/2019 12:00:00 AM,Cyberattack,2017-12-29T00:00:00,2019-03-13T00:00:00,"Drury Hotels Company, LLC",Unclear/unknown,,Business,Hospitality,Name,2019,Unknown,400-499,
10634,03/26/2019 12:00:00 AM,05/24/2019 12:00:00 AM,Cyberattack,2017-12-29T00:00:00,2019-03-13T00:00:00,"Drury Hotels Company, LLC",Unclear/unknown,,Business,Hospitality,Financial & Banking Information,2019,Unknown,400-499,
10634,03/26/2019 12:00:00 AM,05/24/2019 12:00:00 AM,Cyberattack,2017-12-29T00:00:00,2019-03-13T00:00:00,"Drury Hotels Company, LLC",Unclear/unknown,,Business,Hospitality,Other,2019,Unknown,400-499,
10635,04/16/2019 12:00:00 AM,05/28/2019 12:00:00 AM,Cyberattack,2019-04-01T00:00:00,2019-04-01T00:00:00,Mediant Communications Inc.,Other,6306.0,Business,Telecommunications,Name,2019,"1,000-9,999",1-99,
10635,04/16/2019 12:00:00 AM,05/28/2019 12:00:00 AM,Cyberattack,2019-04-01T00:00:00,2019-04-01T00:00:00,Mediant Communications Inc.,Other,6306.0,Business,Telecommunications,Social Security Number,2019,"1,000-9,999",1-99,
10635,04/16/2019 12:00:00 AM,05/28/2019 12:00:00 AM,Cyberattack,2019-04-01T00:00:00,2019-04-01T00:00:00,Mediant Communications Inc.,Other,6306.0,Business,Telecommunications,Financial & Banking Information,2019,"1,000-9,999",1-99,
10635,04/16/2019 12:00:00 AM,05/28/2019 12:00:00 AM,Cyberattack,2019-04-01T00:00:00,2019-04-01T00:00:00,Mediant Communications Inc.,Other,6306.0,Business,Telecommunications,Other,2019,"1,000-9,999",1-99,
10636,03/20/2019 12:00:00 AM,06/03/2019 12:00:00 AM,Cyberattack,2018-08-01T00:00:00,2019-03-30T00:00:00,Retrieval Masters Creditors Bureau Inc.,Unclear/unknown,33480.0,Business,Professional Services,Name,2019,"10,000-49,999",200-299,
10636,03/20/2019 12:00:00 AM,06/03/2019 12:00:00 AM,Cyberattack,2018-08-01T00:00:00,2019-03-30T00:00:00,Retrieval Masters Creditors Bureau Inc.,Unclear/unknown,33480.0,Business,Professional Services,Social Security Number,2019,"10,000-49,999",200-299,
10636,03/20/2019 12:00:00 AM,06/03/2019 12:00:00 AM,Cyberattack,2018-08-01T00:00:00,2019-03-30T00:00:00,Retrieval Masters Creditors Bureau Inc.,Unclear/unknown,33480.0,Business,Professional Services,Financial & Banking Information,2019,"10,000-49,999",200-299,
10636,03/20/2019 12:00:00 AM,06/03/2019 12:00:00 AM,Cyberattack,2018-08-01T00:00:00,2019-03-30T00:00:00,Retrieval Masters Creditors Bureau Inc.,Unclear/unknown,33480.0,Business,Professional Services,Full Date of Birth,2019,"10,000-49,999",200-299,
10636,03/20/2019 12:00:00 AM,06/03/2019 12:00:00 AM,Cyberattack,2018-08-01T00:00:00,2019-03-30T00:00:00,Retrieval Masters Creditors Bureau Inc.,Unclear/unknown,33480.0,Business,Professional Services,Medical Information,2019,"10,000-49,999",200-299,
10637,04/26/2019 12:00:00 AM,06/03/2019 12:00:00 AM,Theft or Mistake,,,Washington Department of Health,,1336.0,Government,,Name,2019,"1,000-9,999",Unknown,
10637,04/26/2019 12:00:00 AM,06/03/2019 12:00:00 AM,Theft or Mistake,,,Washington Department of Health,,1336.0,Government,,Social Security Number,2019,"1,000-9,999",Unknown,
10637,04/26/2019 12:00:00 AM,06/03/2019 12:00:00 AM,Theft or Mistake,,,Washington Department of Health,,1336.0,Government,,Medical Information,2019,"1,000-9,999",Unknown,
10638,05/21/2019 12:00:00 AM,06/06/2019 12:00:00 AM,Unauthorized Access,,2019-04-03T00:00:00,Acrisure LLC,,1295.0,Business,Human Resources,Name,2019,"1,000-9,999",Unknown,
10638,05/21/2019 12:00:00 AM,06/06/2019 12:00:00 AM,Unauthorized Access,,2019-04-03T00:00:00,Acrisure LLC,,1295.0,Business,Human Resources,Social Security Number,2019,"1,000-9,999",Unknown,
10638,05/21/2019 12:00:00 AM,06/06/2019 12:00:00 AM,Unauthorized Access,,2019-04-03T00:00:00,Acrisure LLC,,1295.0,Business,Human Resources,Driver's License or Washington ID Card Number,2019,"1,000-9,999",Unknown,
10639,04/24/2019 12:00:00 AM,06/07/2019 12:00:00 AM,Cyberattack,2018-11-01T00:00:00,2019-04-29T00:00:00,Princess Polly Group Pty Ltd,Unclear/unknown,2290.0,Business,Clothing,Name,2019,"1,000-9,999",100-199,
10639,04/24/2019 12:00:00 AM,06/07/2019 12:00:00 AM,Cyberattack,2018-11-01T00:00:00,2019-04-29T00:00:00,Princess Polly Group Pty Ltd,Unclear/unknown,2290.0,Business,Clothing,Financial & Banking Information,2019,"1,000-9,999",100-199,
10639,04/24/2019 12:00:00 AM,06/07/2019 12:00:00 AM,Cyberattack,2018-11-01T00:00:00,2019-04-29T00:00:00,Princess Polly Group Pty Ltd,Unclear/unknown,2290.0,Business,Clothing,Username and Password/Security Question Answers,2019,"1,000-9,999",100-199,
10640,05/02/2019 12:00:00 AM,06/07/2019 12:00:00 AM,Cyberattack,2016-09-27T00:00:00,2019-03-16T00:00:00,Darwin's Natural Pet Products,Unclear/unknown,1787.0,Business,Consumable,Name,2019,"1,000-9,999",500+,
10640,05/02/2019 12:00:00 AM,06/07/2019 12:00:00 AM,Cyberattack,2016-09-27T00:00:00,2019-03-16T00:00:00,Darwin's Natural Pet Products,Unclear/unknown,1787.0,Business,Consumable,Financial & Banking Information,2019,"1,000-9,999",500+,
10641,04/24/2019 12:00:00 AM,06/21/2019 12:00:00 AM,Cyberattack,2010-08-25T00:00:00,,Dominion Dental Services Inc.,Unclear/unknown,34455.0,Health,,Name,2019,"10,000-49,999",Unknown,
10641,04/24/2019 12:00:00 AM,06/21/2019 12:00:00 AM,Cyberattack,2010-08-25T00:00:00,,Dominion Dental Services Inc.,Unclear/unknown,34455.0,Health,,Social Security Number,2019,"10,000-49,999",Unknown,
10641,04/24/2019 12:00:00 AM,06/21/2019 12:00:00 AM,Cyberattack,2010-08-25T00:00:00,,Dominion Dental Services Inc.,Unclear/unknown,34455.0,Health,,Financial & Banking Information,2019,"10,000-49,999",Unknown,
10641,04/24/2019 12:00:00 AM,06/21/2019 12:00:00 AM,Cyberattack,2010-08-25T00:00:00,,Dominion Dental Services Inc.,Unclear/unknown,34455.0,Health,,Full Date of Birth,2019,"10,000-49,999",Unknown,
10641,04/24/2019 12:00:00 AM,06/21/2019 12:00:00 AM,Cyberattack,2010-08-25T00:00:00,,Dominion Dental Services Inc.,Unclear/unknown,34455.0,Health,,Other,2019,"10,000-49,999",Unknown,
10642,06/03/2019 12:00:00 AM,07/02/2019 12:00:00 AM,Cyberattack,,,Backcountry Edge,Unclear/unknown,566.0,Business,Retail,Name,2019,500-999,Unknown,
10642,06/03/2019 12:00:00 AM,07/02/2019 12:00:00 AM,Cyberattack,,,Backcountry Edge,Unclear/unknown,566.0,Business,Retail,Financial & Banking Information,2019,500-999,Unknown,
10642,06/03/2019 12:00:00 AM,07/02/2019 12:00:00 AM,Cyberattack,,,Backcountry Edge,Unclear/unknown,566.0,Business,Retail,Username and Password/Security Question Answers,2019,500-999,Unknown,
10642,06/03/2019 12:00:00 AM,07/02/2019 12:00:00 AM,Cyberattack,,,Backcountry Edge,Unclear/unknown,566.0,Business,Retail,Other,2019,500-999,Unknown,
10643,06/24/2019 12:00:00 AM,07/03/2019 12:00:00 AM,Cyberattack,2019-06-14T00:00:00,2019-06-17T00:00:00,Riggs Wealth Management,Phishing,1205.0,Finance,,Name,2019,"1,000-9,999",1-99,
10643,06/24/2019 12:00:00 AM,07/03/2019 12:00:00 AM,Cyberattack,2019-06-14T00:00:00,2019-06-17T00:00:00,Riggs Wealth Management,Phishing,1205.0,Finance,,Social Security Number,2019,"1,000-9,999",1-99,
10643,06/24/2019 12:00:00 AM,07/03/2019 12:00:00 AM,Cyberattack,2019-06-14T00:00:00,2019-06-17T00:00:00,Riggs Wealth Management,Phishing,1205.0,Finance,,Financial & Banking Information,2019,"1,000-9,999",1-99,
10645,05/14/2019 12:00:00 AM,07/13/2019 12:00:00 AM,Cyberattack,2018-08-01T00:00:00,2019-03-30T00:00:00,Laboratory Corporation of America Holdings (LabCorp),Unclear/unknown,18330.0,Health,,Name,2019,"10,000-49,999",200-299,
10645,05/14/2019 12:00:00 AM,07/13/2019 12:00:00 AM,Cyberattack,2018-08-01T00:00:00,2019-03-30T00:00:00,Laboratory Corporation of America Holdings (LabCorp),Unclear/unknown,18330.0,Health,,Social Security Number,2019,"10,000-49,999",200-299,
10645,05/14/2019 12:00:00 AM,07/13/2019 12:00:00 AM,Cyberattack,2018-08-01T00:00:00,2019-03-30T00:00:00,Laboratory Corporation of America Holdings (LabCorp),Unclear/unknown,18330.0,Health,,Financial & Banking Information,2019,"10,000-49,999",200-299,
10645,05/14/2019 12:00:00 AM,07/13/2019 12:00:00 AM,Cyberattack,2018-08-01T00:00:00,2019-03-30T00:00:00,Laboratory Corporation of America Holdings (LabCorp),Unclear/unknown,18330.0,Health,,Full Date of Birth,2019,"10,000-49,999",200-299,
10645,05/14/2019 12:00:00 AM,07/13/2019 12:00:00 AM,Cyberattack,2018-08-01T00:00:00,2019-03-30T00:00:00,Laboratory Corporation of America Holdings (LabCorp),Unclear/unknown,18330.0,Health,,Health Insurance Policy or ID Number,2019,"10,000-49,999",200-299,
10645,05/14/2019 12:00:00 AM,07/13/2019 12:00:00 AM,Cyberattack,2018-08-01T00:00:00,2019-03-30T00:00:00,Laboratory Corporation of America Holdings (LabCorp),Unclear/unknown,18330.0,Health,,Other,2019,"10,000-49,999",200-299,
10646,05/06/2019 12:00:00 AM,07/15/2019 12:00:00 AM,Cyberattack,2019-05-03T00:00:00,2019-05-06T00:00:00,Northwood Inc.,Phishing,1185.0,Health,,Name,2019,"1,000-9,999",1-99,
10646,05/06/2019 12:00:00 AM,07/15/2019 12:00:00 AM,Cyberattack,2019-05-03T00:00:00,2019-05-06T00:00:00,Northwood Inc.,Phishing,1185.0,Health,,Social Security Number,2019,"1,000-9,999",1-99,
10647,05/15/2019 12:00:00 AM,07/15/2019 12:00:00 AM,Cyberattack,2019-03-21T00:00:00,,"Clinical Pathology Laboratories, Inc.",Malware,1155.0,Health,,Name,2019,"1,000-9,999",Unknown,
10647,05/15/2019 12:00:00 AM,07/15/2019 12:00:00 AM,Cyberattack,2019-03-21T00:00:00,,"Clinical Pathology Laboratories, Inc.",Malware,1155.0,Health,,Full Date of Birth,2019,"1,000-9,999",Unknown,
10647,05/15/2019 12:00:00 AM,07/15/2019 12:00:00 AM,Cyberattack,2019-03-21T00:00:00,,"Clinical Pathology Laboratories, Inc.",Malware,1155.0,Health,,Medical Information,2019,"1,000-9,999",Unknown,
10647,05/15/2019 12:00:00 AM,07/15/2019 12:00:00 AM,Cyberattack,2019-03-21T00:00:00,,"Clinical Pathology Laboratories, Inc.",Malware,1155.0,Health,,Other,2019,"1,000-9,999",Unknown,
10648,05/22/2018 12:00:00 AM,07/13/2018 12:00:00 AM,Cyberattack,2018-04-20T00:00:00,2018-05-22T00:00:00,"ComplyRight, Inc.",Unclear/unknown,29322.0,Business,Human Resources,Name,2018,"10,000-49,999",1-99,
10648,05/22/2018 12:00:00 AM,07/13/2018 12:00:00 AM,Cyberattack,2018-04-20T00:00:00,2018-05-22T00:00:00,"ComplyRight, Inc.",Unclear/unknown,29322.0,Business,Human Resources,Social Security Number,2018,"10,000-49,999",1-99,
10648,05/22/2018 12:00:00 AM,07/13/2018 12:00:00 AM,Cyberattack,2018-04-20T00:00:00,2018-05-22T00:00:00,"ComplyRight, Inc.",Unclear/unknown,29322.0,Business,Human Resources,Other,2018,"10,000-49,999",1-99,
10656,08/28/2019 12:00:00 AM,09/09/2019 12:00:00 AM,Cyberattack,2019-04-01T00:00:00,,The Union Labor Life Insurance Company,Phishing,615.0,Finance,Other,Name,2020,500-999,Unknown,MD
10656,08/28/2019 12:00:00 AM,09/09/2019 12:00:00 AM,Cyberattack,2019-04-01T00:00:00,,The Union Labor Life Insurance Company,Phishing,615.0,Finance,Other,Social Security Number,2020,500-999,Unknown,MD
10656,08/28/2019 12:00:00 AM,09/09/2019 12:00:00 AM,Cyberattack,2019-04-01T00:00:00,,The Union Labor Life Insurance Company,Phishing,615.0,Finance,Other,Full Date of Birth,2020,500-999,Unknown,MD
10656,08/28/2019 12:00:00 AM,09/09/2019 12:00:00 AM,Cyberattack,2019-04-01T00:00:00,,The Union Labor Life Insurance Company,Phishing,615.0,Finance,Other,Other,2020,500-999,Unknown,MD
10682,08/07/2020 12:00:00 AM,10/02/2020 12:00:00 AM,Cyberattack,2020-02-26T00:00:00,2020-07-21T00:00:00,PupBox,Malware,1046.0,Business,Retail,Name,2021,"1,000-9,999",100-199,CA
10682,08/07/2020 12:00:00 AM,10/02/2020 12:00:00 AM,Cyberattack,2020-02-26T00:00:00,2020-07-21T00:00:00,PupBox,Malware,1046.0,Business,Retail,Financial & Banking Information,2021,"1,000-9,999",100-199,CA
10682,08/07/2020 12:00:00 AM,10/02/2020 12:00:00 AM,Cyberattack,2020-02-26T00:00:00,2020-07-21T00:00:00,PupBox,Malware,1046.0,Business,Retail,Unique Private Key (e.g. used to authenticate or sign an electronic record),2021,"1,000-9,999",100-199,CA
10682,08/07/2020 12:00:00 AM,10/02/2020 12:00:00 AM,Cyberattack,2020-02-26T00:00:00,2020-07-21T00:00:00,PupBox,Malware,1046.0,Business,Retail,Email Address and Password/Security Question Answers,2021,"1,000-9,999",100-199,CA
10691,05/17/2021 12:00:00 AM,07/12/2021 12:00:00 AM,Cyberattack,2021-05-12T00:00:00,2021-05-26T00:00:00,Clover Park School District,Ransomware,5872.0,Education,,Name,2021,"1,000-9,999",1-99,WA 
10691,05/17/2021 12:00:00 AM,07/12/2021 12:00:00 AM,Cyberattack,2021-05-12T00:00:00,2021-05-26T00:00:00,Clover Park School District,Ransomware,5872.0,Education,,Name,2021,"1,000-9,999",1-99,WA 
10691,05/17/2021 12:00:00 AM,07/12/2021 12:00:00 AM,Cyberattack,2021-05-12T00:00:00,2021-05-26T00:00:00,Clover Park School District,Ransomware,5872.0,Education,,Social Security Number,2021,"1,000-9,999",1-99,WA 
10691,05/17/2021 12:00:00 AM,07/12/2021 12:00:00 AM,Cyberattack,2021-05-12T00:00:00,2021-05-26T00:00:00,Clover Park School District,Ransomware,5872.0,Education,,Social Security Number,2021,"1,000-9,999",1-99,WA 
10691,05/17/2021 12:00:00 AM,07/12/2021 12:00:00 AM,Cyberattack,2021-05-12T00:00:00,2021-05-26T00:00:00,Clover Park School District,Ransomware,5872.0,Education,,Driver's License or Washington ID Card Number,2021,"1,000-9,999",1-99,WA 
10691,05/17/2021 12:00:00 AM,07/12/2021 12:00:00 AM,Cyberattack,2021-05-12T00:00:00,2021-05-26T00:00:00,Clover Park School District,Ransomware,5872.0,Education,,Driver's License or Washington ID Card Number,2021,"1,000-9,999",1-99,WA 
10691,05/17/2021 12:00:00 AM,07/12/2021 12:00:00 AM,Cyberattack,2021-05-12T00:00:00,2021-05-26T00:00:00,Clover Park School District,Ransomware,5872.0,Education,,Financial & Banking Information,2021,"1,000-9,999",1-99,WA 
10691,05/17/2021 12:00:00 AM,07/12/2021 12:00:00 AM,Cyberattack,2021-05-12T00:00:00,2021-05-26T00:00:00,Clover Park School District,Ransomware,5872.0,Education,,Financial & Banking Information,2021,"1,000-9,999",1-99,WA 
10691,05/17/2021 12:00:00 AM,07/12/2021 12:00:00 AM,Cyberattack,2021-05-12T00:00:00,2021-05-26T00:00:00,Clover Park School District,Ransomware,5872.0,Education,,Full Date of Birth,2021,"1,000-9,999",1-99,WA 
10691,05/17/2021 12:00:00 AM,07/12/2021 12:00:00 AM,Cyberattack,2021-05-12T00:00:00,2021-05-26T00:00:00,Clover Park School District,Ransomware,5872.0,Education,,Full Date of Birth,2021,"1,000-9,999",1-99,WA 
10691,05/17/2021 12:00:00 AM,07/12/2021 12:00:00 AM,Cyberattack,2021-05-12T00:00:00,2021-05-26T00:00:00,Clover Park School District,Ransomware,5872.0,Education,,Health Insurance Policy or ID Number,2021,"1,000-9,999",1-99,WA 
10691,05/17/2021 12:00:00 AM,07/12/2021 12:00:00 AM,Cyberattack,2021-05-12T00:00:00,2021-05-26T00:00:00,Clover Park School District,Ransomware,5872.0,Education,,Health Insurance Policy or ID Number,2021,"1,000-9,999",1-99,WA 
10691,05/17/2021 12:00:00 AM,07/12/2021 12:00:00 AM,Cyberattack,2021-05-12T00:00:00,2021-05-26T00:00:00,Clover Park School District,Ransomware,5872.0,Education,,Medical Information,2021,"1,000-9,999",1-99,WA 
10691,05/17/2021 12:00:00 AM,07/12/2021 12:00:00 AM,Cyberattack,2021-05-12T00:00:00,2021-05-26T00:00:00,Clover Park School District,Ransomware,5872.0,Education,,Medical Information,2021,"1,000-9,999",1-99,WA 
10691,05/17/2021 12:00:00 AM,07/12/2021 12:00:00 AM,Cyberattack,2021-05-12T00:00:00,2021-05-26T00:00:00,Clover Park School District,Ransomware,5872.0,Education,,Other,2021,"1,000-9,999",1-99,WA 
10691,05/17/2021 12:00:00 AM,07/12/2021 12:00:00 AM,Cyberattack,2021-05-12T00:00:00,2021-05-26T00:00:00,Clover Park School District,Ransomware,5872.0,Education,,Other,2021,"1,000-9,999",1-99,WA 
10696,06/14/2021 12:00:00 AM,07/14/2021 12:00:00 AM,Cyberattack,2021-02-22T00:00:00,2021-06-14T00:00:00,"Resort Data Processing, Inc.",Malware,1669.0,Business,Software,Name,2021,"1,000-9,999",100-199,PA
10696,06/14/2021 12:00:00 AM,07/14/2021 12:00:00 AM,Cyberattack,2021-02-22T00:00:00,2021-06-14T00:00:00,"Resort Data Processing, Inc.",Malware,1669.0,Business,Software,Financial & Banking Information,2021,"1,000-9,999",100-199,PA
10696,06/14/2021 12:00:00 AM,07/14/2021 12:00:00 AM,Cyberattack,2021-02-22T00:00:00,2021-06-14T00:00:00,"Resort Data Processing, Inc.",Malware,1669.0,Business,Software,Email Address and Password/Security Question Answers,2021,"1,000-9,999",100-199,PA
10703,02/17/2021 12:00:00 AM,05/28/2021 12:00:00 AM,Cyberattack,2021-02-10T00:00:00,,Osborn Cancer Care,Malware,4305.0,Health,,Name,2021,"1,000-9,999",Unknown,WA
10703,02/17/2021 12:00:00 AM,05/28/2021 12:00:00 AM,Cyberattack,2021-02-10T00:00:00,,Osborn Cancer Care,Malware,4305.0,Health,,Driver's License or Washington ID Card Number,2021,"1,000-9,999",Unknown,WA
10703,02/17/2021 12:00:00 AM,05/28/2021 12:00:00 AM,Cyberattack,2021-02-10T00:00:00,,Osborn Cancer Care,Malware,4305.0,Health,,Full Date of Birth,2021,"1,000-9,999",Unknown,WA
10703,02/17/2021 12:00:00 AM,05/28/2021 12:00:00 AM,Cyberattack,2021-02-10T00:00:00,,Osborn Cancer Care,Malware,4305.0,Health,,Medical Information,2021,"1,000-9,999",Unknown,WA
10725,11/30/2020 12:00:00 AM,06/22/2021 12:00:00 AM,Unauthorized Access,2020-09-01T00:00:00,2021-02-28T00:00:00,Made In Oregon,,840.0,Business,Retail,Name,2021,500-999,100-199,OR
10725,11/30/2020 12:00:00 AM,06/22/2021 12:00:00 AM,Unauthorized Access,2020-09-01T00:00:00,2021-02-28T00:00:00,Made In Oregon,,840.0,Business,Retail,Financial & Banking Information,2021,500-999,100-199,OR
10725,11/30/2020 12:00:00 AM,06/22/2021 12:00:00 AM,Unauthorized Access,2020-09-01T00:00:00,2021-02-28T00:00:00,Made In Oregon,,840.0,Business,Retail,Email Address and Password/Security Question Answers,2021,500-999,100-199,OR
10788,06/01/2021 12:00:00 AM,07/30/2021 12:00:00 AM,Cyberattack,,,Mandere Construction / Northwestern Building Components,Ransomware,781.0,Business,Construction,Name,2022,500-999,Unknown,
10788,06/01/2021 12:00:00 AM,07/30/2021 12:00:00 AM,Cyberattack,,,Mandere Construction / Northwestern Building Components,Ransomware,781.0,Business,Construction,Social Security Number,2022,500-999,Unknown,
10793,07/06/2021 12:00:00 AM,08/04/2021 12:00:00 AM,Unauthorized Access,2021-02-19T00:00:00,2021-03-31T00:00:00,Renton Regional Fire Authority,Phishing,1334.0,Government,,Name,2022,"1,000-9,999",100-199,WA
10793,07/06/2021 12:00:00 AM,08/04/2021 12:00:00 AM,Unauthorized Access,2021-02-19T00:00:00,2021-03-31T00:00:00,Renton Regional Fire Authority,Phishing,1334.0,Government,,Social Security Number,2022,"1,000-9,999",100-199,WA
10793,07/06/2021 12:00:00 AM,08/04/2021 12:00:00 AM,Unauthorized Access,2021-02-19T00:00:00,2021-03-31T00:00:00,Renton Regional Fire Authority,Phishing,1334.0,Government,,Driver's License or Washington ID Card Number,2022,"1,000-9,999",100-199,WA
10793,07/06/2021 12:00:00 AM,08/04/2021 12:00:00 AM,Unauthorized Access,2021-02-19T00:00:00,2021-03-31T00:00:00,Renton Regional Fire Authority,Phishing,1334.0,Government,,Financial & Banking Information,2022,"1,000-9,999",100-199,WA
10793,07/06/2021 12:00:00 AM,08/04/2021 12:00:00 AM,Unauthorized Access,2021-02-19T00:00:00,2021-03-31T00:00:00,Renton Regional Fire Authority,Phishing,1334.0,Government,,Full Date of Birth,2022,"1,000-9,999",100-199,WA
10793,07/06/2021 12:00:00 AM,08/04/2021 12:00:00 AM,Unauthorized Access,2021-02-19T00:00:00,2021-03-31T00:00:00,Renton Regional Fire Authority,Phishing,1334.0,Government,,Medical Information,2022,"1,000-9,999",100-199,WA
10806,06/19/2021 12:00:00 AM,07/30/2021 12:00:00 AM,Cyberattack,2021-06-19T00:00:00,2021-06-20T00:00:00,Motor Trend Group LLC,Unclear/unknown,1600.0,Business,Entertainment,Name,2022,"1,000-9,999",1-99,
10806,06/19/2021 12:00:00 AM,07/30/2021 12:00:00 AM,Cyberattack,2021-06-19T00:00:00,2021-06-20T00:00:00,Motor Trend Group LLC,Unclear/unknown,1600.0,Business,Entertainment,Name,2022,"1,000-9,999",1-99,
10806,06/19/2021 12:00:00 AM,07/30/2021 12:00:00 AM,Cyberattack,2021-06-19T00:00:00,2021-06-20T00:00:00,Motor Trend Group LLC,Unclear/unknown,1600.0,Business,Entertainment,Full Date of Birth,2022,"1,000-9,999",1-99,
10806,06/19/2021 12:00:00 AM,07/30/2021 12:00:00 AM,Cyberattack,2021-06-19T00:00:00,2021-06-20T00:00:00,Motor Trend Group LLC,Unclear/unknown,1600.0,Business,Entertainment,Full Date of Birth,2022,"1,000-9,999",1-99,
10806,06/19/2021 12:00:00 AM,07/30/2021 12:00:00 AM,Cyberattack,2021-06-19T00:00:00,2021-06-20T00:00:00,Motor Trend Group LLC,Unclear/unknown,1600.0,Business,Entertainment,Username and Password/Security Question Answers,2022,"1,000-9,999",1-99,
10806,06/19/2021 12:00:00 AM,07/30/2021 12:00:00 AM,Cyberattack,2021-06-19T00:00:00,2021-06-20T00:00:00,Motor Trend Group LLC,Unclear/unknown,1600.0,Business,Entertainment,Username and Password/Security Question Answers,2022,"1,000-9,999",1-99,
10806,06/19/2021 12:00:00 AM,07/30/2021 12:00:00 AM,Cyberattack,2021-06-19T00:00:00,2021-06-20T00:00:00,Motor Trend Group LLC,Unclear/unknown,1600.0,Business,Entertainment,Email Address and Password/Security Question Answers,2022,"1,000-9,999",1-99,
10806,06/19/2021 12:00:00 AM,07/30/2021 12:00:00 AM,Cyberattack,2021-06-19T00:00:00,2021-06-20T00:00:00,Motor Trend Group LLC,Unclear/unknown,1600.0,Business,Entertainment,Email Address and Password/Security Question Answers,2022,"1,000-9,999",1-99,
10806,06/19/2021 12:00:00 AM,07/30/2021 12:00:00 AM,Cyberattack,2021-06-19T00:00:00,2021-06-20T00:00:00,Motor Trend Group LLC,Unclear/unknown,1600.0,Business,Entertainment,Other,2022,"1,000-9,999",1-99,
10806,06/19/2021 12:00:00 AM,07/30/2021 12:00:00 AM,Cyberattack,2021-06-19T00:00:00,2021-06-20T00:00:00,Motor Trend Group LLC,Unclear/unknown,1600.0,Business,Entertainment,Other,2022,"1,000-9,999",1-99,
10807,07/12/2021 12:00:00 AM,08/17/2021 12:00:00 AM,Theft or Mistake,,,"BackNine Insurance and Financial Services, Inc.",,866.0,Finance,,Name,2022,500-999,Unknown,
10807,07/12/2021 12:00:00 AM,08/17/2021 12:00:00 AM,Theft or Mistake,,,"BackNine Insurance and Financial Services, Inc.",,866.0,Finance,,Social Security Number,2022,500-999,Unknown,
10807,07/12/2021 12:00:00 AM,08/17/2021 12:00:00 AM,Theft or Mistake,,,"BackNine Insurance and Financial Services, Inc.",,866.0,Finance,,Driver's License or Washington ID Card Number,2022,500-999,Unknown,
10807,07/12/2021 12:00:00 AM,08/17/2021 12:00:00 AM,Theft or Mistake,,,"BackNine Insurance and Financial Services, Inc.",,866.0,Finance,,Full Date of Birth,2022,500-999,Unknown,
10807,07/12/2021 12:00:00 AM,08/17/2021 12:00:00 AM,Theft or Mistake,,,"BackNine Insurance and Financial Services, Inc.",,866.0,Finance,,Medical Information,2022,500-999,Unknown,
10807,07/12/2021 12:00:00 AM,08/17/2021 12:00:00 AM,Theft or Mistake,,,"BackNine Insurance and Financial Services, Inc.",,866.0,Finance,,Other,2022,500-999,Unknown,
10808,06/04/2021 12:00:00 AM,07/08/2021 12:00:00 AM,Unauthorized Access,2021-05-28T00:00:00,2021-06-04T00:00:00,"Forefront Management, LLC and Forefront Dermatology, S.C.",,877.0,Health,,Name,2021,500-999,1-99,
10808,06/04/2021 12:00:00 AM,07/08/2021 12:00:00 AM,Unauthorized Access,2021-05-28T00:00:00,2021-06-04T00:00:00,"Forefront Management, LLC and Forefront Dermatology, S.C.",,877.0,Health,,Social Security Number,2021,500-999,1-99,
10808,06/04/2021 12:00:00 AM,07/08/2021 12:00:00 AM,Unauthorized Access,2021-05-28T00:00:00,2021-06-04T00:00:00,"Forefront Management, LLC and Forefront Dermatology, S.C.",,877.0,Health,,Full Date of Birth,2021,500-999,1-99,
10808,06/04/2021 12:00:00 AM,07/08/2021 12:00:00 AM,Unauthorized Access,2021-05-28T00:00:00,2021-06-04T00:00:00,"Forefront Management, LLC and Forefront Dermatology, S.C.",,877.0,Health,,Health Insurance Policy or ID Number,2021,500-999,1-99,
10808,06/04/2021 12:00:00 AM,07/08/2021 12:00:00 AM,Unauthorized Access,2021-05-28T00:00:00,2021-06-04T00:00:00,"Forefront Management, LLC and Forefront Dermatology, S.C.",,877.0,Health,,Medical Information,2021,500-999,1-99,
10808,06/04/2021 12:00:00 AM,07/08/2021 12:00:00 AM,Unauthorized Access,2021-05-28T00:00:00,2021-06-04T00:00:00,"Forefront Management, LLC and Forefront Dermatology, S.C.",,877.0,Health,,Other,2021,500-999,1-99,
10813,04/26/2021 12:00:00 AM,07/13/2021 12:00:00 AM,Cyberattack,,,King County Public Health Hospital District No. 2 Dba Evergreen Health,Malware,20215.0,Health,,Name,2021,"10,000-49,999",Unknown,
10813,04/26/2021 12:00:00 AM,07/13/2021 12:00:00 AM,Cyberattack,,,King County Public Health Hospital District No. 2 Dba Evergreen Health,Malware,20215.0,Health,,Full Date of Birth,2021,"10,000-49,999",Unknown,
10813,04/26/2021 12:00:00 AM,07/13/2021 12:00:00 AM,Cyberattack,,,King County Public Health Hospital District No. 2 Dba Evergreen Health,Malware,20215.0,Health,,Health Insurance Policy or ID Number,2021,"10,000-49,999",Unknown,
10813,04/26/2021 12:00:00 AM,07/13/2021 12:00:00 AM,Cyberattack,,,King County Public Health Hospital District No. 2 Dba Evergreen Health,Malware,20215.0,Health,,Other,2021,"10,000-49,999",Unknown,
10840,07/16/2020 12:00:00 AM,10/23/2020 12:00:00 AM,Unauthorized Access,2020-07-01T00:00:00,2020-07-16T00:00:00,"Fragomen, Del Rey, Bernsen & Loewy, LLP",,581.0,Business,Legal,Name,2021,500-999,1-99,
10840,07/16/2020 12:00:00 AM,10/23/2020 12:00:00 AM,Unauthorized Access,2020-07-01T00:00:00,2020-07-16T00:00:00,"Fragomen, Del Rey, Bernsen & Loewy, LLP",,581.0,Business,Legal,Social Security Number,2021,500-999,1-99,
10840,07/16/2020 12:00:00 AM,10/23/2020 12:00:00 AM,Unauthorized Access,2020-07-01T00:00:00,2020-07-16T00:00:00,"Fragomen, Del Rey, Bernsen & Loewy, LLP",,581.0,Business,Legal,Driver's License or Washington ID Card Number,2021,500-999,1-99,
10840,07/16/2020 12:00:00 AM,10/23/2020 12:00:00 AM,Unauthorized Access,2020-07-01T00:00:00,2020-07-16T00:00:00,"Fragomen, Del Rey, Bernsen & Loewy, LLP",,581.0,Business,Legal,Full Date of Birth,2021,500-999,1-99,
10840,07/16/2020 12:00:00 AM,10/23/2020 12:00:00 AM,Unauthorized Access,2020-07-01T00:00:00,2020-07-16T00:00:00,"Fragomen, Del Rey, Bernsen & Loewy, LLP",,581.0,Business,Legal,Passport Number,2021,500-999,1-99,
10841,08/17/2020 12:00:00 AM,08/06/2021 12:00:00 AM,Cyberattack,2020-07-27T00:00:00,2020-08-17T00:00:00,"Ibex Global Solutions, Inc. (Ibex)",Ransomware,891.0,Business,Professional Services,Name,2022,500-999,1-99,ID
10841,08/17/2020 12:00:00 AM,08/06/2021 12:00:00 AM,Cyberattack,2020-07-27T00:00:00,2020-08-17T00:00:00,"Ibex Global Solutions, Inc. (Ibex)",Ransomware,891.0,Business,Professional Services,Name,2022,500-999,1-99,ID
10841,08/17/2020 12:00:00 AM,08/06/2021 12:00:00 AM,Cyberattack,2020-07-27T00:00:00,2020-08-17T00:00:00,"Ibex Global Solutions, Inc. (Ibex)",Ransomware,891.0,Business,Professional Services,Social Security Number,2022,500-999,1-99,ID
10841,08/17/2020 12:00:00 AM,08/06/2021 12:00:00 AM,Cyberattack,2020-07-27T00:00:00,2020-08-17T00:00:00,"Ibex Global Solutions, Inc. (Ibex)",Ransomware,891.0,Business,Professional Services,Social Security Number,2022,500-999,1-99,ID
10841,08/17/2020 12:00:00 AM,08/06/2021 12:00:00 AM,Cyberattack,2020-07-27T00:00:00,2020-08-17T00:00:00,"Ibex Global Solutions, Inc. (Ibex)",Ransomware,891.0,Business,Professional Services,Full Date of Birth,2022,500-999,1-99,ID
10841,08/17/2020 12:00:00 AM,08/06/2021 12:00:00 AM,Cyberattack,2020-07-27T00:00:00,2020-08-17T00:00:00,"Ibex Global Solutions, Inc. (Ibex)",Ransomware,891.0,Business,Professional Services,Full Date of Birth,2022,500-999,1-99,ID
10841,08/17/2020 12:00:00 AM,08/06/2021 12:00:00 AM,Cyberattack,2020-07-27T00:00:00,2020-08-17T00:00:00,"Ibex Global Solutions, Inc. (Ibex)",Ransomware,891.0,Business,Professional Services,Medical Information,2022,500-999,1-99,ID
10841,08/17/2020 12:00:00 AM,08/06/2021 12:00:00 AM,Cyberattack,2020-07-27T00:00:00,2020-08-17T00:00:00,"Ibex Global Solutions, Inc. (Ibex)",Ransomware,891.0,Business,Professional Services,Medical Information,2022,500-999,1-99,ID
10843,03/20/2021 12:00:00 AM,08/13/2021 12:00:00 AM,Cyberattack,2021-03-16T00:00:00,2021-04-13T00:00:00,Destination Maternity,Ransomware,2237.0,Business,Retail,Name,2022,"1,000-9,999",1-99,NJ
10843,03/20/2021 12:00:00 AM,08/13/2021 12:00:00 AM,Cyberattack,2021-03-16T00:00:00,2021-04-13T00:00:00,Destination Maternity,Ransomware,2237.0,Business,Retail,Social Security Number,2022,"1,000-9,999",1-99,NJ
10843,03/20/2021 12:00:00 AM,08/13/2021 12:00:00 AM,Cyberattack,2021-03-16T00:00:00,2021-04-13T00:00:00,Destination Maternity,Ransomware,2237.0,Business,Retail,Financial & Banking Information,2022,"1,000-9,999",1-99,NJ
10846,06/11/2021 12:00:00 AM,08/23/2021 12:00:00 AM,Cyberattack,2020-11-24T00:00:00,2020-12-09T00:00:00,"American Freight, LLC ",Malware,876.0,Business,Retail,Name,2022,500-999,100-199,OH
10846,06/11/2021 12:00:00 AM,08/23/2021 12:00:00 AM,Cyberattack,2020-11-24T00:00:00,2020-12-09T00:00:00,"American Freight, LLC ",Malware,876.0,Business,Retail,Social Security Number,2022,500-999,100-199,OH
10846,06/11/2021 12:00:00 AM,08/23/2021 12:00:00 AM,Cyberattack,2020-11-24T00:00:00,2020-12-09T00:00:00,"American Freight, LLC ",Malware,876.0,Business,Retail,Driver's License or Washington ID Card Number,2022,500-999,100-199,OH
10846,06/11/2021 12:00:00 AM,08/23/2021 12:00:00 AM,Cyberattack,2020-11-24T00:00:00,2020-12-09T00:00:00,"American Freight, LLC ",Malware,876.0,Business,Retail,Financial & Banking Information,2022,500-999,100-199,OH
10846,06/11/2021 12:00:00 AM,08/23/2021 12:00:00 AM,Cyberattack,2020-11-24T00:00:00,2020-12-09T00:00:00,"American Freight, LLC ",Malware,876.0,Business,Retail,Health Insurance Policy or ID Number,2022,500-999,100-199,OH
10846,06/11/2021 12:00:00 AM,08/23/2021 12:00:00 AM,Cyberattack,2020-11-24T00:00:00,2020-12-09T00:00:00,"American Freight, LLC ",Malware,876.0,Business,Retail,Medical Information,2022,500-999,100-199,OH
10856,08/17/2021 12:00:00 AM,08/24/2021 12:00:00 AM,Cyberattack,2021-07-22T00:00:00,,T-Mobile USA,Malware,2079648.0,Business,Telecommunications,Name,2022,"1,000,000+",Unknown,WA
10856,08/17/2021 12:00:00 AM,08/24/2021 12:00:00 AM,Cyberattack,2021-07-22T00:00:00,,T-Mobile USA,Malware,2079648.0,Business,Telecommunications,Name,2022,"1,000,000+",Unknown,WA
10856,08/17/2021 12:00:00 AM,08/24/2021 12:00:00 AM,Cyberattack,2021-07-22T00:00:00,,T-Mobile USA,Malware,2079648.0,Business,Telecommunications,Social Security Number,2022,"1,000,000+",Unknown,WA
10856,08/17/2021 12:00:00 AM,08/24/2021 12:00:00 AM,Cyberattack,2021-07-22T00:00:00,,T-Mobile USA,Malware,2079648.0,Business,Telecommunications,Social Security Number,2022,"1,000,000+",Unknown,WA
10856,08/17/2021 12:00:00 AM,08/24/2021 12:00:00 AM,Cyberattack,2021-07-22T00:00:00,,T-Mobile USA,Malware,2079648.0,Business,Telecommunications,Driver's License or Washington ID Card Number,2022,"1,000,000+",Unknown,WA
10856,08/17/2021 12:00:00 AM,08/24/2021 12:00:00 AM,Cyberattack,2021-07-22T00:00:00,,T-Mobile USA,Malware,2079648.0,Business,Telecommunications,Driver's License or Washington ID Card Number,2022,"1,000,000+",Unknown,WA
10856,08/17/2021 12:00:00 AM,08/24/2021 12:00:00 AM,Cyberattack,2021-07-22T00:00:00,,T-Mobile USA,Malware,2079648.0,Business,Telecommunications,Full Date of Birth,2022,"1,000,000+",Unknown,WA
10856,08/17/2021 12:00:00 AM,08/24/2021 12:00:00 AM,Cyberattack,2021-07-22T00:00:00,,T-Mobile USA,Malware,2079648.0,Business,Telecommunications,Full Date of Birth,2022,"1,000,000+",Unknown,WA
10863,12/18/2020 12:00:00 AM,08/24/2021 12:00:00 AM,Cyberattack,,,"SmartStart Employment Screening, Inc.",Malware,639.0,Business,Other,Name,2022,500-999,Unknown,
10863,12/18/2020 12:00:00 AM,08/24/2021 12:00:00 AM,Cyberattack,,,"SmartStart Employment Screening, Inc.",Malware,639.0,Business,Other,Social Security Number,2022,500-999,Unknown,
10864,06/29/2021 12:00:00 AM,08/27/2021 12:00:00 AM,Cyberattack,2021-06-18T00:00:00,2021-06-29T00:00:00,"CareATC, Inc.",Phishing,600.0,Health,,Name,2022,500-999,1-99,OK
10864,06/29/2021 12:00:00 AM,08/27/2021 12:00:00 AM,Cyberattack,2021-06-18T00:00:00,2021-06-29T00:00:00,"CareATC, Inc.",Phishing,600.0,Health,,Full Date of Birth,2022,500-999,1-99,OK
10864,06/29/2021 12:00:00 AM,08/27/2021 12:00:00 AM,Cyberattack,2021-06-18T00:00:00,2021-06-29T00:00:00,"CareATC, Inc.",Phishing,600.0,Health,,Health Insurance Policy or ID Number,2022,500-999,1-99,OK
10864,06/29/2021 12:00:00 AM,08/27/2021 12:00:00 AM,Cyberattack,2021-06-18T00:00:00,2021-06-29T00:00:00,"CareATC, Inc.",Phishing,600.0,Health,,Medical Information,2022,500-999,1-99,OK
10913,08/17/2020 12:00:00 AM,12/01/2020 12:00:00 AM,Unauthorized Access,2020-05-19T00:00:00,2020-08-17T00:00:00,Kitsap County Credit Union,,3268.0,Finance,,Name,2021,"1,000-9,999",1-99,
10913,08/17/2020 12:00:00 AM,12/01/2020 12:00:00 AM,Unauthorized Access,2020-05-19T00:00:00,2020-08-17T00:00:00,Kitsap County Credit Union,,3268.0,Finance,,Social Security Number,2021,"1,000-9,999",1-99,
10913,08/17/2020 12:00:00 AM,12/01/2020 12:00:00 AM,Unauthorized Access,2020-05-19T00:00:00,2020-08-17T00:00:00,Kitsap County Credit Union,,3268.0,Finance,,Financial & Banking Information,2021,"1,000-9,999",1-99,
10913,08/17/2020 12:00:00 AM,12/01/2020 12:00:00 AM,Unauthorized Access,2020-05-19T00:00:00,2020-08-17T00:00:00,Kitsap County Credit Union,,3268.0,Finance,,Full Date of Birth,2021,"1,000-9,999",1-99,
10913,08/17/2020 12:00:00 AM,12/01/2020 12:00:00 AM,Unauthorized Access,2020-05-19T00:00:00,2020-08-17T00:00:00,Kitsap County Credit Union,,3268.0,Finance,,Medical Information,2021,"1,000-9,999",1-99,
10913,08/17/2020 12:00:00 AM,12/01/2020 12:00:00 AM,Unauthorized Access,2020-05-19T00:00:00,2020-08-17T00:00:00,Kitsap County Credit Union,,3268.0,Finance,,Other,2021,"1,000-9,999",1-99,
10916,07/07/2021 12:00:00 AM,09/03/2021 12:00:00 AM,Cyberattack,2021-07-07T00:00:00,2021-07-07T00:00:00,Famous Smoke Shop,Ransomware,32950.0,Business,Retail,Name,2022,"10,000-49,999",0,PA
10916,07/07/2021 12:00:00 AM,09/03/2021 12:00:00 AM,Cyberattack,2021-07-07T00:00:00,2021-07-07T00:00:00,Famous Smoke Shop,Ransomware,32950.0,Business,Retail,Full Date of Birth,2022,"10,000-49,999",0,PA
10916,07/07/2021 12:00:00 AM,09/03/2021 12:00:00 AM,Cyberattack,2021-07-07T00:00:00,2021-07-07T00:00:00,Famous Smoke Shop,Ransomware,32950.0,Business,Retail,Email Address and Password/Security Question Answers,2022,"10,000-49,999",0,PA
10916,07/07/2021 12:00:00 AM,09/03/2021 12:00:00 AM,Cyberattack,2021-07-07T00:00:00,2021-07-07T00:00:00,Famous Smoke Shop,Ransomware,32950.0,Business,Retail,Other,2022,"10,000-49,999",0,PA
11011,09/15/2021 12:00:00 AM,09/22/2021 12:00:00 AM,Unauthorized Access,2021-09-13T00:00:00,,"Epik Holdings, Inc.",,2040.0,Business,Web Services,Name,2022,"1,000-9,999",Unknown,WA
11011,09/15/2021 12:00:00 AM,09/22/2021 12:00:00 AM,Unauthorized Access,2021-09-13T00:00:00,,"Epik Holdings, Inc.",,2040.0,Business,Web Services,Financial & Banking Information,2022,"1,000-9,999",Unknown,WA
11011,09/15/2021 12:00:00 AM,09/22/2021 12:00:00 AM,Unauthorized Access,2021-09-13T00:00:00,,"Epik Holdings, Inc.",,2040.0,Business,Web Services,Username and Password/Security Question Answers,2022,"1,000-9,999",Unknown,WA
11011,09/15/2021 12:00:00 AM,09/22/2021 12:00:00 AM,Unauthorized Access,2021-09-13T00:00:00,,"Epik Holdings, Inc.",,2040.0,Business,Web Services,Email Address and Password/Security Question Answers,2022,"1,000-9,999",Unknown,WA
11012,01/24/2021 12:00:00 AM,09/24/2021 12:00:00 AM,Cyberattack,2021-01-24T00:00:00,2021-01-24T00:00:00,Golden Entertainment,Ransomware,3223.0,Business,Entertainment,Name,2022,"1,000-9,999",0,NV
11012,01/24/2021 12:00:00 AM,09/24/2021 12:00:00 AM,Cyberattack,2021-01-24T00:00:00,2021-01-24T00:00:00,Golden Entertainment,Ransomware,3223.0,Business,Entertainment,Social Security Number,2022,"1,000-9,999",0,NV
11012,01/24/2021 12:00:00 AM,09/24/2021 12:00:00 AM,Cyberattack,2021-01-24T00:00:00,2021-01-24T00:00:00,Golden Entertainment,Ransomware,3223.0,Business,Entertainment,Driver's License or Washington ID Card Number,2022,"1,000-9,999",0,NV
11012,01/24/2021 12:00:00 AM,09/24/2021 12:00:00 AM,Cyberattack,2021-01-24T00:00:00,2021-01-24T00:00:00,Golden Entertainment,Ransomware,3223.0,Business,Entertainment,Full Date of Birth,2022,"1,000-9,999",0,NV
11012,01/24/2021 12:00:00 AM,09/24/2021 12:00:00 AM,Cyberattack,2021-01-24T00:00:00,2021-01-24T00:00:00,Golden Entertainment,Ransomware,3223.0,Business,Entertainment,Military ID Number,2022,"1,000-9,999",0,NV
11029,07/02/2021 12:00:00 AM,08/09/2021 12:00:00 AM,Cyberattack,,,"Spreadshirt, Inc.",Ransomware,911.0,Business,Clothing,Name,2022,500-999,Unknown,PA
11029,07/02/2021 12:00:00 AM,08/09/2021 12:00:00 AM,Cyberattack,,,"Spreadshirt, Inc.",Ransomware,911.0,Business,Clothing,Name,2022,500-999,Unknown,PA
11029,07/02/2021 12:00:00 AM,08/09/2021 12:00:00 AM,Cyberattack,,,"Spreadshirt, Inc.",Ransomware,911.0,Business,Clothing,Financial & Banking Information,2022,500-999,Unknown,PA
11029,07/02/2021 12:00:00 AM,08/09/2021 12:00:00 AM,Cyberattack,,,"Spreadshirt, Inc.",Ransomware,911.0,Business,Clothing,Financial & Banking Information,2022,500-999,Unknown,PA
11033,09/14/2021 12:00:00 AM,09/24/2021 12:00:00 AM,Theft or Mistake,2021-09-09T00:00:00,2021-09-09T00:00:00,Zenith American Solutions,,1687.0,Health,,Name,2022,"1,000-9,999",1-99,WA
11033,09/14/2021 12:00:00 AM,09/24/2021 12:00:00 AM,Theft or Mistake,2021-09-09T00:00:00,2021-09-09T00:00:00,Zenith American Solutions,,1687.0,Health,,Social Security Number,2022,"1,000-9,999",1-99,WA
11035,03/15/2021 12:00:00 AM,08/30/2021 12:00:00 AM,Unauthorized Access,2021-03-13T00:00:00,,"Hyphen, LLC",,1331.0,Finance,,Name,2022,"1,000-9,999",Unknown,
11035,03/15/2021 12:00:00 AM,08/30/2021 12:00:00 AM,Unauthorized Access,2021-03-13T00:00:00,,"Hyphen, LLC",,1331.0,Finance,,Social Security Number,2022,"1,000-9,999",Unknown,
11035,03/15/2021 12:00:00 AM,08/30/2021 12:00:00 AM,Unauthorized Access,2021-03-13T00:00:00,,"Hyphen, LLC",,1331.0,Finance,,Financial & Banking Information,2022,"1,000-9,999",Unknown,
11035,03/15/2021 12:00:00 AM,08/30/2021 12:00:00 AM,Unauthorized Access,2021-03-13T00:00:00,,"Hyphen, LLC",,1331.0,Finance,,Full Date of Birth,2022,"1,000-9,999",Unknown,
11040,11/20/2020 12:00:00 AM,09/21/2021 12:00:00 AM,Cyberattack,2020-03-11T00:00:00,2020-12-15T00:00:00,"Dick Blick Holdings, Inc.",Malware,690.0,Business,Retail,Name,2022,500-999,200-299,
11040,11/20/2020 12:00:00 AM,09/21/2021 12:00:00 AM,Cyberattack,2020-03-11T00:00:00,2020-12-15T00:00:00,"Dick Blick Holdings, Inc.",Malware,690.0,Business,Retail,Financial & Banking Information,2022,500-999,200-299,
11041,03/30/2021 12:00:00 AM,09/24/2021 12:00:00 AM,Unauthorized Access,,2021-08-27T00:00:00,"Hattrup & Associates, P.S.",,2839.0,Finance,,Name,2022,"1,000-9,999",Unknown,
11041,03/30/2021 12:00:00 AM,09/24/2021 12:00:00 AM,Unauthorized Access,,2021-08-27T00:00:00,"Hattrup & Associates, P.S.",,2839.0,Finance,,Social Security Number,2022,"1,000-9,999",Unknown,
11041,03/30/2021 12:00:00 AM,09/24/2021 12:00:00 AM,Unauthorized Access,,2021-08-27T00:00:00,"Hattrup & Associates, P.S.",,2839.0,Finance,,Driver's License or Washington ID Card Number,2022,"1,000-9,999",Unknown,
11041,03/30/2021 12:00:00 AM,09/24/2021 12:00:00 AM,Unauthorized Access,,2021-08-27T00:00:00,"Hattrup & Associates, P.S.",,2839.0,Finance,,Financial & Banking Information,2022,"1,000-9,999",Unknown,
11041,03/30/2021 12:00:00 AM,09/24/2021 12:00:00 AM,Unauthorized Access,,2021-08-27T00:00:00,"Hattrup & Associates, P.S.",,2839.0,Finance,,Full Date of Birth,2022,"1,000-9,999",Unknown,
11043,09/09/2021 12:00:00 AM,09/30/2021 12:00:00 AM,Unauthorized Access,2020-05-02T00:00:00,2020-05-17T00:00:00,"The Neiman Marcus Group, LLC (NMG or the Company)",,67410.0,Business,Retail,Name,2022,"50,000-999,999",400-499,TX
11043,09/09/2021 12:00:00 AM,09/30/2021 12:00:00 AM,Unauthorized Access,2020-05-02T00:00:00,2020-05-17T00:00:00,"The Neiman Marcus Group, LLC (NMG or the Company)",,67410.0,Business,Retail,Financial & Banking Information,2022,"50,000-999,999",400-499,TX
11043,09/09/2021 12:00:00 AM,09/30/2021 12:00:00 AM,Unauthorized Access,2020-05-02T00:00:00,2020-05-17T00:00:00,"The Neiman Marcus Group, LLC (NMG or the Company)",,67410.0,Business,Retail,Username and Password/Security Question Answers,2022,"50,000-999,999",400-499,TX
11099,08/05/2021 12:00:00 AM,09/30/2021 12:00:00 AM,Unauthorized Access,2021-07-26T00:00:00,2021-07-28T00:00:00,LPL Financial LLC,,992.0,Finance,,Name,2022,500-999,1-99,
11099,08/05/2021 12:00:00 AM,09/30/2021 12:00:00 AM,Unauthorized Access,2021-07-26T00:00:00,2021-07-28T00:00:00,LPL Financial LLC,,992.0,Finance,,Name,2022,500-999,1-99,
11099,08/05/2021 12:00:00 AM,09/30/2021 12:00:00 AM,Unauthorized Access,2021-07-26T00:00:00,2021-07-28T00:00:00,LPL Financial LLC,,992.0,Finance,,Social Security Number,2022,500-999,1-99,
11099,08/05/2021 12:00:00 AM,09/30/2021 12:00:00 AM,Unauthorized Access,2021-07-26T00:00:00,2021-07-28T00:00:00,LPL Financial LLC,,992.0,Finance,,Social Security Number,2022,500-999,1-99,
11099,08/05/2021 12:00:00 AM,09/30/2021 12:00:00 AM,Unauthorized Access,2021-07-26T00:00:00,2021-07-28T00:00:00,LPL Financial LLC,,992.0,Finance,,Financial & Banking Information,2022,500-999,1-99,
11099,08/05/2021 12:00:00 AM,09/30/2021 12:00:00 AM,Unauthorized Access,2021-07-26T00:00:00,2021-07-28T00:00:00,LPL Financial LLC,,992.0,Finance,,Financial & Banking Information,2022,500-999,1-99,
11099,08/05/2021 12:00:00 AM,09/30/2021 12:00:00 AM,Unauthorized Access,2021-07-26T00:00:00,2021-07-28T00:00:00,LPL Financial LLC,,992.0,Finance,,Health Insurance Policy or ID Number,2022,500-999,1-99,
11099,08/05/2021 12:00:00 AM,09/30/2021 12:00:00 AM,Unauthorized Access,2021-07-26T00:00:00,2021-07-28T00:00:00,LPL Financial LLC,,992.0,Finance,,Health Insurance Policy or ID Number,2022,500-999,1-99,
11099,08/05/2021 12:00:00 AM,09/30/2021 12:00:00 AM,Unauthorized Access,2021-07-26T00:00:00,2021-07-28T00:00:00,LPL Financial LLC,,992.0,Finance,,Medical Information,2022,500-999,1-99,
11099,08/05/2021 12:00:00 AM,09/30/2021 12:00:00 AM,Unauthorized Access,2021-07-26T00:00:00,2021-07-28T00:00:00,LPL Financial LLC,,992.0,Finance,,Medical Information,2022,500-999,1-99,
11100,04/24/2021 12:00:00 AM,10/08/2021 12:00:00 AM,Cyberattack,2021-04-23T00:00:00,2021-04-24T00:00:00,Smile Brands Inc.,Ransomware,108927.0,Health,,Name,2022,"50,000-999,999",1-99,CA
11100,04/24/2021 12:00:00 AM,10/08/2021 12:00:00 AM,Cyberattack,2021-04-23T00:00:00,2021-04-24T00:00:00,Smile Brands Inc.,Ransomware,108927.0,Health,,Social Security Number,2022,"50,000-999,999",1-99,CA
11100,04/24/2021 12:00:00 AM,10/08/2021 12:00:00 AM,Cyberattack,2021-04-23T00:00:00,2021-04-24T00:00:00,Smile Brands Inc.,Ransomware,108927.0,Health,,Financial & Banking Information,2022,"50,000-999,999",1-99,CA
11100,04/24/2021 12:00:00 AM,10/08/2021 12:00:00 AM,Cyberattack,2021-04-23T00:00:00,2021-04-24T00:00:00,Smile Brands Inc.,Ransomware,108927.0,Health,,Full Date of Birth,2022,"50,000-999,999",1-99,CA
11100,04/24/2021 12:00:00 AM,10/08/2021 12:00:00 AM,Cyberattack,2021-04-23T00:00:00,2021-04-24T00:00:00,Smile Brands Inc.,Ransomware,108927.0,Health,,Health Insurance Policy or ID Number,2022,"50,000-999,999",1-99,CA
11100,04/24/2021 12:00:00 AM,10/08/2021 12:00:00 AM,Cyberattack,2021-04-23T00:00:00,2021-04-24T00:00:00,Smile Brands Inc.,Ransomware,108927.0,Health,,Medical Information,2022,"50,000-999,999",1-99,CA
11101,08/10/2021 12:00:00 AM,10/08/2021 12:00:00 AM,Cyberattack,2021-08-08T00:00:00,2021-08-10T00:00:00,"ReproSource Fertility Diagnostics, Inc.",Ransomware,7781.0,Health,,Name,2022,"1,000-9,999",1-99,WA
11101,08/10/2021 12:00:00 AM,10/08/2021 12:00:00 AM,Cyberattack,2021-08-08T00:00:00,2021-08-10T00:00:00,"ReproSource Fertility Diagnostics, Inc.",Ransomware,7781.0,Health,,Social Security Number,2022,"1,000-9,999",1-99,WA
11101,08/10/2021 12:00:00 AM,10/08/2021 12:00:00 AM,Cyberattack,2021-08-08T00:00:00,2021-08-10T00:00:00,"ReproSource Fertility Diagnostics, Inc.",Ransomware,7781.0,Health,,Driver's License or Washington ID Card Number,2022,"1,000-9,999",1-99,WA
11101,08/10/2021 12:00:00 AM,10/08/2021 12:00:00 AM,Cyberattack,2021-08-08T00:00:00,2021-08-10T00:00:00,"ReproSource Fertility Diagnostics, Inc.",Ransomware,7781.0,Health,,Financial & Banking Information,2022,"1,000-9,999",1-99,WA
11101,08/10/2021 12:00:00 AM,10/08/2021 12:00:00 AM,Cyberattack,2021-08-08T00:00:00,2021-08-10T00:00:00,"ReproSource Fertility Diagnostics, Inc.",Ransomware,7781.0,Health,,Full Date of Birth,2022,"1,000-9,999",1-99,WA
11101,08/10/2021 12:00:00 AM,10/08/2021 12:00:00 AM,Cyberattack,2021-08-08T00:00:00,2021-08-10T00:00:00,"ReproSource Fertility Diagnostics, Inc.",Ransomware,7781.0,Health,,Passport Number,2022,"1,000-9,999",1-99,WA
11101,08/10/2021 12:00:00 AM,10/08/2021 12:00:00 AM,Cyberattack,2021-08-08T00:00:00,2021-08-10T00:00:00,"ReproSource Fertility Diagnostics, Inc.",Ransomware,7781.0,Health,,Health Insurance Policy or ID Number,2022,"1,000-9,999",1-99,WA
11101,08/10/2021 12:00:00 AM,10/08/2021 12:00:00 AM,Cyberattack,2021-08-08T00:00:00,2021-08-10T00:00:00,"ReproSource Fertility Diagnostics, Inc.",Ransomware,7781.0,Health,,Medical Information,2022,"1,000-9,999",1-99,WA
11101,08/10/2021 12:00:00 AM,10/08/2021 12:00:00 AM,Cyberattack,2021-08-08T00:00:00,2021-08-10T00:00:00,"ReproSource Fertility Diagnostics, Inc.",Ransomware,7781.0,Health,,Email Address and Password/Security Question Answers,2022,"1,000-9,999",1-99,WA
11106,07/03/2021 12:00:00 AM,10/04/2021 12:00:00 AM,Unauthorized Access,2021-07-01T00:00:00,2021-10-05T00:00:00,Royell Manufacturing,,1145.0,Business,Other,Name,2022,"1,000-9,999",1-99,WA
11106,07/03/2021 12:00:00 AM,10/04/2021 12:00:00 AM,Unauthorized Access,2021-07-01T00:00:00,2021-10-05T00:00:00,Royell Manufacturing,,1145.0,Business,Other,Social Security Number,2022,"1,000-9,999",1-99,WA
11106,07/03/2021 12:00:00 AM,10/04/2021 12:00:00 AM,Unauthorized Access,2021-07-01T00:00:00,2021-10-05T00:00:00,Royell Manufacturing,,1145.0,Business,Other,Financial & Banking Information,2022,"1,000-9,999",1-99,WA
11113,06/14/2021 12:00:00 AM,10/11/2021 12:00:00 AM,Cyberattack,2021-06-14T00:00:00,2021-06-15T00:00:00,University Medical Center of Southern Nevada (UMC),Unclear/unknown,3572.0,Health,,Name,2022,"1,000-9,999",1-99,
11113,06/14/2021 12:00:00 AM,10/11/2021 12:00:00 AM,Cyberattack,2021-06-14T00:00:00,2021-06-15T00:00:00,University Medical Center of Southern Nevada (UMC),Unclear/unknown,3572.0,Health,,Social Security Number,2022,"1,000-9,999",1-99,
11113,06/14/2021 12:00:00 AM,10/11/2021 12:00:00 AM,Cyberattack,2021-06-14T00:00:00,2021-06-15T00:00:00,University Medical Center of Southern Nevada (UMC),Unclear/unknown,3572.0,Health,,Full Date of Birth,2022,"1,000-9,999",1-99,
11113,06/14/2021 12:00:00 AM,10/11/2021 12:00:00 AM,Cyberattack,2021-06-14T00:00:00,2021-06-15T00:00:00,University Medical Center of Southern Nevada (UMC),Unclear/unknown,3572.0,Health,,Health Insurance Policy or ID Number,2022,"1,000-9,999",1-99,
11113,06/14/2021 12:00:00 AM,10/11/2021 12:00:00 AM,Cyberattack,2021-06-14T00:00:00,2021-06-15T00:00:00,University Medical Center of Southern Nevada (UMC),Unclear/unknown,3572.0,Health,,Medical Information,2022,"1,000-9,999",1-99,
11125,09/11/2021 12:00:00 AM,10/14/2021 12:00:00 AM,Unauthorized Access,2021-09-11T00:00:00,2021-09-11T00:00:00,The Public School and Education Employees Retirement Systems,,532.0,Government,,Name,2022,500-999,0,MO
11125,09/11/2021 12:00:00 AM,10/14/2021 12:00:00 AM,Unauthorized Access,2021-09-11T00:00:00,2021-09-11T00:00:00,The Public School and Education Employees Retirement Systems,,532.0,Government,,Social Security Number,2022,500-999,0,MO
11125,09/11/2021 12:00:00 AM,10/14/2021 12:00:00 AM,Unauthorized Access,2021-09-11T00:00:00,2021-09-11T00:00:00,The Public School and Education Employees Retirement Systems,,532.0,Government,,Financial & Banking Information,2022,500-999,0,MO
11125,09/11/2021 12:00:00 AM,10/14/2021 12:00:00 AM,Unauthorized Access,2021-09-11T00:00:00,2021-09-11T00:00:00,The Public School and Education Employees Retirement Systems,,532.0,Government,,Full Date of Birth,2022,500-999,0,MO
11125,09/11/2021 12:00:00 AM,10/14/2021 12:00:00 AM,Unauthorized Access,2021-09-11T00:00:00,2021-09-11T00:00:00,The Public School and Education Employees Retirement Systems,,532.0,Government,,Other,2022,500-999,0,MO
11126,11/18/2020 12:00:00 AM,10/14/2021 12:00:00 AM,Cyberattack,2020-07-21T00:00:00,2020-12-19T00:00:00,"Elevated Title, LLC",Phishing,685.0,Business,Other,Name,2022,500-999,100-199,GA
11126,11/18/2020 12:00:00 AM,10/14/2021 12:00:00 AM,Cyberattack,2020-07-21T00:00:00,2020-12-19T00:00:00,"Elevated Title, LLC",Phishing,685.0,Business,Other,Social Security Number,2022,500-999,100-199,GA
11126,11/18/2020 12:00:00 AM,10/14/2021 12:00:00 AM,Cyberattack,2020-07-21T00:00:00,2020-12-19T00:00:00,"Elevated Title, LLC",Phishing,685.0,Business,Other,Driver's License or Washington ID Card Number,2022,500-999,100-199,GA
11126,11/18/2020 12:00:00 AM,10/14/2021 12:00:00 AM,Cyberattack,2020-07-21T00:00:00,2020-12-19T00:00:00,"Elevated Title, LLC",Phishing,685.0,Business,Other,Financial & Banking Information,2022,500-999,100-199,GA
11126,11/18/2020 12:00:00 AM,10/14/2021 12:00:00 AM,Cyberattack,2020-07-21T00:00:00,2020-12-19T00:00:00,"Elevated Title, LLC",Phishing,685.0,Business,Other,Full Date of Birth,2022,500-999,100-199,GA
11126,11/18/2020 12:00:00 AM,10/14/2021 12:00:00 AM,Cyberattack,2020-07-21T00:00:00,2020-12-19T00:00:00,"Elevated Title, LLC",Phishing,685.0,Business,Other,Military ID Number,2022,500-999,100-199,GA
11126,11/18/2020 12:00:00 AM,10/14/2021 12:00:00 AM,Cyberattack,2020-07-21T00:00:00,2020-12-19T00:00:00,"Elevated Title, LLC",Phishing,685.0,Business,Other,Passport Number,2022,500-999,100-199,GA
11126,11/18/2020 12:00:00 AM,10/14/2021 12:00:00 AM,Cyberattack,2020-07-21T00:00:00,2020-12-19T00:00:00,"Elevated Title, LLC",Phishing,685.0,Business,Other,Health Insurance Policy or ID Number,2022,500-999,100-199,GA
11126,11/18/2020 12:00:00 AM,10/14/2021 12:00:00 AM,Cyberattack,2020-07-21T00:00:00,2020-12-19T00:00:00,"Elevated Title, LLC",Phishing,685.0,Business,Other,Medical Information,2022,500-999,100-199,GA
11129,09/08/2021 12:00:00 AM,10/18/2021 12:00:00 AM,Cyberattack,2021-07-01T00:00:00,2021-07-07T00:00:00,World Travel Holdings,Ransomware,1692.0,Business,Hospitality,Name,2022,"1,000-9,999",1-99,MA
11129,09/08/2021 12:00:00 AM,10/18/2021 12:00:00 AM,Cyberattack,2021-07-01T00:00:00,2021-07-07T00:00:00,World Travel Holdings,Ransomware,1692.0,Business,Hospitality,Social Security Number,2022,"1,000-9,999",1-99,MA
11129,09/08/2021 12:00:00 AM,10/18/2021 12:00:00 AM,Cyberattack,2021-07-01T00:00:00,2021-07-07T00:00:00,World Travel Holdings,Ransomware,1692.0,Business,Hospitality,Driver's License or Washington ID Card Number,2022,"1,000-9,999",1-99,MA
11129,09/08/2021 12:00:00 AM,10/18/2021 12:00:00 AM,Cyberattack,2021-07-01T00:00:00,2021-07-07T00:00:00,World Travel Holdings,Ransomware,1692.0,Business,Hospitality,Financial & Banking Information,2022,"1,000-9,999",1-99,MA
11129,09/08/2021 12:00:00 AM,10/18/2021 12:00:00 AM,Cyberattack,2021-07-01T00:00:00,2021-07-07T00:00:00,World Travel Holdings,Ransomware,1692.0,Business,Hospitality,Full Date of Birth,2022,"1,000-9,999",1-99,MA
11129,09/08/2021 12:00:00 AM,10/18/2021 12:00:00 AM,Cyberattack,2021-07-01T00:00:00,2021-07-07T00:00:00,World Travel Holdings,Ransomware,1692.0,Business,Hospitality,Passport Number,2022,"1,000-9,999",1-99,MA
11129,09/08/2021 12:00:00 AM,10/18/2021 12:00:00 AM,Cyberattack,2021-07-01T00:00:00,2021-07-07T00:00:00,World Travel Holdings,Ransomware,1692.0,Business,Hospitality,Username and Password/Security Question Answers,2022,"1,000-9,999",1-99,MA
11131,08/05/2021 12:00:00 AM,10/21/2021 12:00:00 AM,Cyberattack,2021-08-02T00:00:00,2021-08-05T00:00:00,"Wallick & Volk, Inc.",Malware,1625.0,Finance,,Name,2022,"1,000-9,999",1-99,WA
11131,08/05/2021 12:00:00 AM,10/21/2021 12:00:00 AM,Cyberattack,2021-08-02T00:00:00,2021-08-05T00:00:00,"Wallick & Volk, Inc.",Malware,1625.0,Finance,,Social Security Number,2022,"1,000-9,999",1-99,WA
11131,08/05/2021 12:00:00 AM,10/21/2021 12:00:00 AM,Cyberattack,2021-08-02T00:00:00,2021-08-05T00:00:00,"Wallick & Volk, Inc.",Malware,1625.0,Finance,,Financial & Banking Information,2022,"1,000-9,999",1-99,WA
11192,05/21/2021 12:00:00 AM,10/29/2021 12:00:00 AM,Cyberattack,2021-05-21T00:00:00,2021-05-21T00:00:00,"Goldwater Bank, N.A.",Ransomware,762.0,Finance,,Name,2022,500-999,0,AZ
11192,05/21/2021 12:00:00 AM,10/29/2021 12:00:00 AM,Cyberattack,2021-05-21T00:00:00,2021-05-21T00:00:00,"Goldwater Bank, N.A.",Ransomware,762.0,Finance,,Social Security Number,2022,500-999,0,AZ
11192,05/21/2021 12:00:00 AM,10/29/2021 12:00:00 AM,Cyberattack,2021-05-21T00:00:00,2021-05-21T00:00:00,"Goldwater Bank, N.A.",Ransomware,762.0,Finance,,Financial & Banking Information,2022,500-999,0,AZ
11207,03/16/2021 12:00:00 AM,10/21/2021 12:00:00 AM,Unauthorized Access,2021-02-03T00:00:00,2021-03-16T00:00:00,"SCUF Gaming International, LLC",,691.0,Business,Manufacturing,Name,2022,500-999,1-99,GA
11207,03/16/2021 12:00:00 AM,10/21/2021 12:00:00 AM,Unauthorized Access,2021-02-03T00:00:00,2021-03-16T00:00:00,"SCUF Gaming International, LLC",,691.0,Business,Manufacturing,Financial & Banking Information,2022,500-999,1-99,GA
11207,03/16/2021 12:00:00 AM,10/21/2021 12:00:00 AM,Unauthorized Access,2021-02-03T00:00:00,2021-03-16T00:00:00,"SCUF Gaming International, LLC",,691.0,Business,Manufacturing,Email Address and Password/Security Question Answers,2022,500-999,1-99,GA
11218,06/24/2021 12:00:00 AM,11/15/2021 12:00:00 AM,Cyberattack,,,Sea Mar Community Health Centers,Unclear/unknown,628569.0,Health,,Name,2022,"50,000-999,999",Unknown,
11218,06/24/2021 12:00:00 AM,11/15/2021 12:00:00 AM,Cyberattack,,,Sea Mar Community Health Centers,Unclear/unknown,628569.0,Health,,Social Security Number,2022,"50,000-999,999",Unknown,
11218,06/24/2021 12:00:00 AM,11/15/2021 12:00:00 AM,Cyberattack,,,Sea Mar Community Health Centers,Unclear/unknown,628569.0,Health,,Full Date of Birth,2022,"50,000-999,999",Unknown,
11218,06/24/2021 12:00:00 AM,11/15/2021 12:00:00 AM,Cyberattack,,,Sea Mar Community Health Centers,Unclear/unknown,628569.0,Health,,Health Insurance Policy or ID Number,2022,"50,000-999,999",Unknown,
11218,06/24/2021 12:00:00 AM,11/15/2021 12:00:00 AM,Cyberattack,,,Sea Mar Community Health Centers,Unclear/unknown,628569.0,Health,,Medical Information,2022,"50,000-999,999",Unknown,
11218,06/24/2021 12:00:00 AM,11/15/2021 12:00:00 AM,Cyberattack,,,Sea Mar Community Health Centers,Unclear/unknown,628569.0,Health,,Other,2022,"50,000-999,999",Unknown,
11225,06/03/2021 12:00:00 AM,10/28/2021 12:00:00 AM,Cyberattack,2021-06-03T00:00:00,2021-06-03T00:00:00,"Terrier Media Buyer, Inc. dba Cox Media Group",Ransomware,693.0,Business,Telecommunications,Name,2022,500-999,0,GA
11225,06/03/2021 12:00:00 AM,10/28/2021 12:00:00 AM,Cyberattack,2021-06-03T00:00:00,2021-06-03T00:00:00,"Terrier Media Buyer, Inc. dba Cox Media Group",Ransomware,693.0,Business,Telecommunications,Social Security Number,2022,500-999,0,GA
11225,06/03/2021 12:00:00 AM,10/28/2021 12:00:00 AM,Cyberattack,2021-06-03T00:00:00,2021-06-03T00:00:00,"Terrier Media Buyer, Inc. dba Cox Media Group",Ransomware,693.0,Business,Telecommunications,Driver's License or Washington ID Card Number,2022,500-999,0,GA
11225,06/03/2021 12:00:00 AM,10/28/2021 12:00:00 AM,Cyberattack,2021-06-03T00:00:00,2021-06-03T00:00:00,"Terrier Media Buyer, Inc. dba Cox Media Group",Ransomware,693.0,Business,Telecommunications,Financial & Banking Information,2022,500-999,0,GA
11225,06/03/2021 12:00:00 AM,10/28/2021 12:00:00 AM,Cyberattack,2021-06-03T00:00:00,2021-06-03T00:00:00,"Terrier Media Buyer, Inc. dba Cox Media Group",Ransomware,693.0,Business,Telecommunications,Full Date of Birth,2022,500-999,0,GA
11225,06/03/2021 12:00:00 AM,10/28/2021 12:00:00 AM,Cyberattack,2021-06-03T00:00:00,2021-06-03T00:00:00,"Terrier Media Buyer, Inc. dba Cox Media Group",Ransomware,693.0,Business,Telecommunications,Passport Number,2022,500-999,0,GA
11225,06/03/2021 12:00:00 AM,10/28/2021 12:00:00 AM,Cyberattack,2021-06-03T00:00:00,2021-06-03T00:00:00,"Terrier Media Buyer, Inc. dba Cox Media Group",Ransomware,693.0,Business,Telecommunications,Health Insurance Policy or ID Number,2022,500-999,0,GA
11225,06/03/2021 12:00:00 AM,10/28/2021 12:00:00 AM,Cyberattack,2021-06-03T00:00:00,2021-06-03T00:00:00,"Terrier Media Buyer, Inc. dba Cox Media Group",Ransomware,693.0,Business,Telecommunications,Medical Information,2022,500-999,0,GA
11225,06/03/2021 12:00:00 AM,10/28/2021 12:00:00 AM,Cyberattack,2021-06-03T00:00:00,2021-06-03T00:00:00,"Terrier Media Buyer, Inc. dba Cox Media Group",Ransomware,693.0,Business,Telecommunications,Username and Password/Security Question Answers,2022,500-999,0,GA
11225,06/03/2021 12:00:00 AM,10/28/2021 12:00:00 AM,Cyberattack,2021-06-03T00:00:00,2021-06-03T00:00:00,"Terrier Media Buyer, Inc. dba Cox Media Group",Ransomware,693.0,Business,Telecommunications,Email Address and Password/Security Question Answers,2022,500-999,0,GA
11226,09/01/2021 12:00:00 AM,11/08/2021 12:00:00 AM,Unauthorized Access,,2021-09-12T00:00:00,"Insureon Holdings, LLC",,671.0,Finance,,Name,2022,500-999,Unknown,WA
11226,09/01/2021 12:00:00 AM,11/08/2021 12:00:00 AM,Unauthorized Access,,2021-09-12T00:00:00,"Insureon Holdings, LLC",,671.0,Finance,,Social Security Number,2022,500-999,Unknown,WA
11226,09/01/2021 12:00:00 AM,11/08/2021 12:00:00 AM,Unauthorized Access,,2021-09-12T00:00:00,"Insureon Holdings, LLC",,671.0,Finance,,Full Date of Birth,2022,500-999,Unknown,WA
11232,08/03/2020 12:00:00 AM,11/09/2021 12:00:00 AM,Unauthorized Access,2020-07-31T00:00:00,2020-08-04T00:00:00,Hoffman Construction Company,,3078.0,Business,Construction,Name,2022,"1,000-9,999",1-99,OR
11232,08/03/2020 12:00:00 AM,11/09/2021 12:00:00 AM,Unauthorized Access,2020-07-31T00:00:00,2020-08-04T00:00:00,Hoffman Construction Company,,3078.0,Business,Construction,Social Security Number,2022,"1,000-9,999",1-99,OR
11232,08/03/2020 12:00:00 AM,11/09/2021 12:00:00 AM,Unauthorized Access,2020-07-31T00:00:00,2020-08-04T00:00:00,Hoffman Construction Company,,3078.0,Business,Construction,Financial & Banking Information,2022,"1,000-9,999",1-99,OR
11232,08/03/2020 12:00:00 AM,11/09/2021 12:00:00 AM,Unauthorized Access,2020-07-31T00:00:00,2020-08-04T00:00:00,Hoffman Construction Company,,3078.0,Business,Construction,Full Date of Birth,2022,"1,000-9,999",1-99,OR
11232,08/03/2020 12:00:00 AM,11/09/2021 12:00:00 AM,Unauthorized Access,2020-07-31T00:00:00,2020-08-04T00:00:00,Hoffman Construction Company,,3078.0,Business,Construction,Health Insurance Policy or ID Number,2022,"1,000-9,999",1-99,OR
11232,08/03/2020 12:00:00 AM,11/09/2021 12:00:00 AM,Unauthorized Access,2020-07-31T00:00:00,2020-08-04T00:00:00,Hoffman Construction Company,,3078.0,Business,Construction,Medical Information,2022,"1,000-9,999",1-99,OR
11233,12/24/2020 12:00:00 AM,11/10/2021 12:00:00 AM,Cyberattack,2020-12-24T00:00:00,2021-02-15T00:00:00,Christensen OConnor Johnson Kindness PLLC,Malware,815.0,Business,Legal,Name,2022,500-999,1-99,WA
11233,12/24/2020 12:00:00 AM,11/10/2021 12:00:00 AM,Cyberattack,2020-12-24T00:00:00,2021-02-15T00:00:00,Christensen OConnor Johnson Kindness PLLC,Malware,815.0,Business,Legal,Social Security Number,2022,500-999,1-99,WA
11233,12/24/2020 12:00:00 AM,11/10/2021 12:00:00 AM,Cyberattack,2020-12-24T00:00:00,2021-02-15T00:00:00,Christensen OConnor Johnson Kindness PLLC,Malware,815.0,Business,Legal,Financial & Banking Information,2022,500-999,1-99,WA
11233,12/24/2020 12:00:00 AM,11/10/2021 12:00:00 AM,Cyberattack,2020-12-24T00:00:00,2021-02-15T00:00:00,Christensen OConnor Johnson Kindness PLLC,Malware,815.0,Business,Legal,Full Date of Birth,2022,500-999,1-99,WA
11235,11/24/2020 12:00:00 AM,10/20/2021 12:00:00 AM,Cyberattack,,,Abeo Solutions Inc. d/b/a Crystal Practice Management,Ransomware,6141.0,Health,,Name,2022,"1,000-9,999",Unknown,
11235,11/24/2020 12:00:00 AM,10/20/2021 12:00:00 AM,Cyberattack,,,Abeo Solutions Inc. d/b/a Crystal Practice Management,Ransomware,6141.0,Health,,Social Security Number,2022,"1,000-9,999",Unknown,
11235,11/24/2020 12:00:00 AM,10/20/2021 12:00:00 AM,Cyberattack,,,Abeo Solutions Inc. d/b/a Crystal Practice Management,Ransomware,6141.0,Health,,Full Date of Birth,2022,"1,000-9,999",Unknown,
11235,11/24/2020 12:00:00 AM,10/20/2021 12:00:00 AM,Cyberattack,,,Abeo Solutions Inc. d/b/a Crystal Practice Management,Ransomware,6141.0,Health,,Health Insurance Policy or ID Number,2022,"1,000-9,999",Unknown,
11235,11/24/2020 12:00:00 AM,10/20/2021 12:00:00 AM,Cyberattack,,,Abeo Solutions Inc. d/b/a Crystal Practice Management,Ransomware,6141.0,Health,,Medical Information,2022,"1,000-9,999",Unknown,
11235,11/24/2020 12:00:00 AM,10/20/2021 12:00:00 AM,Cyberattack,,,Abeo Solutions Inc. d/b/a Crystal Practice Management,Ransomware,6141.0,Health,,Biometric Data,2022,"1,000-9,999",Unknown,
11236,07/02/2021 12:00:00 AM,10/20/2021 12:00:00 AM,Theft or Mistake,2020-08-17T00:00:00,2021-07-02T00:00:00,"J.B. Hunt Transport, Inc.",,3798.0,Business,Transportation,Name,2022,"1,000-9,999",300-399,
11236,07/02/2021 12:00:00 AM,10/20/2021 12:00:00 AM,Theft or Mistake,2020-08-17T00:00:00,2021-07-02T00:00:00,"J.B. Hunt Transport, Inc.",,3798.0,Business,Transportation,Social Security Number,2022,"1,000-9,999",300-399,
11237,08/08/2021 12:00:00 AM,10/27/2021 12:00:00 AM,Cyberattack,,,Primary Residential Mortgage,Malware,1712.0,Finance,,Name,2022,"1,000-9,999",Unknown,UT
11237,08/08/2021 12:00:00 AM,10/27/2021 12:00:00 AM,Cyberattack,,,Primary Residential Mortgage,Malware,1712.0,Finance,,Social Security Number,2022,"1,000-9,999",Unknown,UT
11237,08/08/2021 12:00:00 AM,10/27/2021 12:00:00 AM,Cyberattack,,,Primary Residential Mortgage,Malware,1712.0,Finance,,Driver's License or Washington ID Card Number,2022,"1,000-9,999",Unknown,UT
11238,10/09/2021 12:00:00 AM,11/22/2021 12:00:00 AM,Cyberattack,2021-10-09T00:00:00,2021-10-15T00:00:00,Boeing Employees Credit Union,Skimmers,657.0,Finance,,Name,2022,500-999,1-99,WA
11238,10/09/2021 12:00:00 AM,11/22/2021 12:00:00 AM,Cyberattack,2021-10-09T00:00:00,2021-10-15T00:00:00,Boeing Employees Credit Union,Skimmers,657.0,Finance,,Financial & Banking Information,2022,500-999,1-99,WA
11238,10/09/2021 12:00:00 AM,11/22/2021 12:00:00 AM,Cyberattack,2021-10-09T00:00:00,2021-10-15T00:00:00,Boeing Employees Credit Union,Skimmers,657.0,Finance,,Other,2022,500-999,1-99,WA
11251,09/15/2021 12:00:00 AM,11/15/2021 12:00:00 AM,Cyberattack,,2021-09-15T00:00:00,California Pizza Kitchen,Ransomware,1095.0,Business,Retail,Name,2022,"1,000-9,999",Unknown,CA
11251,09/15/2021 12:00:00 AM,11/15/2021 12:00:00 AM,Cyberattack,,2021-09-15T00:00:00,California Pizza Kitchen,Ransomware,1095.0,Business,Retail,Name,2022,"1,000-9,999",Unknown,CA
11251,09/15/2021 12:00:00 AM,11/15/2021 12:00:00 AM,Cyberattack,,2021-09-15T00:00:00,California Pizza Kitchen,Ransomware,1095.0,Business,Retail,Social Security Number,2022,"1,000-9,999",Unknown,CA
11251,09/15/2021 12:00:00 AM,11/15/2021 12:00:00 AM,Cyberattack,,2021-09-15T00:00:00,California Pizza Kitchen,Ransomware,1095.0,Business,Retail,Social Security Number,2022,"1,000-9,999",Unknown,CA
11256,10/22/2021 12:00:00 AM,11/16/2021 12:00:00 AM,Cyberattack,2020-09-26T00:00:00,2021-10-27T00:00:00,"Diode Dynamics, L.L.C.",Skimmers,1462.0,Business,Retail,Name,2022,"1,000-9,999",300-399,MO
11256,10/22/2021 12:00:00 AM,11/16/2021 12:00:00 AM,Cyberattack,2020-09-26T00:00:00,2021-10-27T00:00:00,"Diode Dynamics, L.L.C.",Skimmers,1462.0,Business,Retail,Financial & Banking Information,2022,"1,000-9,999",300-399,MO
11257,09/04/2021 12:00:00 AM,11/18/2021 12:00:00 AM,Cyberattack,2021-08-29T00:00:00,2021-09-04T00:00:00,"Utah Imaging Associates, Inc.",Ransomware,895.0,Health,,Name,2022,500-999,1-99,WA
11257,09/04/2021 12:00:00 AM,11/18/2021 12:00:00 AM,Cyberattack,2021-08-29T00:00:00,2021-09-04T00:00:00,"Utah Imaging Associates, Inc.",Ransomware,895.0,Health,,Social Security Number,2022,500-999,1-99,WA
11257,09/04/2021 12:00:00 AM,11/18/2021 12:00:00 AM,Cyberattack,2021-08-29T00:00:00,2021-09-04T00:00:00,"Utah Imaging Associates, Inc.",Ransomware,895.0,Health,,Full Date of Birth,2022,500-999,1-99,WA
11257,09/04/2021 12:00:00 AM,11/18/2021 12:00:00 AM,Cyberattack,2021-08-29T00:00:00,2021-09-04T00:00:00,"Utah Imaging Associates, Inc.",Ransomware,895.0,Health,,Health Insurance Policy or ID Number,2022,500-999,1-99,WA
11257,09/04/2021 12:00:00 AM,11/18/2021 12:00:00 AM,Cyberattack,2021-08-29T00:00:00,2021-09-04T00:00:00,"Utah Imaging Associates, Inc.",Ransomware,895.0,Health,,Medical Information,2022,500-999,1-99,WA
11257,09/04/2021 12:00:00 AM,11/18/2021 12:00:00 AM,Cyberattack,2021-08-29T00:00:00,2021-09-04T00:00:00,"Utah Imaging Associates, Inc.",Ransomware,895.0,Health,,Other,2022,500-999,1-99,WA
11259,04/19/2021 12:00:00 AM,11/22/2021 12:00:00 AM,Cyberattack,2021-04-19T00:00:00,2021-04-20T00:00:00,One Community Health,Ransomware,7945.0,Health,,Name,2022,"1,000-9,999",1-99,WA
11259,04/19/2021 12:00:00 AM,11/22/2021 12:00:00 AM,Cyberattack,2021-04-19T00:00:00,2021-04-20T00:00:00,One Community Health,Ransomware,7945.0,Health,,Social Security Number,2022,"1,000-9,999",1-99,WA
11259,04/19/2021 12:00:00 AM,11/22/2021 12:00:00 AM,Cyberattack,2021-04-19T00:00:00,2021-04-20T00:00:00,One Community Health,Ransomware,7945.0,Health,,Driver's License or Washington ID Card Number,2022,"1,000-9,999",1-99,WA
11259,04/19/2021 12:00:00 AM,11/22/2021 12:00:00 AM,Cyberattack,2021-04-19T00:00:00,2021-04-20T00:00:00,One Community Health,Ransomware,7945.0,Health,,Full Date of Birth,2022,"1,000-9,999",1-99,WA
11259,04/19/2021 12:00:00 AM,11/22/2021 12:00:00 AM,Cyberattack,2021-04-19T00:00:00,2021-04-20T00:00:00,One Community Health,Ransomware,7945.0,Health,,Health Insurance Policy or ID Number,2022,"1,000-9,999",1-99,WA
11259,04/19/2021 12:00:00 AM,11/22/2021 12:00:00 AM,Cyberattack,2021-04-19T00:00:00,2021-04-20T00:00:00,One Community Health,Ransomware,7945.0,Health,,Medical Information,2022,"1,000-9,999",1-99,WA
11260,02/08/2021 12:00:00 AM,11/22/2021 12:00:00 AM,Cyberattack,2021-01-19T00:00:00,2021-01-29T00:00:00,Astoria Company LLC,Other,22095.0,Business,Web Services,Name,2022,"10,000-49,999",1-99,WA
11260,02/08/2021 12:00:00 AM,11/22/2021 12:00:00 AM,Cyberattack,2021-01-19T00:00:00,2021-01-29T00:00:00,Astoria Company LLC,Other,22095.0,Business,Web Services,Social Security Number,2022,"10,000-49,999",1-99,WA
11260,02/08/2021 12:00:00 AM,11/22/2021 12:00:00 AM,Cyberattack,2021-01-19T00:00:00,2021-01-29T00:00:00,Astoria Company LLC,Other,22095.0,Business,Web Services,Driver's License or Washington ID Card Number,2022,"10,000-49,999",1-99,WA
11260,02/08/2021 12:00:00 AM,11/22/2021 12:00:00 AM,Cyberattack,2021-01-19T00:00:00,2021-01-29T00:00:00,Astoria Company LLC,Other,22095.0,Business,Web Services,Full Date of Birth,2022,"10,000-49,999",1-99,WA
11269,08/06/2021 12:00:00 AM,11/29/2021 12:00:00 AM,Cyberattack,2021-05-24T00:00:00,2021-07-28T00:00:00,"DNA Diagnostics Center, Inc.",Ransomware,4278.0,Business,Other,Name,2022,"1,000-9,999",1-99,OH
11269,08/06/2021 12:00:00 AM,11/29/2021 12:00:00 AM,Cyberattack,2021-05-24T00:00:00,2021-07-28T00:00:00,"DNA Diagnostics Center, Inc.",Ransomware,4278.0,Business,Other,Social Security Number,2022,"1,000-9,999",1-99,OH
11269,08/06/2021 12:00:00 AM,11/29/2021 12:00:00 AM,Cyberattack,2021-05-24T00:00:00,2021-07-28T00:00:00,"DNA Diagnostics Center, Inc.",Ransomware,4278.0,Business,Other,Financial & Banking Information,2022,"1,000-9,999",1-99,OH
11271,09/07/2021 12:00:00 AM,11/30/2021 12:00:00 AM,Cyberattack,2021-08-08T00:00:00,2021-08-08T00:00:00,"Cedar Grove Composting, Inc.",Ransomware,1596.0,Business,Other,Name,2022,"1,000-9,999",1-99,WA
11271,09/07/2021 12:00:00 AM,11/30/2021 12:00:00 AM,Cyberattack,2021-08-08T00:00:00,2021-08-08T00:00:00,"Cedar Grove Composting, Inc.",Ransomware,1596.0,Business,Other,Social Security Number,2022,"1,000-9,999",1-99,WA
11271,09/07/2021 12:00:00 AM,11/30/2021 12:00:00 AM,Cyberattack,2021-08-08T00:00:00,2021-08-08T00:00:00,"Cedar Grove Composting, Inc.",Ransomware,1596.0,Business,Other,Driver's License or Washington ID Card Number,2022,"1,000-9,999",1-99,WA
11271,09/07/2021 12:00:00 AM,11/30/2021 12:00:00 AM,Cyberattack,2021-08-08T00:00:00,2021-08-08T00:00:00,"Cedar Grove Composting, Inc.",Ransomware,1596.0,Business,Other,Health Insurance Policy or ID Number,2022,"1,000-9,999",1-99,WA
11271,09/07/2021 12:00:00 AM,11/30/2021 12:00:00 AM,Cyberattack,2021-08-08T00:00:00,2021-08-08T00:00:00,"Cedar Grove Composting, Inc.",Ransomware,1596.0,Business,Other,Medical Information,2022,"1,000-9,999",1-99,WA
11272,11/03/2021 12:00:00 AM,12/01/2021 12:00:00 AM,Cyberattack,2021-09-19T00:00:00,2021-09-22T00:00:00,"HealthCare, Inc. ",Unclear/unknown,625.0,Health,,Name,2022,500-999,1-99,FL
11272,11/03/2021 12:00:00 AM,12/01/2021 12:00:00 AM,Cyberattack,2021-09-19T00:00:00,2021-09-22T00:00:00,"HealthCare, Inc. ",Unclear/unknown,625.0,Health,,Full Date of Birth,2022,500-999,1-99,FL
11273,06/10/2021 12:00:00 AM,12/03/2021 12:00:00 AM,Cyberattack,2021-05-25T00:00:00,2021-06-10T00:00:00,American Council for International Studies ,Malware,3712.0,Business,Other,Name,2022,"1,000-9,999",1-99,MA
11273,06/10/2021 12:00:00 AM,12/03/2021 12:00:00 AM,Cyberattack,2021-05-25T00:00:00,2021-06-10T00:00:00,American Council for International Studies ,Malware,3712.0,Business,Other,Social Security Number,2022,"1,000-9,999",1-99,MA
11273,06/10/2021 12:00:00 AM,12/03/2021 12:00:00 AM,Cyberattack,2021-05-25T00:00:00,2021-06-10T00:00:00,American Council for International Studies ,Malware,3712.0,Business,Other,Full Date of Birth,2022,"1,000-9,999",1-99,MA
11273,06/10/2021 12:00:00 AM,12/03/2021 12:00:00 AM,Cyberattack,2021-05-25T00:00:00,2021-06-10T00:00:00,American Council for International Studies ,Malware,3712.0,Business,Other,Passport Number,2022,"1,000-9,999",1-99,MA
11274,07/16/2021 12:00:00 AM,12/09/2021 12:00:00 AM,Cyberattack,2021-07-13T00:00:00,2021-07-16T00:00:00,"Mor Furniture for Less, Inc.",Ransomware,731.0,Business,Other,Name,2022,500-999,1-99,CA
11274,07/16/2021 12:00:00 AM,12/09/2021 12:00:00 AM,Cyberattack,2021-07-13T00:00:00,2021-07-16T00:00:00,"Mor Furniture for Less, Inc.",Ransomware,731.0,Business,Other,Social Security Number,2022,500-999,1-99,CA
11274,07/16/2021 12:00:00 AM,12/09/2021 12:00:00 AM,Cyberattack,2021-07-13T00:00:00,2021-07-16T00:00:00,"Mor Furniture for Less, Inc.",Ransomware,731.0,Business,Other,Financial & Banking Information,2022,500-999,1-99,CA
11275,11/11/2021 12:00:00 AM,12/10/2021 12:00:00 AM,Unauthorized Access,2021-10-25T00:00:00,2021-11-11T00:00:00,"BioPlus Specialty Pharmacy Services, LLC",,13357.0,Health,,Name,2022,"10,000-49,999",1-99,FL
11275,11/11/2021 12:00:00 AM,12/10/2021 12:00:00 AM,Unauthorized Access,2021-10-25T00:00:00,2021-11-11T00:00:00,"BioPlus Specialty Pharmacy Services, LLC",,13357.0,Health,,Social Security Number,2022,"10,000-49,999",1-99,FL
11275,11/11/2021 12:00:00 AM,12/10/2021 12:00:00 AM,Unauthorized Access,2021-10-25T00:00:00,2021-11-11T00:00:00,"BioPlus Specialty Pharmacy Services, LLC",,13357.0,Health,,Full Date of Birth,2022,"10,000-49,999",1-99,FL
11275,11/11/2021 12:00:00 AM,12/10/2021 12:00:00 AM,Unauthorized Access,2021-10-25T00:00:00,2021-11-11T00:00:00,"BioPlus Specialty Pharmacy Services, LLC",,13357.0,Health,,Health Insurance Policy or ID Number,2022,"10,000-49,999",1-99,FL
11275,11/11/2021 12:00:00 AM,12/10/2021 12:00:00 AM,Unauthorized Access,2021-10-25T00:00:00,2021-11-11T00:00:00,"BioPlus Specialty Pharmacy Services, LLC",,13357.0,Health,,Medical Information,2022,"10,000-49,999",1-99,FL
11279,11/17/2021 12:00:00 AM,11/23/2021 12:00:00 AM,Cyberattack,2021-09-06T00:00:00,,"GoDaddy.com, LLC",Malware,9581.0,Business,Web Services,Unique Private Key (e.g. used to authenticate or sign an electronic record),2022,"1,000-9,999",Unknown,AZ
11279,11/17/2021 12:00:00 AM,11/23/2021 12:00:00 AM,Cyberattack,2021-09-06T00:00:00,,"GoDaddy.com, LLC",Malware,9581.0,Business,Web Services,Username and Password/Security Question Answers,2022,"1,000-9,999",Unknown,AZ
11279,11/17/2021 12:00:00 AM,11/23/2021 12:00:00 AM,Cyberattack,2021-09-06T00:00:00,,"GoDaddy.com, LLC",Malware,9581.0,Business,Web Services,Email Address and Password/Security Question Answers,2022,"1,000-9,999",Unknown,AZ
11281,08/27/2021 12:00:00 AM,11/30/2021 12:00:00 AM,Cyberattack,2021-08-25T00:00:00,2021-08-27T00:00:00,Seneca Family of Agencies,Malware,1313.0,Health,,Name,2022,"1,000-9,999",1-99,CA
11281,08/27/2021 12:00:00 AM,11/30/2021 12:00:00 AM,Cyberattack,2021-08-25T00:00:00,2021-08-27T00:00:00,Seneca Family of Agencies,Malware,1313.0,Health,,Social Security Number,2022,"1,000-9,999",1-99,CA
11281,08/27/2021 12:00:00 AM,11/30/2021 12:00:00 AM,Cyberattack,2021-08-25T00:00:00,2021-08-27T00:00:00,Seneca Family of Agencies,Malware,1313.0,Health,,Driver's License or Washington ID Card Number,2022,"1,000-9,999",1-99,CA
11281,08/27/2021 12:00:00 AM,11/30/2021 12:00:00 AM,Cyberattack,2021-08-25T00:00:00,2021-08-27T00:00:00,Seneca Family of Agencies,Malware,1313.0,Health,,Financial & Banking Information,2022,"1,000-9,999",1-99,CA
11281,08/27/2021 12:00:00 AM,11/30/2021 12:00:00 AM,Cyberattack,2021-08-25T00:00:00,2021-08-27T00:00:00,Seneca Family of Agencies,Malware,1313.0,Health,,Full Date of Birth,2022,"1,000-9,999",1-99,CA
11281,08/27/2021 12:00:00 AM,11/30/2021 12:00:00 AM,Cyberattack,2021-08-25T00:00:00,2021-08-27T00:00:00,Seneca Family of Agencies,Malware,1313.0,Health,,Unique Private Key (e.g. used to authenticate or sign an electronic record),2022,"1,000-9,999",1-99,CA
11281,08/27/2021 12:00:00 AM,11/30/2021 12:00:00 AM,Cyberattack,2021-08-25T00:00:00,2021-08-27T00:00:00,Seneca Family of Agencies,Malware,1313.0,Health,,Health Insurance Policy or ID Number,2022,"1,000-9,999",1-99,CA
11281,08/27/2021 12:00:00 AM,11/30/2021 12:00:00 AM,Cyberattack,2021-08-25T00:00:00,2021-08-27T00:00:00,Seneca Family of Agencies,Malware,1313.0,Health,,Medical Information,2022,"1,000-9,999",1-99,CA
11281,08/27/2021 12:00:00 AM,11/30/2021 12:00:00 AM,Cyberattack,2021-08-25T00:00:00,2021-08-27T00:00:00,Seneca Family of Agencies,Malware,1313.0,Health,,Other,2022,"1,000-9,999",1-99,CA
11282,09/28/2021 12:00:00 AM,12/06/2021 12:00:00 AM,Cyberattack,2021-09-28T00:00:00,,"Pawn America Minnesota, LLC",Ransomware,748.0,Business,Retail,Name,2022,500-999,Unknown,MN
11282,09/28/2021 12:00:00 AM,12/06/2021 12:00:00 AM,Cyberattack,2021-09-28T00:00:00,,"Pawn America Minnesota, LLC",Ransomware,748.0,Business,Retail,Social Security Number,2022,500-999,Unknown,MN
11282,09/28/2021 12:00:00 AM,12/06/2021 12:00:00 AM,Cyberattack,2021-09-28T00:00:00,,"Pawn America Minnesota, LLC",Ransomware,748.0,Business,Retail,Driver's License or Washington ID Card Number,2022,500-999,Unknown,MN
11282,09/28/2021 12:00:00 AM,12/06/2021 12:00:00 AM,Cyberattack,2021-09-28T00:00:00,,"Pawn America Minnesota, LLC",Ransomware,748.0,Business,Retail,Passport Number,2022,500-999,Unknown,MN
11282,09/28/2021 12:00:00 AM,12/06/2021 12:00:00 AM,Cyberattack,2021-09-28T00:00:00,,"Pawn America Minnesota, LLC",Ransomware,748.0,Business,Retail,Email Address and Password/Security Question Answers,2022,500-999,Unknown,MN
11285,11/12/2021 12:00:00 AM,12/16/2021 12:00:00 AM,Cyberattack,2021-11-11T00:00:00,2021-11-12T00:00:00,"Cirrus Asset Management, Inc.",Ransomware,568.0,Business,Other,Name,2022,500-999,1-99,WA
11285,11/12/2021 12:00:00 AM,12/16/2021 12:00:00 AM,Cyberattack,2021-11-11T00:00:00,2021-11-12T00:00:00,"Cirrus Asset Management, Inc.",Ransomware,568.0,Business,Other,Social Security Number,2022,500-999,1-99,WA
11286,10/15/2021 12:00:00 AM,12/17/2021 12:00:00 AM,Theft or Mistake,2021-10-01T00:00:00,,"Tennis Warehouse, LLC",,18228.0,Business,Retail,Financial & Banking Information,2022,"10,000-49,999",Unknown,
11286,10/15/2021 12:00:00 AM,12/17/2021 12:00:00 AM,Theft or Mistake,2021-10-01T00:00:00,,"Tennis Warehouse, LLC",,18228.0,Business,Retail,Email Address and Password/Security Question Answers,2022,"10,000-49,999",Unknown,
11287,10/15/2021 12:00:00 AM,12/17/2021 12:00:00 AM,Theft or Mistake,2021-10-01T00:00:00,,"Tackle Warehouse, LLC",,10942.0,Business,Retail,Financial & Banking Information,2022,"10,000-49,999",Unknown,
11287,10/15/2021 12:00:00 AM,12/17/2021 12:00:00 AM,Theft or Mistake,2021-10-01T00:00:00,,"Tackle Warehouse, LLC",,10942.0,Business,Retail,Email Address and Password/Security Question Answers,2022,"10,000-49,999",Unknown,
11288,10/15/2021 12:00:00 AM,12/17/2021 12:00:00 AM,Theft or Mistake,2021-10-01T00:00:00,,"Running Warehouse, LLC",,17556.0,Business,Retail,Financial & Banking Information,2022,"10,000-49,999",Unknown,
11288,10/15/2021 12:00:00 AM,12/17/2021 12:00:00 AM,Theft or Mistake,2021-10-01T00:00:00,,"Running Warehouse, LLC",,17556.0,Business,Retail,Email Address and Password/Security Question Answers,2022,"10,000-49,999",Unknown,
11289,10/15/2021 12:00:00 AM,12/17/2021 12:00:00 AM,Theft or Mistake,2021-10-01T00:00:00,,"Skate Warehouse, LLC",,8655.0,Business,Retail,Financial & Banking Information,2022,"1,000-9,999",Unknown,
11289,10/15/2021 12:00:00 AM,12/17/2021 12:00:00 AM,Theft or Mistake,2021-10-01T00:00:00,,"Skate Warehouse, LLC",,8655.0,Business,Retail,Email Address and Password/Security Question Answers,2022,"1,000-9,999",Unknown,
11299,08/12/2021 12:00:00 AM,12/17/2021 12:00:00 AM,Cyberattack,2021-02-12T00:00:00,2021-10-26T00:00:00,Heirloom Roses,Malware,3118.0,Business,Retail,Name,2022,"1,000-9,999",200-299,OR
11299,08/12/2021 12:00:00 AM,12/17/2021 12:00:00 AM,Cyberattack,2021-02-12T00:00:00,2021-10-26T00:00:00,Heirloom Roses,Malware,3118.0,Business,Retail,Financial & Banking Information,2022,"1,000-9,999",200-299,OR
11303,11/19/2021 12:00:00 AM,01/07/2022 12:00:00 AM,Cyberattack,2021-11-13T00:00:00,,"BearTooth Mapping, Inc.",Malware,4774.0,Business,Software,Username and Password/Security Question Answers,2022,"1,000-9,999",Unknown,
11303,11/19/2021 12:00:00 AM,01/07/2022 12:00:00 AM,Cyberattack,2021-11-13T00:00:00,,"BearTooth Mapping, Inc.",Malware,4774.0,Business,Software,Email Address and Password/Security Question Answers,2022,"1,000-9,999",Unknown,
11304,10/10/2021 12:00:00 AM,12/30/2021 12:00:00 AM,Cyberattack,2019-11-01T00:00:00,2021-08-31T00:00:00,Penn LLC d/b/a PulseTV,Malware,4302.0,Business,Retail,Name,2022,"1,000-9,999",500+,IL
11304,10/10/2021 12:00:00 AM,12/30/2021 12:00:00 AM,Cyberattack,2019-11-01T00:00:00,2021-08-31T00:00:00,Penn LLC d/b/a PulseTV,Malware,4302.0,Business,Retail,Financial & Banking Information,2022,"1,000-9,999",500+,IL
11304,10/10/2021 12:00:00 AM,12/30/2021 12:00:00 AM,Cyberattack,2019-11-01T00:00:00,2021-08-31T00:00:00,Penn LLC d/b/a PulseTV,Malware,4302.0,Business,Retail,Email Address and Password/Security Question Answers,2022,"1,000-9,999",500+,IL
11305,11/16/2021 12:00:00 AM,12/20/2021 12:00:00 AM,Cyberattack,2021-08-17T00:00:00,2021-10-11T00:00:00,"J.C. Penney Corporation, Inc. Pension Plan",Ransomware,1147.0,Business,Retail,Name,2022,"1,000-9,999",1-99,TX
11305,11/16/2021 12:00:00 AM,12/20/2021 12:00:00 AM,Cyberattack,2021-08-17T00:00:00,2021-10-11T00:00:00,"J.C. Penney Corporation, Inc. Pension Plan",Ransomware,1147.0,Business,Retail,Full Date of Birth,2022,"1,000-9,999",1-99,TX
11305,11/16/2021 12:00:00 AM,12/20/2021 12:00:00 AM,Cyberattack,2021-08-17T00:00:00,2021-10-11T00:00:00,"J.C. Penney Corporation, Inc. Pension Plan",Ransomware,1147.0,Business,Retail,Other,2022,"1,000-9,999",1-99,TX
11306,11/01/2021 12:00:00 AM,12/22/2021 12:00:00 AM,Cyberattack,2021-04-01T00:00:00,2021-11-01T00:00:00,Pro Wrestling Tees,Malware,581.0,Business,Clothing,Name,2022,500-999,200-299,IL
11306,11/01/2021 12:00:00 AM,12/22/2021 12:00:00 AM,Cyberattack,2021-04-01T00:00:00,2021-11-01T00:00:00,Pro Wrestling Tees,Malware,581.0,Business,Clothing,Financial & Banking Information,2022,500-999,200-299,IL
11321,12/12/2021 12:00:00 AM,12/30/2021 12:00:00 AM,Cyberattack,2021-12-07T00:00:00,2021-12-12T00:00:00,"McMenamins, Inc.",Ransomware,4693.0,Business,Hospitality,Name,2022,"1,000-9,999",1-99,OR
11321,12/12/2021 12:00:00 AM,12/30/2021 12:00:00 AM,Cyberattack,2021-12-07T00:00:00,2021-12-12T00:00:00,"McMenamins, Inc.",Ransomware,4693.0,Business,Hospitality,Social Security Number,2022,"1,000-9,999",1-99,OR
11321,12/12/2021 12:00:00 AM,12/30/2021 12:00:00 AM,Cyberattack,2021-12-07T00:00:00,2021-12-12T00:00:00,"McMenamins, Inc.",Ransomware,4693.0,Business,Hospitality,Full Date of Birth,2022,"1,000-9,999",1-99,OR
11321,12/12/2021 12:00:00 AM,12/30/2021 12:00:00 AM,Cyberattack,2021-12-07T00:00:00,2021-12-12T00:00:00,"McMenamins, Inc.",Ransomware,4693.0,Business,Hospitality,Health Insurance Policy or ID Number,2022,"1,000-9,999",1-99,OR
11321,12/12/2021 12:00:00 AM,12/30/2021 12:00:00 AM,Cyberattack,2021-12-07T00:00:00,2021-12-12T00:00:00,"McMenamins, Inc.",Ransomware,4693.0,Business,Hospitality,Medical Information,2022,"1,000-9,999",1-99,OR
11321,12/12/2021 12:00:00 AM,12/30/2021 12:00:00 AM,Cyberattack,2021-12-07T00:00:00,2021-12-12T00:00:00,"McMenamins, Inc.",Ransomware,4693.0,Business,Hospitality,Email Address and Password/Security Question Answers,2022,"1,000-9,999",1-99,OR
11321,12/12/2021 12:00:00 AM,12/30/2021 12:00:00 AM,Cyberattack,2021-12-07T00:00:00,2021-12-12T00:00:00,"McMenamins, Inc.",Ransomware,4693.0,Business,Hospitality,Other,2022,"1,000-9,999",1-99,OR
11322,10/19/2021 12:00:00 AM,01/02/2022 12:00:00 AM,Cyberattack,2021-10-15T00:00:00,2021-10-19T00:00:00,North Broward Hospital District d/b/a Broward Health,Malware,1168.0,Health,,Name,2022,"1,000-9,999",1-99,WA
11322,10/19/2021 12:00:00 AM,01/02/2022 12:00:00 AM,Cyberattack,2021-10-15T00:00:00,2021-10-19T00:00:00,North Broward Hospital District d/b/a Broward Health,Malware,1168.0,Health,,Social Security Number,2022,"1,000-9,999",1-99,WA
11322,10/19/2021 12:00:00 AM,01/02/2022 12:00:00 AM,Cyberattack,2021-10-15T00:00:00,2021-10-19T00:00:00,North Broward Hospital District d/b/a Broward Health,Malware,1168.0,Health,,Driver's License or Washington ID Card Number,2022,"1,000-9,999",1-99,WA
11322,10/19/2021 12:00:00 AM,01/02/2022 12:00:00 AM,Cyberattack,2021-10-15T00:00:00,2021-10-19T00:00:00,North Broward Hospital District d/b/a Broward Health,Malware,1168.0,Health,,Financial & Banking Information,2022,"1,000-9,999",1-99,WA
11322,10/19/2021 12:00:00 AM,01/02/2022 12:00:00 AM,Cyberattack,2021-10-15T00:00:00,2021-10-19T00:00:00,North Broward Hospital District d/b/a Broward Health,Malware,1168.0,Health,,Full Date of Birth,2022,"1,000-9,999",1-99,WA
11322,10/19/2021 12:00:00 AM,01/02/2022 12:00:00 AM,Cyberattack,2021-10-15T00:00:00,2021-10-19T00:00:00,North Broward Hospital District d/b/a Broward Health,Malware,1168.0,Health,,Health Insurance Policy or ID Number,2022,"1,000-9,999",1-99,WA
11322,10/19/2021 12:00:00 AM,01/02/2022 12:00:00 AM,Cyberattack,2021-10-15T00:00:00,2021-10-19T00:00:00,North Broward Hospital District d/b/a Broward Health,Malware,1168.0,Health,,Medical Information,2022,"1,000-9,999",1-99,WA
11322,10/19/2021 12:00:00 AM,01/02/2022 12:00:00 AM,Cyberattack,2021-10-15T00:00:00,2021-10-19T00:00:00,North Broward Hospital District d/b/a Broward Health,Malware,1168.0,Health,,Email Address and Password/Security Question Answers,2022,"1,000-9,999",1-99,WA
11323,09/27/2021 12:00:00 AM,01/03/2022 12:00:00 AM,Cyberattack,,2021-09-27T00:00:00,Ravkoo,Other,5729.0,Health,,Name,2022,"1,000-9,999",Unknown,FL
11323,09/27/2021 12:00:00 AM,01/03/2022 12:00:00 AM,Cyberattack,,2021-09-27T00:00:00,Ravkoo,Other,5729.0,Health,,Full Date of Birth,2022,"1,000-9,999",Unknown,FL
11323,09/27/2021 12:00:00 AM,01/03/2022 12:00:00 AM,Cyberattack,,2021-09-27T00:00:00,Ravkoo,Other,5729.0,Health,,Medical Information,2022,"1,000-9,999",Unknown,FL
11331,11/09/2021 12:00:00 AM,01/07/2022 12:00:00 AM,Cyberattack,2021-11-02T00:00:00,2021-11-09T00:00:00,Medical Review Institute of America,Malware,3225.0,Health,,Name,2022,"1,000-9,999",1-99,WA
11331,11/09/2021 12:00:00 AM,01/07/2022 12:00:00 AM,Cyberattack,2021-11-02T00:00:00,2021-11-09T00:00:00,Medical Review Institute of America,Malware,3225.0,Health,,Social Security Number,2022,"1,000-9,999",1-99,WA
11331,11/09/2021 12:00:00 AM,01/07/2022 12:00:00 AM,Cyberattack,2021-11-02T00:00:00,2021-11-09T00:00:00,Medical Review Institute of America,Malware,3225.0,Health,,Full Date of Birth,2022,"1,000-9,999",1-99,WA
11331,11/09/2021 12:00:00 AM,01/07/2022 12:00:00 AM,Cyberattack,2021-11-02T00:00:00,2021-11-09T00:00:00,Medical Review Institute of America,Malware,3225.0,Health,,Health Insurance Policy or ID Number,2022,"1,000-9,999",1-99,WA
11331,11/09/2021 12:00:00 AM,01/07/2022 12:00:00 AM,Cyberattack,2021-11-02T00:00:00,2021-11-09T00:00:00,Medical Review Institute of America,Malware,3225.0,Health,,Medical Information,2022,"1,000-9,999",1-99,WA
11331,11/09/2021 12:00:00 AM,01/07/2022 12:00:00 AM,Cyberattack,2021-11-02T00:00:00,2021-11-09T00:00:00,Medical Review Institute of America,Malware,3225.0,Health,,Email Address and Password/Security Question Answers,2022,"1,000-9,999",1-99,WA
11331,11/09/2021 12:00:00 AM,01/07/2022 12:00:00 AM,Cyberattack,2021-11-02T00:00:00,2021-11-09T00:00:00,Medical Review Institute of America,Malware,3225.0,Health,,Other,2022,"1,000-9,999",1-99,WA
11332,12/21/2021 12:00:00 AM,01/19/2022 12:00:00 AM,Cyberattack,,2021-12-21T00:00:00,Spokane Regional Health District,Phishing,1058.0,Government,,Name,2022,"1,000-9,999",Unknown,WA
11332,12/21/2021 12:00:00 AM,01/19/2022 12:00:00 AM,Cyberattack,,2021-12-21T00:00:00,Spokane Regional Health District,Phishing,1058.0,Government,,Full Date of Birth,2022,"1,000-9,999",Unknown,WA
11332,12/21/2021 12:00:00 AM,01/19/2022 12:00:00 AM,Cyberattack,,2021-12-21T00:00:00,Spokane Regional Health District,Phishing,1058.0,Government,,Medical Information,2022,"1,000-9,999",Unknown,WA
11332,12/21/2021 12:00:00 AM,01/19/2022 12:00:00 AM,Cyberattack,,2021-12-21T00:00:00,Spokane Regional Health District,Phishing,1058.0,Government,,Other,2022,"1,000-9,999",Unknown,WA
11336,12/21/2021 12:00:00 AM,01/19/2022 12:00:00 AM,Cyberattack,2021-02-02T00:00:00,2021-03-22T00:00:00,"LendUS, LLC",Phishing,696.0,Finance,,Name,2022,500-999,300-399,CA
11336,12/21/2021 12:00:00 AM,01/19/2022 12:00:00 AM,Cyberattack,2021-02-02T00:00:00,2021-03-22T00:00:00,"LendUS, LLC",Phishing,696.0,Finance,,Social Security Number,2022,500-999,300-399,CA
11336,12/21/2021 12:00:00 AM,01/19/2022 12:00:00 AM,Cyberattack,2021-02-02T00:00:00,2021-03-22T00:00:00,"LendUS, LLC",Phishing,696.0,Finance,,Driver's License or Washington ID Card Number,2022,500-999,300-399,CA
11336,12/21/2021 12:00:00 AM,01/19/2022 12:00:00 AM,Cyberattack,2021-02-02T00:00:00,2021-03-22T00:00:00,"LendUS, LLC",Phishing,696.0,Finance,,Financial & Banking Information,2022,500-999,300-399,CA
11336,12/21/2021 12:00:00 AM,01/19/2022 12:00:00 AM,Cyberattack,2021-02-02T00:00:00,2021-03-22T00:00:00,"LendUS, LLC",Phishing,696.0,Finance,,Passport Number,2022,500-999,300-399,CA
11336,12/21/2021 12:00:00 AM,01/19/2022 12:00:00 AM,Cyberattack,2021-02-02T00:00:00,2021-03-22T00:00:00,"LendUS, LLC",Phishing,696.0,Finance,,Health Insurance Policy or ID Number,2022,500-999,300-399,CA
11336,12/21/2021 12:00:00 AM,01/19/2022 12:00:00 AM,Cyberattack,2021-02-02T00:00:00,2021-03-22T00:00:00,"LendUS, LLC",Phishing,696.0,Finance,,Medical Information,2022,500-999,300-399,CA
11336,12/21/2021 12:00:00 AM,01/19/2022 12:00:00 AM,Cyberattack,2021-02-02T00:00:00,2021-03-22T00:00:00,"LendUS, LLC",Phishing,696.0,Finance,,Username and Password/Security Question Answers,2022,500-999,300-399,CA
11337,12/30/2021 12:00:00 AM,01/21/2022 12:00:00 AM,Theft or Mistake,2021-12-27T00:00:00,,Boeing Employees' Credit Union,,2187.0,Finance,,Name,2022,"1,000-9,999",Unknown,WA
11337,12/30/2021 12:00:00 AM,01/21/2022 12:00:00 AM,Theft or Mistake,2021-12-27T00:00:00,,Boeing Employees' Credit Union,,2187.0,Finance,,Financial & Banking Information,2022,"1,000-9,999",Unknown,WA
11337,12/30/2021 12:00:00 AM,01/21/2022 12:00:00 AM,Theft or Mistake,2021-12-27T00:00:00,,Boeing Employees' Credit Union,,2187.0,Finance,,Other,2022,"1,000-9,999",Unknown,WA
11374,12/07/2021 12:00:00 AM,01/21/2022 12:00:00 AM,Cyberattack,2020-03-26T00:00:00,2021-04-07T00:00:00,"Nuna Baby Essentials, Inc. ",Other,816.0,Business,Retail,Name,2022,500-999,500+,PA
11374,12/07/2021 12:00:00 AM,01/21/2022 12:00:00 AM,Cyberattack,2020-03-26T00:00:00,2021-04-07T00:00:00,"Nuna Baby Essentials, Inc. ",Other,816.0,Business,Retail,Financial & Banking Information,2022,500-999,500+,PA
11392,10/28/2021 12:00:00 AM,12/09/2021 12:00:00 AM,Cyberattack,2021-10-24T00:00:00,2021-11-24T00:00:00,Title Guaranty Company of Lewis County,Ransomware,1109.0,Business,Other,Name,2022,"1,000-9,999",1-99,WA
11392,10/28/2021 12:00:00 AM,12/09/2021 12:00:00 AM,Cyberattack,2021-10-24T00:00:00,2021-11-24T00:00:00,Title Guaranty Company of Lewis County,Ransomware,1109.0,Business,Other,Social Security Number,2022,"1,000-9,999",1-99,WA
11392,10/28/2021 12:00:00 AM,12/09/2021 12:00:00 AM,Cyberattack,2021-10-24T00:00:00,2021-11-24T00:00:00,Title Guaranty Company of Lewis County,Ransomware,1109.0,Business,Other,Driver's License or Washington ID Card Number,2022,"1,000-9,999",1-99,WA
11392,10/28/2021 12:00:00 AM,12/09/2021 12:00:00 AM,Cyberattack,2021-10-24T00:00:00,2021-11-24T00:00:00,Title Guaranty Company of Lewis County,Ransomware,1109.0,Business,Other,Financial & Banking Information,2022,"1,000-9,999",1-99,WA
11392,10/28/2021 12:00:00 AM,12/09/2021 12:00:00 AM,Cyberattack,2021-10-24T00:00:00,2021-11-24T00:00:00,Title Guaranty Company of Lewis County,Ransomware,1109.0,Business,Other,Full Date of Birth,2022,"1,000-9,999",1-99,WA
11392,10/28/2021 12:00:00 AM,12/09/2021 12:00:00 AM,Cyberattack,2021-10-24T00:00:00,2021-11-24T00:00:00,Title Guaranty Company of Lewis County,Ransomware,1109.0,Business,Other,Medical Information,2022,"1,000-9,999",1-99,WA
11392,10/28/2021 12:00:00 AM,12/09/2021 12:00:00 AM,Cyberattack,2021-10-24T00:00:00,2021-11-24T00:00:00,Title Guaranty Company of Lewis County,Ransomware,1109.0,Business,Other,Email Address and Password/Security Question Answers,2022,"1,000-9,999",1-99,WA
11393,12/14/2021 12:00:00 AM,01/25/2022 12:00:00 AM,Cyberattack,2021-12-09T00:00:00,2021-12-10T00:00:00,Aditi Consulting,Other,918.0,Business,Professional Services,Name,2022,500-999,1-99,WA
11393,12/14/2021 12:00:00 AM,01/25/2022 12:00:00 AM,Cyberattack,2021-12-09T00:00:00,2021-12-10T00:00:00,Aditi Consulting,Other,918.0,Business,Professional Services,Social Security Number,2022,500-999,1-99,WA
11393,12/14/2021 12:00:00 AM,01/25/2022 12:00:00 AM,Cyberattack,2021-12-09T00:00:00,2021-12-10T00:00:00,Aditi Consulting,Other,918.0,Business,Professional Services,Full Date of Birth,2022,500-999,1-99,WA
11394,08/16/2021 12:00:00 AM,01/28/2022 12:00:00 AM,Cyberattack,2021-08-16T00:00:00,2021-08-17T00:00:00,Accutech Systems Corporation,Ransomware,1376.0,Business,Software,Name,2022,"1,000-9,999",1-99,IN
11394,08/16/2021 12:00:00 AM,01/28/2022 12:00:00 AM,Cyberattack,2021-08-16T00:00:00,2021-08-17T00:00:00,Accutech Systems Corporation,Ransomware,1376.0,Business,Software,Social Security Number,2022,"1,000-9,999",1-99,IN
11394,08/16/2021 12:00:00 AM,01/28/2022 12:00:00 AM,Cyberattack,2021-08-16T00:00:00,2021-08-17T00:00:00,Accutech Systems Corporation,Ransomware,1376.0,Business,Software,Financial & Banking Information,2022,"1,000-9,999",1-99,IN
11394,08/16/2021 12:00:00 AM,01/28/2022 12:00:00 AM,Cyberattack,2021-08-16T00:00:00,2021-08-17T00:00:00,Accutech Systems Corporation,Ransomware,1376.0,Business,Software,Full Date of Birth,2022,"1,000-9,999",1-99,IN
11422,07/01/2021 12:00:00 AM,12/14/2021 12:00:00 AM,Cyberattack,2021-06-25T00:00:00,2021-08-10T00:00:00,"Cities Digital, Inc.",Malware,3000.0,Business,Professional Services,Name,2022,"1,000-9,999",1-99,WI
11422,07/01/2021 12:00:00 AM,12/14/2021 12:00:00 AM,Cyberattack,2021-06-25T00:00:00,2021-08-10T00:00:00,"Cities Digital, Inc.",Malware,3000.0,Business,Professional Services,Full Date of Birth,2022,"1,000-9,999",1-99,WI
11423,11/18/2021 12:00:00 AM,12/29/2021 12:00:00 AM,Cyberattack,2021-10-27T00:00:00,2021-10-30T00:00:00,"Innovations Group, Inc.",Malware,772.0,Health,,Name,2022,500-999,1-99,
11423,11/18/2021 12:00:00 AM,12/29/2021 12:00:00 AM,Cyberattack,2021-10-27T00:00:00,2021-10-30T00:00:00,"Innovations Group, Inc.",Malware,772.0,Health,,Social Security Number,2022,500-999,1-99,
11423,11/18/2021 12:00:00 AM,12/29/2021 12:00:00 AM,Cyberattack,2021-10-27T00:00:00,2021-10-30T00:00:00,"Innovations Group, Inc.",Malware,772.0,Health,,Driver's License or Washington ID Card Number,2022,500-999,1-99,
11423,11/18/2021 12:00:00 AM,12/29/2021 12:00:00 AM,Cyberattack,2021-10-27T00:00:00,2021-10-30T00:00:00,"Innovations Group, Inc.",Malware,772.0,Health,,Financial & Banking Information,2022,500-999,1-99,
11423,11/18/2021 12:00:00 AM,12/29/2021 12:00:00 AM,Cyberattack,2021-10-27T00:00:00,2021-10-30T00:00:00,"Innovations Group, Inc.",Malware,772.0,Health,,Full Date of Birth,2022,500-999,1-99,
11423,11/18/2021 12:00:00 AM,12/29/2021 12:00:00 AM,Cyberattack,2021-10-27T00:00:00,2021-10-30T00:00:00,"Innovations Group, Inc.",Malware,772.0,Health,,Health Insurance Policy or ID Number,2022,500-999,1-99,
11423,11/18/2021 12:00:00 AM,12/29/2021 12:00:00 AM,Cyberattack,2021-10-27T00:00:00,2021-10-30T00:00:00,"Innovations Group, Inc.",Malware,772.0,Health,,Medical Information,2022,500-999,1-99,
11423,11/18/2021 12:00:00 AM,12/29/2021 12:00:00 AM,Cyberattack,2021-10-27T00:00:00,2021-10-30T00:00:00,"Innovations Group, Inc.",Malware,772.0,Health,,Other,2022,500-999,1-99,
11424,11/18/2021 12:00:00 AM,01/28/2022 12:00:00 AM,Cyberattack,2021-11-22T00:00:00,2021-11-22T00:00:00,Keller Supply Company,Ransomware,2486.0,Business,Retail,Name,2022,"1,000-9,999",0,WA
11424,11/18/2021 12:00:00 AM,01/28/2022 12:00:00 AM,Cyberattack,2021-11-22T00:00:00,2021-11-22T00:00:00,Keller Supply Company,Ransomware,2486.0,Business,Retail,Social Security Number,2022,"1,000-9,999",0,WA
11424,11/18/2021 12:00:00 AM,01/28/2022 12:00:00 AM,Cyberattack,2021-11-22T00:00:00,2021-11-22T00:00:00,Keller Supply Company,Ransomware,2486.0,Business,Retail,Full Date of Birth,2022,"1,000-9,999",0,WA
11425,09/08/2020 12:00:00 AM,01/29/2022 12:00:00 AM,Cyberattack,2020-09-03T00:00:00,2020-09-08T00:00:00,Fairmount Memorial Association,Ransomware,6909.0,Business,Other,Name,2022,"1,000-9,999",1-99,WA
11425,09/08/2020 12:00:00 AM,01/29/2022 12:00:00 AM,Cyberattack,2020-09-03T00:00:00,2020-09-08T00:00:00,Fairmount Memorial Association,Ransomware,6909.0,Business,Other,Social Security Number,2022,"1,000-9,999",1-99,WA
11425,09/08/2020 12:00:00 AM,01/29/2022 12:00:00 AM,Cyberattack,2020-09-03T00:00:00,2020-09-08T00:00:00,Fairmount Memorial Association,Ransomware,6909.0,Business,Other,Driver's License or Washington ID Card Number,2022,"1,000-9,999",1-99,WA
11425,09/08/2020 12:00:00 AM,01/29/2022 12:00:00 AM,Cyberattack,2020-09-03T00:00:00,2020-09-08T00:00:00,Fairmount Memorial Association,Ransomware,6909.0,Business,Other,Financial & Banking Information,2022,"1,000-9,999",1-99,WA
11425,09/08/2020 12:00:00 AM,01/29/2022 12:00:00 AM,Cyberattack,2020-09-03T00:00:00,2020-09-08T00:00:00,Fairmount Memorial Association,Ransomware,6909.0,Business,Other,Full Date of Birth,2022,"1,000-9,999",1-99,WA
11425,09/08/2020 12:00:00 AM,01/29/2022 12:00:00 AM,Cyberattack,2020-09-03T00:00:00,2020-09-08T00:00:00,Fairmount Memorial Association,Ransomware,6909.0,Business,Other,Passport Number,2022,"1,000-9,999",1-99,WA
11425,09/08/2020 12:00:00 AM,01/29/2022 12:00:00 AM,Cyberattack,2020-09-03T00:00:00,2020-09-08T00:00:00,Fairmount Memorial Association,Ransomware,6909.0,Business,Other,Health Insurance Policy or ID Number,2022,"1,000-9,999",1-99,WA
11425,09/08/2020 12:00:00 AM,01/29/2022 12:00:00 AM,Cyberattack,2020-09-03T00:00:00,2020-09-08T00:00:00,Fairmount Memorial Association,Ransomware,6909.0,Business,Other,Medical Information,2022,"1,000-9,999",1-99,WA
11427,11/23/2021 12:00:00 AM,01/31/2022 12:00:00 AM,Unauthorized Access,2021-10-28T00:00:00,2021-11-15T00:00:00,"Unum Group (""Unum"")",,1610.0,Business,Other,Name,2022,"1,000-9,999",1-99,TN
11427,11/23/2021 12:00:00 AM,01/31/2022 12:00:00 AM,Unauthorized Access,2021-10-28T00:00:00,2021-11-15T00:00:00,"Unum Group (""Unum"")",,1610.0,Business,Other,Social Security Number,2022,"1,000-9,999",1-99,TN
11427,11/23/2021 12:00:00 AM,01/31/2022 12:00:00 AM,Unauthorized Access,2021-10-28T00:00:00,2021-11-15T00:00:00,"Unum Group (""Unum"")",,1610.0,Business,Other,Full Date of Birth,2022,"1,000-9,999",1-99,TN
11427,11/23/2021 12:00:00 AM,01/31/2022 12:00:00 AM,Unauthorized Access,2021-10-28T00:00:00,2021-11-15T00:00:00,"Unum Group (""Unum"")",,1610.0,Business,Other,Health Insurance Policy or ID Number,2022,"1,000-9,999",1-99,TN
11442,12/29/2021 12:00:00 AM,02/09/2022 12:00:00 AM,Cyberattack,,2021-12-29T00:00:00,WA State Department of Transportation,Other,2249.0,Government,,Name,2022,"1,000-9,999",Unknown,WA
11442,12/29/2021 12:00:00 AM,02/09/2022 12:00:00 AM,Cyberattack,,2021-12-29T00:00:00,WA State Department of Transportation,Other,2249.0,Government,,Social Security Number,2022,"1,000-9,999",Unknown,WA
11443,02/20/2021 12:00:00 AM,02/11/2022 12:00:00 AM,Cyberattack,2021-01-22T00:00:00,2021-02-20T00:00:00,"DPI Specialty Foods, Inc.",Malware,610.0,Business,Other,Name,2022,500-999,1-99,CA
11443,02/20/2021 12:00:00 AM,02/11/2022 12:00:00 AM,Cyberattack,2021-01-22T00:00:00,2021-02-20T00:00:00,"DPI Specialty Foods, Inc.",Malware,610.0,Business,Other,Social Security Number,2022,500-999,1-99,CA
11443,02/20/2021 12:00:00 AM,02/11/2022 12:00:00 AM,Cyberattack,2021-01-22T00:00:00,2021-02-20T00:00:00,"DPI Specialty Foods, Inc.",Malware,610.0,Business,Other,Driver's License or Washington ID Card Number,2022,500-999,1-99,CA
11443,02/20/2021 12:00:00 AM,02/11/2022 12:00:00 AM,Cyberattack,2021-01-22T00:00:00,2021-02-20T00:00:00,"DPI Specialty Foods, Inc.",Malware,610.0,Business,Other,Full Date of Birth,2022,500-999,1-99,CA
11443,02/20/2021 12:00:00 AM,02/11/2022 12:00:00 AM,Cyberattack,2021-01-22T00:00:00,2021-02-20T00:00:00,"DPI Specialty Foods, Inc.",Malware,610.0,Business,Other,Passport Number,2022,500-999,1-99,CA
11443,02/20/2021 12:00:00 AM,02/11/2022 12:00:00 AM,Cyberattack,2021-01-22T00:00:00,2021-02-20T00:00:00,"DPI Specialty Foods, Inc.",Malware,610.0,Business,Other,Health Insurance Policy or ID Number,2022,500-999,1-99,CA
11443,02/20/2021 12:00:00 AM,02/11/2022 12:00:00 AM,Cyberattack,2021-01-22T00:00:00,2021-02-20T00:00:00,"DPI Specialty Foods, Inc.",Malware,610.0,Business,Other,Medical Information,2022,500-999,1-99,CA
11450,09/30/2020 12:00:00 AM,02/15/2022 12:00:00 AM,Cyberattack,2020-04-09T00:00:00,2020-10-22T00:00:00,Comprehensive Health Services,Other,2785.0,Health,,Name,2022,"1,000-9,999",100-199,FL
11450,09/30/2020 12:00:00 AM,02/15/2022 12:00:00 AM,Cyberattack,2020-04-09T00:00:00,2020-10-22T00:00:00,Comprehensive Health Services,Other,2785.0,Health,,Social Security Number,2022,"1,000-9,999",100-199,FL
11451,01/18/2022 12:00:00 AM,02/18/2022 12:00:00 AM,Cyberattack,2021-12-21T00:00:00,2022-01-03T00:00:00,Virginia Mason Medical Center,Phishing,3000.0,Health,,Name,2022,"1,000-9,999",1-99,WA
11451,01/18/2022 12:00:00 AM,02/18/2022 12:00:00 AM,Cyberattack,2021-12-21T00:00:00,2022-01-03T00:00:00,Virginia Mason Medical Center,Phishing,3000.0,Health,,Social Security Number,2022,"1,000-9,999",1-99,WA
11451,01/18/2022 12:00:00 AM,02/18/2022 12:00:00 AM,Cyberattack,2021-12-21T00:00:00,2022-01-03T00:00:00,Virginia Mason Medical Center,Phishing,3000.0,Health,,Driver's License or Washington ID Card Number,2022,"1,000-9,999",1-99,WA
11451,01/18/2022 12:00:00 AM,02/18/2022 12:00:00 AM,Cyberattack,2021-12-21T00:00:00,2022-01-03T00:00:00,Virginia Mason Medical Center,Phishing,3000.0,Health,,Financial & Banking Information,2022,"1,000-9,999",1-99,WA
11451,01/18/2022 12:00:00 AM,02/18/2022 12:00:00 AM,Cyberattack,2021-12-21T00:00:00,2022-01-03T00:00:00,Virginia Mason Medical Center,Phishing,3000.0,Health,,Full Date of Birth,2022,"1,000-9,999",1-99,WA
11451,01/18/2022 12:00:00 AM,02/18/2022 12:00:00 AM,Cyberattack,2021-12-21T00:00:00,2022-01-03T00:00:00,Virginia Mason Medical Center,Phishing,3000.0,Health,,Passport Number,2022,"1,000-9,999",1-99,WA
11451,01/18/2022 12:00:00 AM,02/18/2022 12:00:00 AM,Cyberattack,2021-12-21T00:00:00,2022-01-03T00:00:00,Virginia Mason Medical Center,Phishing,3000.0,Health,,Health Insurance Policy or ID Number,2022,"1,000-9,999",1-99,WA
11451,01/18/2022 12:00:00 AM,02/18/2022 12:00:00 AM,Cyberattack,2021-12-21T00:00:00,2022-01-03T00:00:00,Virginia Mason Medical Center,Phishing,3000.0,Health,,Medical Information,2022,"1,000-9,999",1-99,WA
11451,01/18/2022 12:00:00 AM,02/18/2022 12:00:00 AM,Cyberattack,2021-12-21T00:00:00,2022-01-03T00:00:00,Virginia Mason Medical Center,Phishing,3000.0,Health,,Other,2022,"1,000-9,999",1-99,WA
11452,07/21/2021 12:00:00 AM,02/18/2022 12:00:00 AM,Cyberattack,2021-07-15T00:00:00,2021-07-21T00:00:00,"Welfare & Pension Administration Service, Inc. (WPAS)",Malware,103557.0,Business,Professional Services,Name,2022,"50,000-999,999",1-99,WA
11452,07/21/2021 12:00:00 AM,02/18/2022 12:00:00 AM,Cyberattack,2021-07-15T00:00:00,2021-07-21T00:00:00,"Welfare & Pension Administration Service, Inc. (WPAS)",Malware,103557.0,Business,Professional Services,Social Security Number,2022,"50,000-999,999",1-99,WA
11452,07/21/2021 12:00:00 AM,02/18/2022 12:00:00 AM,Cyberattack,2021-07-15T00:00:00,2021-07-21T00:00:00,"Welfare & Pension Administration Service, Inc. (WPAS)",Malware,103557.0,Business,Professional Services,Driver's License or Washington ID Card Number,2022,"50,000-999,999",1-99,WA
11452,07/21/2021 12:00:00 AM,02/18/2022 12:00:00 AM,Cyberattack,2021-07-15T00:00:00,2021-07-21T00:00:00,"Welfare & Pension Administration Service, Inc. (WPAS)",Malware,103557.0,Business,Professional Services,Financial & Banking Information,2022,"50,000-999,999",1-99,WA
11452,07/21/2021 12:00:00 AM,02/18/2022 12:00:00 AM,Cyberattack,2021-07-15T00:00:00,2021-07-21T00:00:00,"Welfare & Pension Administration Service, Inc. (WPAS)",Malware,103557.0,Business,Professional Services,Full Date of Birth,2022,"50,000-999,999",1-99,WA
11452,07/21/2021 12:00:00 AM,02/18/2022 12:00:00 AM,Cyberattack,2021-07-15T00:00:00,2021-07-21T00:00:00,"Welfare & Pension Administration Service, Inc. (WPAS)",Malware,103557.0,Business,Professional Services,Passport Number,2022,"50,000-999,999",1-99,WA
11452,07/21/2021 12:00:00 AM,02/18/2022 12:00:00 AM,Cyberattack,2021-07-15T00:00:00,2021-07-21T00:00:00,"Welfare & Pension Administration Service, Inc. (WPAS)",Malware,103557.0,Business,Professional Services,Health Insurance Policy or ID Number,2022,"50,000-999,999",1-99,WA
11452,07/21/2021 12:00:00 AM,02/18/2022 12:00:00 AM,Cyberattack,2021-07-15T00:00:00,2021-07-21T00:00:00,"Welfare & Pension Administration Service, Inc. (WPAS)",Malware,103557.0,Business,Professional Services,Medical Information,2022,"50,000-999,999",1-99,WA
11453,11/22/2021 12:00:00 AM,02/22/2022 12:00:00 AM,Unauthorized Access,2021-11-18T00:00:00,2021-11-22T00:00:00,Logan Health Medical Center,,3575.0,Health,,Name,2022,"1,000-9,999",1-99,MT
11453,11/22/2021 12:00:00 AM,02/22/2022 12:00:00 AM,Unauthorized Access,2021-11-18T00:00:00,2021-11-22T00:00:00,Logan Health Medical Center,,3575.0,Health,,Social Security Number,2022,"1,000-9,999",1-99,MT
11453,11/22/2021 12:00:00 AM,02/22/2022 12:00:00 AM,Unauthorized Access,2021-11-18T00:00:00,2021-11-22T00:00:00,Logan Health Medical Center,,3575.0,Health,,Full Date of Birth,2022,"1,000-9,999",1-99,MT
11453,11/22/2021 12:00:00 AM,02/22/2022 12:00:00 AM,Unauthorized Access,2021-11-18T00:00:00,2021-11-22T00:00:00,Logan Health Medical Center,,3575.0,Health,,Health Insurance Policy or ID Number,2022,"1,000-9,999",1-99,MT
11453,11/22/2021 12:00:00 AM,02/22/2022 12:00:00 AM,Unauthorized Access,2021-11-18T00:00:00,2021-11-22T00:00:00,Logan Health Medical Center,,3575.0,Health,,Medical Information,2022,"1,000-9,999",1-99,MT
13146,11/26/2021 12:00:00 AM,02/23/2022 12:00:00 AM,Cyberattack,2021-11-23T00:00:00,2021-11-23T00:00:00,"Creative Services, Inc., on behalf of relevant data owners",Other,1311.0,Business,Professional Services,Name,2022,"1,000-9,999",1-99,MA
13146,11/26/2021 12:00:00 AM,02/23/2022 12:00:00 AM,Cyberattack,2021-11-23T00:00:00,2021-11-23T00:00:00,"Creative Services, Inc., on behalf of relevant data owners",Other,1311.0,Business,Professional Services,Social Security Number,2022,"1,000-9,999",1-99,MA
13146,11/26/2021 12:00:00 AM,02/23/2022 12:00:00 AM,Cyberattack,2021-11-23T00:00:00,2021-11-23T00:00:00,"Creative Services, Inc., on behalf of relevant data owners",Other,1311.0,Business,Professional Services,Driver's License or Washington ID Card Number,2022,"1,000-9,999",1-99,MA
13146,11/26/2021 12:00:00 AM,02/23/2022 12:00:00 AM,Cyberattack,2021-11-23T00:00:00,2021-11-23T00:00:00,"Creative Services, Inc., on behalf of relevant data owners",Other,1311.0,Business,Professional Services,Full Date of Birth,2022,"1,000-9,999",1-99,MA
13147,01/24/2022 12:00:00 AM,02/24/2022 12:00:00 AM,Unauthorized Access,,,Washington State Department of Licensing,,483904.0,Government,,Name,2022,"50,000-999,999",Unknown,WA
13147,01/24/2022 12:00:00 AM,02/24/2022 12:00:00 AM,Unauthorized Access,,,Washington State Department of Licensing,,483904.0,Government,,Social Security Number,2022,"50,000-999,999",Unknown,WA
13147,01/24/2022 12:00:00 AM,02/24/2022 12:00:00 AM,Unauthorized Access,,,Washington State Department of Licensing,,483904.0,Government,,Driver's License or Washington ID Card Number,2022,"50,000-999,999",Unknown,WA
13147,01/24/2022 12:00:00 AM,02/24/2022 12:00:00 AM,Unauthorized Access,,,Washington State Department of Licensing,,483904.0,Government,,Full Date of Birth,2022,"50,000-999,999",Unknown,WA
13147,01/24/2022 12:00:00 AM,02/24/2022 12:00:00 AM,Unauthorized Access,,,Washington State Department of Licensing,,483904.0,Government,,Email Address and Password/Security Question Answers,2022,"50,000-999,999",Unknown,WA
13148,12/26/2021 12:00:00 AM,03/04/2022 12:00:00 AM,Cyberattack,2021-12-17T00:00:00,2021-12-26T00:00:00,"Wagstaff, Inc.",Ransomware,2028.0,Business,Manufacturing,Name,2022,"1,000-9,999",1-99,WA
13148,12/26/2021 12:00:00 AM,03/04/2022 12:00:00 AM,Cyberattack,2021-12-17T00:00:00,2021-12-26T00:00:00,"Wagstaff, Inc.",Ransomware,2028.0,Business,Manufacturing,Social Security Number,2022,"1,000-9,999",1-99,WA
13162,12/20/2021 12:00:00 AM,03/11/2022 12:00:00 AM,Unauthorized Access,2020-12-06T00:00:00,2020-12-20T00:00:00,"American Financial Resources, Inc.",,6581.0,Finance,,Name,2022,"1,000-9,999",300-399,NJ
13162,12/20/2021 12:00:00 AM,03/11/2022 12:00:00 AM,Unauthorized Access,2020-12-06T00:00:00,2020-12-20T00:00:00,"American Financial Resources, Inc.",,6581.0,Finance,,Social Security Number,2022,"1,000-9,999",300-399,NJ
13162,12/20/2021 12:00:00 AM,03/11/2022 12:00:00 AM,Unauthorized Access,2020-12-06T00:00:00,2020-12-20T00:00:00,"American Financial Resources, Inc.",,6581.0,Finance,,Driver's License or Washington ID Card Number,2022,"1,000-9,999",300-399,NJ
13162,12/20/2021 12:00:00 AM,03/11/2022 12:00:00 AM,Unauthorized Access,2020-12-06T00:00:00,2020-12-20T00:00:00,"American Financial Resources, Inc.",,6581.0,Finance,,Financial & Banking Information,2022,"1,000-9,999",300-399,NJ
13163,07/05/2021 12:00:00 AM,03/15/2022 12:00:00 AM,Cyberattack,2021-07-02T00:00:00,2021-07-04T00:00:00,Chelan Douglas Health District,Malware,108906.0,Health,,Name,2022,"50,000-999,999",1-99,
13163,07/05/2021 12:00:00 AM,03/15/2022 12:00:00 AM,Cyberattack,2021-07-02T00:00:00,2021-07-04T00:00:00,Chelan Douglas Health District,Malware,108906.0,Health,,Social Security Number,2022,"50,000-999,999",1-99,
13163,07/05/2021 12:00:00 AM,03/15/2022 12:00:00 AM,Cyberattack,2021-07-02T00:00:00,2021-07-04T00:00:00,Chelan Douglas Health District,Malware,108906.0,Health,,Driver's License or Washington ID Card Number,2022,"50,000-999,999",1-99,
13163,07/05/2021 12:00:00 AM,03/15/2022 12:00:00 AM,Cyberattack,2021-07-02T00:00:00,2021-07-04T00:00:00,Chelan Douglas Health District,Malware,108906.0,Health,,Financial & Banking Information,2022,"50,000-999,999",1-99,
13163,07/05/2021 12:00:00 AM,03/15/2022 12:00:00 AM,Cyberattack,2021-07-02T00:00:00,2021-07-04T00:00:00,Chelan Douglas Health District,Malware,108906.0,Health,,Full Date of Birth,2022,"50,000-999,999",1-99,
13163,07/05/2021 12:00:00 AM,03/15/2022 12:00:00 AM,Cyberattack,2021-07-02T00:00:00,2021-07-04T00:00:00,Chelan Douglas Health District,Malware,108906.0,Health,,Health Insurance Policy or ID Number,2022,"50,000-999,999",1-99,
13163,07/05/2021 12:00:00 AM,03/15/2022 12:00:00 AM,Cyberattack,2021-07-02T00:00:00,2021-07-04T00:00:00,Chelan Douglas Health District,Malware,108906.0,Health,,Medical Information,2022,"50,000-999,999",1-99,
13163,07/05/2021 12:00:00 AM,03/15/2022 12:00:00 AM,Cyberattack,2021-07-02T00:00:00,2021-07-04T00:00:00,Chelan Douglas Health District,Malware,108906.0,Health,,Other,2022,"50,000-999,999",1-99,
13164,09/03/2021 12:00:00 AM,03/14/2022 12:00:00 AM,Cyberattack,2021-09-03T00:00:00,2021-09-03T00:00:00,Marker Group Inc.,Ransomware,1493.0,Business,Professional Services,Name,2022,"1,000-9,999",0,TX
13164,09/03/2021 12:00:00 AM,03/14/2022 12:00:00 AM,Cyberattack,2021-09-03T00:00:00,2021-09-03T00:00:00,Marker Group Inc.,Ransomware,1493.0,Business,Professional Services,Social Security Number,2022,"1,000-9,999",0,TX
13164,09/03/2021 12:00:00 AM,03/14/2022 12:00:00 AM,Cyberattack,2021-09-03T00:00:00,2021-09-03T00:00:00,Marker Group Inc.,Ransomware,1493.0,Business,Professional Services,Full Date of Birth,2022,"1,000-9,999",0,TX
13164,09/03/2021 12:00:00 AM,03/14/2022 12:00:00 AM,Cyberattack,2021-09-03T00:00:00,2021-09-03T00:00:00,Marker Group Inc.,Ransomware,1493.0,Business,Professional Services,Health Insurance Policy or ID Number,2022,"1,000-9,999",0,TX
13164,09/03/2021 12:00:00 AM,03/14/2022 12:00:00 AM,Cyberattack,2021-09-03T00:00:00,2021-09-03T00:00:00,Marker Group Inc.,Ransomware,1493.0,Business,Professional Services,Medical Information,2022,"1,000-9,999",0,TX
13215,02/06/2022 12:00:00 AM,03/16/2022 12:00:00 AM,Unauthorized Access,2022-01-13T00:00:00,2022-02-06T00:00:00,Sarku Japan,Other,729.0,Business,Other,Name,2022,500-999,1-99,NY
13215,02/06/2022 12:00:00 AM,03/16/2022 12:00:00 AM,Unauthorized Access,2022-01-13T00:00:00,2022-02-06T00:00:00,Sarku Japan,Other,729.0,Business,Other,Social Security Number,2022,500-999,1-99,NY
13215,02/06/2022 12:00:00 AM,03/16/2022 12:00:00 AM,Unauthorized Access,2022-01-13T00:00:00,2022-02-06T00:00:00,Sarku Japan,Other,729.0,Business,Other,Full Date of Birth,2022,500-999,1-99,NY
13215,02/06/2022 12:00:00 AM,03/16/2022 12:00:00 AM,Unauthorized Access,2022-01-13T00:00:00,2022-02-06T00:00:00,Sarku Japan,Other,729.0,Business,Other,Other,2022,500-999,1-99,NY
13216,12/06/2021 12:00:00 AM,03/18/2022 12:00:00 AM,Unauthorized Access,2021-10-27T00:00:00,2021-12-07T00:00:00,"Lakeview Loan Servicing, LLC",,156630.0,Finance,,Name,2022,"50,000-999,999",1-99,FL
13216,12/06/2021 12:00:00 AM,03/18/2022 12:00:00 AM,Unauthorized Access,2021-10-27T00:00:00,2021-12-07T00:00:00,"Lakeview Loan Servicing, LLC",,156630.0,Finance,,Social Security Number,2022,"50,000-999,999",1-99,FL
13216,12/06/2021 12:00:00 AM,03/18/2022 12:00:00 AM,Unauthorized Access,2021-10-27T00:00:00,2021-12-07T00:00:00,"Lakeview Loan Servicing, LLC",,156630.0,Finance,,Driver's License or Washington ID Card Number,2022,"50,000-999,999",1-99,FL
13216,12/06/2021 12:00:00 AM,03/18/2022 12:00:00 AM,Unauthorized Access,2021-10-27T00:00:00,2021-12-07T00:00:00,"Lakeview Loan Servicing, LLC",,156630.0,Finance,,Financial & Banking Information,2022,"50,000-999,999",1-99,FL
13216,12/06/2021 12:00:00 AM,03/18/2022 12:00:00 AM,Unauthorized Access,2021-10-27T00:00:00,2021-12-07T00:00:00,"Lakeview Loan Servicing, LLC",,156630.0,Finance,,Full Date of Birth,2022,"50,000-999,999",1-99,FL
13217,02/24/2022 12:00:00 AM,03/21/2022 12:00:00 AM,Cyberattack,2022-02-23T00:00:00,2022-03-23T00:00:00,Spokane Regional Health District,Phishing,1260.0,Government,,Name,2022,"1,000-9,999",1-99,WA
13217,02/24/2022 12:00:00 AM,03/21/2022 12:00:00 AM,Cyberattack,2022-02-23T00:00:00,2022-03-23T00:00:00,Spokane Regional Health District,Phishing,1260.0,Government,,Full Date of Birth,2022,"1,000-9,999",1-99,WA
13217,02/24/2022 12:00:00 AM,03/21/2022 12:00:00 AM,Cyberattack,2022-02-23T00:00:00,2022-03-23T00:00:00,Spokane Regional Health District,Phishing,1260.0,Government,,Medical Information,2022,"1,000-9,999",1-99,WA
13217,02/24/2022 12:00:00 AM,03/21/2022 12:00:00 AM,Cyberattack,2022-02-23T00:00:00,2022-03-23T00:00:00,Spokane Regional Health District,Phishing,1260.0,Government,,Other,2022,"1,000-9,999",1-99,WA
13221,08/01/2021 12:00:00 AM,03/21/2022 12:00:00 AM,Unauthorized Access,2021-07-20T00:00:00,2021-09-02T00:00:00,"Morley Companies, Inc.",,42633.0,Business,Other,Name,2022,"10,000-49,999",1-99,WA
13221,08/01/2021 12:00:00 AM,03/21/2022 12:00:00 AM,Unauthorized Access,2021-07-20T00:00:00,2021-09-02T00:00:00,"Morley Companies, Inc.",,42633.0,Business,Other,Social Security Number,2022,"10,000-49,999",1-99,WA
13221,08/01/2021 12:00:00 AM,03/21/2022 12:00:00 AM,Unauthorized Access,2021-07-20T00:00:00,2021-09-02T00:00:00,"Morley Companies, Inc.",,42633.0,Business,Other,Driver's License or Washington ID Card Number,2022,"10,000-49,999",1-99,WA
13221,08/01/2021 12:00:00 AM,03/21/2022 12:00:00 AM,Unauthorized Access,2021-07-20T00:00:00,2021-09-02T00:00:00,"Morley Companies, Inc.",,42633.0,Business,Other,Full Date of Birth,2022,"10,000-49,999",1-99,WA
13221,08/01/2021 12:00:00 AM,03/21/2022 12:00:00 AM,Unauthorized Access,2021-07-20T00:00:00,2021-09-02T00:00:00,"Morley Companies, Inc.",,42633.0,Business,Other,Health Insurance Policy or ID Number,2022,"10,000-49,999",1-99,WA
13221,08/01/2021 12:00:00 AM,03/21/2022 12:00:00 AM,Unauthorized Access,2021-07-20T00:00:00,2021-09-02T00:00:00,"Morley Companies, Inc.",,42633.0,Business,Other,Medical Information,2022,"10,000-49,999",1-99,WA
13222,11/12/2021 12:00:00 AM,03/22/2022 12:00:00 AM,Cyberattack,2021-11-10T00:00:00,2021-11-17T00:00:00,"Horizon Actuarial Services, LLC",Other,53256.0,Business,Professional Services,Name,2022,"50,000-999,999",1-99,GA
13222,11/12/2021 12:00:00 AM,03/22/2022 12:00:00 AM,Cyberattack,2021-11-10T00:00:00,2021-11-17T00:00:00,"Horizon Actuarial Services, LLC",Other,53256.0,Business,Professional Services,Social Security Number,2022,"50,000-999,999",1-99,GA
13222,11/12/2021 12:00:00 AM,03/22/2022 12:00:00 AM,Cyberattack,2021-11-10T00:00:00,2021-11-17T00:00:00,"Horizon Actuarial Services, LLC",Other,53256.0,Business,Professional Services,Full Date of Birth,2022,"50,000-999,999",1-99,GA
13223,03/04/2021 12:00:00 AM,03/23/2022 12:00:00 AM,Cyberattack,2020-09-08T00:00:00,2021-11-24T00:00:00,"Leerburg Enterprises, Inc.",Skimmers,634.0,Business,Retail,Name,2022,500-999,400-499,WI
13223,03/04/2021 12:00:00 AM,03/23/2022 12:00:00 AM,Cyberattack,2020-09-08T00:00:00,2021-11-24T00:00:00,"Leerburg Enterprises, Inc.",Skimmers,634.0,Business,Retail,Financial & Banking Information,2022,500-999,400-499,WI
13223,03/04/2021 12:00:00 AM,03/23/2022 12:00:00 AM,Cyberattack,2020-09-08T00:00:00,2021-11-24T00:00:00,"Leerburg Enterprises, Inc.",Skimmers,634.0,Business,Retail,Other,2022,500-999,400-499,WI
13227,03/10/2022 12:00:00 AM,03/25/2022 12:00:00 AM,Cyberattack,2021-07-14T00:00:00,2021-08-19T00:00:00,"Christie Business Holdings Company, P.C.",Phishing,694.0,Health,,Name,2022,500-999,200-299,IL
13227,03/10/2022 12:00:00 AM,03/25/2022 12:00:00 AM,Cyberattack,2021-07-14T00:00:00,2021-08-19T00:00:00,"Christie Business Holdings Company, P.C.",Phishing,694.0,Health,,Social Security Number,2022,500-999,200-299,IL
13227,03/10/2022 12:00:00 AM,03/25/2022 12:00:00 AM,Cyberattack,2021-07-14T00:00:00,2021-08-19T00:00:00,"Christie Business Holdings Company, P.C.",Phishing,694.0,Health,,Full Date of Birth,2022,500-999,200-299,IL
13227,03/10/2022 12:00:00 AM,03/25/2022 12:00:00 AM,Cyberattack,2021-07-14T00:00:00,2021-08-19T00:00:00,"Christie Business Holdings Company, P.C.",Phishing,694.0,Health,,Health Insurance Policy or ID Number,2022,500-999,200-299,IL
13227,03/10/2022 12:00:00 AM,03/25/2022 12:00:00 AM,Cyberattack,2021-07-14T00:00:00,2021-08-19T00:00:00,"Christie Business Holdings Company, P.C.",Phishing,694.0,Health,,Medical Information,2022,500-999,200-299,IL
13228,10/03/2021 12:00:00 AM,03/25/2022 12:00:00 AM,Cyberattack,2021-09-30T00:00:00,2021-10-04T00:00:00,"Marten Transport, Ltd.",Ransomware,521.0,Business,Shipping,Name,2022,500-999,1-99,WI
13228,10/03/2021 12:00:00 AM,03/25/2022 12:00:00 AM,Cyberattack,2021-09-30T00:00:00,2021-10-04T00:00:00,"Marten Transport, Ltd.",Ransomware,521.0,Business,Shipping,Social Security Number,2022,500-999,1-99,WI
13228,10/03/2021 12:00:00 AM,03/25/2022 12:00:00 AM,Cyberattack,2021-09-30T00:00:00,2021-10-04T00:00:00,"Marten Transport, Ltd.",Ransomware,521.0,Business,Shipping,Driver's License or Washington ID Card Number,2022,500-999,1-99,WI
13228,10/03/2021 12:00:00 AM,03/25/2022 12:00:00 AM,Cyberattack,2021-09-30T00:00:00,2021-10-04T00:00:00,"Marten Transport, Ltd.",Ransomware,521.0,Business,Shipping,Financial & Banking Information,2022,500-999,1-99,WI
13228,10/03/2021 12:00:00 AM,03/25/2022 12:00:00 AM,Cyberattack,2021-09-30T00:00:00,2021-10-04T00:00:00,"Marten Transport, Ltd.",Ransomware,521.0,Business,Shipping,Full Date of Birth,2022,500-999,1-99,WI
13228,10/03/2021 12:00:00 AM,03/25/2022 12:00:00 AM,Cyberattack,2021-09-30T00:00:00,2021-10-04T00:00:00,"Marten Transport, Ltd.",Ransomware,521.0,Business,Shipping,Passport Number,2022,500-999,1-99,WI
13228,10/03/2021 12:00:00 AM,03/25/2022 12:00:00 AM,Cyberattack,2021-09-30T00:00:00,2021-10-04T00:00:00,"Marten Transport, Ltd.",Ransomware,521.0,Business,Shipping,Health Insurance Policy or ID Number,2022,500-999,1-99,WI
13228,10/03/2021 12:00:00 AM,03/25/2022 12:00:00 AM,Cyberattack,2021-09-30T00:00:00,2021-10-04T00:00:00,"Marten Transport, Ltd.",Ransomware,521.0,Business,Shipping,Medical Information,2022,500-999,1-99,WI
13228,10/03/2021 12:00:00 AM,03/25/2022 12:00:00 AM,Cyberattack,2021-09-30T00:00:00,2021-10-04T00:00:00,"Marten Transport, Ltd.",Ransomware,521.0,Business,Shipping,Username and Password/Security Question Answers,2022,500-999,1-99,WI
13228,10/03/2021 12:00:00 AM,03/25/2022 12:00:00 AM,Cyberattack,2021-09-30T00:00:00,2021-10-04T00:00:00,"Marten Transport, Ltd.",Ransomware,521.0,Business,Shipping,Email Address and Password/Security Question Answers,2022,500-999,1-99,WI
13263,02/18/2022 12:00:00 AM,04/05/2022 12:00:00 AM,Unauthorized Access,2021-10-09T00:00:00,2022-02-18T00:00:00,Sterling Valley Systems d/b/a Inntopia,,13396.0,Business,Software,Name,2022,"10,000-49,999",100-199,VT
13263,02/18/2022 12:00:00 AM,04/05/2022 12:00:00 AM,Unauthorized Access,2021-10-09T00:00:00,2022-02-18T00:00:00,Sterling Valley Systems d/b/a Inntopia,,13396.0,Business,Software,Financial & Banking Information,2022,"10,000-49,999",100-199,VT
13263,02/18/2022 12:00:00 AM,04/05/2022 12:00:00 AM,Unauthorized Access,2021-10-09T00:00:00,2022-02-18T00:00:00,Sterling Valley Systems d/b/a Inntopia,,13396.0,Business,Software,Full Date of Birth,2022,"10,000-49,999",100-199,VT
13264,12/06/2021 12:00:00 AM,04/06/2022 12:00:00 AM,Unauthorized Access,2021-10-27T00:00:00,2021-12-07T00:00:00,"Pingora Loan Servicing, LLC",,52606.0,Finance,,Name,2022,"50,000-999,999",1-99,CO
13264,12/06/2021 12:00:00 AM,04/06/2022 12:00:00 AM,Unauthorized Access,2021-10-27T00:00:00,2021-12-07T00:00:00,"Pingora Loan Servicing, LLC",,52606.0,Finance,,Social Security Number,2022,"50,000-999,999",1-99,CO
13264,12/06/2021 12:00:00 AM,04/06/2022 12:00:00 AM,Unauthorized Access,2021-10-27T00:00:00,2021-12-07T00:00:00,"Pingora Loan Servicing, LLC",,52606.0,Finance,,Driver's License or Washington ID Card Number,2022,"50,000-999,999",1-99,CO
13264,12/06/2021 12:00:00 AM,04/06/2022 12:00:00 AM,Unauthorized Access,2021-10-27T00:00:00,2021-12-07T00:00:00,"Pingora Loan Servicing, LLC",,52606.0,Finance,,Financial & Banking Information,2022,"50,000-999,999",1-99,CO
13264,12/06/2021 12:00:00 AM,04/06/2022 12:00:00 AM,Unauthorized Access,2021-10-27T00:00:00,2021-12-07T00:00:00,"Pingora Loan Servicing, LLC",,52606.0,Finance,,Full Date of Birth,2022,"50,000-999,999",1-99,CO
13265,07/04/2021 12:00:00 AM,04/06/2022 12:00:00 AM,Cyberattack,2021-02-02T00:00:00,2021-07-09T00:00:00,"DialAmerica Marketing, Inc.",Ransomware,621.0,Business,Other,Name,2022,500-999,100-199,NJ
13265,07/04/2021 12:00:00 AM,04/06/2022 12:00:00 AM,Cyberattack,2021-02-02T00:00:00,2021-07-09T00:00:00,"DialAmerica Marketing, Inc.",Ransomware,621.0,Business,Other,Social Security Number,2022,500-999,100-199,NJ
13265,07/04/2021 12:00:00 AM,04/06/2022 12:00:00 AM,Cyberattack,2021-02-02T00:00:00,2021-07-09T00:00:00,"DialAmerica Marketing, Inc.",Ransomware,621.0,Business,Other,Financial & Banking Information,2022,500-999,100-199,NJ
13265,07/04/2021 12:00:00 AM,04/06/2022 12:00:00 AM,Cyberattack,2021-02-02T00:00:00,2021-07-09T00:00:00,"DialAmerica Marketing, Inc.",Ransomware,621.0,Business,Other,Full Date of Birth,2022,500-999,100-199,NJ
13265,07/04/2021 12:00:00 AM,04/06/2022 12:00:00 AM,Cyberattack,2021-02-02T00:00:00,2021-07-09T00:00:00,"DialAmerica Marketing, Inc.",Ransomware,621.0,Business,Other,Health Insurance Policy or ID Number,2022,500-999,100-199,NJ
13265,07/04/2021 12:00:00 AM,04/06/2022 12:00:00 AM,Cyberattack,2021-02-02T00:00:00,2021-07-09T00:00:00,"DialAmerica Marketing, Inc.",Ransomware,621.0,Business,Other,Other,2022,500-999,100-199,NJ
13270,02/04/2022 12:00:00 AM,04/07/2022 12:00:00 AM,Cyberattack,2022-02-04T00:00:00,,PBS Engineering and Environmental,Ransomware,691.0,Business,Manufacturing,Name,2022,500-999,Unknown,OR
13270,02/04/2022 12:00:00 AM,04/07/2022 12:00:00 AM,Cyberattack,2022-02-04T00:00:00,,PBS Engineering and Environmental,Ransomware,691.0,Business,Manufacturing,Social Security Number,2022,500-999,Unknown,OR
13271,06/28/2021 12:00:00 AM,04/08/2022 12:00:00 AM,Unauthorized Access,2021-06-28T00:00:00,2021-06-28T00:00:00,Stevens & Lee,,1028.0,Business,Legal,Name,2022,"1,000-9,999",0,PA
13271,06/28/2021 12:00:00 AM,04/08/2022 12:00:00 AM,Unauthorized Access,2021-06-28T00:00:00,2021-06-28T00:00:00,Stevens & Lee,,1028.0,Business,Legal,Social Security Number,2022,"1,000-9,999",0,PA
13271,06/28/2021 12:00:00 AM,04/08/2022 12:00:00 AM,Unauthorized Access,2021-06-28T00:00:00,2021-06-28T00:00:00,Stevens & Lee,,1028.0,Business,Legal,Driver's License or Washington ID Card Number,2022,"1,000-9,999",0,PA
13271,06/28/2021 12:00:00 AM,04/08/2022 12:00:00 AM,Unauthorized Access,2021-06-28T00:00:00,2021-06-28T00:00:00,Stevens & Lee,,1028.0,Business,Legal,Financial & Banking Information,2022,"1,000-9,999",0,PA
13271,06/28/2021 12:00:00 AM,04/08/2022 12:00:00 AM,Unauthorized Access,2021-06-28T00:00:00,2021-06-28T00:00:00,Stevens & Lee,,1028.0,Business,Legal,Full Date of Birth,2022,"1,000-9,999",0,PA
13271,06/28/2021 12:00:00 AM,04/08/2022 12:00:00 AM,Unauthorized Access,2021-06-28T00:00:00,2021-06-28T00:00:00,Stevens & Lee,,1028.0,Business,Legal,Medical Information,2022,"1,000-9,999",0,PA
13271,06/28/2021 12:00:00 AM,04/08/2022 12:00:00 AM,Unauthorized Access,2021-06-28T00:00:00,2021-06-28T00:00:00,Stevens & Lee,,1028.0,Business,Legal,Biometric Data,2022,"1,000-9,999",0,PA
13290,01/08/2022 12:00:00 AM,04/12/2022 12:00:00 AM,Unauthorized Access,2021-12-28T00:00:00,2022-01-08T00:00:00,Illuminate Education,,1743.0,Education,,Name,2022,"1,000-9,999",1-99,CA
13290,01/08/2022 12:00:00 AM,04/12/2022 12:00:00 AM,Unauthorized Access,2021-12-28T00:00:00,2022-01-08T00:00:00,Illuminate Education,,1743.0,Education,,Full Date of Birth,2022,"1,000-9,999",1-99,CA
13290,01/08/2022 12:00:00 AM,04/12/2022 12:00:00 AM,Unauthorized Access,2021-12-28T00:00:00,2022-01-08T00:00:00,Illuminate Education,,1743.0,Education,,Student ID Number,2022,"1,000-9,999",1-99,CA
13290,01/08/2022 12:00:00 AM,04/12/2022 12:00:00 AM,Unauthorized Access,2021-12-28T00:00:00,2022-01-08T00:00:00,Illuminate Education,,1743.0,Education,,Other,2022,"1,000-9,999",1-99,CA
13291,02/05/2022 12:00:00 AM,04/14/2022 12:00:00 AM,Cyberattack,2022-02-02T00:00:00,2022-02-03T00:00:00,"AUTOPAY Direct, Inc. ",Ransomware,831.0,Finance,,Name,2022,500-999,1-99,CO
13291,02/05/2022 12:00:00 AM,04/14/2022 12:00:00 AM,Cyberattack,2022-02-02T00:00:00,2022-02-03T00:00:00,"AUTOPAY Direct, Inc. ",Ransomware,831.0,Finance,,Social Security Number,2022,500-999,1-99,CO
13291,02/05/2022 12:00:00 AM,04/14/2022 12:00:00 AM,Cyberattack,2022-02-02T00:00:00,2022-02-03T00:00:00,"AUTOPAY Direct, Inc. ",Ransomware,831.0,Finance,,Driver's License or Washington ID Card Number,2022,500-999,1-99,CO
13291,02/05/2022 12:00:00 AM,04/14/2022 12:00:00 AM,Cyberattack,2022-02-02T00:00:00,2022-02-03T00:00:00,"AUTOPAY Direct, Inc. ",Ransomware,831.0,Finance,,Full Date of Birth,2022,500-999,1-99,CO
13292,03/15/2022 12:00:00 AM,04/15/2022 12:00:00 AM,Cyberattack,2022-02-17T00:00:00,2022-03-15T00:00:00,PlanMember Securities Corporation,Phishing,4231.0,Finance,,Name,2022,"1,000-9,999",1-99,CA
13292,03/15/2022 12:00:00 AM,04/15/2022 12:00:00 AM,Cyberattack,2022-02-17T00:00:00,2022-03-15T00:00:00,PlanMember Securities Corporation,Phishing,4231.0,Finance,,Social Security Number,2022,"1,000-9,999",1-99,CA
13292,03/15/2022 12:00:00 AM,04/15/2022 12:00:00 AM,Cyberattack,2022-02-17T00:00:00,2022-03-15T00:00:00,PlanMember Securities Corporation,Phishing,4231.0,Finance,,Financial & Banking Information,2022,"1,000-9,999",1-99,CA
13311,03/01/2022 12:00:00 AM,04/22/2022 12:00:00 AM,Cyberattack,2021-12-04T00:00:00,2021-12-04T00:00:00,King County Public Hospital District No. 2,Other,19092.0,Health,,Name,2022,"10,000-49,999",1-99,WA
13311,03/01/2022 12:00:00 AM,04/22/2022 12:00:00 AM,Cyberattack,2021-12-04T00:00:00,2021-12-04T00:00:00,King County Public Hospital District No. 2,Other,19092.0,Health,,Full Date of Birth,2022,"10,000-49,999",1-99,WA
13311,03/01/2022 12:00:00 AM,04/22/2022 12:00:00 AM,Cyberattack,2021-12-04T00:00:00,2021-12-04T00:00:00,King County Public Hospital District No. 2,Other,19092.0,Health,,Medical Information,2022,"10,000-49,999",1-99,WA
13311,03/01/2022 12:00:00 AM,04/22/2022 12:00:00 AM,Cyberattack,2021-12-04T00:00:00,2021-12-04T00:00:00,King County Public Hospital District No. 2,Other,19092.0,Health,,Other,2022,"10,000-49,999",1-99,WA
13328,02/22/2022 12:00:00 AM,04/07/2022 12:00:00 AM,Unauthorized Access,,,"IMCO General Construction, Inc.",,1442.0,Business,Construction,Name,2022,"1,000-9,999",Unknown,PA
13328,02/22/2022 12:00:00 AM,04/07/2022 12:00:00 AM,Unauthorized Access,,,"IMCO General Construction, Inc.",,1442.0,Business,Construction,Social Security Number,2022,"1,000-9,999",Unknown,PA
13328,02/22/2022 12:00:00 AM,04/07/2022 12:00:00 AM,Unauthorized Access,,,"IMCO General Construction, Inc.",,1442.0,Business,Construction,Driver's License or Washington ID Card Number,2022,"1,000-9,999",Unknown,PA
13328,02/22/2022 12:00:00 AM,04/07/2022 12:00:00 AM,Unauthorized Access,,,"IMCO General Construction, Inc.",,1442.0,Business,Construction,Financial & Banking Information,2022,"1,000-9,999",Unknown,PA
13328,02/22/2022 12:00:00 AM,04/07/2022 12:00:00 AM,Unauthorized Access,,,"IMCO General Construction, Inc.",,1442.0,Business,Construction,Full Date of Birth,2022,"1,000-9,999",Unknown,PA
13328,02/22/2022 12:00:00 AM,04/07/2022 12:00:00 AM,Unauthorized Access,,,"IMCO General Construction, Inc.",,1442.0,Business,Construction,Passport Number,2022,"1,000-9,999",Unknown,PA
13329,03/03/2022 12:00:00 AM,04/14/2022 12:00:00 AM,Unauthorized Access,,,Snap-On Incorporated,,531.0,Business,Manufacturing,Name,2022,500-999,Unknown,WI
13329,03/03/2022 12:00:00 AM,04/14/2022 12:00:00 AM,Unauthorized Access,,,Snap-On Incorporated,,531.0,Business,Manufacturing,Social Security Number,2022,500-999,Unknown,WI
13329,03/03/2022 12:00:00 AM,04/14/2022 12:00:00 AM,Unauthorized Access,,,Snap-On Incorporated,,531.0,Business,Manufacturing,Driver's License or Washington ID Card Number,2022,500-999,Unknown,WI
13329,03/03/2022 12:00:00 AM,04/14/2022 12:00:00 AM,Unauthorized Access,,,Snap-On Incorporated,,531.0,Business,Manufacturing,Passport Number,2022,500-999,Unknown,WI
13329,03/03/2022 12:00:00 AM,04/14/2022 12:00:00 AM,Unauthorized Access,,,Snap-On Incorporated,,531.0,Business,Manufacturing,Medical Information,2022,500-999,Unknown,WI
13329,03/03/2022 12:00:00 AM,04/14/2022 12:00:00 AM,Unauthorized Access,,,Snap-On Incorporated,,531.0,Business,Manufacturing,Other,2022,500-999,Unknown,WI
13355,09/26/2021 12:00:00 AM,03/25/2022 12:00:00 AM,Unauthorized Access,2021-09-10T00:00:00,2021-09-29T00:00:00,"Lincare Holdings, Inc.",,37050.0,Health,,Name,2022,"10,000-49,999",1-99,FL
13355,09/26/2021 12:00:00 AM,03/25/2022 12:00:00 AM,Unauthorized Access,2021-09-10T00:00:00,2021-09-29T00:00:00,"Lincare Holdings, Inc.",,37050.0,Health,,Social Security Number,2022,"10,000-49,999",1-99,FL
13355,09/26/2021 12:00:00 AM,03/25/2022 12:00:00 AM,Unauthorized Access,2021-09-10T00:00:00,2021-09-29T00:00:00,"Lincare Holdings, Inc.",,37050.0,Health,,Financial & Banking Information,2022,"10,000-49,999",1-99,FL
13355,09/26/2021 12:00:00 AM,03/25/2022 12:00:00 AM,Unauthorized Access,2021-09-10T00:00:00,2021-09-29T00:00:00,"Lincare Holdings, Inc.",,37050.0,Health,,Medical Information,2022,"10,000-49,999",1-99,FL
13367,01/28/2022 12:00:00 AM,04/18/2022 12:00:00 AM,Cyberattack,2021-11-10T00:00:00,2021-11-11T00:00:00,UNITE HERE Retirement Fund,Ransomware,584.0,Finance,,Name,2022,500-999,1-99,
13367,01/28/2022 12:00:00 AM,04/18/2022 12:00:00 AM,Cyberattack,2021-11-10T00:00:00,2021-11-11T00:00:00,UNITE HERE Retirement Fund,Ransomware,584.0,Finance,,Social Security Number,2022,500-999,1-99,
13367,01/28/2022 12:00:00 AM,04/18/2022 12:00:00 AM,Cyberattack,2021-11-10T00:00:00,2021-11-11T00:00:00,UNITE HERE Retirement Fund,Ransomware,584.0,Finance,,Full Date of Birth,2022,500-999,1-99,
13376,03/28/2022 12:00:00 AM,04/28/2022 12:00:00 AM,Theft or Mistake,2022-03-28T00:00:00,,Washington Department of Labor & Industries,,,Government,,Name,2022,Unknown,Unknown,WA
13376,03/28/2022 12:00:00 AM,04/28/2022 12:00:00 AM,Theft or Mistake,2022-03-28T00:00:00,,Washington Department of Labor & Industries,,,Government,,Social Security Number,2022,Unknown,Unknown,WA
13376,03/28/2022 12:00:00 AM,04/28/2022 12:00:00 AM,Theft or Mistake,2022-03-28T00:00:00,,Washington Department of Labor & Industries,,,Government,,Driver's License or Washington ID Card Number,2022,Unknown,Unknown,WA
13376,03/28/2022 12:00:00 AM,04/28/2022 12:00:00 AM,Theft or Mistake,2022-03-28T00:00:00,,Washington Department of Labor & Industries,,,Government,,Financial & Banking Information,2022,Unknown,Unknown,WA
13376,03/28/2022 12:00:00 AM,04/28/2022 12:00:00 AM,Theft or Mistake,2022-03-28T00:00:00,,Washington Department of Labor & Industries,,,Government,,Full Date of Birth,2022,Unknown,Unknown,WA
13376,03/28/2022 12:00:00 AM,04/28/2022 12:00:00 AM,Theft or Mistake,2022-03-28T00:00:00,,Washington Department of Labor & Industries,,,Government,,Student ID Number,2022,Unknown,Unknown,WA
13376,03/28/2022 12:00:00 AM,04/28/2022 12:00:00 AM,Theft or Mistake,2022-03-28T00:00:00,,Washington Department of Labor & Industries,,,Government,,Military ID Number,2022,Unknown,Unknown,WA
13376,03/28/2022 12:00:00 AM,04/28/2022 12:00:00 AM,Theft or Mistake,2022-03-28T00:00:00,,Washington Department of Labor & Industries,,,Government,,Passport Number,2022,Unknown,Unknown,WA
13376,03/28/2022 12:00:00 AM,04/28/2022 12:00:00 AM,Theft or Mistake,2022-03-28T00:00:00,,Washington Department of Labor & Industries,,,Government,,Health Insurance Policy or ID Number,2022,Unknown,Unknown,WA
13376,03/28/2022 12:00:00 AM,04/28/2022 12:00:00 AM,Theft or Mistake,2022-03-28T00:00:00,,Washington Department of Labor & Industries,,,Government,,Medical Information,2022,Unknown,Unknown,WA
13376,03/28/2022 12:00:00 AM,04/28/2022 12:00:00 AM,Theft or Mistake,2022-03-28T00:00:00,,Washington Department of Labor & Industries,,,Government,,Username and Password/Security Question Answers,2022,Unknown,Unknown,WA
13376,03/28/2022 12:00:00 AM,04/28/2022 12:00:00 AM,Theft or Mistake,2022-03-28T00:00:00,,Washington Department of Labor & Industries,,,Government,,Email Address and Password/Security Question Answers,2022,Unknown,Unknown,WA
13377,01/02/2022 12:00:00 AM,05/03/2022 12:00:00 AM,Theft or Mistake,2021-12-31T00:00:00,2021-12-31T00:00:00,"Wells Fargo Bank, N.A.",,1511.0,Finance,,Name,2022,"1,000-9,999",1-99,CA
13377,01/02/2022 12:00:00 AM,05/03/2022 12:00:00 AM,Theft or Mistake,2021-12-31T00:00:00,2021-12-31T00:00:00,"Wells Fargo Bank, N.A.",,1511.0,Finance,,Social Security Number,2022,"1,000-9,999",1-99,CA
13377,01/02/2022 12:00:00 AM,05/03/2022 12:00:00 AM,Theft or Mistake,2021-12-31T00:00:00,2021-12-31T00:00:00,"Wells Fargo Bank, N.A.",,1511.0,Finance,,Full Date of Birth,2022,"1,000-9,999",1-99,CA
13397,06/11/2021 12:00:00 AM,05/06/2022 12:00:00 AM,Cyberattack,2021-06-06T00:00:00,2021-06-10T00:00:00,Cornish College of the Arts ,Ransomware,72139.0,Education,,Name,2022,"50,000-999,999",1-99,WA
13397,06/11/2021 12:00:00 AM,05/06/2022 12:00:00 AM,Cyberattack,2021-06-06T00:00:00,2021-06-10T00:00:00,Cornish College of the Arts ,Ransomware,72139.0,Education,,Social Security Number,2022,"50,000-999,999",1-99,WA
13397,06/11/2021 12:00:00 AM,05/06/2022 12:00:00 AM,Cyberattack,2021-06-06T00:00:00,2021-06-10T00:00:00,Cornish College of the Arts ,Ransomware,72139.0,Education,,Driver's License or Washington ID Card Number,2022,"50,000-999,999",1-99,WA
13397,06/11/2021 12:00:00 AM,05/06/2022 12:00:00 AM,Cyberattack,2021-06-06T00:00:00,2021-06-10T00:00:00,Cornish College of the Arts ,Ransomware,72139.0,Education,,Financial & Banking Information,2022,"50,000-999,999",1-99,WA
13397,06/11/2021 12:00:00 AM,05/06/2022 12:00:00 AM,Cyberattack,2021-06-06T00:00:00,2021-06-10T00:00:00,Cornish College of the Arts ,Ransomware,72139.0,Education,,Full Date of Birth,2022,"50,000-999,999",1-99,WA
13397,06/11/2021 12:00:00 AM,05/06/2022 12:00:00 AM,Cyberattack,2021-06-06T00:00:00,2021-06-10T00:00:00,Cornish College of the Arts ,Ransomware,72139.0,Education,,Student ID Number,2022,"50,000-999,999",1-99,WA
13397,06/11/2021 12:00:00 AM,05/06/2022 12:00:00 AM,Cyberattack,2021-06-06T00:00:00,2021-06-10T00:00:00,Cornish College of the Arts ,Ransomware,72139.0,Education,,Passport Number,2022,"50,000-999,999",1-99,WA
13397,06/11/2021 12:00:00 AM,05/06/2022 12:00:00 AM,Cyberattack,2021-06-06T00:00:00,2021-06-10T00:00:00,Cornish College of the Arts ,Ransomware,72139.0,Education,,Health Insurance Policy or ID Number,2022,"50,000-999,999",1-99,WA
13397,06/11/2021 12:00:00 AM,05/06/2022 12:00:00 AM,Cyberattack,2021-06-06T00:00:00,2021-06-10T00:00:00,Cornish College of the Arts ,Ransomware,72139.0,Education,,Medical Information,2022,"50,000-999,999",1-99,WA
13398,03/14/2022 12:00:00 AM,05/12/2022 12:00:00 AM,Unauthorized Access,2022-03-11T00:00:00,2022-03-14T00:00:00,Parker-Hannifin Corporation,,4597.0,Business,Manufacturing,Name,2022,"1,000-9,999",1-99,OH
13398,03/14/2022 12:00:00 AM,05/12/2022 12:00:00 AM,Unauthorized Access,2022-03-11T00:00:00,2022-03-14T00:00:00,Parker-Hannifin Corporation,,4597.0,Business,Manufacturing,Social Security Number,2022,"1,000-9,999",1-99,OH
13398,03/14/2022 12:00:00 AM,05/12/2022 12:00:00 AM,Unauthorized Access,2022-03-11T00:00:00,2022-03-14T00:00:00,Parker-Hannifin Corporation,,4597.0,Business,Manufacturing,Driver's License or Washington ID Card Number,2022,"1,000-9,999",1-99,OH
13398,03/14/2022 12:00:00 AM,05/12/2022 12:00:00 AM,Unauthorized Access,2022-03-11T00:00:00,2022-03-14T00:00:00,Parker-Hannifin Corporation,,4597.0,Business,Manufacturing,Financial & Banking Information,2022,"1,000-9,999",1-99,OH
13398,03/14/2022 12:00:00 AM,05/12/2022 12:00:00 AM,Unauthorized Access,2022-03-11T00:00:00,2022-03-14T00:00:00,Parker-Hannifin Corporation,,4597.0,Business,Manufacturing,Passport Number,2022,"1,000-9,999",1-99,OH
13398,03/14/2022 12:00:00 AM,05/12/2022 12:00:00 AM,Unauthorized Access,2022-03-11T00:00:00,2022-03-14T00:00:00,Parker-Hannifin Corporation,,4597.0,Business,Manufacturing,Health Insurance Policy or ID Number,2022,"1,000-9,999",1-99,OH
13398,03/14/2022 12:00:00 AM,05/12/2022 12:00:00 AM,Unauthorized Access,2022-03-11T00:00:00,2022-03-14T00:00:00,Parker-Hannifin Corporation,,4597.0,Business,Manufacturing,Medical Information,2022,"1,000-9,999",1-99,OH
13398,03/14/2022 12:00:00 AM,05/12/2022 12:00:00 AM,Unauthorized Access,2022-03-11T00:00:00,2022-03-14T00:00:00,Parker-Hannifin Corporation,,4597.0,Business,Manufacturing,Username and Password/Security Question Answers,2022,"1,000-9,999",1-99,OH
13399,03/19/2022 12:00:00 AM,05/18/2022 12:00:00 AM,Cyberattack,2022-03-19T00:00:00,2022-03-19T00:00:00,Partnership HealthPlan of California,Ransomware,1352.0,Health,,Name,2022,"1,000-9,999",0,CA
13399,03/19/2022 12:00:00 AM,05/18/2022 12:00:00 AM,Cyberattack,2022-03-19T00:00:00,2022-03-19T00:00:00,Partnership HealthPlan of California,Ransomware,1352.0,Health,,Social Security Number,2022,"1,000-9,999",0,CA
13399,03/19/2022 12:00:00 AM,05/18/2022 12:00:00 AM,Cyberattack,2022-03-19T00:00:00,2022-03-19T00:00:00,Partnership HealthPlan of California,Ransomware,1352.0,Health,,Driver's License or Washington ID Card Number,2022,"1,000-9,999",0,CA
13399,03/19/2022 12:00:00 AM,05/18/2022 12:00:00 AM,Cyberattack,2022-03-19T00:00:00,2022-03-19T00:00:00,Partnership HealthPlan of California,Ransomware,1352.0,Health,,Financial & Banking Information,2022,"1,000-9,999",0,CA
13399,03/19/2022 12:00:00 AM,05/18/2022 12:00:00 AM,Cyberattack,2022-03-19T00:00:00,2022-03-19T00:00:00,Partnership HealthPlan of California,Ransomware,1352.0,Health,,Full Date of Birth,2022,"1,000-9,999",0,CA
13399,03/19/2022 12:00:00 AM,05/18/2022 12:00:00 AM,Cyberattack,2022-03-19T00:00:00,2022-03-19T00:00:00,Partnership HealthPlan of California,Ransomware,1352.0,Health,,Unique Private Key (e.g. used to authenticate or sign an electronic record),2022,"1,000-9,999",0,CA
13399,03/19/2022 12:00:00 AM,05/18/2022 12:00:00 AM,Cyberattack,2022-03-19T00:00:00,2022-03-19T00:00:00,Partnership HealthPlan of California,Ransomware,1352.0,Health,,Health Insurance Policy or ID Number,2022,"1,000-9,999",0,CA
13399,03/19/2022 12:00:00 AM,05/18/2022 12:00:00 AM,Cyberattack,2022-03-19T00:00:00,2022-03-19T00:00:00,Partnership HealthPlan of California,Ransomware,1352.0,Health,,Medical Information,2022,"1,000-9,999",0,CA
13399,03/19/2022 12:00:00 AM,05/18/2022 12:00:00 AM,Cyberattack,2022-03-19T00:00:00,2022-03-19T00:00:00,Partnership HealthPlan of California,Ransomware,1352.0,Health,,Username and Password/Security Question Answers,2022,"1,000-9,999",0,CA
13399,03/19/2022 12:00:00 AM,05/18/2022 12:00:00 AM,Cyberattack,2022-03-19T00:00:00,2022-03-19T00:00:00,Partnership HealthPlan of California,Ransomware,1352.0,Health,,Other,2022,"1,000-9,999",0,CA
13400,10/30/2021 12:00:00 AM,05/23/2022 12:00:00 AM,Unauthorized Access,2021-10-30T00:00:00,2021-10-30T00:00:00,"C.R. England, Inc.",Ransomware,4143.0,Business,Shipping,Name,2022,"1,000-9,999",0,UT
13400,10/30/2021 12:00:00 AM,05/23/2022 12:00:00 AM,Unauthorized Access,2021-10-30T00:00:00,2021-10-30T00:00:00,"C.R. England, Inc.",Ransomware,4143.0,Business,Shipping,Social Security Number,2022,"1,000-9,999",0,UT
13400,10/30/2021 12:00:00 AM,05/23/2022 12:00:00 AM,Unauthorized Access,2021-10-30T00:00:00,2021-10-30T00:00:00,"C.R. England, Inc.",Ransomware,4143.0,Business,Shipping,Driver's License or Washington ID Card Number,2022,"1,000-9,999",0,UT
13400,10/30/2021 12:00:00 AM,05/23/2022 12:00:00 AM,Unauthorized Access,2021-10-30T00:00:00,2021-10-30T00:00:00,"C.R. England, Inc.",Ransomware,4143.0,Business,Shipping,Full Date of Birth,2022,"1,000-9,999",0,UT
13400,10/30/2021 12:00:00 AM,05/23/2022 12:00:00 AM,Unauthorized Access,2021-10-30T00:00:00,2021-10-30T00:00:00,"C.R. England, Inc.",Ransomware,4143.0,Business,Shipping,Other,2022,"1,000-9,999",0,UT
13407,12/31/2021 12:00:00 AM,04/08/2022 12:00:00 AM,Unauthorized Access,2021-12-28T00:00:00,2021-12-30T00:00:00,EMC National Life Company,,2666.0,Finance,,Name,2022,"1,000-9,999",1-99,OR
13407,12/31/2021 12:00:00 AM,04/08/2022 12:00:00 AM,Unauthorized Access,2021-12-28T00:00:00,2021-12-30T00:00:00,EMC National Life Company,,2666.0,Finance,,Social Security Number,2022,"1,000-9,999",1-99,OR
13407,12/31/2021 12:00:00 AM,04/08/2022 12:00:00 AM,Unauthorized Access,2021-12-28T00:00:00,2021-12-30T00:00:00,EMC National Life Company,,2666.0,Finance,,Driver's License or Washington ID Card Number,2022,"1,000-9,999",1-99,OR
13407,12/31/2021 12:00:00 AM,04/08/2022 12:00:00 AM,Unauthorized Access,2021-12-28T00:00:00,2021-12-30T00:00:00,EMC National Life Company,,2666.0,Finance,,Financial & Banking Information,2022,"1,000-9,999",1-99,OR
13407,12/31/2021 12:00:00 AM,04/08/2022 12:00:00 AM,Unauthorized Access,2021-12-28T00:00:00,2021-12-30T00:00:00,EMC National Life Company,,2666.0,Finance,,Medical Information,2022,"1,000-9,999",1-99,OR
13407,12/31/2021 12:00:00 AM,04/08/2022 12:00:00 AM,Unauthorized Access,2021-12-28T00:00:00,2021-12-30T00:00:00,EMC National Life Company,,2666.0,Finance,,Other,2022,"1,000-9,999",1-99,OR
13444,04/25/2022 12:00:00 AM,05/25/2022 12:00:00 AM,Cyberattack,2022-03-26T00:00:00,2022-04-01T00:00:00,"Elephant Insurance Services, LLC",Other,937.0,Business,Other,Name,2022,500-999,1-99,VA
13444,04/25/2022 12:00:00 AM,05/25/2022 12:00:00 AM,Cyberattack,2022-03-26T00:00:00,2022-04-01T00:00:00,"Elephant Insurance Services, LLC",Other,937.0,Business,Other,Driver's License or Washington ID Card Number,2022,500-999,1-99,VA
13444,04/25/2022 12:00:00 AM,05/25/2022 12:00:00 AM,Cyberattack,2022-03-26T00:00:00,2022-04-01T00:00:00,"Elephant Insurance Services, LLC",Other,937.0,Business,Other,Full Date of Birth,2022,500-999,1-99,VA
13445,03/26/2022 12:00:00 AM,05/25/2022 12:00:00 AM,Unauthorized Access,2022-03-25T00:00:00,2022-03-26T00:00:00,Fred Hutchinson Cancer Center,,78834.0,Health,,Name,2022,"50,000-999,999",1-99,WA
13445,03/26/2022 12:00:00 AM,05/25/2022 12:00:00 AM,Unauthorized Access,2022-03-25T00:00:00,2022-03-26T00:00:00,Fred Hutchinson Cancer Center,,78834.0,Health,,Social Security Number,2022,"50,000-999,999",1-99,WA
13445,03/26/2022 12:00:00 AM,05/25/2022 12:00:00 AM,Unauthorized Access,2022-03-25T00:00:00,2022-03-26T00:00:00,Fred Hutchinson Cancer Center,,78834.0,Health,,Driver's License or Washington ID Card Number,2022,"50,000-999,999",1-99,WA
13445,03/26/2022 12:00:00 AM,05/25/2022 12:00:00 AM,Unauthorized Access,2022-03-25T00:00:00,2022-03-26T00:00:00,Fred Hutchinson Cancer Center,,78834.0,Health,,Financial & Banking Information,2022,"50,000-999,999",1-99,WA
13445,03/26/2022 12:00:00 AM,05/25/2022 12:00:00 AM,Unauthorized Access,2022-03-25T00:00:00,2022-03-26T00:00:00,Fred Hutchinson Cancer Center,,78834.0,Health,,Full Date of Birth,2022,"50,000-999,999",1-99,WA
13445,03/26/2022 12:00:00 AM,05/25/2022 12:00:00 AM,Unauthorized Access,2022-03-25T00:00:00,2022-03-26T00:00:00,Fred Hutchinson Cancer Center,,78834.0,Health,,Health Insurance Policy or ID Number,2022,"50,000-999,999",1-99,WA
13446,02/25/2022 12:00:00 AM,05/26/2022 12:00:00 AM,Unauthorized Access,2020-12-29T00:00:00,2022-03-01T00:00:00,Aon Plc,,6889.0,Finance,,Name,2022,"1,000-9,999",400-499,IL
13446,02/25/2022 12:00:00 AM,05/26/2022 12:00:00 AM,Unauthorized Access,2020-12-29T00:00:00,2022-03-01T00:00:00,Aon Plc,,6889.0,Finance,,Social Security Number,2022,"1,000-9,999",400-499,IL
13446,02/25/2022 12:00:00 AM,05/26/2022 12:00:00 AM,Unauthorized Access,2020-12-29T00:00:00,2022-03-01T00:00:00,Aon Plc,,6889.0,Finance,,Driver's License or Washington ID Card Number,2022,"1,000-9,999",400-499,IL
13446,02/25/2022 12:00:00 AM,05/26/2022 12:00:00 AM,Unauthorized Access,2020-12-29T00:00:00,2022-03-01T00:00:00,Aon Plc,,6889.0,Finance,,Health Insurance Policy or ID Number,2022,"1,000-9,999",400-499,IL
13447,12/13/2021 12:00:00 AM,05/26/2022 12:00:00 AM,Cyberattack,2021-12-03T00:00:00,2021-12-15T00:00:00,"Shutterfly, LLC",Ransomware,1273.0,Business,Retail,Name,2022,"1,000-9,999",1-99,CA
13447,12/13/2021 12:00:00 AM,05/26/2022 12:00:00 AM,Cyberattack,2021-12-03T00:00:00,2021-12-15T00:00:00,"Shutterfly, LLC",Ransomware,1273.0,Business,Retail,Social Security Number,2022,"1,000-9,999",1-99,CA
13447,12/13/2021 12:00:00 AM,05/26/2022 12:00:00 AM,Cyberattack,2021-12-03T00:00:00,2021-12-15T00:00:00,"Shutterfly, LLC",Ransomware,1273.0,Business,Retail,Financial & Banking Information,2022,"1,000-9,999",1-99,CA
13447,12/13/2021 12:00:00 AM,05/26/2022 12:00:00 AM,Cyberattack,2021-12-03T00:00:00,2021-12-15T00:00:00,"Shutterfly, LLC",Ransomware,1273.0,Business,Retail,Full Date of Birth,2022,"1,000-9,999",1-99,CA
13447,12/13/2021 12:00:00 AM,05/26/2022 12:00:00 AM,Cyberattack,2021-12-03T00:00:00,2021-12-15T00:00:00,"Shutterfly, LLC",Ransomware,1273.0,Business,Retail,Passport Number,2022,"1,000-9,999",1-99,CA
13447,12/13/2021 12:00:00 AM,05/26/2022 12:00:00 AM,Cyberattack,2021-12-03T00:00:00,2021-12-15T00:00:00,"Shutterfly, LLC",Ransomware,1273.0,Business,Retail,Health Insurance Policy or ID Number,2022,"1,000-9,999",1-99,CA
13447,12/13/2021 12:00:00 AM,05/26/2022 12:00:00 AM,Cyberattack,2021-12-03T00:00:00,2021-12-15T00:00:00,"Shutterfly, LLC",Ransomware,1273.0,Business,Retail,Medical Information,2022,"1,000-9,999",1-99,CA
13447,12/13/2021 12:00:00 AM,05/26/2022 12:00:00 AM,Cyberattack,2021-12-03T00:00:00,2021-12-15T00:00:00,"Shutterfly, LLC",Ransomware,1273.0,Business,Retail,Username and Password/Security Question Answers,2022,"1,000-9,999",1-99,CA
13447,12/13/2021 12:00:00 AM,05/26/2022 12:00:00 AM,Cyberattack,2021-12-03T00:00:00,2021-12-15T00:00:00,"Shutterfly, LLC",Ransomware,1273.0,Business,Retail,Other,2022,"1,000-9,999",1-99,CA
13448,10/17/2021 12:00:00 AM,04/27/2022 12:00:00 AM,Unauthorized Access,,,"Medscan Laboratory, Inc. (Adaptive Health Integrations",,2968.0,Health,,Name,2022,"1,000-9,999",Unknown,ND
13448,10/17/2021 12:00:00 AM,04/27/2022 12:00:00 AM,Unauthorized Access,,,"Medscan Laboratory, Inc. (Adaptive Health Integrations",,2968.0,Health,,Social Security Number,2022,"1,000-9,999",Unknown,ND
13448,10/17/2021 12:00:00 AM,04/27/2022 12:00:00 AM,Unauthorized Access,,,"Medscan Laboratory, Inc. (Adaptive Health Integrations",,2968.0,Health,,Full Date of Birth,2022,"1,000-9,999",Unknown,ND
13449,11/18/2021 12:00:00 AM,05/27/2022 12:00:00 AM,Cyberattack,2021-11-04T00:00:00,2021-11-18T00:00:00,"Private Client Services, LLC",Phishing,518.0,Finance,,Name,2022,500-999,1-99,WA
13449,11/18/2021 12:00:00 AM,05/27/2022 12:00:00 AM,Cyberattack,2021-11-04T00:00:00,2021-11-18T00:00:00,"Private Client Services, LLC",Phishing,518.0,Finance,,Social Security Number,2022,500-999,1-99,WA
13449,11/18/2021 12:00:00 AM,05/27/2022 12:00:00 AM,Cyberattack,2021-11-04T00:00:00,2021-11-18T00:00:00,"Private Client Services, LLC",Phishing,518.0,Finance,,Driver's License or Washington ID Card Number,2022,500-999,1-99,WA
13449,11/18/2021 12:00:00 AM,05/27/2022 12:00:00 AM,Cyberattack,2021-11-04T00:00:00,2021-11-18T00:00:00,"Private Client Services, LLC",Phishing,518.0,Finance,,Full Date of Birth,2022,500-999,1-99,WA
13450,12/17/2021 12:00:00 AM,05/27/2022 12:00:00 AM,Cyberattack,2021-12-10T00:00:00,2021-12-14T00:00:00,Lower LLC,Ransomware,3806.0,Finance,,Name,2022,"1,000-9,999",1-99,MD
13450,12/17/2021 12:00:00 AM,05/27/2022 12:00:00 AM,Cyberattack,2021-12-10T00:00:00,2021-12-14T00:00:00,Lower LLC,Ransomware,3806.0,Finance,,Social Security Number,2022,"1,000-9,999",1-99,MD
